"On the Distance-Sensitive and Load-Balanced Information Storage and Retrieval for 3D Sensor Networks","W. Liu; H. Jiang; J. Liu; X. Liao; H. Lin; T. Deng","School of Electronic Information and Communications, Huazhong University of Science and Technology, China","IEEE/ACM Transactions on Networking","20161215","2016","24","6","3439","3449","Efficient in-network information storage and retrieval is of paramount importance to sensor networks and has attracted a large number of studies while most of them focus on 2D fields. In this paper, we propose novel Reeb graph based information storage and retrieval schemes for 3D sensor networks. The key is to extract the line-like skeleton from the Reeb graph of a network, based on which two distance-sensitive information storage and retrieval schemes are developed: one devoted to shorter retrieval path and the other devoted to more balanced load. Desirably, the proposed algorithms have no reliance on the geographic location or boundary information, and have no constraint on the network shape or communication graph. The extensive simulations also show their efficiency in terms of sensor storage load and retrieval path length.","1063-6692;10636692","","10.1109/TNET.2016.2523242","http://ieeexplore.ieee.org/stamp/stamp.jsp?arnumber=7401137","3D sensor networks;complex-connected 3D settings;information retrieval;information storage","Delays;Feature extraction;IEEE transactions;Level set;Shape;Skeleton;Three-dimensional displays","graph theory;information retrieval systems;resource allocation;wireless sensor networks","3D sensor networks retrieval;Reeb graph;boundary information;distance-sensitive information retrieval;distance-sensitive information storage;geographic location;in-network information retrieval;in-network information storage;line-like skeleton;load-balanced information storage","","","","","","20160208","December 2016","","IEEE","IEEE Journals & Magazines"
"Context based information retrieval based on ontological concepts","K. S. Mule; A. Waghmare","Dept. Of Computer Engg., Dr. D. Y. Patil School Of Engg & Tech, Affiliated to Savitribai Phule Pune University, India","2015 International Conference on Information Processing (ICIP)","20160613","2015","","","491","495","Ontology has rich internal structure. There are relations and constraints between the concepts that is why Ontology has a richer internal structure. Ontology can be used for information retrieval. Ontology is a halfway determination of a conceptual vocabulary to be utilized for formulating knowledge-level hypothesis around a domain of discourse. The key part of ontology is to help knowledge sharing and reuse. The process of allotting descriptions to documents in an IRS is called indexing. In this paper a technique is proposed which improves results. In this technique web pages are stored in xml database. WordNet is used as dictionary for finding synonyms of user's query. The technique is based on context of word. Using context of words helps improvise the search results. The technique is called ontological indexing. This technique is compared with text based search. The words on the web pages are mapped to concepts in ontology. Mapping score is generated for each word. Results of search depend on value of mapping score. Moreover the issue of word sense disambiguation is solved up to some extent using parts of speech tagger.","","Electronic:978-1-4673-7758-4; POD:978-1-4673-7759-1","10.1109/INFOP.2015.7489433","http://ieeexplore.ieee.org/stamp/stamp.jsp?arnumber=7489433","Information retrieval(IR);JENA API;RDF(resource description framework);ontological indexing;ontology;parts of speech (POS);retrieval status value(RSV);tag-based ranking","Context;Indexing;Ontologies;Resource description framework;Web pages","XML;indexing;natural language processing;ontologies (artificial intelligence);query processing","IRS;WordNet;conceptual vocabulary;context-based information retrieval;knowledge reuse;knowledge sharing;knowledge-level hypothesis;ontological concepts;ontological indexing;speech tagger;text-based search;user query;web pages;word sense disambiguation;xml database","","","","14","","","16-19 Dec. 2015","","IEEE","IEEE Conference Publications"
"Text analysis and information retrieval of text data","H. Gupta; A. Kottwani; S. Gogia; S. Chaudhari","Department of Information Technology, Sardar Patel Institute of Technology, Mumbai, India","2016 International Conference on Wireless Communications, Signal Processing and Networking (WiSPNET)","20160915","2016","","","788","792","Text summarization combines the process of POS tagging, term frequency and topical analysis. All these together are used to produce insightful summary of the document/documents. The concise version of the text document can be made using the concept of frequency of the terms and inverse frequency of documents. Text summarization is useful for bring the short story of all the newspaper articles, email correspondence or to extract key elements for the search engine. To compact the size, the sentences which are not near to the centroid is not to be considered in the output. To do that, the data which does not relate to the centroid topic has to be pruned. The output consists of only important data useful to the user. Large unstructured data can be converted in such form that can be used for report making, compacting of web pages and review of the book. In this, the summary from documents contains significant information, and is less than half of the original size. The output should be such that it fully satisfies the user's query and understands the answer given to it.","","","10.1109/WiSPNET.2016.7566241","http://ieeexplore.ieee.org/stamp/stamp.jsp?arnumber=7566241","Text summarization;abstractive summary;document indexing;graph-based term weighting;lexical association","Conferences;Context;Frequency conversion;Grammar;Indexing;Peer-to-peer computing;Tagging","information retrieval;text analysis","POS tagging;document inverse frequency;document summary;email correspondence;information retrieval;newspaper articles;search engine;term frequency;text analysis;text data;text summarization;topical analysis;user query","","","","","","","23-25 March 2016","","IEEE","IEEE Conference Publications"
"A Market Collaborative Agents-Based Framework for Information Retrieval","D. E. Menacer; N. Guenaoui","Nat. Comput. Eng. Sch. of Algiers (ESI), LCSI Lab., Algiers, Algeria","2016 International Conference on Collaboration Technologies and Systems (CTS)","20170306","2016","","","465","471","The Information Retrieval in the World Wide Web (Web IR) plays an important role in the use of the Internet. An information retrieval process begins when a user enters a formal statements of information needs, known as query, into the system and ends when results are given. Results consist of several objects that match the query with different degrees of relevancy. The relevancy of the results is still an important concern and is often associated with the volume of the results: getting better relevancy involves bigger volume of returned information while lesser volume involves lower relevancy. This issue makes the Web IR an active domain of research and development. Since a decade, an interest was given to software agents technology and its applications. Agents have been successfully used in many fields: agents-based market systems prove to be efficient for implementing e-commerce or B2B applications on the Internet, thanks to inherent properties such as prominency of interactions, collaboration between agents, autonomy, scalability, flexibility, interoperability, etc. Although the use of agents in other application domains is not yet widespread, the integration of agents into market mechanisms bring clear and efficient solutions to Quality of Service (QoS) issues encountered in most distributed applications and notably in Web IR systems. Mobility allows defining a new interaction model, where agents act on behalf of final users or devices providing resources, while Market Places provide an organizational setting for the matching of demands and offers. This paper, a renewed form of [1], will show how market mechanisms and mobility can ease collaboration between agents to deliver a service with relevant results in Web IR.","","Electronic:978-1-5090-2300-4; POD:978-1-5090-2301-1","10.1109/CTS.2016.0088","http://ieeexplore.ieee.org/stamp/stamp.jsp?arnumber=7871026","Agents;Information Retrieval;Market Place;Negotiation","Indexes;Mobile agents;Quality of service;Search engines;Security;Servers","electronic commerce;groupware;information resources;marketing;multi-agent systems;quality of service;query processing;software agents","B2B applications;QoS issues;Web IR systems;World Wide Web;agents-based market systems;e-commerce applications;information retrieval;market collaborative agents;organizational setting;quality of service issues;query matching;research and development;result relevancy;software agents technology","","","","","","","Oct. 31 2016-Nov. 4 2016","","IEEE","IEEE Conference Publications"
"Configuring and Assembling Information Retrieval Based Solutions for Software Engineering Tasks","B. Dit","Comput. Sci. Dept., Boise State Univ., Boise, ID, USA","2016 IEEE International Conference on Software Maintenance and Evolution (ICSME)","20170116","2016","","","641","646","Information Retrieval (IR) approaches are used to leverage textual or unstructured data generated during the software development process to support various software engineering (SE) tasks (e.g., concept location, traceability link recovery, change impact analysis, etc.). Two of the most important steps for applying IR techniques to support SE tasks are preprocessing the corpus and configuring the IR technique, and these steps can significantly influence the outcome and the amount of effort developers have to spend for these maintenance tasks. We present the use of Genetic Algorithms (GAs) to automatically configure and assemble an IR process to support SE tasks. The approach named IR-GA determines the (near) optimal solution to be used for each step of the IR process without requiring any training. We applied IR-GA on three different SE tasks and the results of the study indicate that IR-GA outperforms approaches previously used in the literature, and that it does not significantly differ from an ideal upper bound that could be achieved by a supervised approach and a combinatorial approach.","","Electronic:978-1-5090-3806-0; POD:978-1-5090-3807-7","10.1109/ICSME.2016.85","http://ieeexplore.ieee.org/stamp/stamp.jsp?arnumber=7816533","Information Retrieval;Parametrization;Reproducibility of experiments;Search-based software engineering;Text-based software engineering","Calibration;Context;Data models;Genetic algorithms;Natural languages;Software;Software engineering","genetic algorithms;information retrieval;software maintenance","IR process assembling;IR process configuration;IR techniques;SE tasks;genetic algorithms;information retrieval;maintenance tasks;software development process;software engineering tasks;textual data;unstructured data","","","","","","","2-7 Oct. 2016","","IEEE","IEEE Conference Publications"
"Impact of Query Sample Selection Bias on Information Retrieval System Ranking","M. Melucci","Univ. of Padua, Padua, Italy","2016 IEEE International Conference on Data Science and Advanced Analytics (DSAA)","20161226","2016","","","341","350","Information Retrieval (IR) effectiveness measures commonly assume that the experimental query sets consist of randomly drawn queries that represent the population of queries submitted to IR systems. In many practical situations, however, this assumption is violated, in a problem known as sample selection bias. It follows that the systems participating in evaluation campaigns are ranked by biased estimators of effectiveness. In this paper, we address the problem of query sample selection bias in machine learning terms and study experimentally how retrieval system rankings are affected by it. To this end, we apply a number of retrieval effectiveness measures and query probability estimation methods useful to correct sample selection bias. We report that the ranking of the most effective systems and that of the least effective systems is fairly affected by query sample selection bias, while the ranking of the average systems is much more affected. We also report that the measure of bias depends on the retrieval measure used to rank systems and eventually on the search task being evaluated.","","Electronic:978-1-5090-5206-6; POD:978-1-5090-5207-3","10.1109/DSAA.2016.43","http://ieeexplore.ieee.org/stamp/stamp.jsp?arnumber=7796920","","Atmospheric measurements;Estimation;Particle measurements;Random variables;Sociology;Statistics;Training","information retrieval systems;learning (artificial intelligence);query processing;set theory","IR systems;experimental query sets;information retrieval system ranking;machine learning terms;query probability estimation methods;query sample selection;retrieval effectiveness measurement;search task","","","","","","","17-19 Oct. 2016","","IEEE","IEEE Conference Publications"
"Information Retrieval Based on a Query Document Using Maximal Frequent Sequences","R. Merlo-Galeazzi; J. A. Carrasco-Ochoa; J. F. Martínez-Trinidad; J. A. Olvera-López","Comput. Sci. Dept., Inst. Nac. de Astrofis. Opt. y Electron., Tonantzintla, Mexico","2013 32nd International Conference of the Chilean Computer Science Society (SCCC)","20170116","2013","","","58","62","Information Retrieval (IR) methods are commonly based on words, these methods allow the user to formulate a query through keywords. However, there are situations where the user has only one example document and based on this example it is needed to recover the most similar documents in a collection. This paper proposes an IR method that receives as input a query document and retrieves the k most similar documents to the query document using a representation based on Maximal Frequent Sequences (MFSs). Our method is tested and compared against the IR model based on bag of words, the experimental results show that the proposed method obtains good performance in contrast to the results obtained by the IR model based on bag of words.","1522-4902;15224902","Electronic:978-1-5090-0426-3; POD:978-1-5090-0427-0","10.1109/SCCC.2013.13","http://ieeexplore.ieee.org/stamp/stamp.jsp?arnumber=7814436","Document Indexing;Document Representation;IR;MFS;Query Document;Vector Space Model","Computer science;Electronic mail;Indexing;Search engines;Semantics","document handling;query formulation","MFS;information retrieval methods;maximal frequent sequences;query document;query formulation","","","","","","","11-15 Nov. 2013","","IEEE","IEEE Conference Publications"
"Keyword search in information retrieval and relational database system: Two class view","S. S. Pawar; A. Manepatil; A. Kadam; P. Jagtap","Dept. Computer Engineering, Bharati Vidyapeeth University, College of Engineering lavale, Lavale, India","2016 International Conference on Electrical, Electronics, and Optimization Techniques (ICEEOT)","20161124","2016","","","4534","4540","Information Retrieval and web search domain revolves around search and retrieve Methodologies. keyword search has been most popular and easy to used technique. Popular search Engine like Google Bing at core have this methodology in operation. Keywords are terms Extracted from document or single sentence generating sense when clustered in context. Same Keywords might be present in different document but structure and position of keywords build different meaning, this highlights keyword importance. Keywords are daily used atomic terms which when used in two or more group to represent information form phrases or short sentences and require concept generated by keywords. Success of keyword technology is simple match of documents consisting Question Keyword. Even though irrelevant results are retrieved due to word sense Ambiguity (WSD) necessitate concept extraction, web information is multiplying in petabytes and daily 20 petabytes of information is processed by Google still core technique of search remains on keyword as best even today. A lot effort has been taken to extend this keyword search patterns to relational database systems from last four decades. A large volume of information is stored in data which is as large as size of static web. Extending keyword search to relational data base systems would eliminate requirement of specialized data processing and manipulation language like sql. Database would be handled by nontechnical person simply with assistance of word. Relational database system are operated with precise query retrieving all matched records restricted query dimension on other hand IR System rank and present information documents containing cluster and focusing on user experience and precision. Extending keyword pattern search on relational database management system also requires extending Index, ranking, clustering to database management system with specially constructed components performing above task. This research work is dedicated to keyword - earch and gives two viewpoints of its application in IR and database system. Article present prototype of Machine A and B, where A presents Innovative IR system and B presents Discover approach relational database management system. Article focus more on extending keyword search to database management system as it less addressed topic and more challenging. Analysis of Machine B show that performance evaluation need to address with effective evaluation like query workload memory utilization for flexible and scalable optimized machine development. Rather than evaluation parameters like time delay etc. hybrid scalable document retrieval system is build and evaluated on memory utilization and search space is reduced by half with two layer algorithm. Further scope of system is developing hybridization at machine level and working with images as input query.","","CD:978-1-4673-9936-4; DVD:978-1-4673-9937-1; Electronic:978-1-4673-9939-5; POD:978-1-4673-9940-1; USB:978-1-4673-9938-8","10.1109/ICEEOT.2016.7755576","http://ieeexplore.ieee.org/stamp/stamp.jsp?arnumber=7755576","Information retriveal;keyword search;relational database mangement system","Indexes;Keyword search;Relational databases;Semantics","information retrieval;pattern clustering;relational databases;search engines","Google Bing;IR system rank;WSD;Web information documents;Web search domain;atomic terms;clustering;concept extraction;hybridization;index;information retrieval;keyword search patterns;keyword technology;machine level;manipulation language;memory utilization;petabytes;query dimension;question keyword;ranking;relational database management systems;scalable document retrieval system;search engine;search space;short sentences;single sentence;specialized data processing;static Web;user experience;word sense ambiguity","","","","","","","3-5 March 2016","","IEEE","IEEE Conference Publications"
"Information-Retrieval-as-a-Service for the Web of Things: A Survey and a Proposal of IRaaS Architecture","C. Manta-Caro; J. M. Fernández-Luna","Dept. of Comput. Sci. & AI, Univ. of Granada, Granada, Spain","2016 IEEE 4th International Conference on Future Internet of Things and Cloud (FiCloud)","20160926","2016","","","325","333","The Cloud age, characterized by a revolution of Data center infrastructures with powerful resources, has leveraged the ""as-a-service"" paradigms. Nowadays, the Web of Things (WoT) proposes the abstraction of real world entities in a virtual Web avatar, to acquire, process and present real-time information with the ability to connect with the real-world, and to control real things. A new generation of services can arise from these complementary paradigms. One of them is crucial for a daily basis interaction with this new smart world, Information Retrieval (IR), mostly in the form of search engines can also evolve into more powerful tools. Based on that, a new architecture of this kind of services has to be defined by the synergy and challenges that WoT imposes. We propose an IR as a service IRaaS architecture for the new era of the Web of Things. It considers the high dynamics in WoT which leverages a significant amount of changes in the IR collection to merge efficiently conventional IR concepts and the cloud power. Our IRaaS approach takes into account the big-data characteristics of WoT concerning velocity, volume, volatility, and the variety of data. The architecture has two main pillars: the indexing and analysis block, and the querying and retrieval block. We propose building it driven in three dimensions: search scope, resources, and data type. From these perspectives, we show and compare the related works and researches.","","","10.1109/FiCloud.2016.53","http://ieeexplore.ieee.org/stamp/stamp.jsp?arnumber=7575881","Cloud Computing;Information Retrieval;Web of Things","Cloud computing;Computer architecture;Information retrieval;Internet of things;Proposals;Protocols;Sensors","Big Data;cloud computing;information retrieval;query processing","Big-Data characteristics;IR as a service architecture;IR collection;IRaaS architecture;Web of Things;WoT;data center infrastructures;information retrieval as-a-service;querying block;retrieval block","","","","","","","22-24 Aug. 2016","","IEEE","IEEE Conference Publications"
"Analysis of various information retrieval models","M. Khari; A. Jain; S. Vij; M. Kumar","Dept. of Computer Science & Engineering, Guru Gobind Singh Indraprastha University, AIACT&R, Delhi, India","2016 3rd International Conference on Computing for Sustainable Global Development (INDIACom)","20161031","2016","","","2176","2181","Information Retrieval is an automated way to extract the information from various sources. It has always been a key area of research due to its wide range of applications in document searching, software traceability etc. We have presented an analysis of the three basic models of information retrieval i.e. Vector Space Model, Latent Dirichlet Allocation Model and Latent Semantic Indexing Model in this paper. These models are explained in detail according to their basic concepts, methodology adopted and area of application. We have provided the advantages of these topic models over each other and have discussed their limitations too. We have also highlighted the basic categories of information. The variants of some basic models are also described according to their concept and usage. This kind of analysis will be useful for the user to make a choice between these information retrieval models as to find out which one is to be used regarding a particular problem or application.","","","","http://ieeexplore.ieee.org/stamp/stamp.jsp?arnumber=7724650","Information Retrieval;Latent Dirichlet Model;Latent Semantic Indexing Model;Term Document Matrix;Vector Space Model","Analytical models;Computational modeling;Conferences;Indexing;Information retrieval;Resource management;Semantics","document handling;indexing;information retrieval","document searching;information retrieval models;latent Dirichlet allocation model;latent semantic indexing model;software traceability;vector space model","","","","","","","16-18 March 2016","","IEEE","IEEE Conference Publications"
"Using Generic Summarization to Improve Music Information Retrieval Tasks","F. Raposo; R. Ribeiro; D. Martins de Matos","Department of Computer Science and Engineering, Instituto Superior T&#233;cnico, Universidade de Lisboa, Lisbon, Portugal","IEEE/ACM Transactions on Audio, Speech, and Language Processing","20160502","2016","24","6","1119","1128","In order to satisfy processing time constraints, many music information retrieval (MIR) tasks process only a segment of the whole music signal. This may lead to decreasing performance, as the most important information for the tasks may not be in the processed segments. We leverage generic summarization algorithms, previously applied to text and speech, to summarize items in music datasets. These algorithms build summaries (both concise and diverse), by selecting appropriate segments from the input signal, also making them good candidates to summarize music. We evaluate the summarization process on binary and multiclass music genre classification tasks, by comparing the accuracy when using summarized datasets against the accuracy when using human-oriented summaries, continuous segments (the traditional method used for addressing the previously mentioned time constraints), and full songs of the original dataset. We show that GRASSHOPPER, LexRank, LSA, MMR, and a Support Sets-based centrality model improve classification performance when compared to selected baselines. We also show that summarized datasets lead to a classification performance whose difference is not statistically significant from using full songs. Furthermore, we make an argument stating the advantages of sharing summarized datasets for future MIR research.","2329-9290;23299290","","10.1109/TASLP.2016.2541299","http://ieeexplore.ieee.org/stamp/stamp.jsp?arnumber=7431980","Automatic music summarization;generic summarization algorithms;music classification","Feature extraction;Hidden Markov models;IEEE transactions;Matrix decomposition;Multiple signal classification;Speech;Speech processing","information retrieval;music;pattern classification","GRASSHOPPER;LSA;LexRank;MIR;MMR;generic summarization;human-oriented summaries;multiclass music genre classification;music information retrieval;music signal;support set-based centrality model","","","","29","","20160311","June 2016","","IEEE","IEEE Journals & Magazines"
