"Automatic Personalized Summarization Using Non-negative Matrix Factorization and Relevance Measure","S. Park; J. H. Lee; J. W. Song","Dept. of Comput. Eng., Honam Univ., Gwangju","2008 IEEE International Workshop on Semantic Computing and Applications","20080722","2008","","","72","77","In this paper, a new automatic personalized summarization method, which uses non-negative matrix factorization (NMF) and relevance measure (RM), is introduced to extract meaningful sentences from to retrieve documents in Internet. The proposed method can improve the quality of personalized summaries because the inherent semantics of the documents are well reflected by using the semantic features calculated by NMF and the sentences most relevant to the given query are extracted efficiently by using the semantic variables derived by NMF. Besides, it uses RM to summarize generic summary so that it can select sentences covering the major topics of the document. The experimental results using Yahoo-Korea News data show that the proposed method achieves better performance than the other methods.","","CD-ROM:978-0-7695-3317-9","10.1109/IWSCA.2008.10","http://ieeexplore.ieee.org/stamp/stamp.jsp?arnumber=4573153","","Application software;Computer applications;Computer science;Conferences;Data mining;Feature extraction;Information filtering;Information retrieval;Internet;Sun","Internet;matrix algebra;query processing","Internet;Yahoo-Korea News data;automatic personalized summarization method;document retrieval;generic summary;nonnegative matrix factorization;relevance measure;semantic variables","","2","","15","","","10-11 July 2008","","IEEE","IEEE Conference Publications"
"FCTH: Fuzzy Color and Texture Histogram - A Low Level Feature for Accurate Image Retrieval","S. A. Chatzichristofis; Y. S. Boutalis","Dept. of Electr. & Comput. Eng., Democritus Univ. of Thrace, Xanthi","2008 Ninth International Workshop on Image Analysis for Multimedia Interactive Services","20080715","2008","","","191","196","This paper deals with the extraction of a new low level feature that combines, in one histogram, color and texture information. This feature is named FCTH - Fuzzy Color and Texture Histogram - and results from the combination of 3 fuzzy systems. FCTH size is limited to 72 bytes per image, rendering this descriptor suitable for use in large image databases. The proposed feature is appropriate for accurately retrieving images even in distortion cases such as deformations, noise and smoothing. It is tested on a large number of images selected from proprietary image databases or randomly retrieved from popular search engines. To evaluate the performance of the proposed feature, the averaged normalized modified retrieval rank was used. An online demo that implements the proposed feature in an image retrieval system is available at: http://orpheus.ee.duth.gr/image_retrieval.","2158-5873;21585873","CD-ROM:978-0-7695-3130-4; POD:978-0-7695-3344-5","10.1109/WIAMIS.2008.24","http://ieeexplore.ieee.org/stamp/stamp.jsp?arnumber=4556917","FCTH;Fuzzy Linking;Image Retrieval;Low Level Features","Colored noise;Data mining;Fuzzy systems;Histograms;Image databases;Image retrieval;Information retrieval;Rendering (computer graphics);Smoothing methods;Testing","fuzzy set theory;image colour analysis;image retrieval;image texture;visual databases","accurate image retrieval;averaged normalized modified retrieval rank;fuzzy color histogram;fuzzy systems;fuzzy texture histogram;image retrieval system;large image databases;low level feature;search engines;texture information","","61","","14","","","7-9 May 2008","","IEEE","IEEE Conference Publications"
"An architecture for fast semantic retrieval in the film heritage domain","Y. Cobosi; C. Toro; C. Sarasua; J. Vaquero; M. T. Linaza; J. Posada","Visual Communication Technologies VICOMTech (Spain)","2008 International Workshop on Content-Based Multimedia Indexing","20080715","2008","","","272","279","How to best perform a search over a dataset is a common field of research in the scientific community. Query engines are used when the information is handled by an ontology in order to obtain structured information semantically. A common issue that arises is when the same query is performed several times, as the query engine must check the domain every time in order to retrieve the information. In this paper, we propose an architecture that takes advantage of the concept of Reflexive Ontologies (RO) in order to achieve timely semantic retrieval. The proposed architecture is illustrated by a case study in the Film Heritage domain, showing a performance improvement and providing ground for further research and discussion.","1949-3983;19493983","CD-ROM:978-1-4244-2044-5; POD:978-1-4244-2043-8","10.1109/CBMI.2008.4564957","http://ieeexplore.ieee.org/stamp/stamp.jsp?arnumber=4564957","","Communications technology;Engines;Image retrieval;Information retrieval;Microstrip;OWL;Ontologies;Resource description framework;Semantic Web;Visual communication","information retrieval;ontologies (artificial intelligence);query processing","fast semantic retrieval;film heritage domain;information retrieval;query engine;reflexive ontologies","","2","","25","","","18-20 June 2008","","IEEE","IEEE Conference Publications"
"Modeling and Adding Intelligibility to Human Activity","A. K. Dey","Human-Comput. Interaction Inst., Carnegie Mellon Univ., Pittsburgh, PA","2008 International Symposium on Ubiquitous Virtual Reality","20080718","2008","","","5","8","Over the past 20 years, a lot of effort has gone into making the vision of ubiquitous computing a reality. A major focus of this effort has been on the understanding of human activity as input to enable the design and implementation of context-aware applications. Context-awareness is a vital enabling technology for ubiquitous virtual reality applications. However, it is only recently that we have developed both the ability to sense human activity and model it for appropriate use in these applications. Now that we can build interesting and useful applications, one of the challenges is in making the leap from modeled human behavior to inferring human intent in context aware applications. With the expectation that many applications will make incorrect inferences, I argue that what is needed is a focus on intelligibility, or an understanding of why an application is behaving in a particular way. We also need to focus on making these applications usable by end-users. I will describe my grouppsilas work in sensing and modeling human activity in a variety of domains including office work, driving, and health. I will also describe work on making complex modeling systems intelligible to end-users who need to form reasonable mental models of these systems in order to use them.","","CD-ROM:978-0-7695-3259-2","10.1109/ISUVR.2008.25","http://ieeexplore.ieee.org/stamp/stamp.jsp?arnumber=4568633","context-awareness;intelligibility;modeling","Application software;Cognitive science;Context modeling;Context-aware services;Handheld computers;Humans;Information retrieval;Pervasive computing;Ubiquitous computing;Virtual reality","human computer interaction;ubiquitous computing","complex modeling systems;context-aware applications;human activity;intelligibility adding;ubiquitous computing;ubiquitous virtual reality","","2","","18","","","10-13 July 2008","","IEEE","IEEE Conference Publications"
"Ontology Support for Biomedical Information Resources","T. Dillon; E. Chang; M. Hadzic","Digital Ecosyst. & Bus. Intell. Inst., Curtin Univ. of Technol., WA","2008 21st IEEE International Symposium on Computer-Based Medical Systems","20080715","2008","","","7","16","The increasing body of distributed and heterogeneous information and the autonomous, heterogeneous and dynamic nature of information resources are important issues hindering effective and efficient data access, retrieval and knowledge sharing. The importance of ontologies has been recognised within the biomedical domain and work has begun on developing and sharing biomedical ontologies. In this paper, we define ontology and ontology commitments and explain the main characteristics and representations of ontology models. Ontologies are highly expressive knowledge models and as such increase expressiveness and intelligence of a system. We highlight the significance of ontologies in a variety of semi-automatic and automatic tasks, and provide an illustrative example of an ontology-based multi-agent system designed to intelligently retrieve information about human diseases from a number of heterogeneous and dispersed information resources.","1063-7125;10637125","POD:978-0-7695-3165-6","10.1109/CBMS.2008.21","http://ieeexplore.ieee.org/stamp/stamp.jsp?arnumber=4561946","biomedical ontologies;intelligent systems;semantics","Application software;Content based retrieval;Databases;Humans;Information resources;Information retrieval;Intelligent systems;Knowledge management;Multiagent systems;Ontologies","medical computing;ontologies (artificial intelligence)","automatic tasks;biomedical information resources;dispersed information resources;heterogeneous information;intelligently retrieve information;knowledge models;knowledge sharing;ontology support","","0","","44","","","17-19 June 2008","","IEEE","IEEE Conference Publications"
"Localized asynchronous packet scheduling for buffered crossbar switches","D. Pan; Y. Yang","Dept. of Comput. Sci., State Univ. of New York, Stony Brook, NY","2006 Symposium on Architecture For Networking And Communications Systems","20080725","2006","","","153","162","In such a switch, besides normal input queues and output queues, a small buffer is associated with each crosspoint. Due to the introduction of crosspoint buffers, output and input contention is eliminated, and the scheduling process for buffered crossbar switches is greatly simplified. Moreover, crosspoint buffers enable the switch to work in an asynchronous mode and easily schedule and transmit variable length packets. Compared with fixed length packet scheduling or cell scheduling, variable length packet scheduling, or packet scheduling for short, has some unique advantages: higher throughput, shorter packet latency and lower hardware cost. In this paper, we present a fast and practical scheduling scheme for buffered crossbar switches called Localized Asynchronous Packet Scheduling (LAPS). With LAPS, an input port or output port makes scheduling decisions solely based on the state information of its local crosspoint buffers, i.e., the crosspoint buffers where the input port sends packets to or the output port retrieves packets from. The localization property makes LAPS suitable for a distributed implementation and thus highly scalable. Since no comparison operation is required in LAPS, scheduling arbiters can be efficiently implemented using priority encoders, which can make arbitration decisions quickly in hardware. Another advantage of LAPS is that each crosspoint needs only L (the maximum packet length) buffer space, which minimizes the hardware cost of the switches. We also theoretically analyze the performance of LAPS, and in particular we prove that LAPS achieves 100% throughput for any admissible traffic with speedup of two. Finally, simulations are conducted to verify the analytical results and measure the performance of LAPS.","","POD:1-59593-580-0","","http://ieeexplore.ieee.org/stamp/stamp.jsp?arnumber=4579533","100% throughput;buffered crossbar switches;packet scheduling;priority encoders","Costs;Delay;Hardware;Information retrieval;Packet switching;Performance analysis;Scheduling algorithm;Switches;Throughput;Traffic control","packet switching;queueing theory;scheduling","buffered crossbar switches;cell scheduling;fixed length packet scheduling;input queues;localized asynchronous packet scheduling;output queues;priority encoders;scheduling process","","0","","29","","","3-5 Dec. 2006","","IEEE","IEEE Conference Publications"
"Feature extraction for speech and music discrimination","Huiyu Zhou; A. Sadka; R. M. Jiang","Brunel University, Uxbridge, Middlesex, United Kingdom","2008 International Workshop on Content-Based Multimedia Indexing","20080715","2008","","","170","173","Driven by the demand of information retrieval, video editing and human-computer interface, in this paper we propose a novel spectral feature for music and speech discrimination. This scheme attempts to simulate a biological model using the averaged cepstrum, where human perception tends to pick up the areas of large cepstral changes. The cepstrum data that is away from the mean value will be exponentially reduced in magnitude. We conduct experiments of music/speech discrimination by comparing the performance of the proposed feature with that of previously proposed features in classification. The dynamic time warping based classification verifies that the proposed feature has the best quality of music/speech classification in the test database.","1949-3983;19493983","CD-ROM:978-1-4244-2044-5; POD:978-1-4244-2043-8","10.1109/CBMI.2008.4564943","http://ieeexplore.ieee.org/stamp/stamp.jsp?arnumber=4564943","","Biological system modeling;Cepstral analysis;Cepstrum;Feature extraction;Mel frequency cepstral coefficient;Multiple signal classification;Music information retrieval;Spatial databases;Speech;Testing","audio signal processing;cepstral analysis;feature extraction;information retrieval;music;signal classification;speech processing","averaged cepstrum;dynamic time warping based classification;feature extraction;human perception;human-computer interface;information retrieval;music discrimination;speech discrimination;video editing","","3","","11","","","18-20 June 2008","","IEEE","IEEE Conference Publications"
"Ontology based viso-semantic similarity for image retrieval","C. Andreatta","Fondazione Bruno Kessler - IRST, Via Sommarive 18 - 38050 Povo - Italy","2008 International Workshop on Content-Based Multimedia Indexing","20080715","2008","","","70","76","In this paper we present COMPASS/web, a distributed image retrieval system that provides novel solutions to the problem of efficient and effective content-based browsing and retrieval over large multimedia databases. The system aims to exploit the synergy between visual and textual information introducing a viso-semantic distance based on a visual and a semantic similarity measure. The visual similarity is computed using low level features describing the image content while the semantic similarity is computed over graphs representing ontologies. Interactivity is achieved using relevance feedback mechanisms to adapt the similarity measures to the current task exploiting successive hints from the user. Preliminary results and future work directions are presented.","1949-3983;19493983","CD-ROM:978-1-4244-2044-5; POD:978-1-4244-2043-8","10.1109/CBMI.2008.4564930","http://ieeexplore.ieee.org/stamp/stamp.jsp?arnumber=4564930","","Content based retrieval;Data mining;Feedback;Image analysis;Image databases;Image retrieval;Information retrieval;Multimedia systems;Ontologies;Pipelines","content-based retrieval;image retrieval;multimedia databases;ontologies (artificial intelligence);relevance feedback;very large databases","COMPASS/web;content-based browsing;distributed image retrieval system;image content;large multimedia databases;ontology;relevance feedback mechanisms;viso-semantic similarity","","1","","11","","","18-20 June 2008","","IEEE","IEEE Conference Publications"
"Fast k nearest neighbor search using GPU","V. Garcia; E. Debreuve; M. Barlaud","Universit&#252; de Nice-Sophia Antipolis/CNRS Laboratoire I3S, 2000 route des Lucioles, 06903, France","2008 IEEE Computer Society Conference on Computer Vision and Pattern Recognition Workshops","20080715","2008","","","1","6","Statistical measures coming from information theory represent interesting bases for image and video processing tasks such as image retrieval and video object tracking. For example, let us mention the entropy and the Kullback-Leibler divergence. Accurate estimation of these measures requires to adapt to the local sample density, especially if the data are high-dimensional. The k nearest neighbor (kNN) framework has been used to define efficient variable-bandwidth kernel-based estimators with such a locally adaptive property. Unfortunately, these estimators are computationally intensive since they rely on searching neighbors among large sets of d-dimensional vectors. This computational burden can be reduced by pre-structuring the data, e.g. using binary trees as proposed by the approximated nearest neighbor (ANN) library. Yet, the recent opening of graphics processing units (GPU) to general-purpose computation by means of the NVIDIA CUDA API offers the image and video processing community a powerful platform with parallel calculation capabilities. In this paper, we propose a CUDA implementation of the ldquobrute forcerdquo kNN search and we compare its performances to several CPU-based implementations including an equivalent brute force algorithm and ANN. We show a speed increase on synthetic and real data by up to one or two orders of magnitude depending on the data, with a quasi-linear behavior with respect to the data size in a given, practical range.","2160-7508;21607508","CD-ROM:978-1-4244-2340-8; POD:978-1-4244-2339-2","10.1109/CVPRW.2008.4563100","http://ieeexplore.ieee.org/stamp/stamp.jsp?arnumber=4563100","","Binary trees;Concurrent computing;Density measurement;Entropy;Graphics;Image retrieval;Information retrieval;Information theory;Libraries;Nearest neighbor searches","computer graphics;image retrieval;search problems;statistical analysis;video signal processing","GPU;Kullback-Leibler divergence;NVIDIA CUDA API;approximated nearest neighbor library;brute force algorithm;efficient variable-bandwidth kernel-based estimators;fast k nearest neighbor search;graphics processing units;image processing;image retrieval;information theory;quasi-linear behavior;statistical measures;video object tracking;video processing","","114","","9","","","23-28 June 2008","","IEEE","IEEE Conference Publications"
"Extending MS Office for Sharing Document Content Units over the Semantic Web","S. Neic; D. Gaevic; M. Jazayeri","Fac. of Inf., Lugano Univ., Lugano","2008 Eighth International Conference on Web Engineering","20080725","2008","","","350","353","In this paper, we present an extension to MS Office that enables users to search and retrieve document content units (e.g., paragraphs, images, tables, slides, etc.) from documents, which are stored on userpsilas individual desktops organized in a peer-to-peer fashion. We first introduce the semantic document model (SDM) that turns MS Office documents (i.e., MS Word and MS PowerPoint) into semantic Web resources, making document content to be accessible and query-able as RDF data. Then we describe the developed tools, which extend Office applications with support for ontology-based, distributed search of semantic documents stored in local RDF repositories over se-mantic Web protocols.","","CD-ROM:978-0-7695-3261-5","10.1109/ICWE.2008.17","http://ieeexplore.ieee.org/stamp/stamp.jsp?arnumber=4577900","","Content based retrieval;Humans;Informatics;Information retrieval;Information systems;Ontologies;Peer to peer computing;Resource description framework;Semantic Web;Software agents","document handling;peer-to-peer computing;semantic Web","distributed search;extending MS office;ontology-based;peer-to-peer fashion;retrieve document content units;semantic Web;semantic document model;sharing document content units","","0","","9","","","14-18 July 2008","","IEEE","IEEE Conference Publications"
"Overview of image segmentation techniques and searching for future directions of research in content-based image retrieval","S. Deb","School of Information Technology, Charles Sturt University, Bathurst 2795, NSW Australia","2008 First IEEE International Conference on Ubi-Media Computing","20080722","2008","","","184","189","Research in content-based image retrieval has proved extremely difficult because of the inherent problems in proper automated analysis and feature extraction of the image to facilitate efficient retrieval. An image may contain more than one object and to segment the image in line with object features to extract meaningful objects has become a challenge to the researchers in the field. Until we win over this challenge, the efficient retrieval of images from the database based on a given input image will be difficult to achieve. In this paper we take stock of the current situation and suggest some future directions in the resolution of this problem.","","POD:978-1-4244-1865-7","10.1109/UMEDIA.2008.4570887","http://ieeexplore.ieee.org/stamp/stamp.jsp?arnumber=4570887","Content-based;Future directions;Image segmentation;Overview;image retrieval;multimedia","Content based retrieval;Feature extraction;Image analysis;Image color analysis;Image databases;Image retrieval;Image segmentation;Information retrieval;Shape;Wavelet transforms","content-based retrieval;feature extraction;image retrieval;image segmentation","content-based image retrieval;feature extraction;image segmentation","","1","","31","","","July 31 2008-Aug. 1 2008","","IEEE","IEEE Conference Publications"
"Design a wireless radio frequency identification based intelligent drug preparation system","Y. T. Chen; C. M. Huang; P. P. Huang; W. C. Chu","Institute of Biomedical Engineering, National Yang-Ming University, Taipei, Taiwan China","2008 International Conference on Information Technology and Applications in Biomedicine","20080718","2008","","","549","551","A wireless radio frequency identification (RFID) based intelligent drug preparation system is developed and validated. Locations of the prescribed drugs on the drug shelf that correlated to a patientpsilas prescription in the hospital information system (HIS) are identified via RFID. During drug dispensing, pharmacists are prompted with such location information on a real-time basis such that a warning signal will be alarmed should the pharmacist picked up a wrong drug or mistakenly placing back a drug bottle into a wrong drug partition. By incorporating a digital pharmacopedia in the system, pictures and related information of the designated drugs will also be displayed concurrently with the patientpsilas drug orders. Improved drug dispensing efficiency and reduced human error can be achieved with the aid of the proposed system.","2168-2194;21682194","CD-ROM:978-1-4244-2255-5; POD:978-1-4244-2254-8","10.1109/ITAB.2008.4570595","http://ieeexplore.ieee.org/stamp/stamp.jsp?arnumber=4570595","","Biomedical engineering;Design engineering;Drugs;Hospitals;Humans;Information retrieval;Information technology;Intelligent systems;Multiplexing;Radiofrequency identification","drugs;medical information systems;patient care;radiofrequency identification;wireless sensor networks","digital pharmacopedia;drug dispensing;drug dispensing efficiency;hospital information system;intelligent drug preparation system;patient drug order;wireless radio frequency identification;wrong drug partition","","0","","5","","","30-31 May 2008","","IEEE","IEEE Conference Publications"
"The millimeter wave response to volume density and grain size of dry homogeneous snow. An algorithm for retrieval of snow depth from radiometer data at the frequencies 22 and 37 GHz","V. A. Golunov","Russian Academy of Sciences, Institute of Radioengineering and Electronics, Russia","2008 Microwave Radiometry and Remote Sensing of the Environment","20080725","2008","","","1","4","Results of experimental investigation of dry homogeneous snow cover and man-made like-snow media emissivity and scattering properties in the microwave and millimeter wavelength ranges are presented. The effects of grain size, volume density and layer depth on the scattering properties were examined. Approximate expressions for scattering layer reflectivity and transmissivity based on the semi-empirical scattering model approach were obtained. Spectral relationship between basic parameters of emission from grained snow at the frequencies 22 and 37.5 GHz has been restored due to analysis of experimental data sets obtained for both dry snow and man-made like-snow media. As a result the algorithm for retrieval of snow depth has been developed using radiometry frequency channels at the 22 and 37.5 GHz. This algorithm permits to retrieve snow depth regardless of crystal size. It was scheduled to use this algorithm in the space program LtPrirodaGt.","","POD:978-1-4244-1986-9","10.1109/MICRAD.2008.4579510","http://ieeexplore.ieee.org/stamp/stamp.jsp?arnumber=4579510","Electromagnetic scattering by random media;radiometry;remote sensing;snow","Electromagnetic scattering;Frequency;Grain size;Information retrieval;Microwave radiometry;Millimeter wave technology;Particle scattering;Random media;Reflectivity;Snow","electromagnetic wave scattering;emissivity;grain size;hydrological techniques;radiometry;remote sensing;snow","grain size;microwave emissivity;microwave scattering;millimeter wave response;radiometer data;snow depth;volume density","","0","","6","","","11-14 March 2008","","IEEE","IEEE Conference Publications"
