"Nanopositioning for probe-based data storage [Applications of Control]","A. Sebastian; A. Pantazi; H. Pozidis; E. Eleftheriou","","IEEE Control Systems","20080716","2008","28","4","26","35","Probe-based data-storage devices are being considered as an ultra-high-density, small- form-factor alternative to conventional data storage. The probe-based data-storage concept is derived from scanning-probe microscopy, where nanometer-sharp tips are used to interrogate and manipulate matter down to the atomic scale. One implementation of this concept is based on a thermomechanical principle for storing and retrieving data encoded as nanometer-scale indentations in thin polymer films. Ultra-high densities of more than 1 Tb/in<sup>2</sup> have been achieved with this scheme. A small-scaleprototype system comprising all of the elements of a probe- based data storage device has been developed. One of the key challenges is the positioning of the storage medium relative to the read/write probes with nanometer-scale accuracy. A microscanner with X/Y motion capability is used to position the storage medium. Position information along both scan directions is provided by a pair of thermal position sensors. In addition, medium-derived position information provides a measure of the cross-track deviations in the Y-scan direction. Control architectures for both scan directions are presented. The X control architecture relies on thermal position sensors alone, whereas the Y control architecture relies on both the thermal position sensors and the medium-derived PES. Nanometer-scale positioning accuracies are achieved over a bandwidth of a few hundred hertz. Read/write demonstrations with sufficiently low error rates demonstrate the efficacy of the nanopositioning schemes employed.","1066-033X;1066033X","","10.1109/MCS.2008.924795","http://ieeexplore.ieee.org/stamp/stamp.jsp?arnumber=4566028","","Image retrieval;Information retrieval;Memory;Microscopy;Nanopositioning;Polymer films;Position measurement;Probes;Thermal sensors;Thermomechanical processes","","","","30","","13","","","Aug. 2008","","IEEE","IEEE Journals & Magazines"
"Semantic annotation and retrieval of unedited video based on extraction of 3D camera motion","W. Waizenegger; I. Feldmann; O. Schreer","Fraunhofer Institute for Telecommunications/Heinrich-Hertz-Institut, Einsteinufer 37, 10587 Berlin, Germany","2008 International Workshop on Content-Based Multimedia Indexing","20080715","2008","","","265","271","In this paper, we propose an approach towards high-level semantic annotation of 3D camera motion information in videos. For video search and retrieval, query by example is a common technique, which proved its capability even for image features. However, complex properties of video clips even in the temporal domain can hardly be described via examples as they often fail to capture the relevant information. Hence, high-level semantic information seems much more appropriate for future video search and retrieval engines fully based on user-friendly interfaces. Well known self-calibration techniques provide robust and reliable information on camera motion, but this rich source of information is not well exploited for high-level semantic video annotation, search and retrieval. The full temporal information along the sequence is evaluated and exploited for the annotation of meaningful high-level semantics such as turn, rotation, fast moving camera, transversal motion and so on. We present a first approach to derive generalmotion properties of the camera motion within video segments and show the potential for further investigations.","1949-3983;19493983","CD-ROM:978-1-4244-2044-5; POD:978-1-4244-2043-8","10.1109/CBMI.2008.4564956","http://ieeexplore.ieee.org/stamp/stamp.jsp?arnumber=4564956","","Cameras;Data mining;Face detection;Image reconstruction;Image retrieval;Information retrieval;Layout;Material storage;Multimedia communication;Optical character recognition software","image sensors;user interfaces;video retrieval;video signal processing","3D camera motion information;self-calibration techniques;semantic annotation;unedited video;user-friendly interfaces;video retrieval;video search","","1","","7","","","18-20 June 2008","","IEEE","IEEE Conference Publications"
"Constructing an Immersive Poetry Learning multimedia environment using ontology-based approach","Jui-Feng Weng; Shian-Shyong Tseng; Jun-Ming Su; Yuh-Jye Wang","Department of Computer Science, National Chiao Tung University, Taiwan","2008 First IEEE International Conference on Ubi-Media Computing","20080722","2008","","","308","313","Chinese has a rise in popularity due to the spring up of the Chinese language education. In the poetry of the Tang Dynasty, there is a lot of information in the limited number of Chinese characters. Therefore, how to assist learners in understanding of the background story and emotional feature of poetry is a challenging issue. In this paper, to support the poetry appreciation learning, our idea is to provide the Immersive Poetry Learning with multimedia properties: the Vision such as scenic spot, the Reading with occasional poetry, and the Emotional Reinforcement such as background music. To construct the immersive poetry learning with multimedia environment, the Learning Context ontology, the Poetry Noun Ontology and the Music Emotion ontology are defined to annotate the context information poetry contents and music emotional properties. Thus, the Ontology-based Immersive Poetry Learning system can base on the learner contexts to generate the coherent poetry and music by the ontology mapping.","","POD:978-1-4244-1865-7","10.1109/UMEDIA.2008.4570908","http://ieeexplore.ieee.org/stamp/stamp.jsp?arnumber=4570908","Ontology;algorithmic music;immersive learning;poetry;ubi-media for education","Computer science;Data mining;Information science;Layout;Learning systems;Music information retrieval;Natural languages;Ontologies;Springs;Vocabulary","computer aided instruction;literature;multimedia systems;natural languages;ontologies (artificial intelligence)","Chinese language education;Tang Dynasty;emotional reinforcement;immersive poetry learning multimedia environment;learning context ontology;music emotion ontology;poetry noun ontology","","1","","12","","","July 31 2008-Aug. 1 2008","","IEEE","IEEE Conference Publications"
"Multimodal indexing of digital audio-visual documents: A case study for cultural heritage data","J. Carmichael; M. Larson; J. Marlow; E. Newman; P. Clough; J. Oomen; S. Sav","University of Sheffield, UK","2008 International Workshop on Content-Based Multimedia Indexing","20080715","2008","","","93","100","This paper describes a multimedia multimodal information access sub-system (MIAS) for digital audio-visual documents, typically presented in streaming media format. The system is designed to provide both professional and general users with entry points into video documents that are relevant to their information needs. In this work, we focus on the information needs of multimedia specialists at a Dutch cultural heritage institution with a large multimedia archive. A quantitative and qualitative assessment is made of the efficiency of search operations using our multimodal system and it is demonstrated that MIAS significantly facilitates information retrieval operations when searching within a video document.","1949-3983;19493983","CD-ROM:978-1-4244-2044-5; POD:978-1-4244-2043-8","10.1109/CBMI.2008.4564933","http://ieeexplore.ieee.org/stamp/stamp.jsp?arnumber=4564933","","Automatic speech recognition;Broadcasting;Cultural differences;Indexing;Information retrieval;Multimedia communication;Multimedia systems;Prototypes;Search engines;Streaming media","document handling;humanities;indexing;video retrieval;video signal processing","Dutch cultural heritage institution;digital audio-visual documents;information retrieval operations;media format;multimodal indexing;video documents","","1","1","15","","","18-20 June 2008","","IEEE","IEEE Conference Publications"
"Observations of attenuation due to liquid-bearing stratocumulus clouds over Ottawa using a ground-based profiling radiometer","P. Bouchard","Satellite Communications and Radio Propagation Research Branch, Communications Research Centre Canada, Ottawa, Ontario, Box 11490 Station H, K2H 8S2, Canada","2008 Microwave Radiometry and Remote Sensing of the Environment","20080725","2008","","","1","4","Statistics on the attenuation due to non-precipitating, liquid-bearing overcast stratocumulus (Sc) clouds over Ottawa during the daytime are presented in this paper. Time series of Sc cloud attenuation are extracted from the brightness temperature data and retrievals from a ground-based multifrequency profiling radiometer. Frequencies of interest are 30 and 51.25 GHz; four elevation angles between 15 and 90 degrees (zenith) are considered. Both the MPM psila93 and Rosenkranz models are used to assess gaseous absorption using retrieved profiles ldquotopped uprdquo with the closest in time radiosonde data from a local station. Since most of the clouds in the data set contain some supercooled liquid, these extracted cloud attenuation data are compared to predictions from various dielectric constant models for pure liquid water using both the contemporaneously-retrieved liquid water path data and temperature at the cloud base as inputs.","","POD:978-1-4244-1986-9","10.1109/MICRAD.2008.4579488","http://ieeexplore.ieee.org/stamp/stamp.jsp?arnumber=4579488","Attenuation measurement;clouds;microwave radio propagation;microwave radiometry","Attenuation;Brightness temperature;Clouds;Data mining;Dielectric constant;Electromagnetic wave absorption;Frequency;Information retrieval;Radiometry;Statistics","atmospheric electromagnetic wave propagation;atmospheric humidity;clouds;radiometry;remote sensing","MPM psila93;Ottawa;Rosenkranz model;brightness temperature data;cloud attenuation;dielectric constant;gaseous absorption;ground-based profiling radiometer;liquid water path;liquid-bearing stratocumulus clouds;supercooled liquid","","1","","20","","","11-14 March 2008","","IEEE","IEEE Conference Publications"
"eul.icio.us: Euler Diagrams for del.icio.us","R. D. Chiara; A. Fish","Dip. di Inf. ed Applicazioni, Univ. degli Studi di Salerno, Salerno","2008 12th International Conference Information Visualisation","20080725","2008","","","632","637","EulerView incorporates a non-hierarchical classification structure to enable enhanced resource management. We apply the EulerView concept to the use of urls, constructing eli.icio.us which is a tool that realizes the EulerView concept and integrates it with del.icio.us. Currently, in del.icio.us, users can tag urls and browse for similar urls and the results can be displayed via an alphabetically sorted tag cloud. As well as facilitating easy tag management, using an EulerView display has the advantage that the user can use this representation for both tagging urls and for searching or browsing tasks, thus reducing any cognitive difficulties of users due to interacting with multiple representations.","1550-6037;15506037","POD:978-0-7695-3268-4","10.1109/IV.2008.77","http://ieeexplore.ieee.org/stamp/stamp.jsp?arnumber=4578014","Euler diagrams;delicious;eulerview;treeview;user interface;visualisation","Books;Displays;Information retrieval;Internet;Resource management;Space exploration;Tag clouds;Tagging;Uniform resource locators;Visualization","Web sites;data visualisation;pattern classification;resource allocation","Euler diagrams;EulerView display;URL;alphabetically sorted tag cloud;del.icio.us;easy tag management;enhanced resource management;eul.icio.us;nonhierarchical classification structure","","0","","21","","","9-11 July 2008","","IEEE","IEEE Conference Publications"
"Digital Rights Metadata Management and Retrieval on Structured Overlay Networks","W. Allasia; F. Gallo; M. Milanesio; R. Schifanella; F. Chiariglione; A. Difino","EURIX Torino, Italy, Turin","2008 Ninth International Workshop on Image Analysis for Multimedia Interactive Services","20080715","2008","","","130","133","This paper introduces a suitable way for indexing multimedia metadata on a structured peer-to-peer overlay network, with special care to the management of rights metadata expressed by MPEG-21. We have selected a suitable subset of MPEG-21 rights expression language elements to be indexed, in order to map governed contents into a flat space and allow insertion and retrieval of digital contents. Furthermore, we present a distributed application built on a structured overlay network enabling the search of multimedia items using rights related information. Our solution is completely decentralized and can be exploited in any MPEG-21 compliant metadata representation.","2158-5873;21585873","CD-ROM:978-0-7695-3130-4; POD:978-0-7695-3344-5","10.1109/WIAMIS.2008.33","http://ieeexplore.ieee.org/stamp/stamp.jsp?arnumber=4556902","Complex metadata indexing;DHT;Peer-to-Peer;digital rights","Content based retrieval;Image analysis;Indexing;Information retrieval;Licenses;MPEG 7 Standard;Object oriented databases;Peer to peer computing;Relational databases;XML","indexing;information retrieval;meta data;multimedia databases;peer-to-peer computing","MPEG-21 rights expression language;digital rights metadata management;digital rights metadata retrieval;distributed application;multimedia metadata indexing;structured overlay networks;structured peer-to-peer overlay network","","0","","11","","","7-9 May 2008","","IEEE","IEEE Conference Publications"
"Boosting of factorial correspondence analysis for image retrieval","Nguyen-Khang Pham; A. Morin; P. Gros","IRISA, Campus Universitaire de Beaulieu, F-35042 Rennes Cedex, France","2008 International Workshop on Content-Based Multimedia Indexing","20080715","2008","","","224","229","We are concerned by the use of factorial correspondence analysis (FCA) for image retrieval. FCA is designed for analysing contingency tables. In textual data analysis (TDA), FCA analyses a contingency table crossing terms/words and documents. For adapting FCA on images, we first define rdquovisual wordsrdquo computed from scalable invariant feature transform (SIFT) descriptors in images and use them for image quantization. At this step, we can build a contingency table crossing rdquovisual wordsrdquo as terms/words and images as documents. In spite of its successful applications in information retrieval, FCA suffers from large dimension problem because of the diagonalization of a large matrix. We propose a new algorithm, CABoost, which overcomes this large dimension problem of FCA. The data are sampled by column (word) and a FCA is applied on the sample. After some samplings, we finally combine separated results by a weighting - principle component analysis (PCA). The numerical experiments show that our algorithm performs more rapidly than the classical FCA without losing precision.","1949-3983;19493983","CD-ROM:978-1-4244-2044-5; POD:978-1-4244-2043-8","10.1109/CBMI.2008.4564950","http://ieeexplore.ieee.org/stamp/stamp.jsp?arnumber=4564950","","Boosting;Cities and towns;Content based retrieval;Data analysis;Frequency;Image analysis;Image databases;Image retrieval;Information retrieval;Vocabulary","data compression;image coding;image retrieval;principal component analysis;text analysis","contingency table crossing;factorial correspondence analysis;image quantization;image retrieval;principle component analysis;scalable invariant feature transform descriptors;textual data analysis","","0","","23","","","18-20 June 2008","","IEEE","IEEE Conference Publications"
"Combining Color and Spatial Information for Retrieving Landscape Images","N. H. Quyng; N. Q. Tao","","2008 Congress on Image and Signal Processing","20080716","2008","2","","480","484","Image retrieval based on color histogram is a popular method for content-based image retrieval. However, this technique does not benefit spatial information of image colors. This paper deals with a technique that retrieves images based on spatial and color infor-mation applied in landscape images including three steps: •Sort gray by descending order of histogram and reducing the number of gray level by histogram equalization. •Split images into rectangles by horizontal or ver-tical cutting. •Use spatial information for retrieving relevance images from landscape images database. We carried out an experiment on an image database containing 320 landscape images. Experiment result shows that our technique is more effective than the color histogram based retrieval technique.","","POD:978-0-7695-3119-9","10.1109/CISP.2008.146","http://ieeexplore.ieee.org/stamp/stamp.jsp?arnumber=4566350","Content based image retrieval;color information;histogram;spatial information","Color;Content based retrieval;Histograms;Image databases;Image retrieval;Image segmentation;Information retrieval;Pattern matching;Shape;Signal processing","","","","0","","18","","","27-30 May 2008","","IEEE","IEEE Conference Publications"
"Image Retrieval Based on Multi-wavelet Transform","X. Wu; T. Zhu","","2008 Congress on Image and Signal Processing","20080716","2008","2","","510","514","This paper represents a method of Content Based Image Retrieval (CBIR) which uses multi-wavelet transform to improve the shape and texture feature extraction and decrease the operand. The theoretical analysis is represented first and the numerical verification and experimental validation using real CT image is showed behind. Both the theoretical analysis and the numerical and experimental results agree that the multi-wavelet transform based image retrieval can get good result for image retrieval.","","POD:978-0-7695-3119-9","10.1109/CISP.2008.342","http://ieeexplore.ieee.org/stamp/stamp.jsp?arnumber=4566356","Critical sampling;Image Retrieval;Multi-scale Wavelet","Content based retrieval;Feature extraction;Image analysis;Image reconstruction;Image retrieval;Information retrieval;Information technology;Shape;Signal processing;Wavelet transforms","","","","0","","16","","","27-30 May 2008","","IEEE","IEEE Conference Publications"
"A New Image Retrieval Method Based on Combined Features and Feature Statistic","P. Liu; K. Jia; Z. Wang","","2008 Congress on Image and Signal Processing","20080716","2008","2","","635","639","Image has various inherent features which reflect its content such as color, texture, shape, spatial relationship features etc How to organize and utilize these features effectively and improve the retrieval performance is a valuable research topic in content-based image retrieval. One of the key issues in image retrieval based on combined features is how to assign weight to different feature. An image retrieval method combined color and texture features is proposed in this paper. According to image texture characteristic, a kind of image feature statistic is defined. By using feature weight assignment operators designed here, the method can assign weight to the color and texture features according to image content adaptively and realize image retrieval based on combined image features. The experiment results show that the method is more efficiently than those traditional CBIR methods based on single visual feature or simple linear combined low-level visual features of fixed weight","","POD:978-0-7695-3119-9","10.1109/CISP.2008.507","http://ieeexplore.ieee.org/stamp/stamp.jsp?arnumber=4566380","combined image features;feature statistic;image retrieval","Color;Content based retrieval;Educational institutions;Histograms;Image retrieval;Image texture;Information retrieval;Shape;Signal processing;Statistics","","","","0","","6","","","27-30 May 2008","","IEEE","IEEE Conference Publications"
"Shape Matching and Object Recognition Using Chord Contexts","Y. Mingqiang; K. Kidiyo; R. Joseph","IETR-INSA, UMR-CNRS 6164, Rennes","2008 International Conference Visualisation","20080718","2008","","","63","69","We propose a new effective shape descriptor, chord context, for shape description in content-based image retrieval. For a shape, the chord context describes a frequency distribution of chord lengths with different orientations. The histograms which represent the chord context are compacted and normalized into a feature matrix. Unlike other shape representation schemes, the proposed scheme is able to extract attributes from both contour as well as region information without the need for special landmarks or key-points. It does not require points on the edge with their orders, but it can capture the feature of shapes with holes or even with separated regions. In addition, the proposed method is shown to be unaffected by image translation, rotation and scaling; at the same time, it is robust to minor occultation, non-rigid deformations, distortions and corruption due to noise. Several experimental results demonstrate the feasibility of the chord context descriptor methodology and also highlight its advantages over other existing methodologies.","","POD:978-0-7695-3271-4","10.1109/VIS.2008.11","http://ieeexplore.ieee.org/stamp/stamp.jsp?arnumber=4568674","Feature extraction;chord;histogram;shape description;shape retrieval","Feature extraction;Histograms;Image databases;Image retrieval;Information retrieval;Noise robustness;Noise shaping;Object recognition;Robust stability;Shape measurement","content-based retrieval;image matching;image retrieval;matrix algebra;object recognition","chord context descriptor methodology;content-based image retrieval;feature matrix;frequency distribution;image translation;nonrigid deformations;object recognition;shape descriptor;shape matching","","3","","22","","","9-11 July 2008","","IEEE","IEEE Conference Publications"
"Real AdaBoost for large vocabulary image classification","Wei-Chao Lin; M. Oakes; J. Tait","School of Computing and Technology, University of Sunderland, SR6 0DD, UK","2008 International Workshop on Content-Based Multimedia Indexing","20080715","2008","","","192","199","In this paper, we describe the use of a Boosting algorithm, Real AdaBoost, for content-based image retrieval (CBIR) on a large number (190) of keyword categories. Previous work with Boosting for image orientation detection has involved only a few categories, such as a simple outdoor vs. indoor scene dichotomy. Other work with CBIR has incorporated Boosting into relevance feedback for a form of supervised learning based on end-userspsila evaluation, but here we use AdaBoost as a purely learning algorithm to reduce noisy and outlier information. For the 190-category classification task, Real AdaBoost with its own final learner model outperformed the k-nearest neighbour (K-NN) classifier in terms of precision.","1949-3983;19493983","CD-ROM:978-1-4244-2044-5; POD:978-1-4244-2043-8","10.1109/CBMI.2008.4564946","http://ieeexplore.ieee.org/stamp/stamp.jsp?arnumber=4564946","","Boosting;Content based retrieval;Feedback;Image classification;Image retrieval;Image segmentation;Indexing;Information retrieval;Noise reduction;Vocabulary","content-based retrieval;image classification;image retrieval;vocabulary","Boosting algorithm;Real AdaBoost;content-based image retrieval;image orientation detection;k-nearest neighbour classification;keyword categories;large vocabulary image classification","","3","","30","","","18-20 June 2008","","IEEE","IEEE Conference Publications"
"Wavelet Based Image Indexing and Retrieval","A. V. Sutagundar; S. S. Manvi; S. R. Bharamgoudar","Basaveshwar Eng. Collge, Bagalkot","2008 First International Conference on Emerging Trends in Engineering and Technology","20080729","2008","","","52","55","In this paper we present wavelet based image indexing and retrieval system for color images. Highly de-correlated wavelet coefficient planes are used to acquire a search efficient feature space. In this work low level feature, dominant color of the several images is extracted and keys are generated. The image key represents the image content with respect to other images in the database. At the time of the query, feature vector of the query image is computed and the database is searched for the matching feature vectors. All the images corresponding to the matched feature vectors are found to be similar images.","2157-0477;21570477","CD-ROM:978-0-7695-3267-7","10.1109/ICETET.2008.129","http://ieeexplore.ieee.org/stamp/stamp.jsp?arnumber=4579865","Content Based Image Indexing;Feature Vector;Image key;Image retrieval;Indexing","Color;Content based retrieval;Feature extraction;Image databases;Image retrieval;Indexing;Information retrieval;Spatial databases;Videos;Visual databases","feature extraction;image colour analysis;image matching;image retrieval;indexing;wavelet transforms","feature extraction;feature vector matching;image color;image query;image retrieval;wavelet based image indexing","","0","","9","","","16-18 July 2008","","IEEE","IEEE Conference Publications"
