"Prediction of rating from comments based on information retrieval and sentiment analysis","E. M. Alshari; A. Azman; N. Mustapha; S. C. Doraisamy; M. Alksher","Faculty of Computer Science, IBB University, Yemen","2016 Third International Conference on Information Retrieval and Knowledge Management (CAMP)","20170105","2016","","","32","36","The number of users of an on-line shopping websites is continuously increasing. Such website often provides facility for the users to give comments and ratings to the products being sold on the websites. This information can be useful as the recommendation for other users in making their purchase decision. This paper investigates the problem of predicting rating based on users' comments. A classifier based on information retrieval model is proposed for the prediction. In addition, the effect of integrating sentiment analysis for the rating prediction is also investigated. Based on the results, an improvement in prediction performance can be expected with sentiment analysis where an increase of 54% is achieved.","","CD:978-1-5090-2953-2; Electronic:978-1-5090-2954-9; POD:978-1-5090-2955-6","10.1109/INFRKM.2016.7806330","http://ieeexplore.ieee.org/stamp/stamp.jsp?arnumber=7806330","comments;information retrieval;rating;sentiment analysis;vector space model","Analytical models;Indexes;Internet;Predictive models;Sentiment analysis;Social network services","Internet;Web sites;information retrieval;retail data processing;sentiment analysis","comments;information retrieval model;online shopping Web sites;prediction performance;sentiment analysis","","","","","","","23-24 Aug. 2016","","IEEE","IEEE Conference Publications"
"Design of focused crawler for information retrieval of Indian origin Academicians","M. Kumar; R. Bhatia; A. Ohri; A. Kohli","Department of Computer Science & Engineering, PEC University of Technology, Chandigarh, India","2016 International Conference on Advances in Computing, Communication, & Automation (ICACCA) (Spring)","20160929","2016","","","1","6","Search engines alleviate the task of finding information on Internet very easy. Web crawler is the main part of any search engine that follows the URLs to gather information from the Web. For topic specific crawling, a special type of crawler called focused Web crawler is used. Focused crawler tries to find high quality information on a specific topic while avoiding irrelevant links. In the era of contemporary world, boundary of countries has evanesces for researchers, scientists and academicians. In this paper, we have applied the concept of focused crawling for information retrieval of Indian origin academicians working abroad. The aim is to develop a database of such academicians working in universities abroad, finding, and connecting with them. Gathering all such individuals through manual search is an impossible task and hence this paper gives a design of a focused crawler that can conglomerate all such information. This continuously updating database will cater to students wishing to connect with their alumni or other professors for academic collaboration.","","Electronic:978-1-5090-0673-1; POD:978-1-5090-0674-8","10.1109/ICACCA.2016.7578895","http://ieeexplore.ieee.org/stamp/stamp.jsp?arnumber=7578895","Crawler4j;Indian academicians database;focused crawling;open source crawlers","Crawlers;Data mining;Databases;Internet;Search engines;Uniform resource locators","Internet;information retrieval;search engines","Indian origin academicians;Internet;academic collaboration;continuously updating database;focused Web crawler;information retrieval;search engines;topic specific crawling","","","","","","","8-9 April 2016","","IEEE","IEEE Conference Publications"
"Agricultural information retrieval in geographically distributed networks","C. Wei; L. Zhemin; Z. Chao; W. Dongjie; W. Chen","Agricultural Information Institute, Chinese Academy of Agricultural Sciences, Beijing, China","2016 Fifth International Conference on Agro-Geoinformatics (Agro-Geoinformatics)","20160929","2016","","","1","4","As the rapid development of information technology and agricultural applications, agricultural information has been widely distributed geographically in a region. It is observed that agricultural production and trading activities tend to be localized in many cases. Effective retrieval of geographically distributed information can facilitate agricultural production as well as trading. In this paper, an agricultural information retrieval approach is proposed for geographically distributed networks. The network structure of the unstructured peer-to-peer network is introduced. A topic-aware agent reputation model that combines individual- and social-level reputations is adopted to distinguish different information retrieval performance on various topics. A location-based network structure optimization method is proposed to gather geographically small distance agents together. A hybrid query routing approach is presented that combines topic-aware agent reputation scores and location-based ratings. Simulation experiments are conducted for the evaluation of the proposed approach. The results of the experiments show good performance of it.","","","10.1109/Agro-Geoinformatics.2016.7577614","http://ieeexplore.ieee.org/stamp/stamp.jsp?arnumber=7577614","agricultural information retrieval;geographically distributed network;network structure optimization;peer-to-peer network;query routing","Information retrieval;Optimization;Organizations;Peer-to-peer computing;Production;Query processing","agricultural engineering;agriculture;optimisation;peer-to-peer computing;query processing","agricultural information retrieval;agricultural production;geographically distributed networks;hybrid query routing approach;location-based ratings;locationbased network structure optimization method;topic-aware agent reputation model;unstructured peer-to-peer network","","","","","","","18-20 July 2016","","IEEE","IEEE Conference Publications"
"Homomorphic encryption for secure information retrieval from the cloud","V. Anand; S. C. Satapathy","C V R College of Engineering, Hyderabad, India","2016 International Conference on Emerging Trends in Engineering, Technology and Science (ICETETS)","20161024","2016","","","1","5","Cloud computing has established itself as a major way of controlling the technology infrastructure costs borne by the organizations. A cost-sensitive organization would most likely find a certain amount of delay to be acceptable while retrieving information from the cloud. The main focus of this paper is on cost-efficiency and privacy. Three secure search protocols, namely Ostrovsky protocol, COPS protocol and EIRQ protocol are discussed in this paper. Each of these protocols incrementally improves upon the basic keyword search. Ostrovsky protocol offers privacy. COPS protocol aggregates the search results and achieves cost efficiency. EIRQ allows the users to retrieve a certain percentage of files after the users assign ranks to the queries themselves. A comparison of these three protocols is followed by the future work that could be carried out in this area.","","","10.1109/ICETETS.2016.7602988","http://ieeexplore.ieee.org/stamp/stamp.jsp?arnumber=7602988","cloud computing;cost efficiency;homomorphic encryption;privacy","Bandwidth;Cloud computing;Dictionaries;Encryption;Organizations;Protocols","cloud computing;costing;cryptography;data privacy;protocols;query processing","COPS protocol;EIRQ protocol;Ostrovsky protocol;cloud computing;cost-efficiency;cost-sensitive organization;homomorphic encryption;keyword search;privacy;query;secure information retrieval;secure search protocols;technology infrastructure costs","","","","","","","24-26 Feb. 2016","","IEEE","IEEE Conference Publications"
"From Word Embeddings to Document Similarities for Improved Information Retrieval in Software Engineering","X. Ye; H. Shen; X. Ma; R. Bunescu; C. Liu","Sch. of Electr. Eng. & Comput. Sci., Ohio Univ. Athens, Athens, OH, USA","2016 IEEE/ACM 38th International Conference on Software Engineering (ICSE)","20170403","2016","","","404","415","The application of information retrieval techniques to search tasks in software engineering is made difficult by the lexical gap between search queries, usually expressed in natural language (e.g. English), and retrieved documents, usually expressed in code (e.g. programming languages). This is often the case in bug and feature location, community question answering, or more generally the communication between technical personnel and non-technical stake holders in a software project. In this paper, we propose bridging the lexical gap by projecting natural language statements and code snippets as meaning vectors in a shared representation space. In the proposed architecture, word embeddings are rst trained on API documents, tutorials, and reference documents, and then aggregated in order to estimate semantic similarities between documents. Empirical evaluations show that the learned vector space embeddings lead to improvements in a previously explored bug localization task and a newly de ned task of linking API documents to computer programming questions.","","Electronic:978-1-4503-3900-1; POD:978-1-5090-2071-3","10.1145/2884781.2884862","http://ieeexplore.ieee.org/stamp/stamp.jsp?arnumber=7886921","API documents;bug localization;bug reports;skip-gram model;word embeddings","Computer bugs;Context;Mathematical model;Natural languages;Semantics;Software;Vocabulary","application program interfaces;document handling;information retrieval;natural language processing;software engineering;system documentation","API documents;bug localization task;code snippets;document similarities;information retrieval techniques;natural language statements;reference documents;software engineering;tutorials;vector space embeddings;word embeddings","","","","","","","14-22 May 2016","","IEEE","IEEE Conference Publications"
"An improved bug localization using structured information retrieval and version history","S. Rahman; K. K. Ganguly; K. Sakib","Institute of Information Techology, University of Dhaka, Dhaka, Bangladesh","2015 18th International Conference on Computer and Information Technology (ICCIT)","20160609","2015","","","190","195","Locating buggy files is a time consuming and challenging task because defects can deflate from a large variety of sources. So, researchers proposed several automated bug localization techniques where the accuracy can be improved. In this paper, an information retrieval based bug localization technique has been proposed, where buggy files are identified by measuring the similarity between bug report and source code. Besides this, source code structure and frequently changed files are also incorporated to produce a better rank for buggy files. To evaluate the proposed approach, a large-scale experiment on three open source projects, namely SWT, ZXing and Guava has been conducted. The result shows that the proposed approach improves 7% in terms of Mean Reciprocal Rank (MRR) and about 8% for Mean Average Precision (MAP) compared to existing techniques.","","Electronic:978-1-4673-9930-2; POD:978-1-4673-9931-9","10.1109/ICCITechn.2015.7488066","http://ieeexplore.ieee.org/stamp/stamp.jsp?arnumber=7488066","Accuracy;Bug Localization;Information Retrieval;Vector Space Model","Computer bugs;Electronic mail;History;Information retrieval;Mathematical model;Semantics;Software","configuration management;information retrieval;program debugging;program testing;source code (software)","Guava project;MAP;MRR;SWT project;ZXing project;automated bug file localization techniques;bug report;buggy file ranking;improved bug localization;mean average precision;mean reciprocal rank;open source projects;similarity measurement;source code structure;structured information retrieval;version history","","1","","12","","","21-23 Dec. 2015","","IEEE","IEEE Conference Publications"
"STRICT: Information retrieval based search term identification for concept location","M. M. Rahman; C. K. Roy","Department of Computer Science, University of Saskatchewan, Canada","2017 IEEE 24th International Conference on Software Analysis, Evolution and Reengineering (SANER)","20170323","2017","","","79","90","During maintenance, software developers deal with numerous change requests that are written in an unstructured fashion using natural language. Such natural language texts illustrate the change requirement involving various domain related concepts. Software developers need to find appropriate search terms from those concepts so that they could locate the possible locations in the source code using a search technique. Once such locations are identified, they can implement the requested changes there. Studies suggest that developers often perform poorly in coming up with good search terms for a change task. In this paper, we propose a novel technique-STRICT-that automatically identifies suitable search terms for a software change task by analyzing its task description using two information retrieval (IR) techniques-TextRank and POSRank. These IR techniques determine a term's importance based on not only its co-occurrences with other important terms but also its syntactic relationships with them. Experiments using 1,939 change requests from eight subject systems report that STRICT can identify better quality search terms than baseline terms from 52%-62% of the requests with 30%-57% Top-10 retrieval accuracy which are promising. Comparison with two state-of-the-art techniques not only validates our empirical findings and but also demonstrates the superiority of our technique.","","Electronic:978-1-5090-5501-2; POD:978-1-5090-5502-9","10.1109/SANER.2017.7884611","http://ieeexplore.ieee.org/stamp/stamp.jsp?arnumber=7884611","Concept location;POSRank;TextRank;information retrieval;search term identification","Information retrieval;Java;Maintenance engineering;Natural languages;Position measurement;Software;Syntactics","graph theory;information retrieval;natural language processing;software maintenance;text analysis","IR;POSRank;STRICT;TextRank;concept location;graph based term-weighting;information retrieval;natural language text;search term identification;software change task;software developer;software maintenance;task description analysis","","","","","","","20-24 Feb. 2017","","IEEE","IEEE Conference Publications"
"ROSF: Leveraging Information Retrieval and Supervised Learning for Recommending Code Snippets","H. Jiang; L. Nie; Z. Sun; Z. Ren; W. Kong; T. Zhang; X. Luo","He Jiang is with the School of Software, Dalian University of Technology, Dalian, China and the Key Laboratory for Ubiquitous Network and Service Software of Liaoning Province, Dalian, China.(Email: jianghe@dlut.edu.cn)","IEEE Transactions on Services Computing","","2016","PP","99","1","1","when implementing unfamiliar programming tasks, developers commonly search code examples and learn usage patterns of APIs from the code examples or reuse them by copy-pasting and modifying. For providing high-quality code examples, previous studies present several methods to recommend code snippets mainly based on information retrieval. In this paper, to provide better recommendation results, we propose ROSF, Recommending cOde Snippets with multi-aspect Features, a novel method combining both information retrieval and supervised learning. In our method, we recommend Top-Kcode snippets for a givenfree-form query based on two stages, i.e., coarse-grained searching and fine-grained re-ranking. First, we generate a code snippet candidate set by searching a code snippet corpus using an information retrieval method. Second, we predict probability values of the code snippets for different relevance scores in the candidate set by the learned prediction model from a training set, re-rank these candidate code snippets according to the probability values, and recommend the final results to developers. We conduct several experiments to evaluate our method in a large-scale corpus containing 921,713 real-world code snippets. The results show that ROSF is an effective method for code snippets recommendation and outperforms the-state-of-the-art methods by 20%-41% in Precision and 13%-33% in NDCG","1939-1374;19391374","","10.1109/TSC.2016.2592909","http://ieeexplore.ieee.org/stamp/stamp.jsp?arnumber=7516727","Code snippetsrecommendation;feature;information retrieval;supervised learning;topic model","Computational modeling;Information retrieval;Java;Predictive models;Software;Supervised learning;Training","","","","1","","","","20160719","","","IEEE","IEEE Early Access Articles"
"The Unreasonable Effectiveness of Traditional Information Retrieval in Crash Report Deduplication","J. C. Campbell; E. A. Santos; A. Hindle","Dept. of Comput. Sci., Univ. of Alberta, Edmonton, AB, Canada","2016 IEEE/ACM 13th Working Conference on Mining Software Repositories (MSR)","20170126","2016","","","269","280","Organizations like Mozilla, Microsoft, and Apple are flooded with thousands of automated crash reports per day. Although crash reports contain valuable information for debugging, there are often too many for developers to examine individually. Therefore, in industry, crash reports are often automatically grouped together in buckets. Ubuntu's repository contains crashes from hundreds of software systems available with Ubuntu. A variety of crash report bucketing methods are evaluated using data collected by Ubuntu's Apport automated crash reporting system. The trade-off between precision and recall of numerous scalable crash deduplication techniques is explored. A set of criteria that a crash deduplication method must meet is presented and several methods that meet these criteria are evaluated on a new dataset. The evaluations presented in this paper show that using off-the-shelf information retrieval techniques, that were not designed to be used with crash reports, outperform other techniques which are specifically designed for the task of crash bucketing at realistic industrial scales. This research indicates that automated crash bucketing still has a lot of room for improvement, especially in terms of identifier tokenization.","","Electronic:978-1-4503-4186-8; POD:978-1-5090-2242-7","10.1109/MSR.2016.035","http://ieeexplore.ieee.org/stamp/stamp.jsp?arnumber=7832906","Automatic Crash Re- porting;Call Stack Trace;Contextual Information;Deduplication;Duplicate Bug Reports;Duplicate Crash Report;Free/Open Source Software;Information Retrieval;Software En- gineering","Computer bugs;Debugging;Indexing;Information retrieval;Organizations;Software","information retrieval;program debugging;software maintenance","Ubuntu Apport automated crash reporting system;Ubuntu repository;crash report bucketing methods;identifier tokenization;off-the-shelf information retrieval techniques;precision factor;recall factor;scalable crash report deduplication technique;software systems","","","","","","","14-15 May 2016","","IEEE","IEEE Conference Publications"
"Location based semantic information retrieval from web documents using web crawler","A. B. Archana; J. Kumar","Department of CS&E, J.N.N College of Engineering, Shivamogga-577204, Karnataka, India","2015 International Conference on Applied and Theoretical Computing and Communication Technology (iCATccT)","20160421","2015","","","370","375","Today's web is a human-readable where information cannot be easily processed by the machine. At the same time, the enormous amount of data has made it increasingly difficult to find, access, present, and maintain relevant information. The present data retrieval techniques are based on the full content coordinating of keywords, which lack the semantic data. In this paper the semantic based information retrieval methodology is proposed to get data from the web archives in a specific domain by gathering the domain relevant information with web crawler. By utilizing ontology and semantic information matched with a given user's query is used for retrieval. The results are discussed for retrieving attractive tourist places in a particular city. Analyses are carried out by comparing results obtained with and without wordnet, with ontology and both ontology and wordnet respectively. The analysis carried out reveals that the proposed system is working efficiently.","","Electronic:978-1-4673-9223-5; POD:978-1-4673-9224-2; USB:978-1-4673-9222-8","10.1109/ICATCCT.2015.7456912","http://ieeexplore.ieee.org/stamp/stamp.jsp?arnumber=7456912","Information retrieval;Location;Ontology;Semantic web;Wordnet","Crawlers;Databases;Ontologies;Semantics;Uniform resource locators;Web pages","ontologies (artificial intelligence);query processing;semantic Web","Web crawler;Web documents;data retrieval techniques;location-based semantic information retrieval;ontology;semantic information matched;wordnet","","","","9","","","29-31 Oct. 2015","","IEEE","IEEE Conference Publications"
"Entropy Optimized Feature-Based Bag-of-Words Representation for Information Retrieval","N. Passalis; A. Tefas","Department of Informatics, Aristotle University of Thessaloniki, Thessaloniki, Greece","IEEE Transactions on Knowledge and Data Engineering","20160602","2016","28","7","1664","1677","In this paper, we present a supervised dictionary learning method for optimizing the feature-based Bag-of-Words (BoW) representation towards Information Retrieval. Following the cluster hypothesis, which states that points in the same cluster are likely to fulfill the same information need, we propose the use of an entropy-based optimization criterion that is better suited for retrieval instead of classification. We demonstrate the ability of the proposed method, abbreviated as EO-BoW, to improve the retrieval performance by providing extensive experiments on two multi-class image datasets. The BoW model can be applied to other domains as well, so we also evaluate our approach using a collection of 45 time-series datasets, a text dataset, and a video dataset. The gains are three-fold since the EO-BoW can improve the mean Average Precision, while reducing the encoding time and the database storage requirements. Finally, we provide evidence that the EO-BoW maintains its representation ability even when used to retrieve objects from classes that were not seen during the training.","1041-4347;10414347","","10.1109/TKDE.2016.2545657","http://ieeexplore.ieee.org/stamp/stamp.jsp?arnumber=7439840","Dictionary Learning;Entropy Optimization;Image Retrieval;Information Search and Retrieval;Information search and retrieval;Time-series Retrieval;dictionary learning;entropy optimization;image retrieval;time-series retrieval","Dictionaries;Entropy;Feature extraction;Histograms;Optimization;Time series analysis;Training","image retrieval;learning (artificial intelligence);optimisation;pattern clustering","cluster hypothesis;database storage requirements;entropy optimized feature-based bag-of-words representation;entropy-based optimization criterion;information retrieval;mean average precision;multiclass image datasets;supervised dictionary learning method","","2","","45","","20160323","July 1 2016","","IEEE","IEEE Journals & Magazines"
"Intelligent information retrieval for Tsunami detection using wireless sensor nodes","D. Virmani; N. Jain","Head of Department, Department of Computer Science, Bhagwan Parshuram Institute of Technology, New Delhi, India","2016 International Conference on Advances in Computing, Communications and Informatics (ICACCI)","20161103","2016","","","1103","1109","Various natural hazards can be detected by well trained sensors deployed at the target sites. This paper proposes a novel framework of a Tsunami detection system using wireless sensor nodes deployed in coastal areas around earth's magnetic poles. The proposed framework implements intelligent information retrieval technique to generate a Tsunami alert. This method makes use of proposed parameters that defines the underwater condition in terms of magnetic field, electric field, and wave gradient and heat energy. The proposed framework is further used to extract the intelligent information from above mentioned parameters and study the behavioural as well as physiological pattern changes in marine animals. The proposed method filters the messages, transformed by condition tagging which are further evaluated to generate Tsunami alert. The proposed framework is validated by the help of a case study to analyse the behavioural patterns observed in sea turtles when exposed to evident change in electro-magnetic field intensity.","","","10.1109/ICACCI.2016.7732192","http://ieeexplore.ieee.org/stamp/stamp.jsp?arnumber=7732192","Intelligent Information Retrieval;Tsunami Detection;Wireless sensor networks;marine animal behaviour","Alarm systems;Information retrieval;Magnetic fields;Marine animals;Oceans;Tsunami","information retrieval;tsunami;wireless sensor networks","Tsunami alert;Tsunami detection system;condition tagging;earth magnetic poles;electric field;electro-magnetic field intensity;evident change;heat energy;intelligent information retrieval;marine animals;natural hazards;physiological pattern changes;sea turtles;wave gradient;wireless sensor nodes","","","","","","","21-24 Sept. 2016","","IEEE","IEEE Conference Publications"
