"Stalker, A Multilingual Text Mining Search Engine for Open Source Intelligence","F. Neri; M. Pettoni","Synthema, Pisa","2008 12th International Conference Information Visualisation","20080725","2008","","","314","320","The revolution in information technology is making open sources more accessible, ubiquitous, and valuable. The international Intelligence Communities have seen open sources grow increasingly easier and cheaper to acquire in recent years. But up to 80% of electronic data is textual and most valuable information is often hidden and encoded in pages which are neither structured, nor classified. The process of accessing all these raw data, heterogeneous in terms of source and language, and transforming them into information is therefore strongly linked to automatic textual analysis and synthesis, which are greatly related to the ability to master the problems of multilinguality. This paper describes a content enabling system that provides deep semantic search and information access to large quantities of distributed multimedia data for both experts and general public. STALKER provides with a language independent search and dynamic classification features for a broad range of data collected from several sources in a number of culturally diverse languages.","1550-6037;15506037","POD:978-0-7695-3268-4","10.1109/IV.2008.9","http://ieeexplore.ieee.org/stamp/stamp.jsp?arnumber=4577965","focused crawling;functional analysis;morphological analysis;natural language processing;open source intelligence;supervised clustering;syntactic analysis;unsupervised clustering","Databases;Information analysis;Information retrieval;Information security;Information systems;Information technology;Internet;Natural languages;Search engines;Text mining","information retrieval;search engines;text analysis","STALKER;automatic textual analysis;information access;international intelligence communities;multilingual text mining search engine;open source intelligence;semantic search","","1","","14","","","9-11 July 2008","","IEEE","IEEE Conference Publications"
"Monitoring Dependencies for SLAs: The MoDe4SLA Approach","L. Bodenstaff; A. Wombacher; M. Reichert; M. C. Jaeger","IS Group, Univ. of Twente, Enschede","2008 IEEE International Conference on Services Computing","20080725","2008","1","","21","29","In service oriented computing different techniques for monitoring service level agreements (SLAs) are available. Many of these monitoring approaches focus on bilateral agreements between partners. However, when monitoring composite services it is not only important to figure out whether SLAs are violated, but we also need to analyze why these violations have occurred. When offering a composite service a company depends on its content providers to meet the service level they agreed upon. Due to these dependencies a company should not only monitor the SLA of the composite service, but also the SLAs of the services it depends on. By analyzing and monitoring the composite service in this way, causes for SLA violations can be easier found. In this paper we demonstrate how to analyze SLAs during development phase and how to monitor these dependencies using event logs during runtime. We call our approach MoDe4SLA (monitoring dependencies for SLAs).","","POD:978-0-7695-3283-7","10.1109/SCC.2008.120","http://ieeexplore.ieee.org/stamp/stamp.jsp?arnumber=4578445","Service Level Agreement;composite service;monitoring","Contracts;Databases;Delay;Environmental management;Information retrieval;Knowledge based systems;Monitoring;Quality of service;Runtime;Search engines","Web services","composite services;dependencies monitoring;service level agreements;service oriented computing","","23","1","15","","","7-11 July 2008","","IEEE","IEEE Conference Publications"
"Distributed Cross-Modal Search within the MPEG Query Format","M. Gruhne; P. Dunker; M. Döller; R. Tous","Fraunhofer Inst. Digitale Medientechnologie (IDMT), Ilmenau","2008 Ninth International Workshop on Image Analysis for Multimedia Interactive Services","20080715","2008","","","211","214","One of the latest developments of the MPEG committee is the Query Format for search and retrieval of multimedia content. This language constitutes the interface between a client and a search engine for searching multimedia data. Another possible scenario is the use of a service provider, which accepts and understands a query from a client and forwards parts of the query to one or more specific databases. Furthermore the service provider is able to retrieve the reply from these databases and post processes this result in order to send it to this client. During the last years, the cross-modal search of video and audio signals became more and more important, since using both, the video and the audio signal together turned out to be much more robust for identification of video streams, than the image part of the video alone.This paper describes a cross-modal search based on the MPEG Query Format, using a service provider for splitting and aggregating the query and two different types of databases.","2158-5873;21585873","CD-ROM:978-0-7695-3130-4; POD:978-0-7695-3344-5","10.1109/WIAMIS.2008.61","http://ieeexplore.ieee.org/stamp/stamp.jsp?arnumber=4556921","","Content based retrieval;Image analysis;Image databases;Information retrieval;Information technology;Motion pictures;Multimedia databases;Music information retrieval;Robustness;Signal processing","multimedia databases;search engines;video retrieval","MPEG query format;audio signals;cross-modal search;distributed cross-modal search;multimedia content retrieval;multimedia content search;search engine;video signals","","4","1","6","","","7-9 May 2008","","IEEE","IEEE Conference Publications"
"Retrieving frequent walks from tracking data in RFID-equipped warehouses","Z. Berenyi; H. Charaf","Department of Automation and Applied Informatics, Budapest University of Technology and Economics, Hungary","2008 Conference on Human System Interactions","20080729","2008","","","663","667","The utilization of RFID-related (radio-frequency identification) technologies became very common in the last few years. The effected main areas are highway surveillance systems, access cards, transport payments, RFID passports and product tracking systems. Tagged products can be tracked in an appropriately equipped warehouse with the help of the installed RFID readers. The movement of the customers can be followed because of a tag attached to the shopping cart or the products stored in it. In this paper, assuming such an environment, it has been examined how relevant information can be retrieved with the help of data mining methods from the collected, RFID-related data. The frequent sequences have been extracted, revealing the most visited spots and walks across the warehouse and the typical products selected along the way.","2158-2246;21582246","CD-ROM:978-1-4244-1543-4; POD:978-1-4244-1542-7","10.1109/HSI.2008.4581519","http://ieeexplore.ieee.org/stamp/stamp.jsp?arnumber=4581519","RFID;data mining;frequent sequences;frequent walks;pattern growth;sensor grid;tracking data;warehouse;wireless","Automated highways;Automation;Data mining;Environmental economics;Informatics;Information retrieval;Privacy;Radiofrequency identification;Surveillance;Wireless sensor networks","data mining;radiofrequency identification;warehousing","RFID-equipped warehouses;data mining methods;radio-frequency identification","","5","","14","","","25-27 May 2008","","IEEE","IEEE Conference Publications"
"Building a foundation of HPSG-based treebank on Bangla language","A. Mahmud; M. Khan","CRBLP, BRAC University, Dhaka, Bangladesh","2007 10th international conference on computer and information technology","20080725","2007","","","1","6","Now a day, the importance of a large annotated corpus for NLP researchers is widely known. In this paper, we describe an initial phase of developing a linguistically annotated corpus for non-configurational dasiaBanglapsila language. Since, the formalism differs from those posited for configurational languages; several features have been added for constraint based parsing through HPSG-based formalism. We propose an outline of a semi-automated process by applying both case marking approach and some morphological analysis to constraint the parsing of a relatively free word order language for creating a linguistically rich, highly-lexicalized annotated corpus.","","CD-ROM:978-1-4244-1551-9; POD:978-1-4244-1550-2","10.1109/ICCITECHN.2007.4579375","http://ieeexplore.ieee.org/stamp/stamp.jsp?arnumber=4579375","hpsg;non-configurational;parsing;treebank;treebanking","Bidirectional control;Books;Data mining;Information retrieval;Natural language processing;Natural languages;Pattern matching;Speech analysis;Standards development;Stochastic processes","context-free grammars;context-free languages;natural language processing;tree data structures","Bangla language;HPSG-based treebank;NLP;free word order language;head-driven phrase structure grammar formalism;lexicalized annotated corpus;natural language processing","","2","","9","","","27-29 Dec. 2007","","IEEE","IEEE Conference Publications"
"Corners-Based Composite Descriptor for Shapes","A. Sajjanhar; G. Lu; D. Zhang; W. Zhou","","2008 Congress on Image and Signal Processing","20080716","2008","2","","714","718","In this paper, a composite descriptor for shape retrieval is proposed. The composite descriptor is obtained based upon corner-points and shape region. In an earlier paper, we proposed a composite descriptor based on shape region and shape contour, however, the descriptor was not effective for all perspective and geometric transformations. Hence, we modify the composite descriptor by replacing contour features with corner-points features. The proposed descriptor is obtained from Generic FourierDescriptors (GFD) of the shape region and the GFD ofthe corner-points. We study the performance of the proposed composite descriptor. The proposed method is evaluated using Item S8 within the MPEG-7 Still Images Content Set. Experimental results show that the proposed descriptor is effective.","","POD:978-0-7695-3119-9","10.1109/CISP.2008.698","http://ieeexplore.ieee.org/stamp/stamp.jsp?arnumber=4566397","CBIR;shape retrieval","Australia;Discrete Fourier transforms;Histograms;Image retrieval;Information retrieval;Information technology;MPEG 7 Standard;Road transportation;Shape measurement;Signal processing","","","","0","","12","","","27-30 May 2008","","IEEE","IEEE Conference Publications"
"A New Method for Image Retrieval Based on Shape Decomposition","C. I. Chen; P. W. Huang","","2008 Congress on Image and Signal Processing","20080716","2008","2","","439","444","In our proposed scheme, two shape features are extracted by our shape decomposition method. The first feature is the proportion of the number of contour points in each of the four quadrants, and the second feature is the number of contour points intersecting with two quadrant-segmentation lines at the first level. When a query shape is submitted to the system, the second feature is used to generate the lower and upper bounds for the search space. Then, the database shapes within these two bounds are compared with the query shape using the first feature. Experimental results show that our scheme can handle shapes with holes very well, and has high performance in three shape databases.","","POD:978-0-7695-3119-9","10.1109/CISP.2008.649","http://ieeexplore.ieee.org/stamp/stamp.jsp?arnumber=4566342","content-based retrieval;multiresolution;quadtree matching;shape decomposition","Clustering algorithms;Computer science;Dynamic programming;Feature extraction;Image retrieval;Information retrieval;Shape;Signal processing;Spatial databases;Upper bound","","","","0","","15","","","27-30 May 2008","","IEEE","IEEE Conference Publications"
"A Fuzzy-set based Semantic Similarity Matching Algorithm for Web Service","L. Bai; M. Liu","Accounting Dept., Shanghai Lixin Univ. of Commerce, Shanghai","2008 IEEE International Conference on Services Computing","20080725","2008","2","","529","532","A critical step in the process of reusing existing WSDL-specified services for building web-based applications is the discovery of potentially relevant services. However, the category-based service discovery, such as UDDI, is clearly insufficient. Semantic Web Services, augmenting Web service descriptions using Semantic Web technology, were introduced to facilitate the publication, discovery, and execution of Web services at the semantic level. Semantic matchmaker enhances the capability of UDDI service registries in the Semantic Web Services architecture by applying some matching algorithms between advertisements and requests described in OWL-S to recognize various degrees of matching for Web services. Based on Semantic Web Service framework, semantic matchmaker, specification matching and probabilistic matching approach, this paper proposes a fuzzy-set based semantic similarity matching algorithm for Web Service to support a more automated and veracity service discovery process in the Semantic Web Service Framework.","","POD:978-0-7695-3283-7","10.1109/SCC.2008.147","http://ieeexplore.ieee.org/stamp/stamp.jsp?arnumber=4578571","Fuzzy-set;Matching Degree;Semantic Similarity;Semantic Web Services","Algorithm design and analysis;Automation;Computer integrated manufacturing;Computerized monitoring;Grounding;Information retrieval;Ontologies;Semantic Web;Service oriented architecture;Web services","Web services;category theory;fuzzy set theory;ontologies (artificial intelligence);semantic Web","OWL-S;UDDI service registry;WSDL-specified services;Web-based applications;augmenting Web service descriptions;category-based service discovery;fuzzy-set;probabilistic matching approach;semantic Web services architecture;semantic Web technology;semantic matchmaker;semantic similarity matching algorithm;specification matching;veracity service discovery process","","7","","13","","","7-11 July 2008","","IEEE","IEEE Conference Publications"
"Image Inpainting under Single Image","W. Ma; M. Hu; P. Hu","Lab. of Intell. Comput. & Signal Process., Anhui Univ., Hefei","2008 Congress on Image and Signal Processing","20080716","2008","1","","636","640","In this paper, image inpainting based on single image is proposed, which is the problem of filling in the occluded or damaged regions of an image by the visible information from other part of the image. The key problems are how to convert the visible information in the image to consistence and to use available information to repair the target part. The first step of our method is to divide all images into different scene planar regions and to retrieve all regions from the projective distortions, so that the visible information can be directly used; then a new inpainting algorithm with a pyramid approach to sub-pixel image fusion based on mutual information is applied. The experiments show that the approach can repair the target image seamlessly. Our theory also develops the techniques of image fusion and makes it more practically.","","POD:978-0-7695-3119-9","10.1109/CISP.2008.317","http://ieeexplore.ieee.org/stamp/stamp.jsp?arnumber=4566233","","Filling;Image converters;Image fusion;Image restoration;Image retrieval;Information retrieval;Layout;Signal processing;Signal processing algorithms;Visual perception","image fusion;image restoration","image inpainting;planar regions;projective distortions;pyramid approach;region retrieval;subpixel image fusion","","0","","10","","","27-30 May 2008","","IEEE","IEEE Conference Publications"
"Intelligent Search Agent for Internet Computing with Fuzzy Approach","M. Qiu; H. C. Huang; L. T. Yang; J. Wu","Dept. of Electr. Eng., Univ. of New Orleans, New Orleans, LA","2008 11th IEEE International Conference on Computational Science and Engineering","20080725","2008","","","181","188","The advent of Internet and WWW imposes great challenges to search information quickly and accurately. Intelligent search has become a hot topic in Internet computing, with rival search engines battling to become the de facto Web portal. Web search becomes more and more personalized and this requires that the search agent has some ""intelligent"" to satisfy specific requirements of different users. This paper reports a fuzzy intelligent search agent and shows its great advantages. A detail example has been given to illustrate the pros and cons of the fuzzy approach. Based on our fuzzy intelligent search agent, the efficiency of search has been greatly improved and it will be a practical solution for intelligent information retrieval.","","POD:978-0-7695-3193-9","10.1109/CSE.2008.17","http://ieeexplore.ieee.org/stamp/stamp.jsp?arnumber=4578231","Fuzzy;Intelligent;Internet Computing;Search Agent;Web Services","Computational intelligence;Fuzzy logic;Information retrieval;Intelligent agent;Internet;Portals;Search engines;Web search;Web sites;World Wide Web","Internet;fuzzy set theory;search engines;software agents","fuzzy approach;information retrieval;intelligent search agent;internet computing;search engines","","1","","14","","","16-18 July 2008","","IEEE","IEEE Conference Publications"
"Feature Selection for Automatic Classification of Chinese Folk Songs","J. Xu; P. Wang; L. Yan","","2008 Congress on Image and Signal Processing","20080716","2008","5","","441","446","The researches on feature selection play a very important role in the area of classification. In this paper, we introduce a heuristic wrapper method: Classification Contribution-Ratio Based Selection (CCRS). Using RBF neural network as a classifier, we did our experiments on a data set of 74 features extracted from 517 Chinese folk songs which come from 10 regions. The results show that Root Mean Square, Spectral Flux and Linear Prediction Coefficient are very effective for the classification of 10 kinds of Chinese folk songs. It works better when the number of features is reduced from 74 to 30 and the classification accuracy is improved from 39.74% (using the total 74 features) to 43.208% (using 30 optimal features). At last, we give an illustration of validity of the algorithm, and a comparison with the Fisher Criterion Method which shows the efficiency of CCRS.","","POD:978-0-7695-3119-9","10.1109/CISP.2008.461","http://ieeexplore.ieee.org/stamp/stamp.jsp?arnumber=4566866","Radial Basis Function neural network;classification contribution-ratio;feature selection;wrapper method","Costs;Data mining;Feature extraction;Music information retrieval;Neural networks;Pattern classification;Production;Root mean square;Signal processing;Signal processing algorithms","","","","1","","13","","","27-30 May 2008","","IEEE","IEEE Conference Publications"
"User Requirements for Multimedia Indexing and Retrieval of Unedited Audio-Visual Footage - RUSHES","O. Schreer; L. F. Ardeo; D. Sotiriou; A. Sadka; E. Izquierdo","Fraunhofer Inst. for Telecommun./Heinrich-Hertz-Inst., Hamburg","2008 Ninth International Workshop on Image Analysis for Multimedia Interactive Services","20080715","2008","","","76","79","Multimedia analysis and reuse of raw un-edited audio visual content known as rushes is gaining acceptance by a large number of research labs and companies. A set of research projects are considering multimedia indexing, annotation, search and retrieval in the context of European funded research, but only the FP6 project RUSHES is focusing on automatic semantic annotation, indexing and retrieval of raw and un-edited audio-visual content. Even professional content creators and providers as well as home-users are dealing with this type of content and therefore novel technologies for semantic search and retrieval are required. As a first result of this project, the user requirements and possible user-scenarios are presented in this paper. These results lay down the foundation for the research and development of a multimedia search engine particularly dedicated to the specific needs of the users and the content.","2158-5873;21585873","CD-ROM:978-0-7695-3130-4; POD:978-0-7695-3344-5","10.1109/WIAMIS.2008.14","http://ieeexplore.ieee.org/stamp/stamp.jsp?arnumber=4556887","User requirements;indexing;mutlimedia;retrieval;rushes;search","Cameras;Content based retrieval;Image analysis;Indexing;Information retrieval;Multimedia systems;Production;Raw materials;Research and development;Search engines","audio-visual systems;indexing;information retrieval;multimedia computing;search engines","RUSHES;multimedia annotation;multimedia indexing;multimedia retrieval;multimedia search engine;unedited audio-visual footage;user requirements","","3","","5","","","7-9 May 2008","","IEEE","IEEE Conference Publications"
"A Mash Up Home Library Management System","S. Jeyaverasingam; Y. Yan","Univ. of New Brunswick, Fredericton, NB","2008 IEEE Congress on Services - Part I","20080725","2008","","","160","167","We present an online system to manage a home library that consist of multiple collections, such as books and CDs, using Service Oriented Architecture. Many home collections can contain hundreds and thousands of books and CDs. Managing a personal collection of such magnitude could be difficult if one were to rely on using databases or spread sheets. Entering detailed information of each item is a huge undertaking and tedious work. We present a solution to solve this complexity by building an online service to manage a home library. The online service maintains a database to record each userpsilas collection. The users will scan the bar code of the books and CDs. The detailed information of the items will be retrieved from Amazon.com via Amazon Associates Web Service interface and automatically entered into the database. Users are able to edit and search their items. A simple loan management functionality is provided to allow users to borrow out items. Doing so would allow them to share their collections with their friends. Compared to other commercial products for managing home libraries, our solution is a purely online service that absolves users from performing complicated installations and maintenance. The usage of Amazon.compsilas Web Service to retrieve item information provides a reliable source for information retrieval. This is due to the currency of information available and the fact that Amazon.com has one of the largest catalogues of items, from books, CDs to home appliances. All these are made available via the Amazon Associates Web Service. Our system can be extended to manage other items such as prescription medications, and kitchen items. These features make the developed solution an attractive alternative to commercially developed products.","2378-3818;23783818","POD:978-0-7695-3286-8","10.1109/SERVICES-1.2008.83","http://ieeexplore.ieee.org/stamp/stamp.jsp?arnumber=4578319","","Books;DVD;Databases;Home appliances;Information retrieval;Libraries;Maintenance;Niobium;Service oriented architecture;Web services","Web services;home computing;information retrieval;library automation;software architecture","Amazon Associates Web service interface;home library management system;information retrieval;item information;multiple collections;online services;online system;service oriented architecture","","0","","8","","","6-11 July 2008","","IEEE","IEEE Conference Publications"
"Revisiting the Vector Retrieval Model in Context of the MPEG-7 Semantic Description Scheme","M. Lux","Dept. for Inf. Technol., Klagenfurt Univ., Klagenfurt","2008 Ninth International Workshop on Image Analysis for Multimedia Interactive Services","20080715","2008","","","134","138","Due to the semantic gap multimedia metadata is currently the only way to allow multimedia information retrieval on a conceptual level. One prominent multimedia metadata standard is MPEG-7. It offers means to annotate multimedia content using concepts and semantic relations. While several practical solutions for retrieval of MPEG-7 based conceptual annotations exist, a basic theoretical model has not been discussed yet. The paper in hand presents a vector representation for the MPEG-7 semantic description scheme and shows that the vector representation is unique and invertible. The vector representation allows the application of the vector retrieval model and therefore common retrieval mechanisms like weighting and indexing techniques or clustering.","2158-5873;21585873","CD-ROM:978-0-7695-3130-4; POD:978-0-7695-3344-5","10.1109/WIAMIS.2008.19","http://ieeexplore.ieee.org/stamp/stamp.jsp?arnumber=4556903","MPEG-7;Retrieval;Semantics;Vector Model","Context modeling;Context-aware services;Database languages;Image analysis;Image retrieval;Indexing;Information retrieval;Information technology;MPEG 7 Standard;Resource description framework","information retrieval;meta data;multimedia databases","MPEG-7 semantic description scheme;indexing techniques;multimedia content;multimedia information retrieval;semantic gap multimedia metadata;vector representation;vector retrieval model;weighting techniques","","1","","18","","","7-9 May 2008","","IEEE","IEEE Conference Publications"
