"On Labeling Noise and Outliers for Robust Concept Learning for Image Databases","Anlei Dong; B. Bhanu","University of California, Riverside","2004 Conference on Computer Vision and Pattern Recognition Workshop","20050124","2004","","","94","94","The mixture model for image databases remains as a challenging task since the database may contain clutter and outliers, and labelling information derived from multiple users may be inconsistent. Thus, neither the mixture model nor the labelling information is as ideal as most of the researchers have previously assumed. In this paper, we (a) address the problems of the noise disturbances for both mixture model and users' labelling information, (b) propose to process retrieval experiences in an intelligent manner using Bayesian analysis, (c) present a robust mixture model fitting algorithm to achieve visual concept learning, and (d) construct a concept-based indexing structure for efficient search of the database. The experimental results on a Corel image set show the correctness of our retrieval experience analysis, the effectiveness of the proposed concept learning approach, and the improvement of retrieval performance based on the indexing structure.","","","10.1109/CVPR.2004.137","http://ieeexplore.ieee.org/stamp/stamp.jsp?arnumber=1384888","","Bayesian methods;Deductive databases;Image databases;Image retrieval;Indexing;Information analysis;Information retrieval;Intelligent structures;Labeling;Noise robustness","","","","1","","","","","27-02 June 2004","","IEEE","IEEE Conference Publications"
"Similarity search in time series databases using moments","D. Toshniwal; R. C. Joshi","Department of Electronics and Computer Engineering, Indian Institute of Technology, Roorkee, India","2004 International Conference on Machine Learning and Applications, 2004. Proceedings.","20050131","2004","","","164","171","Similarity search in time series data is an area of active interest in the data mining community. In this paper we introduce a simple and novel approach for performing similarity search over time series data using moments. This technique is based on the observation that similar time sequences will have their centroids close to each other. The proposed technique is capable of handling variable length queries and works irrespective of global scaling and shrinking of time series data. It can also handle vertical shifts.","","POD:0-7803-8823-2","10.1109/ICMLA.2004.1383509","http://ieeexplore.ieee.org/stamp/stamp.jsp?arnumber=1383509","","Biomedical computing;Continuous wavelet transforms;Data engineering;Data mining;Databases;Discrete Fourier transforms;Discrete wavelet transforms;Indexing;Information retrieval;Wavelet transforms","","","","0","","11","","","16-18 Dec. 2004","","IEEE","IEEE Conference Publications"
"A new document clustering algorithm based on association rule","Jiang-Chun Song; Jun-Yi Shen; Qing-Bao Song","Dept. of Comput. Sci. & Technol., Xi'an Jiaotong Univ., China","Proceedings of 2004 International Conference on Machine Learning and Cybernetics (IEEE Cat. No.04EX826)","20050124","2004","2","","1310","1313 vol.2","Owing to the widely application in the fields of information retrieval, document analysis and information extraction, document cluster analysis has been concerned broadly, and gotten a great deal of research issues simultaneously. It is one of essential theme in document mining. Based on vector space model (VSM), This work presents a new document cluster algorithm based on association rule, and discusses the efficiency, the scalability and time complexity of the algorithm.","","POD:0-7803-8403-2","10.1109/ICMLC.2004.1382395","http://ieeexplore.ieee.org/stamp/stamp.jsp?arnumber=1382395","","Application software;Association rules;Clustering algorithms;Computer science;Data mining;Databases;Information analysis;Information retrieval;Machine learning;Machine learning algorithms","data mining;document handling;information retrieval","association rule;document analysis;document clustering algorithm;document mining;information extraction;information retrieval;vector space model","","1","2","7","","","26-29 Aug. 2004","","IEEE","IEEE Conference Publications"
"CLVQ: cross-language video question/answering system","Yu-Chyeh Wu; Chia-Hui Chang; Yue-Shi Lee","Nat. Central Univ., Taoyuan, Taiwan","IEEE Sixth International Symposium on Multimedia Software Engineering","20050117","2004","","","294","301","Multilanguage information retrieval promotes users to browse documents in the form of their mother language, and more and more peoples interested in retrieves short answers rather than a full document. In this paper, we present a cross-language video QA system i.e. CLVQ, which could process the English questions, and find answers in Chinese videos. The main contribution of this research are: (1) the application of QA technology into different media; and (2) adopt a new answer finding approach without human-made rules; (3) the combination of several techniques of passage retrieval algorithms. The experimental result shows 56% of answer finding. The testing collection was consists of six discovery movies, and questions are from the School of Discovery Web site.","","POD:0-7695-2217-3","10.1109/MMSE.2004.36","http://ieeexplore.ieee.org/stamp/stamp.jsp?arnumber=1376675","","Biomedical imaging;Cities and towns;Information retrieval;Motion pictures;Natural languages;Optical character recognition software;Performance evaluation;Prototypes;Testing;Watches","Web sites;document handling;information retrieval;multimedia systems;natural languages;video databases","CLVQ;Chinese video;cross-language video question/answering system;discovery Web site;human-made rule;multilanguage information retrieval;passage retrieval algorithm","","2","","18","","","13-15 Dec. 2004","","IEEE","IEEE Conference Publications"
"Topic Map Technology for Municipal Management Information Systems","P. Wolf; H. Krcmar","Technische Universit&#228;t M&#252;nchen","Proceedings of the 38th Annual Hawaii International Conference on System Sciences","20050124","2005","","","121b","121b","Experience shows that data warehouse solutions and reporting systems widely-used in enterprises can support the information needs of municipal managers only to a certain degree. Their need for information need is generated, in part, by ad hoc press reports, citizen requests or actions of the political opposition. Regularly produced reports or figure based information do not often provide satisfactory answers to unpredictable questions. The development of a management information system for the municipality in Stuttgart, Germany, concentrates on ad hoc information retrieval which is semantically supported by topic map technology. The article describes the characteristics of unstructured ad hoc information needs and shows on a conceptual level how topic maps can be developed as an instrument to support municipal management.","1530-1605;15301605","POD:0-7695-2268-8","10.1109/HICSS.2005.627","http://ieeexplore.ieee.org/stamp/stamp.jsp?arnumber=1385482","","Conference management;Councils;Data warehouses;Decision support systems;Information management;Information retrieval;Instruments;Management information systems;Project management;Research and development management","","","","1","","14","","","03-06 Jan. 2005","","IEEE","IEEE Conference Publications"
"Micro-Longitudinal Analysis of Web News Updates","D. O. Kutz; S. C. Herring","Indiana University, Bloomington, Indiana","Proceedings of the 38th Annual Hawaii International Conference on System Sciences","20050124","2005","","","102a","102a","News sites on the World Wide Web pose challenges for information retrieval due to their dynamic content and a tendency to produce multiple versions of the same story. In this study, we advance a method we refer to as micro-longitudinal sampling that automates the capture and reduction of news site content at one-minute intervals to a manageable size for qualitative analysis. This method was used to mine text and images from the front pages of three major news sites over a three-week period, and the changes identified were manually analyzed using content analysis and critical linguistics methods. The results reveal multiple motivations for changes, only some of which, it is argued, need to be attended to in searching and archiving online news.","1530-1605;15301605","POD:0-7695-2268-8","10.1109/HICSS.2005.409","http://ieeexplore.ieee.org/stamp/stamp.jsp?arnumber=1385443","","Content based retrieval;Content management;Data mining;Image analysis;Image sampling;Information analysis;Information retrieval;Libraries;Quality management;Web sites","","","","2","","29","","","03-06 Jan. 2005","","IEEE","IEEE Conference Publications"
"PeerView: query processing based on views over collaborative peers","Aoying Zhou; Tian Xia; Weining Qian","Dept. of Comput. Sci. & Eng., Fudan Univ., Shanghai, China","IEEE International Conference on E-Commerce Technology for Dynamic E-Business","20050207","2004","","","318","321","Peer-to-peer computing is gaining more and more significance in both academia and industry, due to its widespread use currently and potential deployments in future applications. In this paper, we propose a prototype P2P application providing a view-based query processing mechanism in P2P environments, which is named as PeerView. A large number of peers may work under a collaborative and self-organizing scheme to answer their common queries or sub-queries. Given the workload and storage of each peer, some certain peers establish and maintain the views via a cost-based and negotiating way. When processing queries, the peers can first retrieve data from views locally or on nearby peers, instead of from the remote sources. Thus network traffic can be reduced sharply and consequently query-processing efficiency can be boosted significantly","","POD:0-7695-2206-8","10.1109/CEC-EAST.2004.50","http://ieeexplore.ieee.org/stamp/stamp.jsp?arnumber=1388346","","Application software;Collaboration;Collaborative work;Computer industry;Computer science;Design engineering;Information retrieval;Peer to peer computing;Prototypes;Query processing","peer-to-peer computing;query processing;telecommunication traffic","PeerView;collaborative peers;network traffic;peer-to-peer computing;query processing","","0","","3","","","15-15 Sept. 2004","","IEEE","IEEE Conference Publications"
"Measuring Information Understanding in Large Document Collections","M. Slaney; D. M. Russell","IBM Almaden Research Center","Proceedings of the 38th Annual Hawaii International Conference on System Sciences","20050124","2005","","","105","105","We present a method for testing subject's performance in a realistic (end-to-end) information understanding task-rapid understanding of large document collections-and discuss lessons learned from our attempts to measure representative information-understanding tools and behaviors. To further our understanding of this task, we need to move beyond overly constrained and artificial measurements of easily instrumented behavior. From observations, we know information analysis is often performed under time pressure and requiring use of large document collections. Instrumenting people in their workplace is often untenable, yet oversimple laboratory studies often miss explanatory richness. We argue that studies of information analysts need to be done on tests that are closely aligned with their natural tasks. Understanding human performance in such tasks requires analysis that accounts for many of the subtle factors that influence final performance, including the role of background knowledge, variations in reading speed, and tool use costs.","1530-1605;15301605","POD:0-7695-2268-8","10.1109/HICSS.2005.404","http://ieeexplore.ieee.org/stamp/stamp.jsp?arnumber=1385450","","Cathode ray tubes;Displays;Electronic equipment testing;Humans;Information analysis;Information retrieval;Materials testing;Performance evaluation;Sorting;System testing","","","","2","","25","","","03-06 Jan. 2005","","IEEE","IEEE Conference Publications"
"User-Oriented Relevance Judgment: A Conceptual Model","Zhiwei Chen; Yunjie Xu","National University of Singapore","Proceedings of the 38th Annual Hawaii International Conference on System Sciences","20050124","2005","","","101b","101b","The concept of relevance has been heatedly debated in last decade. Not satisfied with the narrow and technical definition of system relevance, researchers turn to the subjective and situational aspect of this concept. How does a user perceive a document as relevant? The literature on relevance has identified numerous factors affecting such judgment. Taking a cognitive approach, this study focuses on the criteria users employ in making relevance judgment. Based on Grice's theory of communication, this paper proposes a five-factor model of relevance: topicality, novelty, reliability, understandability, and scope. Data are collected from a semi-controlled survey study and analyzed following a psychometric procedure. The result supports topicality and novelty as the key relevance criteria. Theoretical and practical implications of this study are discussed.","1530-1605;15301605","POD:0-7695-2268-8","10.1109/HICSS.2005.654","http://ieeexplore.ieee.org/stamp/stamp.jsp?arnumber=1385441","","Information retrieval;Information science;Psychology;Psychometric testing;Reliability theory","","Grice's theory;psychometric analysis;relevance;relevance criteria","","0","","65","","","03-06 Jan. 2005","","IEEE","IEEE Conference Publications"
"Efficient retrieval of electron density patterns for modeling proteins by X-ray crystallography","K. Gopal; T. D. Romo; J. C. Sacchettini; T. R. Ioerger","","2004 International Conference on Machine Learning and Applications, 2004. Proceedings.","20050131","2004","","","380","387","Inefficient case retrieval is a major problem in many case-based reasoning systems, especially when case matching is expensive and the case-base is large. In this paper, we present a two-phase approach where an inexpensive feature-based method is used to jind a set of potential matches and a more expensive and accurate case matching method is used to make the jinal selection. This approach has been successfully employed in TEXTALTM, a system that retrieves previously solved 3D patterns of electron density from a database to determine the structure of proteins. Electron density patterns are characterized by numeric features and an appropriate distance measure is used to efficiently jilter good matches through an exhaustive search of the database. These matches are then examined using a computationally expensive density correlation procedure based on jinding an optimal superposition between 3D patterns. We provide an empirical and theoretical analysis of some of the keys issues related to this method. In particular, we dejine a model for estimating how approximate various featurebased similarity measures are (relative to an objective matching metric), and determine its relation to the number of cases that should be jiltered from a given database to make the approach effective.","","POD:0-7803-8823-2","10.1109/ICMLA.2004.1383539","http://ieeexplore.ieee.org/stamp/stamp.jsp?arnumber=1383539","","Computer science;Crystallography;Databases;Electrons;Information retrieval;Matched filters;Particle measurements;Pattern matching;Predictive models;Proteins","","","","1","","20","","","16-18 Dec. 2004","","IEEE","IEEE Conference Publications"
"Grid-based indexing of a newswire corpus","B. Hughes; S. Venugopal; R. Buyya","Dept. of Comput. Sci. & Software Eng., Melbourne Univ., Parkville, Vic., Australia","Fifth IEEE/ACM International Workshop on Grid Computing","20050124","2004","","","320","327","In this paper we report experience in the use of computational grids in the domain of natural language processing, particularly in the area of information extraction, to create query indices for information retrieval tasks. Given the prevalence of large corpora in the natural language processing domain, computational grids offer significant utility to researchers in the domain who are reaching the bounds of computational efficiency. We leverage the affinities between the segmented data sources prevalent in natural language processing and the parallelisation model from the grid domain. The experiment reported here is a large-scale newswire corpus indexing task, with the goal to efficiently create a queryable index of the entire corpus. By parallelising the indexing task and executing it on an Australian computational grid, we observe overall performance improvement of a 2.26x speedup over the same experiment on a single computational node. In addition to reporting the raw performance impact, we reflect on a number of interesting points discovered during the execution of the experiments and propose a number of new requirements for grid middleware.","1550-5510;15505510","POD:0-7695-2256-4","10.1109/GRID.2004.34","http://ieeexplore.ieee.org/stamp/stamp.jsp?arnumber=1382847","","Australia;Computational efficiency;Concurrent computing;Data mining;Grid computing;Indexing;Information retrieval;Large-scale systems;Middleware;Natural language processing","grid computing;information resources;information retrieval;middleware;natural languages","Newswire corpus;computational;grid-based indexing;information extraction;information retrieval task;middleware;natural language processing;parallelisation model;query indices;segmented data source","","2","","24","","","8 Nov. 2004","","IEEE","IEEE Conference Publications"
"Locating the starting point of closed contour based on half-axes-angle","Hui-Min Zhang; Zhong Wang; Liqun Han; Dong Li","Dept. of Inf. Eng., Acad. of Armored Force Eng., Beijing, China","Proceedings of 2004 International Conference on Machine Learning and Cybernetics (IEEE Cat. No.04EX826)","20050124","2004","6","","3899","3903 vol.6","This work presents an approach to the starting point location of the closed contour based on the half-axes-angle and the shape matching problems using the method. It is considered that the problem core of the translation, scaling and rotation invariance of the shape recognition can be changed into the problem of the starting point location, and then be solved by the coordinates transformation. First, the invariance problems of the translation, scaling and rotation of the wavelet descriptor are analyzed, and the relevant description of the half-axes-angles is given. Then the starting point location of the curve and the shape matching strategy based on half-axes-angles are discussed. The experiments are conducted to prove the effectiveness of the method.","","POD:0-7803-8403-2","10.1109/ICMLC.2004.1380526","http://ieeexplore.ieee.org/stamp/stamp.jsp?arnumber=1380526","","Application software;Computer vision;Digital images;Frequency domain analysis;Image retrieval;Information retrieval;Shape;Wavelet analysis;Wavelet domain;Wavelet transforms","image matching;image processing","coordinate transformation;half-axes-angle;percentage similarity;rotation invariance;shape matching strategy;shape recognition;starting point location;wavelet descriptor","","1","","9","","","26-29 Aug. 2004","","IEEE","IEEE Conference Publications"
"OmniSeer: A Cognitive Framework for User Modeling, Reuse of Prior and Tacit Knowledge, and Collaborative Knowledge Services","J. Cheng; R. Emami; L. Kerschberg; Qunhua Zhao; Hien Nguyen; Hua Wang; M. Huhns; M. Valtorta; J. Dang; H. Goradia; Jingshan Huang; S. Xi","Global InfoTek","Proceedings of the 38th Annual Hawaii International Conference on System Sciences","20050124","2005","","","293c","293c","This paper describes the current state of the OmniSeer system. OmniSeer supports intelligence analysts in the handling of massive amounts of data, the construction of scenarios, and the management of hypotheses. OmniSeer models analysts with dynamic user models that capture an analyst's context, interests, and preferences, thus enabling more efficient and effective information retrieval. OmniSeer explicitly represents the prior and tacit knowledge of analysts, thus enabling transfer and reuse of such knowledge. Both the user and cognitive models employ a Bayesian network fragment representation, which supports principled probabilistic reasoning and analysis. An independent evaluation of OmniSeer was carried out at NIST and will be used to guide further development.","1530-1605;15301605","POD:0-7695-2268-8","10.1109/HICSS.2005.462","http://ieeexplore.ieee.org/stamp/stamp.jsp?arnumber=1385842","","Bayesian methods;Collaboration;Context modeling;Data analysis;Information analysis;Information retrieval;Intelligent agent;Intelligent systems;Knowledge management;NIST","","","","2","1","15","","","03-06 Jan. 2005","","IEEE","IEEE Conference Publications"
"A rough set-based CBR approach for feature and document reduction in text categorization","Yan Li; S. C. K. Shiu; S. K. Pal; J. N. K. Liu","Dept. of Comput., Hong Kong Polytech. Univ., China","Proceedings of 2004 International Conference on Machine Learning and Cybernetics (IEEE Cat. No.04EX826)","20050124","2004","4","","2438","2443 vol.4","An approach of rough set-based case-based reasoning (CBR) approach is proposed to tackle the task of text categorization (TC). The initial work of integrating both feature and document reduction/selection in TC using rough sets and CBR properties is presented. Rough set theory is incorporated to reduce the number of feature terms through generating reducts. On the other hand, two concepts of case coverage and case reachability in CBR are used in selecting the representative documents. The main contribution of this paper is that both the number of features and the documents are reduced with minimal loss of useful information. Some experiments are conducted on the text datasets of Reuters21578. The experimental results show that, although the number of feature terms and documents are reduced greatly, the problem-solving quality in terms of classification accuracy is still preserved.","","POD:0-7803-8403-2","10.1109/ICMLC.2004.1382212","http://ieeexplore.ieee.org/stamp/stamp.jsp?arnumber=1382212","","Computer science;Fuzzy logic;Information retrieval;Machine intelligence;Machine learning;Mathematics;Natural languages;Set theory;Text categorization;Uncertainty","case-based reasoning;natural languages;rough set theory;word processing","case coverage;case reachability;case-based reasoning;document reduction;feature reduction;rough set-based CBR approach;text categorization","","0","","12","","","26-29 Aug. 2004","","IEEE","IEEE Conference Publications"
"A new video retrieval approach based on clustering","Zhen Lei; Liang-Da Wu; Song-Yang Lao; Gang Wang; Chen Wang","Key Lab. of Inf. Syst. Eng., Nat. Univ. of Defense Technol., Changsha, China","Proceedings of 2004 International Conference on Machine Learning and Cybernetics (IEEE Cat. No.04EX826)","20050124","2004","3","","1733","1738 vol.3","The shot based clustering and retrieval is very important for video database organization and access. We can take advantage of semantic clustering to enhance the performance of traditional content-based video retrieval. In this paper, text feature and color feature are first extracted directly from shots. Subsequently, a two-level hierarchical clustering structure that provides indexing scheme for retrieval is constructed by incorporating text and color features. The top level is clustered by text features while the bottom level is clustered by color features. The constructed structure is then used for the cluster-based retrieval. The effectiveness and efficiency of our approach are demonstrated by the experimental results in retrieving and ranking similar video shots.","","POD:0-7803-8403-2","10.1109/ICMLC.2004.1382055","http://ieeexplore.ieee.org/stamp/stamp.jsp?arnumber=1382055","","Automatic speech recognition;Bridges;Content based retrieval;Data mining;Feature extraction;Information analysis;Information retrieval;Spatial databases;Speech analysis;Videoconference","content-based retrieval;data mining;database indexing;feature extraction;pattern clustering;statistical analysis;text analysis;video databases","cluster based retrieval;color feature extraction;content based video retrieval;data mining;indexing scheme;semantic clustering;text feature extraction;video database access;video database organization;video retrieval method;video shot based clustering;video shot based retrieval","","1","","9","","","26-29 Aug. 2004","","IEEE","IEEE Conference Publications"
