"Using Novel IR Measures to Learn Optimal Cluster Structures for Web Information Retrieval","M. Mehlitz; J. Kunegis; S. Albayrak","Technical University Berlin, DAI-Labor, 10587 Berlin, Germany","Web Intelligence, IEEE/WIC/ACM International Conference on","20080107","2007","","","312","316","The Internet is a vast resource of information. Unfortunately, finding and accessing this information is often a very cumbersome task even with existing information platforms. Searching on the WWW suffers from the fact that almost every word is ambiguous to a certain degree in the information-rich environment of the Internet. Clustering search results is a way to solve this problem. This paper demonstrates how to employ novel Information Retrieval measures to derive optimal parametrizations for a cluster algorithm.","","POD:0-7695-3026-5","10.1109/WI.2007.42","http://ieeexplore.ieee.org/stamp/stamp.jsp?arnumber=4427109","","Clustering algorithms;Data visualization;Distortion measurement;Information retrieval;Intelligent structures;Internet;Size measurement;Testing;Web search;World Wide Web","","","","0","","17","","","2-5 Nov. 2007","","IEEE","IEEE Conference Publications"
"Using Phase and Magnitude Information of the Complex Directional Filter Bank for Texture Image Retrieval","A. P. N. Vo; S. Oraintara; T. T. Nguyen","University of Texas at Arlington, Department of Electrical Engineering, Arlington, TX 76019-0016","2007 IEEE International Conference on Image Processing","20071112","2007","4","","IV - 61","IV - 64","This paper discusses how to utilize both magnitude and phase information obtained from the complex directional filter bank (CDFB) for the purpose of texture image retrieval. The relative phase, which is the difference of phases between adjacent CDFB coefficients, has a linear relationship with the angle of dominant orientation within a subband. This information is incorporated to form a new feature vector called CDFB-RP. Texture retrieval performance of the proposed CDFB-RP is compared to those of the conventional transforms including the Gabor wavelet, the contourlet transform, the steerable pyramid and the CDFB. With the same number of features, the CDFB-RP method outperforms all other transforms in texture image retrieval, while keeping lower complexity and computational time.","1522-4880;15224880","CD-ROM:978-1-4244-1437-6; POD:978-1-4244-1436-9","10.1109/ICIP.2007.4379954","http://ieeexplore.ieee.org/stamp/stamp.jsp?arnumber=4379954","Directional Filter Bank;Dual-tree;relative phase;texture classification;texture retrieval","Energy resolution;Filter bank;Frequency;Geophysics computing;Image resolution;Image retrieval;Information retrieval;Spatial resolution;Vectors;Wavelet transforms","image retrieval;image texture","Gabor wavelet;complex directional filter bank;contourlet transform;magnitude information;phase information;texture image retrieval","","14","","10","","","Sept. 16 2007-Oct. 19 2007","","IEEE","IEEE Conference Publications"
"Center Block Duplication Detection and Indexing for Efficient Web Information Retrieval","T. Cadenhead; J. Chen; T. Cook","Computer Science Dept., Queen College, CUNY, thcaden2003@yahoo.com","2006 1st International Conference on Digital Information Management","20070604","2007","","","424","429","Duplicated information in today's Web has serious negative impact to search engines in that it increases the size of the index and results in low efficiency for Web information retrieval. A large amount of Web content duplication happens at block level in addition to page level. Besides, when searching the web, in most cases the desired information is located at the center block of a page. Based on these two observations, we propose a block level duplication detection algorithm, and index center blocks instead of entire Web pages for Web information retrieval. Experiments show that these strategies can effectively reduce index size and indexing time without sacrificing the effectiveness of Web information retrieval.","","POD:1-4244-0682-X","10.1109/ICDIM.2007.369232","http://ieeexplore.ieee.org/stamp/stamp.jsp?arnumber=4221924","","Computer science;Detection algorithms;Educational institutions;Image processing;Indexing;Information retrieval;Infrared detectors;Search engines;Web pages;Web sites","Internet;indexing;information retrieval;search engines","Web information retrieval;center block duplication detection;indexing;search engine","","1","","20","","","6-6 Dec. 2006","","IEEE","IEEE Conference Publications"
"Performance Evaluation of Content-Based Information Retrieval Schemes for DTNs","M. Chuah; P. Yang","Department of Computer Science & Engineering, Lehigh University. chuah@cse.lehigh.edu","MILCOM 2007 - IEEE Military Communications Conference","20080222","2007","","","1","7","Mobile nodes in some challenging network scenarios suffer from intermittent connectivity and frequent partitions e.g. battlefield and disaster recovery scenarios. Disruption Tolerant Network (DTN) technologies are designed to enable nodes in such environments to communicate with one another. Several DTN routing schemes have been proposed. However, not much work has been done on providing information access in such challenging network scenarios. Existing client/server paradigm for information access will not be feasible in such scenarios since end-to-end path does not exist. Thus, in this paper, we explore how a content-based information retrieval system can be designed for DTNs. There are three important design issues, namely (a) how should data be replicated and stored at multiple nodes, (b) how should a query be disseminated in sparsely connected networks, (c) how should a query response be routed back to the querying node. We first describe two data caching schemes: (a) K-copy random caching, (b) K-copy intelligent caching. Then, we describe an L-hop Neighborhood Spraying (LNS) scheme for query dissemination. For message routing, we either use Prophet routing scheme or Highest Encounter First Routing (HEFR) scheme. We conduct extensive simulation studies to evaluate different combinations of these algorithms. Our results reveal that the scheme that performs the best is the one that uses the K-copy intelligent caching combined with the LNS query dissemination and HEFR scheme.","2155-7578;21557578","CD-ROM:978-1-4244-1513-7; POD:978-1-4244-1512-0","10.1109/MILCOM.2007.4455020","http://ieeexplore.ieee.org/stamp/stamp.jsp?arnumber=4455020","content-based routing;disruption tolerant networking;network performance","Batteries;Computer science;Content based retrieval;Disruption tolerant networking;Energy storage;Information retrieval;Intelligent sensors;Mobile computing;Routing;Spraying","","","","3","","17","","","29-31 Oct. 2007","","IEEE","IEEE Conference Publications"
"Modeling User_s Cognitive Structure in Contextual Information Retrieval","X. Tian; X. Du; H. Hu; H. Li","Renmin University of China","Fourth International Conference on Fuzzy Systems and Knowledge Discovery (FSKD 2007)","20071218","2007","4","","349","353","In contextual information retrieval, the retrieval of information depends on the time and place of submitting query, history of interaction, task in hand, and many other factors that are not given explicitly but implicitly lie in the interaction and surroundings of searching, namely the context. User's cognition is one of important contextual factors for understanding his or her personal needs. We propose a model called DOSAM to get user's individual cognitive structure on domain knowledge. DOSAM is developed from the spreading-activation model of psychology and is established on the domain ontology. The cost analysis of algorithm shows that it is feasible to get cognitive structure by DOSAM. Personalized search experimental results on digital library indicate that DOSAM can help improve the search effectiveness and user's satisfaction.","","POD:0-7695-2874-0","10.1109/FSKD.2007.410","http://ieeexplore.ieee.org/stamp/stamp.jsp?arnumber=4406410","","Cognition;Context modeling;Data engineering;Helium;History;Information retrieval;Knowledge engineering;Laboratories;Ontologies;Psychology","cognition;human factors;information retrieval;ontologies (artificial intelligence);psychology;user modelling","DOSAM model;contextual information retrieval;domain ontology;interaction history;psychology spreading-activation model;query submission;user individual cognitive structure modeling","","2","","8","","","24-27 Aug. 2007","","IEEE","IEEE Conference Publications"
"Research on Concept Lattice Based Personalized Information Retrieval","J. Tang; Y. J. Du; L. Qi","school of communication, Qingdao Agricultural University, Qingdao 266109, China. E-MAIL: tangjunwork@163.com","2007 International Conference on Machine Learning and Cybernetics","20071029","2007","7","","4032","4037","The information retrieval model is the core of the information retrieval. Nowadays, with the recent advances in the theory and practice of concept lattice, many researchers are using concept lattice as a basis for constructing information retrieval model, the representative of which is the concept lattice based ranking model (CLR). However, the CLR is only based on the shortest path linking the query to the documents. It is not well defined. To resolve the existing problem, first, this paper presents a concept lattice based user model to represent user interest in concept lattice structure. A novel concept lattice based user modeling algorithm is also provided. Second, this paper proposes a concept lattice based personalized ranking model (CLPR), which measures the similarity among query, user interest model and documents according to the relation between query and user interest based on concept lattice. The similarity computation of CLPR contains more information than traditional information retrieval models, and moreover, the CLPR can identify the new interest of users and find the documents of new interest. Our experiments show that documents retrieved by CLPR achieve steadily higher measures of precision than the CLR and the traditional vector space model. And CLPR is feasible to common search engine users.","2160-133X;2160133X","CD-ROM:978-1-4244-0973-0; POD:978-1-4244-0972-3","10.1109/ICMLC.2007.4370851","http://ieeexplore.ieee.org/stamp/stamp.jsp?arnumber=4370851","Concept lattice;Information retrieval model;Personalized services;User modeling","Cybernetics;Educational institutions;Information filtering;Information filters;Information retrieval;Joining processes;Lattices;Machine learning;Machine learning algorithms;Mathematics","document handling;lattice theory;query processing;search engines;user modelling","concept lattice based ranking model;personalized information retrieval;query processing;search engine;shortest path linking;user interest representation;user modeling algorithm;vector space model","","3","","12","","","19-22 Aug. 2007","","IEEE","IEEE Conference Publications"
"Query Refinement for Internet Multimedia Information Retrieval Using Keywords and Low-level Features","A. Vadivel; S. Sural; A. K. Majumdar","Nat. Inst. of Technol., Tiruchirapalli","International Conference on Computational Intelligence and Multimedia Applications (ICCIMA 2007)","20080107","2007","4","","192","196","The main obstacle in realizing semantic-based image retrieval is from the web that semantic description of an image is difficult to capture in low-level features. Text based keywords can be generated from web documents to capture semantic information for narrowing down the search space. We use an effective approach to integrate keywords, which is extracted from Web documents and low-level features such as color-texture features to take advantage of their complementing strengths. Experimental results show that the keywords can be replaced with low-level features for successful query refinement and improved precision of retrieval.","","POD:0-7695-3050-8","10.1109/ICCIMA.2007.45","http://ieeexplore.ieee.org/stamp/stamp.jsp?arnumber=4426476","","Computational intelligence;Data mining;HTML;Histograms;Image retrieval;Information retrieval;Internet;Search engines;Shape;World Wide Web","image retrieval;text analysis","Internet multimedia information retrieval;Web documents;color-texture features;query refinement;semantic description;semantic information;semantic-based image retrieval;text based keywords","","0","","10","","","13-15 Dec. 2007","","IEEE","IEEE Conference Publications"
"Thesaurus-based query and document expansion in conceptual indexing with UMLS: Application in medical information retrieval","l. T. H. Diem; J. P. Chevallet; D. T. B. Thuy","Joseph Fourier University, Laboratoiry CLIPS-IMAG, 38041 Grenoble Cedex 9, France, Thi-Hoang-Diem.Le@imag.fr","2007 IEEE International Conference on Research, Innovation and Vision for the Future","20070604","2007","","","242","246","UMLS is known as largest thesaurus in biomedical domain constructed by Library National of Medicine. In this paper, we aim to evaluate effect of the exploration of UMLS knowledge in medical domain information retrieval by mapping large text of collection ImageCLEFMed to UMLS concepts, and expanding queries and documents automatically base on semantic relations in the UMLS hierarchy. We get the encouraging result with the best enhancement on MAP of 66% compared to text only retrieval, and 34% compared to conceptual indexing baseline.","","POD:1-4244-0694-3","10.1109/RIVF.2007.369163","http://ieeexplore.ieee.org/stamp/stamp.jsp?arnumber=4223080","Conceptual indexing;UMLS;document expansion;query expansion;semantic relation","Biomedical imaging;Bridges;Cities and towns;Indexing;Information retrieval;Laboratories;Libraries;Terminology;Thesauri;Unified modeling language","document handling;information retrieval;medical information systems;query processing;thesauri","Library National of Medicine;UMLS hierarchy;conceptual indexing;document expansion;medical information retrieval;thesaurus-based query","","0","","24","","","5-9 March 2007","","IEEE","IEEE Conference Publications"
"A Music Information Retrieval Approach Based on Power Laws","P. Roos; B. Manaris","Coll. of Charleston, Charleston","19th IEEE International Conference on Tools with Artificial Intelligence(ICTAI 2007)","20080104","2007","2","","27","31","We present a music information retrieval approach based on power laws. Research in cognitive science and neuroscience reveals connections between power laws, human cognition, and human physiology. Empirical studies also demonstrate connections between power laws and human aesthetics. We utilize 250+ power-law metrics to extract statistical proportions of music-theoretic and other attributes of music pieces. We discuss an experiment where artificial neural networks classify 2,000 music pieces, based on aesthetic preferences of human listeners, with 90. 70% accuracy. Also, we present audio results from a music information retrieval experiment, in which a music search engine prototype retrieves music based on ""aesthetic"" similarity from a corpus of 15,200+ pieces. These results suggest that power-law metrics are a promising model of music aesthetics, as they may be capturing statistical properties of the human hearing apparatus.","1082-3409;10823409","POD:0-7695-3015-X","10.1109/ICTAI.2007.170","http://ieeexplore.ieee.org/stamp/stamp.jsp?arnumber=4410352","","Artificial neural networks;Cognition;Cognitive science;Data mining;Humans;Music information retrieval;Neuroscience;Physiology;Prototypes;Search engines","information retrieval;music;neural nets;search engines","aesthetic similarity;artificial neural networks;human aesthetics;music information retrieval approach;music pieces;music search engine;power laws;statistical proportions","","2","","26","","","29-31 Oct. 2007","","IEEE","IEEE Conference Publications"
"Syntactic Information Retrieval","C. Liu; H. Wang; S. Mcclean; J. Liu; S. Wu","Univ. of Ulster, Newtownabbey","2007 IEEE International Conference on Granular Computing (GRC 2007)","20071217","2007","","","703","703","Natural language processing (NLP) techniques are believed to have the potential to aid information retrieval (IR) in terms of retrieval accuracy. In this paper we report a proof of concept study on a new approach to NLP-based IR that we propose. Documents and queries are represented as syntactic parse trees, which are generated by a natural language parser. Based on this tree structured representation of documents and queries, the matching between a document and a query is executed on their tree representations, with tree comparison as the key operation. An IR experiment is designed to test if this approach is feasible. Experimental results show that this approach is promising and has the potential to outperform the standard bag of words approach to information retrieval, especially in response to long queries.","","POD:0-7695-3032-X","10.1109/GrC.2007.113","http://ieeexplore.ieee.org/stamp/stamp.jsp?arnumber=4403191","","Information analysis;Information retrieval;Natural language processing;Natural languages;Testing;Tree data structures","grammars;information retrieval;natural language processing;tree data structures","document-query matching;natural language processing;parse tree structured representation;syntactic information retrieval","","0","","20","","","2-4 Nov. 2007","","IEEE","IEEE Conference Publications"
"Mahak: A Test Collection for Evaluation of Farsi Information Retrieval Systems","K. S. Esmaili; H. Abolhassani; M. Neshati; E. Behrangi; A. Rostami; M. M. Nasiri","Web Intelligence Laboratory, Sharif University of Technology, Tehran, Iran. shesmail@ce.sharif.edu","2007 IEEE/ACS International Conference on Computer Systems and Applications","20070611","2007","","","639","644","Currently there is no standard test collection for evaluation of Farsi information retrieval systems. In this paper we introduce Mahak, the first complete test collection generally available for evaluating Farsi information retrieval systems. We also discuss our construction process in detail. As a goal, we hope that Mahak will foster the development of Farsi information retrieval systems.","2161-5322;21615322","CD-ROM:1-4244-1031-2; POD:1-4244-1030-4","10.1109/AICCSA.2007.370697","http://ieeexplore.ieee.org/stamp/stamp.jsp?arnumber=4231025","","Data mining;Information retrieval;Laboratories;Large-scale systems;Natural language processing;Natural languages;Statistics;System testing;Text mining","information retrieval system evaluation;natural languages","Farsi information retrieval system;standard test collection","","4","","12","","","13-16 May 2007","","IEEE","IEEE Conference Publications"
"Retrieval of Quantitative and Qualitative Information about Plant Pigment Systems from High Resolution Spectroscopy","S. Ustin; G. Asner; J. Gamon; K. Huemmrich; S. Jacquemoud; M. Schaepman; P. Zarco-Tejada","Dept. L.A.W.R., Univ. of California, Davis, CA","2006 IEEE International Symposium on Geoscience and Remote Sensing","20070618","2006","","","1996","1999","Life on Earth depends on photosynthesis. Photosynthetic systems evolved early in Earth history and have been stable for 2.5 billion years, providing <i>prima</i> <i>facie</i> evidence for these significance of evolutionary functions. Pigments perform multiple plant functions from increasing the range of energy captured for photosynthesis to a range of protective functions. Given the importance of pigments to leaf functioning, greater effort is needed to determine whether individual pigments can be identified and quantified by high fidelity spectroscopy. New methods to identify overlapping pigment absorptions would provide a major advance for understanding plant functions, quantifying net carbon exchange, and identifying plant stresses.","2153-6996;21536996","POD:0-7803-9510-7","10.1109/IGARSS.2006.517","http://ieeexplore.ieee.org/stamp/stamp.jsp?arnumber=4241664","","Absorption;Algae;Earth;Information retrieval;Microorganisms;Pigmentation;Protection;Spectroscopy;Stress;USA Councils","geophysical techniques;photosynthesis;vegetation","high resolution spectroscopy;net carbon exchange;photosynthesis;plant pigment;qualitative information retrieval;quantitative information retrieval","","1","","38","","","July 31 2006-Aug. 4 2006","","IEEE","IEEE Conference Publications"
"Exploiting multi-evidence from multiple users interests to personalizing information retrieval","L. Tamine-Lechani; M. Boughanem; N. Zemirli","Institut de Recherche en Informatique de Toulouse, IRIT 118 Route de Narbonne CEDEX 09, France","2007 2nd International Conference on Digital Information Management","20080131","2007","1","","7","12","The goal of personalization in information retrieval is to tailor the search engine results to the specific goals, preferences and general interests of the users. We propose a novel model that considers the user's interests as sources of evidence in order to tune the accuracy of documents returned in response to the user query. The model's fundation comes from influence diagrams which are extension of Bayesian graphs, dedicated to decision-making problems. Hence, query evaluation is carried out as an inference process that aims to computing an aggregated utility of a document by considering its relevance to the query but also the corresponding utility with regard to the user's topics of interest. Experimental results using enhanced TREC collections indicate that our personalized retrieval model is effective.","","CD-ROM:978-1-4244-1476-5; POD:978-1-4244-1475-8","10.1109/ICDIM.2007.4444192","http://ieeexplore.ieee.org/stamp/stamp.jsp?arnumber=4444192","","Bayesian methods;Clustering algorithms;Context modeling;Data mining;Decision making;Feedback;Information retrieval;Multitasking;Query processing;Search engines","Bayes methods;decision making;inference mechanisms;query processing;search engines","Bayesian graphs;decision making problems;inference;influence diagrams;information retrieval;multievidence;personalization;query evaluation;search engine;user interests","","1","","15","","","28-31 Oct. 2007","","IEEE","IEEE Conference Publications"
"Context-Based Adaptive Personalized Web Search for Improving Information Retrieval Effectiveness","X. Pan; Z. Wang; X. Gu","Dept. of Manage. Sci. & Eng., Zhejiang Sci-Tech Univ., Hangzhou","2007 International Conference on Wireless Communications, Networking and Mobile Computing","20071008","2007","","","5427","5430","Current Web search/metasearch engines are built to serve all users, independent of the special needs of any individual user in different situations. Personalization of web search is to carry out retrieval for each user incorporating his/her interests. In this paper, we propose a novel adaptive personalized approach based on context to adapting search results according to each user's need in different situations for relevant information with little user effort. After the process of the context-based adaptive personalized search is analyzed, three key technologies to implement this process are presented in details, which are semantic indexing for Web resources, modeling and acquiring user context and semantic similarity matching between Web resources and user context. Experimental results indicate that the adaptive personalized search system is adopted by most of users and our approach to personalize Web search is both effective.","2161-9646;21619646","CD-ROM:1-4244-1312-5; POD:1-4244-1311-7","10.1109/WICOM.2007.1329","http://ieeexplore.ieee.org/stamp/stamp.jsp?arnumber=4341104","","Adaptive systems;Context modeling;Demography;Engineering management;Feedback;Information retrieval;Metasearch;Search engines;Web pages;Web search","information needs;information retrieval;search engines;semantic Web","context-based adaptive personalized Web search;information retrieval;metasearch engines;semantic indexing;semantic similarity matching;user context acquisition;user context modeling","","7","","6","","","21-25 Sept. 2007","","IEEE","IEEE Conference Publications"
"An Agent-based Framework for Intelligent and Dynamic Business Information Retrieval","H. Hu; B. Xu","","Workshop on Intelligent Information Technology Application (IITA 2007)","20080107","2007","","","77","81","In order to survive in competitive market, the industries must collect and analyze the business information dynamically according to the demanding of market. Though traditional information retrieval techniques are useful in normal business information analysis, the retrieved results could hardly reflect the dynamic business status. The goal of the A2DT project is to develop an agent-based framework for dynamic business information analysis. In this paper, a dynamic business information retrieval process is proposed and is compared with the traditional information retrieval process. An agent-based framework for dynamic information retrieval process is presented so as to manage the business status intelligently and dynamically.","","POD:0-7695-3063-X","10.1109/IITA.2007.16","http://ieeexplore.ieee.org/stamp/stamp.jsp?arnumber=4426969","","Companies;Competitive intelligence;Decision making;Image retrieval;Information analysis;Information filtering;Information retrieval;Intelligent agent;Intelligent systems;Music information retrieval","","","","3","","16","","","2-3 Dec. 2007","","IEEE","IEEE Conference Publications"
