"Integration and collection of heterogeneous data based on metedata","L. Zhang","Inst. of Sci. & Tech. Inf. of China, Beijing, China","2013 6th International Conference on Information Management, Innovation Management and Industrial Engineering","20140109","2013","1","","205","208","In order to solve the problem of heterogeneous data collection and integration in different industries, metadata-based retrieval model and rule-based web wrapper are proposed. Retrieval metadata set and industry retrieval model are constructed by applying metadata extraction technology, and the rule tree of industry data attributes is built and web wrapper is designed based on industry data format analysis. On the basis of above work, industry data collection system is realized to complete industry data collection. Through the study, researchers can obtain research data rapidly and accurately.","2155-1456;21551456","Electronic:978-1-4799-0245-3; POD:978-1-4799-0243-9","10.1109/ICIII.2013.6702910","http://ieeexplore.ieee.org/stamp/stamp.jsp?arnumber=6702910","retrieval metadata;retrieval model;rule tree;web wrapper","Data collection;Data mining;Data models;Industries;Patents;Search engines;Web pages","Internet;data analysis;distributed databases;information retrieval;meta data","heterogeneous data collection;heterogeneous data integration;industry data attributes;industry data collection system;industry data format analysis;industry retrieval model;metadata extraction technology;metadata-based retrieval model;metedata;retrieval metadata set;rule tree;rule-based Web wrapper","","0","","8","","","23-24 Nov. 2013","","IEEE","IEEE Conference Publications"
"Uncovering Cloaking Web Pages with Hybrid Detection Approaches","J. Deng; H. Chen; J. Sun","Coll. of Inf. Sci. & Eng., Hunan Univ., Changsha, China","2013 International Symposium on Computational and Business Intelligence","20140127","2013","","","291","296","Web search cloaking, used by spammers for the purpose of increasing the visiting rates of their website, is a challenging spamming technique to search engines. Existing cloaking detection systems have some shortcomings: the accuracy of their algorithms is not high enough, the types of cloaking techniques that be detected are limited. In this paper, we present a new system to attack these two problems. To improve the detection accuracy, our algorithm combines text, tag and URL based method. For the purpose of detecting more types of cloaking techniques, our system works as follows: driving a real browser to execute scripts in web pages, crawl a page for the second time by modifying the referrer field of our HTTP headers, obtaining search engine's cached page for further comparison. We apply our system to 104,800 URLs extracted from Yahoo. Results show that our system can gain a high accuracy: precision at 94.52% and recall at 98.57%. More types of cloaking techniques are successfully detected by our system.","","Electronic:978-0-7695-5066-4; POD:978-1-4799-0998-8","10.1109/ISCBI.2013.65","http://ieeexplore.ieee.org/stamp/stamp.jsp?arnumber=6724370","Cloak;Cloaking Techniques;SEO;search terms;similarity detection algorithm","Accuracy;Browsers;Crawlers;HTML;IP networks;Search engines;Web pages","Web sites;information retrieval;search engines;security of data;unsolicited e-mail","HTTP header;URL based method;Web pages cloaking;Web search cloaking;Web site;cloaking detection system;hybrid detection approach;search engines;spamming technique;tag based method;text based method","","0","","14","","","24-26 Aug. 2013","","IEEE","IEEE Conference Publications"
"Short Text Classification Using Wikipedia Concept Based Document Representation","X. Wang; R. Chen; Y. Jia; B. Zhou","Sch. of Comput., Nat. Univ. of Defense Technol., Changsha, China","2013 International Conference on Information Technology and Applications","20140111","2013","","","471","474","Short text classification is a difficult and challenging task in information retrieval systems since the text data is short, sparse and multidimensional. In this paper, we represent short text with Wikipedia concepts for classification. Short document text is mapped to Wikipedia concepts and the concepts are then used to represent document for text categorization. Traditional methods for classification such as SVM can be used to perform text categorization on the Wikipedia concept document representation. Experimental evaluation on real Google search snippets shows that our approach outperforms the traditional BOW method and gives good performance. Although it's not better than the state-of-the-art classifier (see e.g. Phan et al. WWW '08), our method can be easily implemented with low cost.","","Electronic:978-1-4799-2877-4; POD:978-1-4799-2878-1","10.1109/ITA.2013.114","http://ieeexplore.ieee.org/stamp/stamp.jsp?arnumber=6710030","Document Representation;Short Text Classification;Wikipedia","Electronic publishing;Encyclopedias;Indexes;Internet;Support vector machines;Text categorization","Web sites;information retrieval;pattern classification;text analysis","Google search snippets;SVM;information retrieval systems;multidimensional text data;short document text data mapping;short text classification;sparse text data;text categorization;wikipedia concept document representation","","1","","14","","","16-17 Nov. 2013","","IEEE","IEEE Conference Publications"
"Tagpref: User Preference Modeling by Social Tagging","W. Hu; Y. Zhang; Y. Zhou; K. Deng","Dept. of Comput. Sci. & Technol., Tsinghua Univ., Beijing, China","2013 IEEE 10th International Conference on Ubiquitous Intelligence and Computing and 2013 IEEE 10th International Conference on Autonomic and Trusted Computing","20140130","2013","","","111","118","User preference modeling is the basis for the provision of personal information services because it can reflect the user's characteristics and interests. Tagging is a popular online activity that allows a user to discover, describe, and organize Internet contents. Tagging provides a new means of creating user preference. Tags explain and describe items so that a user's attitude toward a tag is his or her attitude toward an aspect of the item. In this paper we design Tagpref inspired by the method of establishing user preference with tags. The user's preference was described by the user's preference degrees for different tags. Different algorithms were proposed and evaluated for taggers and non-taggers on Movie Lens based on direct and indirect behavior. Evaluation results show that the proposed algorithms can accurately predict a user's tag preference. The user's attitude toward tag preference was also analyzed. Users' true preference was determined by an online user survey.","","Electronic:978-1-4799-2482-0; POD:978-1-4799-2483-7","10.1109/UIC-ATC.2013.62","http://ieeexplore.ieee.org/stamp/stamp.jsp?arnumber=6726198","Interesting mining;Preference model;Social tagging","Collaboration;Communities;Inference algorithms;Motion pictures;Mutual information;Prediction algorithms;Tagging","Internet;information retrieval","Internet content;Tagpref;personal information service;social tagging;user preference degree;user preference modeling","","0","","20","","","18-21 Dec. 2013","","IEEE","IEEE Conference Publications"
"Opening the loops — Towards semantic, information-centric networking in the Internet of Things","H. Wirtz; K. Wehrle","Dept. of Commun. & Distrib. Syst., RWTH Aachen, Aachen, Germany","2013 IEEE International Workshop of Internet-of-Things Networking and Control (IoT-NC)","20140102","2013","","","18","24","The advent of the Internet of Things (IoT) paradigm in increasing deployments promises a pervasive proliferation of smart things, capable of sensing, actuating, and processing information. In typical designs, however, application of each thing is restricted to a dedicated use case in a single network of connected devices, resulting in a closed loop of information flow. We argue that, given the envisioned diversity, capabilities, and sheer number of smart things, this obstructs the possibility of creating diverse and exciting applications that benefit of the generated information in public, global usage scenarios. In this paper, we thus aim to initiate the discussion of creating a true Internet of Things, i.e., interconnected IoT networks, based on provision and requests of generated information in a public infrastructure. We highlight the challenges in designing this infrastructure for feasible integration in the current Internet and IoT designs, comprehensive provision and retrieval of information, and versatile derivation of higher information contexts from single information sources. Assessing advantages and shortcomings of existing approaches, we propose a suitable approach and discuss both a centralized and distributed implementation of the proposed infrastructure.","","Electronic:978-1-4799-0826-4; POD:978-1-4799-0824-0","10.1109/IoT-NC.2013.6694049","http://ieeexplore.ieee.org/stamp/stamp.jsp?arnumber=6694049","","Context;Context modeling;Internet;Logic gates;Object oriented modeling;Sensors;Temperature measurement","Internet of Things;information retrieval","Internet of Things;centralized implementation;closed-loop information flow;comprehensive information provision;comprehensive information retrieval;distributed implementation;information actuation;information processing;information provision;information request;information sensing;information sources;interconnected IoT networks;pervasive proliferation;public infrastructure;semantic-information-centric networking;smart things","","0","","23","","","24-24 June 2013","","IEEE","IEEE Conference Publications"
"A proposal on support for reading of novels using question answering technology","S. Okada; T. Arakawa","Dept. of Adv. Production Syst. Eng. Course, Gunma Nat. Coll. of Technol., Gunma, Japan","2013 13th International Conference on Control, Automation and Systems (ICCAS 2013)","20140109","2013","","","1193","1198","In recent years, readings on text files become popular. We can use full-text search while we read text-files. However, full-text search has some weak points for supporting readings. We propose to introduce question-answering to readings of novels on text-files to avoid these problems and make a comfortable support system for readings of novels. We also propose several additional functions such as “Who? Function” and “Spoiler preventer”. We checked the act of our system with various examples to confirm that our system works correctly in actual reading scenes. We also examined the computational complexity of the system theoretically and experimentally, and found our proposed method does not take a long time so that the user will not feel unpleasant.","2093-7121;20937121","Electronic:978-89-93215-05-2; POD:978-1-4799-0549-2","10.1109/ICCAS.2013.6704136","http://ieeexplore.ieee.org/stamp/stamp.jsp?arnumber=6704136","question answering;restriction of spoiler;support for reading","Computational complexity;Random access memory","computational complexity;question answering (information retrieval);text analysis","Spoiler preventer;actual reading scenes;comfortable support system;computational complexity;full text search;question answering technology;text files","","0","","8","","","20-23 Oct. 2013","","IEEE","IEEE Conference Publications"
"A Fuzzy Tree Similarity Measure and Its Application in Telecom Product Recommendation","D. Wu; G. Zhang; J. Lu","Decision Syst. & e-Service Intell. Lab., Univ. of Technol., Sydney, NSW, Australia","2013 IEEE International Conference on Systems, Man, and Cybernetics","20140127","2013","","","3483","3488","The recommender systems field has been well developed in the last few years to provide item recommendations to related users. Existing recommendation approaches, however, assume that an item is described by a single value or a vector. Unfortunately, some items in real world applications, such as telecom products, could have a tree structure. This paper aims to handle this issue by developing a comprehensive fuzzy tree similarity measure. The fuzzy tree similarity measure compares both the concepts and values in two trees of items. The focus of this study is primarily on the fuzzy value similarity between two trees. In the similarity measure, each attribute is associated with a set of linguistic terms to express the value granularly. The node values are first transformed to membership vectors related to the linguistic terms, and the values of the conceptual corresponding nodes are then compared. These local similarities are aggregated into the final fuzzy value similarity between the two trees. A telecom product recommendation case study shows the effectiveness of the proposed fuzzy tree similarity measure and its applicability for telecom product recommendations.","1062-922X;1062922X","Electronic:978-1-4799-0652-9; POD:978-1-4799-0650-5","10.1109/SMC.2013.594","http://ieeexplore.ieee.org/stamp/stamp.jsp?arnumber=6722347","fuzzy similarity measure;recommender systems;tree similarity measure","Data models;Pragmatics;Recommender systems;Semantics;Telecommunications;Vectors;Vegetation","fuzzy set theory;information retrieval;marketing data processing;recommender systems;telecommunication industry;telecommunication services;trees (mathematics)","conceptual corresponding nodes;fuzzy tree similarity measure;fuzzy value similarity;granular value expression;item recommendation;linguistic terms;membership vectors;recommendation approach;recommender systems;telecom product recommendation","","3","","25","","","13-16 Oct. 2013","","IEEE","IEEE Conference Publications"
"Critical Infrastructures Governance Exploring SCADA Cybernetics through Architectured Policy Semantic","D. Khadraoui; C. Feltus","Service Sci. & Innovation, Public Res. Centre Henri Tudor, Luxembourg, Luxembourg","2013 IEEE International Conference on Systems, Man, and Cybernetics","20140127","2013","","","4766","4771","SCADA-systems are very complex, sophisticated and integrated systems which support people in monitoring and governing the huge volumes of knowledge engendered by critical infrastructures (industry, energy, transport, and healthcare). These systems are elaborated upon a colossal range of precontrived components which need to interact thoroughly with each other although, a priori, they all use heterogeneous technologies and protocols, they behave unevenly through the SCADA architecture, and they are all located in miscellaneous corners of the production system. Furthermore, these components interact, amongst other, by means of policies which formulate the reasoning for component behaviour in terms of expecting actions realization or in terms of accessed information. This paper explores these policies' semantic through a unified component modelling approach with the aim of providing a homogeneous and coherent framework, adapted for the governance of the system by all SCADA and non-SCADA operators.","1062-922X;1062922X","Electronic:978-1-4799-0652-9; POD:978-1-4799-0650-5","10.1109/SMC.2013.811","http://ieeexplore.ieee.org/stamp/stamp.jsp?arnumber=6722566","IS security;Policy management;SCADA system;architecture;critical infrastructure","Context;Correlation;Data visualization;Monitoring;Organizations;SCADA systems;Unified modeling language","SCADA systems;Unified Modeling Language;access control;critical infrastructures;inference mechanisms;information retrieval;protocols","SCADA system architecture;actions realization;component behaviour;critical infrastructure governance;heterogeneous technology;information access;policy management;precontrived components interaction;production system;protocols;reasoning;semantics;unified component modelling approach","","0","","26","","","13-16 Oct. 2013","","IEEE","IEEE Conference Publications"
"A low cost medical image digitization setup for enhancement and analyzing of conventional X-ray images","H. Korkmaz; S. Alsan","Dept. of Electr. & Electron. Eng., Univ. of Marmara, Istanbul, Turkey","2013 IEEE International Conference on Signal and Image Processing Applications","20140109","2013","","","95","100","In medical industry, studies about storing, processing, analyzing and re-accessing the patient's information and images are intensively continuing. Both printed and digital medical images take more spaces than the others. In this paper, a mechanism which transfers easily the printed X-ray images to the digital environment enabling radiological assessment and archiving is set and a software is developed to help the analysis of those images. It is aimed to digitize the conventional images with a minimum loss while keeping the image quality. The setup which is in a closed box consists of a light source, a camera for image transfer and lenses. The software provides applying the image processing algorithms on digitized images and archiving them in DICOM format.","","Electronic:978-1-4799-0269-9; POD:978-1-4799-0268-2","10.1109/ICSIPA.2013.6707984","http://ieeexplore.ieee.org/stamp/stamp.jsp?arnumber=6707984","IEEE 1394 camera;Matlab;image acquisition;image digitization;lens","Image edge detection;Image segmentation;MATLAB;PSNR;X-ray imaging","X-ray imaging;image enhancement;information retrieval systems;medical image processing;radiology","DICOM format;X-ray images;archiving;digital medical images;image enhancement;medical image digitization;medical industry;patient information;printed medical images;radiological assessment","","0","","19","","","8-10 Oct. 2013","","IEEE","IEEE Conference Publications"
"The TAO of ATWV: Probing the mysteries of keyword search performance","S. Wegmann; A. Faria; A. Janin; K. Riedhammer; N. Morgan","Int. Comput. Sci. Inst., Berkeley, CA, USA","2013 IEEE Workshop on Automatic Speech Recognition and Understanding","20140109","2013","","","192","197","In this paper we apply diagnostic analysis to gain a deeper understanding of the performance of the the keyword search system that we have developed for conversational telephone speech in the IARPA Babel program. We summarize the Babel task, its primary performance metric, “actual term weighted value” (ATWV), and our recognition and keyword search systems. Our analysis uses two new oracle ATWV measures, a bootstrap-based ATWV confidence interval, and includes a study of the underpinnings of the large ATWV gains due to system combination. This analysis quantifies the potential ATWV gains from improving the number of true hits and the overall quality of the detection scores in our system's posting lists. It also shows that system combination improves our systems' ATWV via a small increase in the number of true hits in the posting lists.","","Electronic:978-1-4799-2756-2; POD:978-1-4799-2757-9; USB:978-1-4799-2755-5","10.1109/ASRU.2013.6707728","http://ieeexplore.ieee.org/stamp/stamp.jsp?arnumber=6707728","keyword search;spoken term detection","Feature extraction;Indexes;Keyword search;Measurement;Merging;Speech;Speech recognition","information retrieval;speech recognition;statistical analysis","IARPA Babel program;TAO;actual term weighted value;bootstrap-based ATWV confidence interval;conversational telephone speech;detection scores;diagnostic analysis;keyword search performance;keyword search systems;oracle ATWV measures;primary performance metric;system combination","","8","","19","","","8-12 Dec. 2013","","IEEE","IEEE Conference Publications"
"A study on output sentence generation method for question answering using statistical machine translation","T. Yamada; T. Arakawa","Dept. of Adv. Production Syst. Eng. Course, Gunma Nat. Coll. of Technol., Gunma, Japan","2013 13th International Conference on Control, Automation and Systems (ICCAS 2013)","20140109","2013","","","1199","1202","Question answering generally generates the answer to the question by extracting the named entity from the sentences containing the answer to the question from information sources. However, it is not always true that a named entity is an answer to the question. So we propose a method for generating the answer sentence using statistical machine translation. The probability models are constructed by learning from enormous samples of the set of question sentence, extracted sentence, and answer sentence. The question sentence and the sentence extracted by the question answering from information source are regarded as an input of machine translation. They are translated to a suitable answer sentence to the question. In this paper, we attempted to apply our method to several simple types questions that can also be answered by the named entity extraction.","2093-7121;20937121","Electronic:978-89-93215-05-2; POD:978-1-4799-0549-2","10.1109/ICCAS.2013.6704146","http://ieeexplore.ieee.org/stamp/stamp.jsp?arnumber=6704146","beam search;phrase-based model;question answering;statistical machine translation","Decoding;Manuals","language translation;question answering (information retrieval);statistical analysis","answer sentence;extracted sentence;information sources;output sentence generation method;probability models;question answering;question sentence;statistical machine translation","","0","","5","","","20-23 Oct. 2013","","IEEE","IEEE Conference Publications"
"Content Repurposing Platform Utilizing Metadata Extracted from Rich Media","G. Kojima","Yokohama Res. Lab., HITACHI, Ltd., Yokohama, Japan","2013 International Conference on Signal-Image Technology & Internet-Based Systems","20140130","2013","","","950","957","The amounts of unstructured data stored in companies are rapidly growing up, and the needs for utilizing those data are coming up. We've been working on research and development of a platform that can ease utilization of unstructured data. In order to make situation aware information system in organizations such as hospitals, utilizing unstructured data such as texts, images, and voices, in combination with structured data is required. For example, most of the hospitals own several information systems for each purpose and each organization. Thus, searching patient information across multiple data sources or data types is difficult problem that must be solved. To solve this problem, we developed content repurposing platform that enables search refinement across data sources using metadata database which store metadata extracted from each data sources. The platform is constructed on top of object storage and includes metadata extraction engine, metadata DB, content router, and search engine. We applied the content repurposing platform to a hospital and made preliminary experimental evaluation. The result of experiment shown that the time to prepare data for a case conference was dramatically reduced to 1/68 meaning that most of the manual operations for data preparation could be removed.","","Electronic:978-1-4799-3211-5; POD:978-1-4799-3212-2","10.1109/SITIS.2013.154","http://ieeexplore.ieee.org/stamp/stamp.jsp?arnumber=6727304","metadata extraction;metadata search;unstructued data","Biomedical imaging;Data mining;Hospitals;Information systems;Search engines;Search problems;XML","content management;data preparation;data structures;information retrieval;meta data;search engines","content repurposing platform;content router;data preparation;data sources;data types;metadata DB;metadata database;metadata extraction engine;object storage;patient information searching;research and development;rich media extracted metadata;search engine;search refinement;situation aware information system;unstructured data","","0","","14","","","2-5 Dec. 2013","","IEEE","IEEE Conference Publications"
