"The design of an output data collection framework for NS-3","L. F. Perrone; T. R. Henderson; M. J. Watrous; V. Daly Felizardo","Dept. of Comput. Sci., Bucknell Univ., Lewisburg, PA, USA","2013 Winter Simulations Conference (WSC)","20140127","2013","","","2984","2995","An important design decision in the construction of a simulator is how to enable users to access the data generated in each run of a simulation experiment. As the simulator executes, the samples of performance metrics that are generated beg to be exposed either in their raw state or after having undergone mathematical processing. Also of concern is the particular format this data assumes when externalized to mass storage, since it determines the ease of processing by other applications or interpretation by the user. In this paper, we present a framework for the ns-3 network simulator for capturing data from inside an experiment, subjecting it to mathematical transformations, and ultimately marshaling it into various output formats. The application of this functionality is illustrated and analyzed via a study of common use cases. Although the implementation of our approach is specific to ns-3, this design presents lessons transferrable to other platforms.","0891-7736;08917736","Electronic:978-1-4799-3950-3; POD:978-1-4799-3727-1","10.1109/WSC.2013.6721666","http://ieeexplore.ieee.org/stamp/stamp.jsp?arnumber=6721666","","Analytical models;Computational modeling;Data collection;Data models;Observers;Probes","information retrieval;mathematical analysis;storage management","NS-3;data access;mass storage;mathematical processing;output data collection framework;performance metrics","","3","1","14","","","8-11 Dec. 2013","","IEEE","IEEE Conference Publications"
"Model-based speech/non-speech segmentation of a heterogeneous multilingual TV broadcast collection","B. Desplanques; J. P. Martens","ELIS Multimedia Lab., Ghent Univ. - iMinds, Ghent, Belgium","2013 International Symposium on Intelligent Signal Processing and Communication Systems","20140109","2013","","","55","60","Multimedia Information Retrieval systems normally comprise a preprocessor that performs a speech/non-speech (SNS) segmentation of the audio stream. The goal of such a segmentation is to divide the audio into intervals that need a lexical transcription and intervals that just need some categorization in terms of jingle, applause, etc. In this paper a baseline SNS system that was trained on monolingual BN data is evaluated on a multilingual BN corpus and on a heterogeneous corpus, composed of diverse TV shows including discussions, soaps, animation films, etc. It appears that the system exhibits serious deficiencies when confronted with such out-of-domain data. Especially the heterogeneous corpus, characterized by many short speaker turns and a rich pallet of non-speech intervals, turns out to be challenging. However, employing a proper SNS information criterion, it is demonstrated that enhancing the acoustic representation of the audio, creating a richer music model and performing a file-wise adaptation of the acoustic models can significantly increase the performance. Complex architectures permitting explicit duration modeling and re-segmentation of the speech parts after speaker change detection on the other hand do not seem to help.","","Electronic:978-1-4673-6361-7; POD:978-1-4673-6359-4","10.1109/ISPACS.2013.6704522","http://ieeexplore.ieee.org/stamp/stamp.jsp?arnumber=6704522","","Acoustics;Adaptation models;Computational modeling;Data models;Hidden Markov models;Speech;TV","acoustic signal processing;audio acoustics;audio signal processing;audio streaming;information retrieval;multimedia systems;signal representation;speech processing;television broadcasting","SNS information criterion;acoustic models;acoustic representation;audio stream;heterogeneous corpus;heterogeneous multilingual TV broadcast collection;lexical transcription;model-based speech-nonspeech segmentation;multimedia information retrieval systems;speaker change detection","","0","","16","","","12-15 Nov. 2013","","IEEE","IEEE Conference Publications"
"A Framework for Automatic Text Generation of Trends in Physiological Time Series Data","H. Banaee; M. U. Ahmed; A. Loutfi","Center for Appl. Autonomous Sensor Syst. (AASS), Orebro Univ., Orebro, Sweden","2013 IEEE International Conference on Systems, Man, and Cybernetics","20140127","2013","","","3876","3881","Health monitoring systems using wearable sensors have rapidly grown in the biomedical community. The main challenges in physiological data monitoring are to analyse large volumes of health measurements and to represent the acquired information. Natural language generation is an effective method to create summaries for both clinicians and patients as it can describe useful information extracted from sensor data in textual format. This paper presents a framework of a natural language generation system that provides a text-based representation of the extracted numeric information from physiological sensor signals. More specifically, a new partial trend detection algorithm is introduced to capture the particular changes and events of health parameters. The extracted information is then represented considering linguistic characterisation of numeric features. Experimental analysis was performed using a wearable sensor and demonstrates a possible output in natural language text.","1062-922X;1062922X","Electronic:978-1-4799-0652-9; POD:978-1-4799-0650-5","10.1109/SMC.2013.661","http://ieeexplore.ieee.org/stamp/stamp.jsp?arnumber=6722414","Health monitoring;body area networks;linguistic summarisation;natural language generation;physiological data analysis","Biomedical monitoring;Data analysis;Heart rate;Market research;Natural languages;Pragmatics;Time series analysis","biosensors;computerised monitoring;health care;information retrieval;natural language processing;text analysis;time series","automatic text generation;biomedical community;clinicians;health measurements;health monitoring systems;linguistic characterisation;natural language generation system;natural language text;numeric information extraction;partial trend detection algorithm;patients;physiological data monitoring;physiological sensor signals;physiological time series data;sensor data;text-based representation;textual format;wearable sensors","","3","","18","","","13-16 Oct. 2013","","IEEE","IEEE Conference Publications"
"Teenagers searching for information by using texts and hypertexts: How effective is it?","P. Gossin","LISEC, Univ. de Strasbourg, Strasbourg, France","2013 3rd International Symposium ISKO-Maghreb","20140130","2013","","","1","4","In 2012, ten years after the original study, we researched this subject for a second time. The exact conditions of the original study were reproduced. We wanted to measure the generational effect. Does the increased use of digital media change the results found in 2002? Are the students as skilled today with hypertext as they are with traditional text? The results showed that the increased use of information technology and communication had no effect on the efficiency of students while searching for information.","","CD-ROM:978-1-4799-3391-4; Electronic:978-1-4799-3392-1; POD:978-1-4799-3393-8","10.1109/ISKO-Maghreb.2013.6728171","http://ieeexplore.ieee.org/stamp/stamp.jsp?arnumber=6728171","Computer science education;Information;digital media;documentation","Educational institutions;Grammar;Information technology;Media;Protocols;Sociology;Statistics","information retrieval;text analysis","digital media;hypertexts;information seeking strategies;of information technology and communication;traditional text","","0","","15","","","8-9 Nov. 2013","","IEEE","IEEE Conference Publications"
"A lightweight operating system-oriented web server realization","L. L. Wang; P. F. Zeng","Coll. of Comput. Sci. & Technol., Donghua Univ., Shanghai, China","2013 10th International Computer Conference on Wavelet Active Media Technology and Information Processing (ICCWAMTIP)","20140123","2013","","","186","190","This paper describes a web server which is oriented to a lightweight operating system. The real-time server is used for remote control and data access. Both the characteristics of the lightweight operating system and the communication principle of HTTP are analyzed when implementing the server. To satisfy its practical requirements, the server is designed to achieve its major function with the limited resources of devices. The processes of request response and data package parsing are described in this paper in details. Meanwhile, this paper gives a new method to obtain the entity bodies from multiple request messages. Though limited by the low-performance hardware, the web server achieves strong portability and practicability. The experience shows that the server responds rapidly and runs steadily. The server also can be applied to the similar lightweight operating systems.","","CD-ROM:978-1-4799-2444-8; Electronic:978-1-4799-2446-2; POD:978-1-4799-2447-9","10.1109/ICCWAMTIP.2013.6716628","http://ieeexplore.ieee.org/stamp/stamp.jsp?arnumber=6716628","HTTP protocol;Web server;embedded device;lightweight operating system","Hardware;Message systems;Operating systems;Performance evaluation;Real-time systems;Web servers","Internet;file servers;information retrieval;operating systems (computers);real-time systems;transport protocols","HTTP communication principle;data access;data package parsing;lightweight operating system-oriented Web server realization;low-performance hardware;real-time server;remote control;request response","","0","","9","","","17-19 Dec. 2013","","IEEE","IEEE Conference Publications"
"SSTCSC: A Semantic Structure of Test Cases and Source Code","M. B. Bashir; T. Malik; T. Afzal","Center for Software Dependability, Mohammad Ali Jinnah Univ., Islamabad, Pakistan","2013 11th International Conference on Frontiers of Information Technology","20140123","2013","","","241","246","If the World Wide Web is taken as a mountain of information containing data regarding every aspect of life, then Semantic Web is its extended version, that structures the information and makes it machine process able. Semantic Web has many advantages which have proved it as an innovative approach to structure the data for multipurpose domains. Its characteristics of annotation enable the extraction of precise information which is required by the user. Software testing is the process which evaluates a systems behavior to ensure whether it meets user's requirement or not. In software engineering, specifically in the software testing domain, semantic structuring the relevant artifacts is new. Researchers provided XML based representations for many languages and approaches but their context is different when we try to apply it on the software testing domain. In this paper, we focus on the shortcomings of the software testing domain when its concerned activities are required to represent semantically. We present a novel approach, Semantic Structure of Test Cases and Source Code (SSTCSC) which relates the RDF based test cases satisfying white box testing coverage criterion statement coverage, with the RDF based target java class(s). After the execution of semantically presented information (test cases against program) is then passes through two phases further i.e. Code Categorization and Code Visualization which shows the final output of the classified code segments visually. Whole process of the presented approach is supported by the tool which performs the related steps with ease automatically.","","Electronic:978-1-4799-2503-2; POD:978-1-4799-2700-5","10.1109/FIT.2013.51","http://ieeexplore.ieee.org/stamp/stamp.jsp?arnumber=6717260","Resource Discription Frameowrk (RDF);Semantic Web;Source Code;Test Cases","Java;Resource description framework;Semantics;Software;Software testing;XML","Java;XML;information retrieval;program testing;semantic Web;source code (software)","RDF based target Java class;RDF based test cases;SSTCSC;World Wide Web;XML based representations;code categorization;code segments;code visualization;multipurpose domains;precise information extraction;semantic Web;semantic structure;semantic structuring;software engineering;software testing domain;source code;systems behavior;white box testing coverage criterion","","0","","27","","","16-18 Dec. 2013","","IEEE","IEEE Conference Publications"
"Socially-Aware Venue Recommendation for Conference Participants","F. Xia; N. Y. Asabere; J. J. P. C. Rodrigues; F. Basso; N. Deonauth; W. Wang","Sch. of Software, Dalian Univ. of Technol., Dalian, China","2013 IEEE 10th International Conference on Ubiquitous Intelligence and Computing and 2013 IEEE 10th International Conference on Autonomic and Trusted Computing","20140130","2013","","","134","141","Current research environments are witnessing high enormities of presentations occurring in different sessions at academic conferences. This situation makes it difficult for researchers (especially juniors) to attend the right presentation session(s) for effective collaboration. In this paper, we propose an innovative venue recommendation algorithm to enhance smart conference participation. Our proposed algorithm, Social Aware Recommendation of Venues and Environments (SARVE), computes the Pearson Correlation and social characteristic information of conference participants. SARVE further incorporates the current context of both the smart conference community and participants in order to model a recommendation process using distributed community detection. Through the integration of the above computations and techniques, we are able to recommend presentation sessions of active participant presenters that may be of high interest to a particular participant. We evaluate SARVE using a real world dataset. Our experimental results demonstrate that SARVE outperforms other state-of-the-art methods.","","Electronic:978-1-4799-2482-0; POD:978-1-4799-2483-7","10.1109/UIC-ATC.2013.81","http://ieeexplore.ieee.org/stamp/stamp.jsp?arnumber=6726201","Social awareness;community;context;recommender systems;smart conference","Collaboration;Communities;Conferences;Context;Correlation;Mobile communication;Recommender systems","information retrieval;mobile computing;recommender systems;social sciences computing","Pearson correlation;SARVE;Social Aware Recommendation of Venues and Environments;academic conferences;conference participants;distributed community detection;effective collaboration;innovative venue recommendation algorithm;mobile device;presentation sessions;research environment;smart conference community;smart conference participation;social characteristic information;socially-aware venue recommendation","","3","","19","","","18-21 Dec. 2013","","IEEE","IEEE Conference Publications"
"Modelings and techniques in Named Entity Recognition-an Information Extraction task","N. Kanya; T. Ravi","Manonmaniam Sundaranar Univ., Thirunelveli, India","IET Chennai 3rd International on Sustainable Energy and Intelligent Systems (SEISCON 2012)","20140123","2012","","","1","5","Information Extraction, which is an area of natural language processing that deals with finding factual information in free text. The task of Information Extraction (IE) is to identify a predefined set of concepts i.e., a representation of the information that is machine understandable. The classic IE tasks include Named Entity Recognition (NER) addresses the problem of the identification and classification of predefined types of named entities. Co-reference Resolution (CO), Relation Extraction (RE),Event Extraction (EE) Named Entity Recognition (NER) aims to extract and to classify rigid designators in text such as proper names, biological species, and temporal expressions. In this paper, we present various efficient NER techniques and modeling's . Named entity recognition addresses the problem of locating textual mentions of predefined types of entities, where the entity categories can be very diverse, ranging from people and companies in business applications to cells and proteins in biomedical applications.","","Electronic:978-1-84919-797-7","10.1049/cp.2012.2199","http://ieeexplore.ieee.org/stamp/stamp.jsp?arnumber=6719105","Information Extraction;Named Entity Recognition;Text Mining","","information retrieval;learning (artificial intelligence);pattern classification;text analysis","CO;EE;IE tasks;NER techniques;RE;biological species;co-reference resolution;entity categories;event extraction;factual information;free-text;information extraction task;machine understandable information representation;named entity classification;named entity identification;named entity recognition modeling;named entity recognition technique;natural language processing;proper names;relation extraction;rigid designator classification;rigid designator extraction;temporal expressions;textual mention location","","0","","","","","27-29 Dec. 2012","","IET","IET Conference Publications"
"Boundary regularization and building reconstruction based on terrestrial laser scanning data","F. Wang; X. Xi; C. Wang; Y. Xiao; Y. Wan","Inst. of Remote Sensing & Digital Earth, Beijing, China","2013 IEEE International Geoscience and Remote Sensing Symposium - IGARSS","20140127","2013","","","1509","1512","Digitization and modeling of city buildings is always one of the most important issues in Virtual 3D City. Traditional methods are usually expensive and time-consuming. Nowadays reconstruction methods based on LiDAR (Light Detection And Range) data have been widely used [1] due to its powerful capacity of data acquisition. Airborne Laser Scanning (ALS) data have got some promising results [2]. However the obvious disadvantage is that it can hardly get the profile information except for the roof of building, and the result is that people can not get complete building model. On the contrary, Terrestrial Laser Scanning (TLS) could get points cloud of buildings with high density and accuracy by multi-stations scanning for realistic 3D model reconstruction. The information includes not only building roofs, but also building profiles. In this paper, the authors use TLS data, and explore an automatic model reconstruction approach to establish digital building model. The registered cloud points from multiple scanning stations are taken as input parameters. Profiles information of building is extracted from raw points cloud by a segmentation algorithm. And a regular polyhedron model of building is finally presented. The experiment results show that the automatic reconstruction procedure and algorithms are easy to implement and can get reasonable building model after facade boundary regularization.","2153-6996;21536996","Electronic:978-1-4799-1114-1; POD:978-1-4799-1112-7","10.1109/IGARSS.2013.6723073","http://ieeexplore.ieee.org/stamp/stamp.jsp?arnumber=6723073","","Algorithm design and analysis;Fitting;Image reconstruction;Laser modes;Three-dimensional displays;Windows","airborne radar;buildings (structures);data acquisition;feature extraction;image reconstruction;image segmentation;information retrieval;optical information processing;optical radar;optical scanners;roofs;solid modelling;virtual reality","LiDAR;TLS data;airborne laser scanning;automatic model reconstruction approach;boundary regularization;building profiles information extraction;building reconstruction;building roof;city buildings digitization;city buildings modeling;data acquisition;digital building model;light detection and range;multistations scanning;points cloud registration;raw points cloud;realistic 3D model reconstruction;regular polyhedron model;segmentation algorithm;terrestrial laser scanning data;virtual 3D city","","1","","8","","","21-26 July 2013","","IEEE","IEEE Conference Publications"
"Semi-supervised framework for writer identification using structural learning","U. Porwal; V. Govindaraju","Dept. of Comput. Sci. & Eng., SUNY - Univ. at Buffalo, Amherst, NY, USA","IET Biometrics","20140109","2013","2","4","208","215","Writer identification is a complex task as the handwriting of an individual encapsulates lot of information pertaining to text and personality of a writer. To learn a model to distinguish one writer from the other, it is important to capture every nuance of the handwriting of an individual. Learning such model poses two challenges. First, discriminatory variables maybe large and potentially related leading to a complex discriminatory function. Second, it will require large amount of training data to learn a complex and possibly high-dimensional function. In this study, the authors are proposing a semi-supervised framework for writer identification for offline handwritten documents that leverages the information hidden in the unlabelled samples. Proposed framework models the complexity of approximating the optimal hypothesis by breaking the main task into several subtasks and learning a separate hypothesis for each subtask. All the hypotheses pertaining to the subtasks will be used for the best model selection by retrieving a common substructure that has high correspondence with all the candidate hypotheses. The obtained substructure acts as a knowledge base that has the contextual information, which is otherwise difficult to retrieve. The extra information can be used to improve the performance of the identification model.","2047-4938;20474938","","10.1049/iet-bmt.2013.0018","http://ieeexplore.ieee.org/stamp/stamp.jsp?arnumber=6679093","","","document handling;handwriting recognition;information retrieval;learning (artificial intelligence)","IAM data set;best model selection;complex discriminatory function;contextual information;discriminatory variables;handwritten text;high-dimensional function;offline handwritten documents;optimal hypothesis;semisupervised framework;structural learning;substructure retrieval;writer identification model","","1","","","","","December 2013","","IET","IET Journals & Magazines"
"A multi-terabyte relational database for geo-tagged social network data","L. Dobos; J. Szüle; T. Bodnár; T. Hanyecz; T. Sebők; D. Kondor; Z. Kallus; J. Stéger; I. Csabai; G. Vattay","Dept. of Phys. of Complex Syst., Eotvos Lorand Univ., Budapest, Hungary","2013 IEEE 4th International Conference on Cognitive Infocommunications (CogInfoCom)","20140123","2013","","","289","294","Despite their relatively low sampling factor, the freely available, randomly sampled status streams of Twitter are very useful sources of geographically embedded social network data. To statistically analyze the information Twitter provides via these streams, we have collected a year's worth of data and built a multi-terabyte relational database from it. The database is designed for fast data loading and to support a wide range of studies focusing on the statistics and geographic features of social networks, as well as on the linguistic analysis of tweets. In this paper we present the method of data collection, the database design, the data loading procedure and special treatment of geo-tagged and multi-lingual data. We also provide some SQL recipes for computing network statistics.","","Electronic:978-1-4799-1546-0; POD:978-1-4799-1545-3; USB:978-1-4799-1544-6","10.1109/CogInfoCom.2013.6719259","http://ieeexplore.ieee.org/stamp/stamp.jsp?arnumber=6719259","","Global Positioning System;Indexes;Loading;Servers;Twitter","SQL;geography;information retrieval;relational databases;social networking (online);statistical analysis","SQL recipes;Twitter;data collection;data loading procedure;database design;geo-tagged social network data;geographic features;geographically embedded social network data;linguistic analysis;multiterabyte relational database;network statistics;random sampled status streams;statistical analysis","","3","","20","","","2-5 Dec. 2013","","IEEE","IEEE Conference Publications"
