"Image Indexing and Retrieval in Compressed Domain Using Color Clusters","M. Bajaj; J. A. lay","Electronics and Communication Engineering Department, Netaji Subhas Institute of Technology, New Delhi 110045, India. meekalbajaj@ieee.org","2007 IEEE Symposium on Computational Intelligence in Image and Signal Processing","20070604","2007","","","271","274","A compressed domain color-based image indexing method that avoids overheads associated with full decompression and color space transformation by operating in the YCbCr space has been presented. The proposed method performs a hard segmentation of the color space into predefined clusters based on perceptual similarity. A three dimensional color descriptor is generated by extracting the average intensity value of the Y, Cb and Cr components for each 8times8 DCT block. Each blocks descriptor is subsequently allocated to its corresponding cluster, whose centroid is updated using a weighted mean. The similarity measure is evaluated using a compact four dimensional feature vector from each cluster, which consists of the quantized centroid coordinates and the percentage contribution to the image composition by the cluster. Retrieval is performed by comparing the feature attributes of the clusters having significant membership in the query image, to those with the database images; the obtained matches are then integrated to evaluate the final ranking. The experimental results of the proposed model on a database of 7380 images are reported","","POD:1-4244-0707-9","10.1109/CIISP.2007.369180","http://ieeexplore.ieee.org/stamp/stamp.jsp?arnumber=4221430","Color indexing;DCT;compressed domain;content based retrieval","Chromium;Coordinate measuring machines;Discrete cosine transforms;Image coding;Image databases;Image retrieval;Image segmentation;Indexing;Information retrieval;Spatial databases","content-based retrieval;data compression;database indexing;discrete cosine transforms;feature extraction;image coding;image colour analysis;image retrieval;image segmentation;pattern clustering;visual databases","3D color descriptor;4D feature vector;YCbCr color space;centroid coordinate quantization;color clusters;color space segmentation;color space transformation;content based retrieval;database image;discrete cosine transform;feature attributes;image composition;image compression;image indexing;image retrieval;perceptual similarity;query image","","4","","17","","","1-5 April 2007","","IEEE","IEEE Conference Publications"
"IDENTIFYING FLUORESCENCE MICROSCOPE IMAGES IN ONLINE JOURNAL ARTICLES USING BOTH IMAGE AND TEXT FEATURES","J. Hua; O. N. Ayasli; W. W. Cohen; R. F. Murphy","Center for Bioimage Informatics, Carnegie Mellon Univ., Pittsburgh, PA","2007 4th IEEE International Symposium on Biomedical Imaging: From Nano to Macro","20070515","2007","","","1224","1227","We have previously built a subcellular location image finder (SLIP) system, which extracts information regarding protein subcellular location patterns from both text and images in journal articles. One important task in SLIP is to identify fluorescence microscope images. To improve the performance of this binary classification problem, a set of 7 edge features extracted from images and a set of ""bag of words"" text features extracted from text have been introduced in addition to the 64 intensity histogram features we have used previously. An overall accuracy of 88.6% has been achieved with an SVM classifier. A co-training algorithm has also been applied to the problem to utilize the unlabeled dataset and it substantially increases the accuracy when the training set is very small but can contribute very little when the training set is large.","1945-7928;19457928","CD-ROM:1-4244-0672-2; POD:1-4244-0671-4","10.1109/ISBI.2007.357079","http://ieeexplore.ieee.org/stamp/stamp.jsp?arnumber=4193513","","Biology;Data mining;Feature extraction;Fluorescence;Histograms;Image databases;Information retrieval;Microscopy;Support vector machine classification;Support vector machines","feature extraction;fluorescence;image classification;medical image processing","88.6 percent;binary classification;edge feature extraction;fluorescence microscope images;image identification;protein subcellular location patterns;subcellular location image finder","","1","","12","","","12-15 April 2007","","IEEE","IEEE Conference Publications"
"Image and video fingerprinting for digital rights management of multimedia data","N. Nikolaidis; I. Pitas","Department of Informatics, Aristotle University of Thessaloniki, Thessaloniki 54124, Greece","2006 International Symposium on Intelligent Signal Processing and Communications","20070529","2006","","","801","807","Multimedia fingerprinting, also know as robust/perceptual hashing and replica detection is an emerging technology that can be used as an alternative to watermarking for the efficient digital rights management (DRM) of multimedia data. Two fingerprinting approaches are reviewed in this paper. The first is an image fingerprinting technique that makes use of color-based descriptors, R-trees and linear discriminant analysis (LDA). The second is a video fingerprinting method that utilizes information about the appearances of actors in videos along with an efficient search strategy. Experimental performance analysis is provided for both methods","","CD-ROM:0-7803-9733-9; POD:0-7803-9732-0","10.1109/ISPACS.2006.364920","http://ieeexplore.ieee.org/stamp/stamp.jsp?arnumber=4212307","","Fingerprint recognition;Information retrieval;Intellectual property;Multimedia databases;Multimedia systems;Protection;Robustness;Spatial databases;Technology management;Watermarking","cryptography;fingerprint identification;multimedia computing;video coding;watermarking","color-based descriptors;digital rights management;fingerprinting approach;image-video fingerprinting;linear discriminant analysis;multimedia data;robust-perceptual hashing;search strategy;video fingerprinting method","","1","7","24","","","12-15 Dec. 2006","","IEEE","IEEE Conference Publications"
"A Framework for Autonomous LBS in Wireless Pervasive Computing Environments","Li Fang; Li Xiaolei; B. Fuling","Research Center of Spatial Information and Digital Engineering, Wuhan University, 129 Luoyu Road, Wuhan 430079, China","The 9th International Conference on Advanced Communication Technology","20070507","2007","3","","1715","1720","The objective of this paper is to characterize the autonomous location based services (LBS) in wireless pervasive computing environments and to design an autonomous LBS framework and facilitating mobile users of accessing the relevant information or services. The service ontology we built focus on giving a solution of developing a methodology to help users, services, devices, and underlying different networks to communicate with each other in a natural manner. Challenges for making LBS autonomous in this type of environment are discussed. A prototype given in this paper offers a practical solution to solve the implementation problem for autonomous LBS, and is also useful for further researches.","1738-9445;17389445","POD:978-89-5519-131-8","10.1109/ICACT.2007.358701","http://ieeexplore.ieee.org/stamp/stamp.jsp?arnumber=4195503","LBS;autonomous;pervasive computing;wireless communication","Computer networks;Context awareness;Context-aware services;Displays;Embedded computing;Information retrieval;Mobile computing;Ontologies;Pervasive computing;Wireless sensor networks","telecommunication services;ubiquitous computing","autonomous LBS;location based services;mobile users;wireless pervasive computing environments","","3","","10","","","12-14 Feb. 2007","","IEEE","IEEE Conference Publications"
"Token Exchange System as incentive mechanism for e-Science Grid","A. Anandasivam; D. Neumann","University of Karlsruhe","Seventh IEEE International Symposium on Cluster Computing and the Grid (CCGrid '07)","20070529","2007","","","649","654","E-Science has a large demand for Grid resources. Research institutes of physics are interested in sharing their computational resources. Currently, Grid resources are not shared between the institutes over a billing system. It is based on an oral agreement. A high communication overhead at a political level is required to start and maintain cooperation. In this paper we propose a mechanism called Token exchange system (TES). Our aim is to facilitate exchange of resources among the different research institutes without any face-to-face agreement. Furthermore, the mechanism has to set the right incentives so that members will share their resources fairly and free-riders are avoided. This approach is the combination of reputation mechanism and the payment mechanism in one coherent system. Since the e-Science community abhors real money as an exchange mechanism, this approach provides a solution to set incentives like payment mechanisms and to implement the advantages of reputation mechanisms.","","POD:0-7695-2833-3","10.1109/CCGRID.2007.114","http://ieeexplore.ieee.org/stamp/stamp.jsp?arnumber=4215433","","Computational modeling;Data analysis;Environmental economics;Grid computing;Information management;Information retrieval;Management information systems;Physics computing;Resource management","grid computing;token networks","Grid resources;e-Science grid;incentive mechanism;payment mechanism;reputation mechanism;token exchange system","","0","","18","","","14-17 May 2007","","IEEE","IEEE Conference Publications"
"On Clustering Multimedia Time Series Data Using K-Means and Dynamic Time Warping","V. Niennattrakul; C. A. Ratanamahatana","Chulalongkorn University","2007 International Conference on Multimedia and Ubiquitous Engineering (MUE'07)","20070507","2007","","","733","738","After the generation of multimedia data turned digital, an explosion of interest in their data storage, retrieval, and processing has drastically increased. This includes videos, images, and audios, where we now have higher expectations in exploiting these data at hands. Typical manipulations are in some forms of video/image/audio processing, including automatic speech recognition, which require fairly large amount of storage and are computationally intensive. In our recent work, we have demonstrated the utility of time series representation in the task of clustering multimedia data using k-medoids method, which allows considerable amount of reduction in computational effort and storage space. However, k- means is a much more generic clustering method when Euclidean distance is used. In this work, we will demonstrate that unfortunately, k-means clustering will sometimes fail to give correct results, an unaware fact that may be overlooked by many researchers. This is especially the case when Dynamic Time Warping (DTW) is used as the distance measure in averaging the shape of time series. We also will demonstrate that the current averaging algorithm may not produce the real average of the time series, thus generates incorrect k-means clustering results, and then show potential causes why DTW averaging methods may not achieve meaningful clustering results. Lastly, we conclude with a suggestion of a method to potentially find the shape-based time series average that satisfies the required properties.","","POD:0-7695-2777-9","10.1109/MUE.2007.165","http://ieeexplore.ieee.org/stamp/stamp.jsp?arnumber=4197360","","Automatic speech recognition;Clustering methods;Euclidean distance;Explosions;Image storage;Information retrieval;Memory;Shape measurement;Storage automation;Videos","data analysis;data structures;information retrieval;multimedia computing;pattern clustering;time series","Euclidean distance;audio processing;automatic speech recognition;data processing;data retrieval;data storage;dynamic time warping;image processing;k-means time warping;multimedia time series data clustering;video processing","","20","","26","","","26-28 April 2007","","IEEE","IEEE Conference Publications"
"The Concentration of Fractional Distances","D. Francois; V. Wertz; M. Verleysen","Department of Mathematical Engineering, Universite&#180; catholique de Louvain, Georges Lema&#305;&#710;tre, 4, B-1348 Louvain-la-Neuve, Belgium","IEEE Transactions on Knowledge and Data Engineering","20070529","2007","19","7","873","886","Nearest neighbor search and many other numerical data analysis tools most often rely on the use of the euclidean distance. When data are high dimensional, however, the euclidean distances seem to concentrate; all distances between pairs of data elements seem to be very similar. Therefore, the relevance of the euclidean distance has been questioned in the past, and fractional norms (Minkowski-like norms with an exponent less than one) were introduced to fight the concentration phenomenon. This paper justifies the use of alternative distances to fight concentration by showing that the concentration is indeed an intrinsic property of the distances and not an artifact from a finite sample. Furthermore, an estimation of the concentration as a function of the exponent of the distance and of the distribution of the data is given. It leads to the conclusion that, contrary to what is generally admitted, fractional norms are not always less concentrated than the euclidean norm; a counterexample is given to prove this claim. Theoretical arguments are presented, which show that the concentration phenomenon can appear for real data that do not match the hypotheses of the theorems, in particular, the assumption of independent and identically distributed variables. Finally, some insights about how to choose an optimal metric are given.","1041-4347;10414347","","10.1109/TKDE.2007.1037","http://ieeexplore.ieee.org/stamp/stamp.jsp?arnumber=4216305","Nearest neighbor search;distance concentration;fractional distances.;high-dimensional data","Books;Content based retrieval;DNA;Data analysis;Databases;Digital cameras;Euclidean distance;Extraterrestrial measurements;Information retrieval;Nearest neighbor searches","","","","81","","52","","","July 2007","","IEEE","IEEE Journals & Magazines"
"Auto Picture Classification Using a Structure Simplicity of the Picture and Face Region Detection","M. B. Chung; I. J. Ko","Department of Media, Soongsil University, nzin@ssu.ac.kr, andy@ssu.ac.kr","The 9th International Conference on Advanced Communication Technology","20070507","2007","1","","819","823","Face region detection can be used at a picture contents classification of huge quantity. We can classify as a people picture when there is the people in the picture which uses face region detection. But, the precision of a picture classification is low if it uses existing face region detection technique. This paper proposes the algorithm about structure simplicity of the picture (SSP) to do the supplementation such problem. The experiment to use face region detection and SSP showed the precision of 74.6%. So if we use face region detection and SSP, we can do efficient picture classification.","1738-9445;17389445","POD:978-89-5519-131-8","10.1109/ICACT.2007.358475","http://ieeexplore.ieee.org/stamp/stamp.jsp?arnumber=4195254","Face region detection;Picture classification;Structure simplicity of the picture","Authentication;Face detection;Face recognition;Fingerprint recognition;Image color analysis;Manufacturing processes;Motion pictures;Music information retrieval;Skin;Space technology","face recognition;image classification","auto picture contents classification;face region detection;structure simplicity","","0","","7","","","12-14 Feb. 2007","","IEEE","IEEE Conference Publications"
"Extraction of Non-hierarchical Relations from Domain Texts","J. Punuru; J. Chen","Computer Science Dept, Louisiana State University, Baton Rouge, LA-70803, USA. Email: jpunur1@csc.lsu.edu","2007 IEEE Symposium on Computational Intelligence and Data Mining","20070604","2007","","","444","449","Ontology of a domain mainly consists of concepts, hierarchical relations, and non-hierarchical relations. Even though there exists a variety of methods for extracting concepts and hierarchical relations, very little concentration is on identification and labeling of non-hierarchical relations. In this paper, we present an unsupervised technique for the identification of non-hierarchical relations between the concepts using VF*ICF metric and log-likelihood ratios. The proposed approach is experimented with the electronic voting domain texts and is also compared with one of the existing approaches","","POD:1-4244-0705-2","10.1109/CIDM.2007.368908","http://ieeexplore.ieee.org/stamp/stamp.jsp?arnumber=4221332","","Computational intelligence;Data mining;Electronic voting;Information retrieval;Knowledge management;Labeling;Ontologies;Semantic Web;Taxonomy;Training data","data mining;ontologies (artificial intelligence);text analysis","VFICF metric;domain texts;log-likelihood ratios;nonhierarchical relation extraction;nonhierarchical relations;ontology;unsupervised technique","","4","","24","","","March 1 2007-April 5 2007","","IEEE","IEEE Conference Publications"
"Dynamic and Personalized Curriculum-Generation Method Analysing Causality and Dependency between Learning Objects","R. Konishi; Y. Takahashi; Y. Kiyoki","Fac. of Policy Manage., Keio Univ., Fujisawa","2007 IEEE International Workshop on Databases for Next Generation Researchers","20070430","2007","","","91","96","In this paper, we show a dynamic and personalized curriculum generation method that analyses the causality and dependency between learning objects. This method calculates the strength and extracts the rules of causality and dependency between individual learning objects, described beforehand, using the results of testing, trends of understanding within a particular community, and definitions of learning objects with a learning order. This method determines the important learning objects for an individual user, and an order for effective learning, by analysing the results of an individual and those of a particular community. It dynamically computes changing relationships between learning objects and the learning situation of individual users, and enables generation of a personalized curriculum that supports effective learning.","","CD-ROM:1-4244-0904-7; POD:1-4244-0903-9","10.1109/SWOD.2007.353204","http://ieeexplore.ieee.org/stamp/stamp.jsp?arnumber=4163068","","Data mining;Databases;Education;Electronic mail;Environmental management;Information analysis;Information retrieval;Knowledge management;Particle measurements;Testing","computer aided instruction;educational administrative data processing;human factors","causality analysis;dependency analysis;dynamic personalized curriculum-generation method;learning object","","1","","16","","","15-15 April 2007","","IEEE","IEEE Conference Publications"
"Best Practices on Delivering A Wiki Collaborative Solution for Enterprise Applications","S. Jang; T. M. Green","Innovation Technology Group, IBM Corporation, Southbury, CT, sjang@us.ibm.com","2006 International Conference on Collaborative Computing: Networking, Applications and Worksharing","20070521","2006","","","1","9","Wikis have become a hot topic in the world of collaboration tools. Wikipedia.org, a vast, community-driven encyclopedia, has proven to be an invaluable information resource that has been developed through collaboration among thousands of people around the world. Today wikis are increasingly being employed for a wide variety of uses in business. Consequently, one of the key challenges is to enable wikis to interoperate with informational and business process applications. The ability to dynamically change the content of Webpages and reflect the changes within an enterprise application brings the power of collaboration to business applications. This paper includes general information about wikis and describes how to use a wiki solution within an enterprise application. Integrating an enterprise application with a wild permits real-time updates of pages in the application by certain groups of experts, without deploying files from the Web application server","","CD-ROM:1-4244-0429-0; POD:1-4244-0428-2","10.1109/COLCOM.2006.361852","http://ieeexplore.ieee.org/stamp/stamp.jsp?arnumber=4207524","Web-based collaboration;collaboration design;collaborative tools;distributed technologies;group collaboration;wiki","Best practices;Collaboration;Collaborative tools;Displays;Encyclopedias;Feeds;File servers;Information resources;Information retrieval;Technological innovation","Web sites;business data processing;open systems","Web application server;Web page;Web-based collaboration;Wikipedia.org;business process application;collaboration design;collaboration tools;distributed technology;enterprise application;group collaboration;information resource;informational process application;interoperate;wiki collaborative solution","","1","","17","","","17-20 Nov. 2006","","IEEE","IEEE Conference Publications"
"Classification of XML Documents","A. Bouchachia; M. Hassler","Dept. of Informatics-Systems, Alpen-Adria-Universit&#228;t Klagenfurt, 9020, Austria. Email: hamid@isys.uni-klu.ac.at","2007 IEEE Symposium on Computational Intelligence and Data Mining","20070604","2007","","","390","396","With the explosion of XML-based online documents, the task of knowledge discovery from the Web becomes highly significant. As an appropriate machinery, classification allows to categorize documents to facilitate that task. A classification approach is introduced in this paper. It is based on the k-nearest neighborhood algorithm that relies on an edit distance measure. The originality of the work lies in combining both the content and the structure of XML documents to compute the edit distance. The approach is empirically evaluated using real-world XML collections","","POD:1-4244-0705-2","10.1109/CIDM.2007.368901","http://ieeexplore.ieee.org/stamp/stamp.jsp?arnumber=4221325","","Computational intelligence;Data mining;Explosions;Information retrieval;Machinery;Software libraries;Standards development;Text categorization;Web mining;XML","XML;classification;data mining","XML document classification;XML-based online documents;edit distance measure;k-nearest neighborhood algorithm;knowledge discovery","","2","","24","","","March 1 2007-April 5 2007","","IEEE","IEEE Conference Publications"
"Effective Detection of Various Wipe Transitions","S. Li; M. C. Lee","Comput. Sci. & Eng. Dept., Chinese Univ. of Hong Kong, Shatin","IEEE Transactions on Circuits and Systems for Video Technology","20070604","2007","17","6","663","673","Automatic detection of wipes and their frame ranges is important for the purpose of reliable video parsing and video database indexing. Wipes are difficult to detect because of the complexity and variety of the transition effects. Many of the existing wipe detection algorithms could detect only a few wipe effects. The false/miss detection problem caused by motion is also very serious. In this paper, we propose a novel wipe detection algorithm that can detect most wipe effects with accurate frame ranges. We carefully model a wipe based on its nature and then use the model to filter out possible confusion caused by motion or other transition effects. More precisely, properties of independence and completeness are proposed to characterize an ideal wipe; frame ranges of potential wipes are located by finding sequences which are a close approximation to an ideal wipe. Bayes rule is applied to each potential wipe to statistically estimate an adaptive threshold for the purpose of wipe verification. Experiment results on videos with different genres show that the proposed methodology can be used to detect various wipe effects effectively","1051-8215;10518215","","10.1109/TCSVT.2007.896621","http://ieeexplore.ieee.org/stamp/stamp.jsp?arnumber=4220722","Multimedia analysis;shot segmentation;video processing;wipe detection","Content based retrieval;Databases;Detection algorithms;Fading;Filters;Gunshot detection systems;Indexing;Information retrieval;Motion detection;Video sequences","Bayes methods;object detection;video signal processing","Bayes rule;adaptive threshold;reliable video parsing;video database indexing;wipe detection algorithm;wipes transistions automatic detection","","14","","20","","","June 2007","","IEEE","IEEE Journals & Magazines"
"Autonomous Context Data Dissemination in Heterogeneous and Dynamic Environments","C. Jacob; D. Linner; S. Steglich; I. Radusch","","2007 4th IEEE Consumer Communications and Networking Conference","20070515","2007","","","425","429","<div style=""font-variant: small-caps; font-size: .9em;"">First Page of the Article</div><img class=""img-abs-container"" style=""width: 95%; border: 1px solid #808080;"" src=""/xploreAssets/images/absImages/04199178.png"" border=""0"">","2331-9852;23319852","POD:1-4244-0667-6","10.1109/CCNC.2007.90","http://ieeexplore.ieee.org/stamp/stamp.jsp?arnumber=4199178","","Context modeling;Context-aware services;Information retrieval;Information technology;Jacobian matrices;Object oriented modeling;Ontologies;Peer to peer computing;Semantic Web;Space technology","","","","5","","16","","","Jan. 2007","","IEEE","IEEE Conference Publications"
