"Locating features in dynamically configured avionics software","M. Ouellet; E. Merlo; N. Sozen; M. Gagnon","Computer and Software Engineering Department, &#x00C9;cole Polytechnique de Montr&#x00E9;al, Montr&#x00E9;al, Canada","2012 34th International Conference on Software Engineering (ICSE)","20120628","2012","","","1453","1454","Locating features in software is an important activity for program comprehension and to support software reengineering. We present a novel automated approach to locate features in source code based on static analysis and model checking. The technique is aimed at dynamically configured software, which is software in which the activation of specific features is controlled by configuration variables. The approach is evaluated on an industrial avionics system.","0270-5257;02705257","Electronic:978-1-4673-1067-3; POD:978-1-4673-1066-6","10.1109/ICSE.2012.6227068","http://ieeexplore.ieee.org/stamp/stamp.jsp?arnumber=6227068","Feature;Feature Location;Feature Mapping;Program Comprehension;Reengineering","Aerospace electronics;Aircraft;Analytical models;Feature extraction;Information retrieval;Security;Software","avionics;formal verification;program diagnostics;systems re-engineering","configuration variables;feature location;industrial avionics system;model checking;program comprehension;software reengineering;source code;static analysis","","0","","8","","","2-9 June 2012","","IEEE","IEEE Conference Publications"
"Matchmaking through semantic annotation and similarity measurement","A. Ensan; Y. Biletskiy","University of New Brunswick, Fredericton, Canada","2012 25th IEEE Canadian Conference on Electrical and Computer Engineering (CCECE)","20121022","2012","","","1","5","The proposed work briefly describes an approach to automatically extract structured information from semi-structured documents to match the document creators and users in order to find the best similarities between them and connect them for further collaborations. The general idea is to employ a semantic annotation technique and similarity measurement approach by using the ontology to find best matches between web documents. The proposed approach uses ontologies to annotate the extracted information and for the measuring the similarity between each pair of documents. GATE (General Architecture for Text Engineering) as one of the most famous annotation tools has been utilized to annotate semi-structure documents. A novel algorithm is proposed to update the supported ontology for extraction purpose in GATE by using a training data set. Furthermore, specific domain-based metrics are also utilized to measure semantic similarities between documents with regard to semantic annotations which are implemented in an ontology-based approach. These metrics can be used in order to find the most similar web documents among documents corpus.","0840-7789;08407789","Electronic:978-1-4673-1433-6; POD:978-1-4673-1431-2","10.1109/CCECE.2012.6334966","http://ieeexplore.ieee.org/stamp/stamp.jsp?arnumber=6334966","Computer Applications;Information Extraction;Matchmaking;Ontology;Semantic Annotation;Semantic Similarity","Data mining;Information retrieval;Logic gates;Ontologies;Semantics;Vectors;XML","groupware;ontologies (artificial intelligence);text analysis","GATE;Web documents;collaborations;document creator-user matching;domain-based metrics;general architecture for text engineering;matchmaking;ontology-based approach;semantic annotation technique;semistructure document annotation;semistructured documents;similarity measurement approach;structured information extraction;training data set","","1","","14","","","April 29 2012-May 2 2012","","IEEE","IEEE Conference Publications"
"Using the Dempster-Shafer theory of evidence to rank documents","J. Zhang; B. Deng; X. Li","Department of Electronic Engineering, Tsinghua University, Beijing 100084, China","Tsinghua Science and Technology","20120615","2012","17","3","241","247","Multi-source information can be utilized collaboratively to improve the performance of information retrieval. To make full use of the document and collection information, this paper introduces a new information retrieval model that relies on the Dempster-Shafer theory of evidence. Each query-document pair is taken as a piece of evidence for the relevance between a document and a query. The evidence is combined using Dempster's rule of combination, and the belief committed to the relevance is obtained. Retrieved documents are then ranked according to the belief committed to the relevance. Several basic probability assignments are also proposed. Extensive experiments over the Text REtrieval Conference (TREC) test collection ClueWeb09 show that the proposed model provides performance similar to that of the Vector Space Model (VSM). Under certain probability assignments, the proposed model outperforms the VSM by 63% in terms of mean average precision.","","","10.1109/TST.2012.6216753","http://ieeexplore.ieee.org/stamp/stamp.jsp?arnumber=6216753","Dempster's rule of combination;Dempster-Shafer theory of evidence;basic probability assignment","Abstracts;Collaboration;Indexing;Information analysis;Information retrieval;Probabilistic logic","","","","0","","","","","June 2012","","TUP","TUP Journals & Magazines"
"A Cloud Computing Service for managing biomedical image collections","R. Alonso-Calvo; J. Crespo; M. Muñoz-Mármol; M. Intriago; A. Jimenez-Castellanos","DLSIIS, Univ. Politec. de Madrid, Madrid, Spain","2012 25th IEEE International Symposium on Computer-Based Medical Systems (CBMS)","20120830","2012","","","1","6","A huge quantity of biomedical images is generated every day. Building effective and agile systems for managing these collections has become an important and expensive issue for hospitals and institutions. In this paper we present a cloud computing service and its application for the storage and analysis of large image collections, specifically for very-large images. This Cloud Computing Service allows users to manage image collections in a relatively low-cost manner. The service is internally implemented by a balanced multiagent system. A novel aspect of the system is that one image could be divided in several, and those can then be stored and managed separately. This feature improves performance in data processing and information retrieval.","1063-7125;10637125","Electronic:978-1-4673-2051-1; POD:978-1-4673-2049-8","10.1109/CBMS.2012.6266401","http://ieeexplore.ieee.org/stamp/stamp.jsp?arnumber=6266401","","Biomedical imaging;Cloud computing;Data structures;Databases;Image color analysis;Information retrieval;Prototypes","cloud computing;content-based retrieval;image retrieval;medical computing;multi-agent systems","balanced multiagent system;biomedical image collection management;cloud computing service;content-based image retrieval;data processing;information retrieval;large image collection analysis;large image collection storage;very-large images","","0","","18","","","20-22 June 2012","","IEEE","IEEE Conference Publications"
"Duplicate-Search-Based Image Annotation Using Web-Scale Data","X. J. Wang; L. Zhang; W. Y. Ma","Microsoft Research Asia, Haidian District, Beijing, China","Proceedings of the IEEE","20120816","2012","100","9","2705","2721","Easy photo-taking and photo-sharing today make image an increasingly important type of media in people's everyday life, which arouses a growing demand for a practical image understanding technique. Traditional computer vision or machine learning methods which learn models based on a set of training data are still in the stage of tackling hundreds of object categories. Such a scale is far from practical usage. In recent years, the technique of search-based image annotation on a large-scale data set has demonstrated great success. Rather than directly mapping visual features to texts which is inevitably hindered by the semantic gap, it understands the content of an image by propagating labels of its similar images in a large-scale data set. Since similarity search is performed among homogenous data, the difficulty is greatly reduced. This paper summarizes the extensive work on web image annotation using the large-scale metadata and social information available on the Web, and introduces the Arista system, which is a nonparametric image annotation platform built upon two billion web images. We propose a highly efficient and scalable duplicate-search technique so that the Arista system can be deployed on a few servers. A few interesting applications such as building large-scale celebrity face database and text-to-image translation are also presented in this paper.","0018-9219;00189219","","10.1109/JPROC.2012.2193109","http://ieeexplore.ieee.org/stamp/stamp.jsp?arnumber=6210348","Automatic image annotation;duplicate-search-based image annotation","Databases;Feature extraction;Image classification;Information retrieval;Measurement;Semantics;Text mining","","","","8","","46","","20120601","Sept. 2012","","IEEE","IEEE Journals & Magazines"
"On the Helmholtz Principle for Data Mining","B. Dadachev; A. Balinsky; H. Balinsky; S. Simske","Cardiff Sch. of Math., Cardiff Univ., Cardiff, UK","2012 Third International Conference on Emerging Security Technologies","20121011","2012","","","99","102","Unusual behaviour detection and information extraction in streams of short documents and files (emails, news, tweets, log files, messages, etc.) are important problems in security applications. In [1], [2], a new approach to rapid change detection and automatic summarization of large documents was introduced. This approach is based on a theory of social networks and ideas from image processing and especially on the Helmholtz Principle from the Gestalt Theory of human perception. In this article we modify, optimize and verify the approach from [1], [2] to unusual behaviour detection and information extraction from small documents.","","Electronic:978-0-7695-4791-6; POD:978-1-4673-2448-9","10.1109/EST.2012.11","http://ieeexplore.ieee.org/stamp/stamp.jsp?arnumber=6328011","Helmholtz Principle;Keywords Extraction;Small-World Networks;Summarization;Unusual Behaviour Detection","Containers;Data mining;Electronic mail;Humans;Information retrieval;Measurement;Security","data mining;document handling;security of data;social networking (online)","Gestalt human perception theory;Helmholtz principle;change detection;data mining;files stream;image processing;information extraction;large document automatic summarization;security applications;short document stream;social networks theory;unusual behaviour detection","","3","","12","","","5-7 Sept. 2012","","IEEE","IEEE Conference Publications"
"Accelerating query by singing/humming on GPU: Optimization for web deployment","C. C. Wang; C. H. Chen; C. Y. Kuo; L. T. Chiu; J. S. R. Jang","Department of Computer Science, National Tsing Hua University, Hsinchu, Taiwan","2012 IEEE International Conference on Acoustics, Speech and Signal Processing (ICASSP)","20120830","2012","","","477","480","This paper presents the use of GPU for implementing a parallelized comparison method of linear scaling in a query by singing/humming system, which can compare a user's acoustic input to the database containing about 13,000 songs. We focus on the comparison from anywhere in a song, and the optimum setting is found through 3 different schemes of parallelization. With a speedup factor of 66, the proposed scheme with the optimum setting has been successfully implemented in a public QBSH system that is available from the internet.","1520-6149;15206149","Electronic:978-1-4673-0046-9; POD:978-1-4673-0045-2; USB:978-1-4673-0044-5","10.1109/ICASSP.2012.6287920","http://ieeexplore.ieee.org/stamp/stamp.jsp?arnumber=6287920","GPU;Music retrieval;Query-bysinging/humming;linear scaling","Acceleration;Computer architecture;Databases;Graphics processing unit;Instruction sets;Music information retrieval;Vectors","Internet;acoustic signal processing;graphics processing units;optimisation;parallel processing;query processing","GPU;Internet;Web deployment;accelerating query;humming system;linear scaling;optimization;parallelization;parallelized comparison method;public QBSH system;singing system;user acoustic input","","3","","11","","","25-30 March 2012","","IEEE","IEEE Conference Publications"
"Research on semantic environment-based annotation techniques for knowledge semantic","Cai Yingfang","School of economics and management, Beijing University of Aeronautics & Astronautics, China 100191","2012 International Conference on Information Management, Innovation Management and Industrial Engineering","20121025","2012","1","","527","530","This paper puts forward the Semantic Environment-based Annotation Techniques for Knowledge Semantic in allusion to the problem in dealing with synonymy and in neglecting semantic environment. It improves the Algorithm on key link of ontology annotation. It is from two way that when calculating the correlation degree of word & document, one is to calculate the correlation degree of the “Example Annotation-Document”, the other hand is to calculate the co expression of the “semantic environment”. The efficiency of the annotation had been significantly increased through improving of Algorithm.","2155-1456;21551456","Electronic:978-1-4673-1931-7; POD:978-1-4673-1932-4","10.1109/ICIII.2012.6339719","http://ieeexplore.ieee.org/stamp/stamp.jsp?arnumber=6339719","knowledge extractive;semantic annotation;semantic environment","Contracts;Equations;Information retrieval;Knowledge based systems;Mathematical model;Ontologies;Semantics","ontologies (artificial intelligence)","example annotation-document;knowledge semantic;ontology annotation;semantic environment-based annotation technique;synonymy","","0","","10","","","20-21 Oct. 2012","","IEEE","IEEE Conference Publications"
"Multiple Feature-Classifier Combination in Automated Text Classification","L. S. P. Busagala; W. Ohyama; T. Wakabayashi; F. Kimura","Sokoine Nat. Agric. Libr., Sokoine Univ. of Agric., Morogoro, Tanzania","2012 10th IAPR International Workshop on Document Analysis Systems","20120507","2012","","","43","47","Automatic text classification (ATC) is important in applications such as indexing and organizing electronic documents in databases leading to enhancement of information access and retrieval. We propose a method which employs various types of feature sets and learning algorithms to improve classification effectiveness. Unlike the conventional methods of multi-classifier combination, the proposed method considers the contributions of various types of feature sets and classifiers. It can therefore be known as multiple feature-classifier combination (MFC) method. In this paper we present empirical evaluation of MFC using two benchmarks of text collections to determine its effectiveness. Empirical evaluation show that MFC consistently outperformed all compared methods.","","Electronic:978-0-7695-4661-2; POD:978-1-4673-0868-7","10.1109/DAS.2012.56","http://ieeexplore.ieee.org/stamp/stamp.jsp?arnumber=6195332","Feature reduction;Feature-Classifier Combination;Multi-classifier combination;Text Classification/Categorization;ensembles","Information retrieval;Machine learning;Principal component analysis;Support vector machines;Text categorization;Training;Vectors","learning (artificial intelligence);pattern classification;text analysis","automated text classification;classification effectiveness;electronic document;feature set;information access;information retrieval;learning algorithm;multiple feature-classifier combination;text collection","","0","2","23","","","27-29 March 2012","","IEEE","IEEE Conference Publications"
"Combining a segmentation-like approach and a density-based approach in content extraction","S. Lin; J. Chen; Z. Niu","School of Computer Science, Beijing Institute of Technology, Beijing 100081, China","Tsinghua Science and Technology","20120615","2012","17","3","256","264","Density-based approaches in content extraction, whose task is to extract contents from Web pages, are commonly used to obtain page contents that are critical to many Web mining applications. However, traditional density-based approaches cannot effectively manage pages that contain short contents and long noises. To overcome this problem, in this paper, we propose a content extraction approach for obtaining content from news pages that combines a segmentation-like approach and a density-based approach. A tool called BlockExtractor was developed based on this approach. BlockExtractor identifies contents in three steps. First, it looks for all Block-Level Elements (BLE) & Inline Elements (IE) blocks, which are designed to roughly segment pages into blocks. Second, it computes the densities of each BLE&IE block and its element to eliminate noises. Third, it removes all redundant BLE&IE blocks that have emerged in other pages from the same site. Compared with three other density-based approaches, our approach shows significant advantages in both precision and recall.","","","10.1109/TST.2012.6216755","http://ieeexplore.ieee.org/stamp/stamp.jsp?arnumber=6216755","content extraction;density-based approach;segmentation","HTML;Information analysis;Information retrieval;Noise measurement;Text mining;Training;Web mining;Web pages","","","","1","","","","","June 2012","","TUP","TUP Journals & Magazines"
"A Boosting, Sparsity- Constrained Bilinear Model for Object Recognition","C. Zhang; J. Liu; Q. Tian; Y. Han; H. Lu; S. Ma","National Lab of Pattern Recognition, Chinese Academy of Sciences","IEEE MultiMedia","20120427","2012","19","2","58","68","Using higher-level visual elements to represent images, the authors have developed a sparsity-constrained bilinear model (SBLM) and have combined a set of SBLMs in a boosting-like procedure to enhance performance.","1070-986X;1070986X","","10.1109/MMUL.2011.20","http://ieeexplore.ieee.org/stamp/stamp.jsp?arnumber=5740827","computer vision;image processing;image/video retrieval;multimedia;object recognition","Adaptation model;Computer vision;Image processing;Image representation;Information retrieval;Object recognition;Robustness;Video communication;Visualization","image representation;object recognition","SBLM;boosting-like procedure;higher-level visual elements;image representation;object recognition;sparsity-constrained bilinear model","","12","","17","","20110405","Feb. 2012","","IEEE","IEEE Journals & Magazines"
"Design and research on network teaching platform of document retrieval course","J. Zhang; X. Li","Institute of Documentation and Information, Shandong University of Science and Technology, Taian, China","2012 International Conference on Systems and Informatics (ICSAI2012)","20120625","2012","","","1183","1186","Compared with the traditional teaching mode, the use of the network teaching platform of document retrieval course has many compelling advantages. The network teaching platform of document retrieval course should be designed to constructivism learning theory as the foundation and basis and implement principles of openness, interactivity, dynamic, and maintainability, and so on. Thus it sets up a “learner centered” main framework with its own characteristics full of Microsoft's technology. The framework of document retrieval course network teaching platform includes the following subsystems, network classroom, communication consultation, exam evaluation, and teaching management. They do their own work and cooperate closely to complete the revolutionary evolution of the document retrieval course teaching mode under network environment.","","Electronic:978-1-4673-0199-2; POD:978-1-4673-0198-5","10.1109/ICSAI.2012.6223245","http://ieeexplore.ieee.org/stamp/stamp.jsp?arnumber=6223245","document retrieval course;library;network teaching platform;university","Educational institutions;Information retrieval;Internet;Knowledge engineering;Libraries;Navigation","Internet;computer aided instruction;educational courses;information retrieval;teaching","Microsoft technology;communication consultation;constructivism learning theory;document retrieval course network teaching platform;document retrieval course teaching mode;exam evaluation;learner centered main framework;network classroom;network environment;revolutionary evolution;teaching management","","0","","7","","","19-20 May 2012","","IEEE","IEEE Conference Publications"
"One Size Does Not Fit All: Toward User- and Query-Dependent Ranking for Web Databases","A. Telang; C. Li; S. Chakravarthy","University of Texas at Arlington, Arlington","IEEE Transactions on Knowledge and Data Engineering","20120723","2012","24","9","1671","1685","With the emergence of the deep web, searching web databases in domains such as vehicles, real estate, etc., has become a routine task. One of the problems in this context is ranking the results of a user query. Earlier approaches for addressing this problem have used frequencies of database values, query logs, and user profiles. A common thread in most of these approaches is that ranking is done in a user- and/or query-independent manner. This paper proposes a novel query- and user-dependent approach for ranking query results in web databases. We present a ranking model, based on two complementary notions of user and query similarity, to derive a ranking function for a given user query. This function is acquired from a sparse workload comprising of several such ranking functions derived for various user-query pairs. The model is based on the intuition that similar users display comparable ranking preferences over the results of similar queries. We define these similarities formally in alternative ways and discuss their effectiveness analytically and experimentally over two distinct web databases.","1041-4347;10414347","","10.1109/TKDE.2011.36","http://ieeexplore.ieee.org/stamp/stamp.jsp?arnumber=5710921","Automated ranking;query similarity;user similarity;web databases;workload","Context awareness;Databases;Image color analysis;Information retrieval;Mathematical model;Search methods;Web services","","","","3","","35","","20110210","Sept. 2012","","IEEE","IEEE Journals & Magazines"
"Analysis and evaluation of unstructured data: text mining versus natural language processing","F. S. Gharehchopogh; Z. A. Khalifelu","Hacettepe University Department, Computer Engineering, Ankara, Turkey","2011 5th International Conference on Application of Information and Communication Technologies (AICT)","20111222","2011","","","1","4","Nowadays, most of information saved in companies are as unstructured models. Retrieval and extraction of the information is essential works and importance in semantic web areas. Many of these requirements will be depend on the storage efficiency and unstructured data analysis. Merrill Lynch recently estimated that more than 80% of all potentially useful business information is unstructured data. The large number and complexity of unstructured data opens up many new possibilities for the analyst. We analyze both structured and unstructured data individually and collectively. Text mining and natural language processing are two techniques with their methods for knowledge discovery form textual context in documents. In this study, text mining and natural language techniques will be illustrated. The aim of this work comparison and evaluation the similarities and differences between text mining and natural language processing for extraction useful information via suitable themselves methods.","","Electronic:978-1-61284-832-7; POD:978-1-61284-831-0","10.1109/ICAICT.2011.6111017","http://ieeexplore.ieee.org/stamp/stamp.jsp?arnumber=6111017","","Databases;Information retrieval;Natural language processing;Pragmatics;Text categorization;Text mining","business data processing;computational complexity;data analysis;data mining;information retrieval;information storage;semantic Web;text analysis","business information;document handling;information extraction;information retrieval;knowledge discovery;natural language processing;semantic Web;storage efficiency;text mining;textual context;unstructured data analysis;unstructured data complexity;unstructured data evaluation","","14","","32","","","12-14 Oct. 2011","","IEEE","IEEE Conference Publications"
