"Research on SOA Architecture for Scattered Web Knowledge Discovery","W. Zeng; J. Zhang; H. Wei","Software Eng. Coll., Beijing Univ. of Technol., Beijing, China","2012 International Conference on Computer Science and Service System","20121231","2012","","","1370","1373","With the rapid update of internet hardware and software, especially the rise of mobile internet and cloud computing platforms, web-based sites has become the world's largest source of information, and so how to extract the accurate domain-specific knowledge, how to improve the extraction efficiency and how to save the cost during information harvest have become the hot research spot. With the advantage of the theories and techniques of software architecture, the paper presents a web knowledge discovery model based on SOA and cloud computing, through which valid information can be obtained in an automatic or semi-automatic way from the distributed information sources environment. A unique web information extraction system built base on the architecture and the verification results were given in the final chapter.","","Electronic:978-0-7695-4719-0; POD:978-1-4673-0721-5","10.1109/CSSS.2012.345","http://ieeexplore.ieee.org/stamp/stamp.jsp?arnumber=6394583","SOA;UML;Web information extraction;knowledge discovery","Cloud computing;Computer architecture;Data mining;Information retrieval;Service oriented architecture;Unified modeling language","Web sites;cloud computing;data mining;mobile computing;service-oriented architecture","Internet hardware;Internet software;SOA architecture;Web information extraction system;Web-based sites;cloud computing platforms;distributed information sources environment;domain-specific knowledge;information harvest;mobile Internet;scattered Web knowledge discovery","","0","","9","","","11-13 Aug. 2012","","IEEE","IEEE Conference Publications"
"A Budget Optimization Framework for Search Advertisements Across Markets","Y. Yang; J. Zhang; R. Qin; J. Li; F. Y. Wang; W. Qi","State Key Lab of Intelligent Control and Management of Complex Systems, Chinese Academy of Sciences , Beijing, China","IEEE Transactions on Systems, Man, and Cybernetics - Part A: Systems and Humans","20120815","2012","42","5","1141","1151","Budget optimization is one of the primary decision-making issues faced by advertisers in search auctions. A quality budget optimization strategy can significantly improve the effectiveness of search advertising campaigns, thus helping advertisers to succeed in the fierce competition of online marketing. This paper investigates budget optimization problems in search advertisements and proposes a novel hierarchical budget optimization framework (BOF), with consideration of the entire life cycle of advertising campaigns. Then, we formulated our BOF framework, made some mathematical analysis on some desirable properties, and presented an effective solution algorithm. Moreover, we established a simple but illustrative instantiation of our BOF framework which can help advertisers to allocate and adjust the budget of search advertising campaigns. Our BOF framework provides an open testbed environment for various strategies of budget allocation and adjustment across search advertising markets. With field reports and logs from real-world search advertising campaigns, we designed some experiments to evaluate the effectiveness of our BOF framework and instantiated strategies. Experimental results are quite promising, where our BOF framework and instantiated strategies perform better than two baseline budget strategies commonly used in practical advertising campaigns.","1083-4427;10834427","","10.1109/TSMCA.2011.2172418","http://ieeexplore.ieee.org/stamp/stamp.jsp?arnumber=6095652","Budget optimization;optimal strategy;search auctions;search engine marketing;sponsored search","Advertising;Convex functions;Information retrieval;Marketing management;Optimization;Search engines;Search problems","Internet;advertising;budgeting;decision making;electronic commerce;search engines","BOF framework;budget allocation;budget optimization framework;decision-making issues;online marketing;search advertising campaigns;search advertising markets;search auctions","","24","","36","","20111206","Sept. 2012","","IEEE","IEEE Journals & Magazines"
"Identifying Provider Counseling Practices Using Natural Language Processing: Gout Example","O. V. Patterson; G. S. Kerr; J. S. Richards; C. A. Nunziato; D. D. Maron; R. L. Amdur; S. L. DuVall","Univ. of Utah, Salt Lake City, UT, USA","2012 IEEE Second International Conference on Healthcare Informatics, Imaging and Systems Biology","20121203","2012","","","127","127","National guidelines for a number of health conditions recommend that practitioners assess and reinforce patient's adherence to specific diet and lifestyle modifications. Counseling intervention has shown to have a long-term positive effect on patient adherence but the extent to which physicians comply is unknown. Evidence of counseling provided by practitioner is recorded only as free text in electronic medical records. To identify physicians' counseling practices we developed a natural language processing system to detect text documentation of dietary counseling in gout patients.","","Electronic:978-0-7695-4921-7; POD:978-1-4673-4803-4","10.1109/HISB.2012.52","http://ieeexplore.ieee.org/stamp/stamp.jsp?arnumber=6366218","NLP;information extraction;patient education","Cities and towns;Educational institutions;Employee welfare;Information retrieval;Medical services;Natural language processing","information retrieval;medical information systems;natural language processing;text analysis","counseling intervention;diet modifications;dietary counseling;electronic medical records;gout patient adherence;health conditions;lifestyle modifications;national guidelines;natural language processing;physician counseling practice identification;text documentation detection","","0","","1","","","27-28 Sept. 2012","","IEEE","IEEE Conference Publications"
"Don't Click Here","D. A. Shamma; M. Slaney","Yahoo! Research","IEEE MultiMedia","20120817","2012","19","3","4","6","One of the most important aspects of multimedia research is mining data about user behavior. In a world with one or fewer clicks per piece of content, one needs a lot of users to get a meaningful signal. A monetization ecosystem now directs multimedia research and is changing how we think about people, interaction, media engagement, and data instrumentation. Single clicks, touches, and gestures are now powerful, often complex interactions that are part of our everyday vernacular. Currently, touchless interactions and zero-click interfaces bring us content, push notifications, and recommend playlists. Beyond this, the absence of interaction, the minus one click, is taking the forefront.","1070-986X;1070986X","","10.1109/MMUL.2012.33","http://ieeexplore.ieee.org/stamp/stamp.jsp?arnumber=6272277","Web research;data mining;interaction;media engagement;minus one click;multimedia;multimedia applications;multimedia research;zero-click interfaces","Behavioral science;Computer interfaces;Data mining;Information retrieval;Internet;Patents;Search methods;Streaming media;Web services","","","","0","","8","","","July-Sept. 2012","","IEEE","IEEE Journals & Magazines"
"Machine Learning Algorithms with Co-occurrence Based Term Association for Text Mining","Y. Yi; L. Liu; C. H. Li; W. Song; S. Liu","Dept. of Comput. Sci. & Inf., He Chi Univ., YiZhou, China","2012 Fourth International Conference on Computational Intelligence and Communication Networks","20121206","2012","","","958","962","In this paper, an effective method for computing term association from a text corpus is presented. Two machine learning algorithms are employed to evaluate the effectiveness of the proposed method for text mining. The co-occurrence based term association method is to overcome the problem of lack of relationship between words for keyword based text mining and improve the performance of text mining. The experiments are conducted on the standard Reuter-21578 data set and 20 news group data set. Different number of associated terms are compared in the experiments. Experimental results show that the proposed method can achieve better results on different machine learning algorithms when measured by F measure.","","Electronic:978-0-7695-4850-0; POD:978-1-4673-2981-1","10.1109/CICN.2012.141","http://ieeexplore.ieee.org/stamp/stamp.jsp?arnumber=6375257","Machine learning algorithms;Term association;Text mining","Educational institutions;Information retrieval;Text categorization;Text mining;Thesauri;Training;Vectors","data mining;learning (artificial intelligence);text analysis","F measure;Reuter-21578 data set;cooccurrence based term association;keyword based text mining;machine learning algorithm;text corpus","","0","","22","","","3-5 Nov. 2012","","IEEE","IEEE Conference Publications"
"Soft clustering algorithms based on neural networks","L. Skovajsová; M. Rojćek","Institute of Informatics, Slovak Academy of Sciences, D&#x00FA;bravsk&#x00E1; cesta 9, 845 07 Bratislava 45, Slovakia","2011 IEEE 12th International Symposium on Computational Intelligence and Informatics (CINTI)","20111222","2011","","","439","442","This paper is oriented into the text document retrieval area. The aim of the paper is to compare two soft document clustering methods by using neural networks, the modification of KMART and the nonlinear Hebbian neural network with Oja learning rule.","","Electronic:978-1-4577-0045-3; POD:978-1-4577-0044-6","10.1109/CINTI.2011.6108545","http://ieeexplore.ieee.org/stamp/stamp.jsp?arnumber=6108545","","Clustering algorithms;Informatics;Information retrieval;Neural networks;Subspace constraints;Training;Vectors","Hebbian learning;information retrieval;neural nets;pattern clustering;text analysis","KMART;Oja learning rule;neural networks;nonlinear Hebbian neural network;soft clustering algorithm;soft document clustering methods;text document retrieval area","","1","","14","","","21-22 Nov. 2011","","IEEE","IEEE Conference Publications"
"Automatic error region detection and characterization in LVCSR transcriptions of TV news shows","R. Dufour; G. Damnati; D. Charlet","Orange Labs, France Telecom, Lannion (France)","2012 IEEE International Conference on Acoustics, Speech and Signal Processing (ICASSP)","20120830","2012","","","4445","4448","This paper addresses the issue of error region detection and characterization in LVCSR transcriptions. It is a well-known phenomenon that errors are not independent and tend to co-occur in automatic transcriptions. We are interested in automatically detecting these so-called error regions. Additionally, in the context of information extraction in TVBN shows, being able to automatically characterize detected error regions is a crucial step towards the definition of suitable recovery strategies. In this paper we propose to classify error regions in four classes with a particular focus on errors on person names. We propose several sequential detection + classification approaches and an integrated sequence labeling approach. We show that our best classification system can reach 70% classification accuracy on automatically detected error regions. Additionally, the overall system is able to detect and correctly characterize 29.6% of error region corresponding to a person name with a precision of 61.9%.","1520-6149;15206149","Electronic:978-1-4673-0046-9; POD:978-1-4673-0045-2; USB:978-1-4673-0044-5","10.1109/ICASSP.2012.6288906","http://ieeexplore.ieee.org/stamp/stamp.jsp?arnumber=6288906","Automatic classification;Error characterization;Error region detection;LVCSR","Accuracy;Context;Focusing;Information retrieval;Labeling;Speech;Speech recognition","speech recognition;television stations","ASR systems;LVCSR transcriptions;TV news shows;TVBN shows;automatic error region detection;automatic speech recognition systems;error region classification;integrated sequence labeling approach;large vocabulary continuous speech recognition;sequential classification approach;sequential detection approach","","2","","13","","","25-30 March 2012","","IEEE","IEEE Conference Publications"
"Towards Efficient Sport Data Integration through Semantic Annotation","Q. M. Nguyen; T. D. Cao; H. C. Nguyen; T. Hagino","Sch. of Electron. & Telecommun., Hanoi Univ. of Sci. & Technol., Hanoi, Vietnam","2012 Fourth International Conference on Knowledge and Systems Engineering","20120913","2012","","","99","106","In news genre, the sport domain is one of great interest to audiences on many occasions. The explosion of Internet these days leads to many obstacles for users in searching information due to enormous amount of data collected from multiple media streams. In this case, Semantic Web is believed to bring a solution for information integration. In this paper, we introduce a novel approach for an integration system of sports information using semantic web. Semantic annotation of sport news on the web is a way to bring success to our system. We propose an algorithm to generate semantic annotations of sport news that relies on the ontology. Named entities recognition is improved by integrating the KIM information extraction system with this ontology, which is dedicated for sport domain. The concepts and relations of ontology detected in the text are combined with these entities to capture the semantic. Initial experiments on soccer news demonstrated promising results.","","Electronic:978-0-7695-4760-2; POD:978-1-4673-2171-6","10.1109/KSE.2012.21","http://ieeexplore.ieee.org/stamp/stamp.jsp?arnumber=6299405","Information integration;Ontology;semantic annotation generation;semantic web","Educational institutions;Information retrieval;Knowledge based systems;Ontologies;Organizations;Semantic Web;Semantics","data integration;knowledge acquisition;ontologies (artificial intelligence);semantic Web;sport","Internet;KIM information extraction system;multiple media streams;named entities recognition;semantic Web;soccer news;sport data integration;sport domain;sport semantic annotation;sports information integration system;text ontology detection","","1","","12","","","17-19 Aug. 2012","","IEEE","IEEE Conference Publications"
"Toward actionable, broadly accessible contests in Software Engineering","J. Cleland-Huang; Y. Shin; E. Keenan; A. Czauderna; G. Leach; E. Moritz; M. Gethers; D. Poshyvanyk; J. H. Hayes; W. Li","DePaul University, Chicago, IL 60604","2012 34th International Conference on Software Engineering (ICSE)","20120628","2012","","","1329","1332","Software Engineering challenges and contests are becoming increasingly popular for focusing researchers' efforts on particular problems. Such contests tend to follow either an exploratory model, in which the contest holders provide data and ask the contestants to discover “interesting things” they can do with it, or task-oriented contests in which contestants must perform a specific task on a provided dataset. Only occasionally do contests provide more rigorous evaluation mechanisms that precisely specify the task to be performed and the metrics that will be used to evaluate the results. In this paper, we propose actionable and crowd-sourced contests: actionable because the contest describes a precise task, datasets, and evaluation metrics, and also provides a downloadable operating environment for the contest; and crowd-sourced because providing these features creates accessibility to Information Technology hobbyists and students who are attracted by the challenge. Our proposed approach is illustrated using research challenges from the software traceability area as well as an experimental workbench named TraceLab.","0270-5257;02705257","Electronic:978-1-4673-1067-3; POD:978-1-4673-1066-6","10.1109/ICSE.2012.6227087","http://ieeexplore.ieee.org/stamp/stamp.jsp?arnumber=6227087","Contest;Empirical Software Engineering;TraceLab;Traceability","Communities;Conferences;Data mining;Information retrieval;Measurement;Software;Software engineering","program diagnostics;social sciences computing;software metrics","TraceLab;actionable broadly accessible contests;crowd-sourced contests;datasets;evaluation mechanisms;evaluation metrics;information technology;software engineering;software traceability area;task-oriented contests","","6","","14","","","2-9 June 2012","","IEEE","IEEE Conference Publications"
"Chunking and Extracting Text Content for Mobile Learning: A Query-Focused Summarizer Based on Relevance Language Model","G. Yang; Kinshuk; E. Sutinen; D. Wen","Sch. of Comput., Univ. of Eastern Finland, Joensuu, Finland","2012 IEEE 12th International Conference on Advanced Learning Technologies","20120816","2012","","","126","128","Millions of text contents and multimedia published on the Web have potential to be shared as the learning contents. However, mobile learners often feel it difficult to extract useful contents for learning. Manually creating content not only requires a huge effort on the part of the teachers but also creates barriers towards reuse of the content that has already been created for e-Learning. In this paper, a text-based content summarizer is introduced to address an approach to help mobile learners to retrieve and process information more quickly by aligning text-based content size to various mobile characteristics. In this work, probabilistic language modeling techniques are integrated into an extractive text summarization system to fulfill the automatic summary generation for mobile learning. Experimental results have shown that our solution is a proper and efficient approach to help mobile learners to summarize important content quickly.","2161-3761;21613761","Electronic:978-0-7695-4702-2; POD:978-1-4673-1642-2","10.1109/ICALT.2012.29","http://ieeexplore.ieee.org/stamp/stamp.jsp?arnumber=6268055","content processing;mobile learning;relevance modelling;text summarization","Computational modeling;Computer architecture;Educational institutions;Humans;Information retrieval;Mobile communication;Probabilistic logic","Internet;computer aided instruction;mobile computing;multimedia systems;natural language processing;probability;query processing;text analysis","Web;automatic summary generation;e-learning;extractive text summarization system;information processing;information retrieval;learning contents;mobile learning;multimedia;probabilistic language modeling techniques;query-focused summarizer;relevance language model;text content chunking;text content extraction;text-based content size;text-based content summarizer","","0","","11","","","4-6 July 2012","","IEEE","IEEE Conference Publications"
"Research on integration model and application system of enterprise information resources","Jing-Yan Wang; Ren-gen Huang; Guo-jian He; Kai-wei Yu","Foshan University, 528000, China","2012 International Conference on Information Management, Innovation Management and Industrial Engineering","20121025","2012","1","","100","104","With constantly advancing of informatization construction and application, many enterprises have accumulated a wealth of information resources, desiderating to solve the problems of information effectively sharing and developing. Based on discussing the connotation and characteristic of enterprise information resources, this paper introduces the integration model of enterprise information resources. The integration scope covers network information resources, internal information resources and commercial database resources. The integration method of internal information resources, functions and characteristics of integration model are presented in detail. In order to utilize information resources integration technology for providing information service, the deployment scheme of information service system based on cloud computing is proposed in the article, and system implement is also explained at full length.","2155-1456;21551456","Electronic:978-1-4673-1931-7; POD:978-1-4673-1932-4","10.1109/ICIII.2012.6339741","http://ieeexplore.ieee.org/stamp/stamp.jsp?arnumber=6339741","application system;cloud computing;enterprise information resources;information service;integration model","Cloud computing;Databases;Information retrieval;Information services;Production;Standards","business data processing;cloud computing;information resources","cloud computing;commercial database resource;enterprise information resource;information resources integration technology;information service system;information sharing;informatization application;informatization construction;internal information resource;network information resource","","0","","8","","","20-21 Oct. 2012","","IEEE","IEEE Conference Publications"
"Prolog to the Section on Mass Storage and Data Retrieval","X. Zhou","School of Information Technology and Electrical Engineering, The University of Queensland, Brisbane, Australia","Proceedings of the IEEE","20120510","2012","100","Special Centennial Issue","1431","1432","","0018-9219;00189219","","10.1109/JPROC.2012.2189914","http://ieeexplore.ieee.org/stamp/stamp.jsp?arnumber=6198392","","Data storage systems;Database systems;Information retrieval;Information technology;Special issues and sections","","","","0","","","","","May 13 2012","","IEEE","IEEE Journals & Magazines"
"In Tags We Trust: Trust modeling in social tagging of multimedia content","I. Ivanov; P. Vajda; J. S. Lee; T. Ebrahimi","Research assistant and Ph.D. student in the Multimedia Signal Processing Group at the Swiss Federal Institute of Technology (EPFL), Lausanne, Switzerland","IEEE Signal Processing Magazine","20120216","2012","29","2","98","107","Tagging in online social networks is very popular these days, as it facilitates search and retrieval of multimedia content. However, noisy and spam annotations often make it difficult to perform an efficient search. Users may make mistakes in tagging and irrelevant tags and content may be maliciously added for advertisement or self-promotion. This article surveys recent advances in techniques for combatting such noise and spam in social tagging. We classify the state-of-the-art approaches into a few categories and study representative examples in each. We also qualitatively compare and contrast them and outline open issues for future research.","1053-5888;10535888","","10.1109/MSP.2011.942345","http://ieeexplore.ieee.org/stamp/stamp.jsp?arnumber=6153150","","Content management;Information analysis;Information retrieval;Multimedia communication;Noise measurement;Online services;Search problems;Social network services;Tagging","information retrieval;multimedia computing;social networking (online);trusted computing;unsolicited e-mail","multimedia content retrieval;online social networks;social tagging;spam annotations;trust modeling","","10","","49","","","March 2012","","IEEE","IEEE Journals & Magazines"
"A Text Representation and Retrieval Method Based on Concept Algebra","F. Ye; H. Cao; X. Luo","Sch. of Comput. Eng. & Sci., Shanghai Univ., Shanghai, China","2012 IEEE 12th International Conference on Computer and Information Technology","20121224","2012","","","1066","1071","This paper introduces the concept algebra (CA) theory as a basis for the conceptual representation and the derivation of text processing to realize a semantic based retrieval system. We also take advantage of Hownet to create the concept attributes space for concept algebra. With the help of LTP, we get the key words and their dependent relations of every sentence to build the CA concept representation of the content with a five-tuple. Concepts make it possible to express both the keyword itself and the semantic relation with its context. According to the demands of text retrieval, some CA operations are optimized to calculate the relations and similarity between concepts. Besides, a text retrieval system framework which processes information based on the concept relations at a concept level is also proposed to verify the advantages of our method.","","Electronic:978-0-7695-4858-6; POD:978-1-4673-4873-7","10.1109/CIT.2012.218","http://ieeexplore.ieee.org/stamp/stamp.jsp?arnumber=6392054","Hownet;LTP;concept algebra;concept relation;concept similarity;semantic;text representation;text retrieval","Algebra;Cognition;Context;Educational institutions;Information retrieval;Knowledge representation;Semantics","information retrieval;knowledge representation;text analysis","Hownet;concept algebra;concept attribute space;concept similarity;conceptual representation;key words;semantic based retrieval system;semantic relation;sentence;text processing;text representation;text retrieval method;text retrieval system","","1","","10","","","27-29 Oct. 2012","","IEEE","IEEE Conference Publications"
