"Superior vision: Always on human-like vision for intelligent devices","V. Mureşan","Movidius SRL, Timisoara, Gh Lazar Street, Nb 24, Romania","2016 IEEE 11th International Symposium on Applied Computational Intelligence and Informatics (SACI)","20160709","2016","","","229","230","Summary form only given. We live in a world of intelligent robots, drones and mobile phones/assistants. The technologies behind these products are heralded by a new wave of deep learning applications ported on mobile devices. The robotic and vision technologies behind these products will shift the applications of electronic devices to a more superior level of intelligence that will change our world. From a hardware point of view, these devices will become a hub of learning sensors that will be able to capture and learn from their surrounding environment and their context. On top of the aforementioned deep learning technologies, the most important sense for these devices will be their vision capabilities. To make this sense as close as possible to human vision, will require advanced technology to capture, process, understand and provide analytics in real time to enable their applications make critical “educated: decisions”. “Always on” vision capabilities are envisaged as the paradigm for the next generation of mobile This Keynote will cover in this context the state of the art in the domain of vision with the latest image processing, computer vision and deep learning algorithms implemented on various low-power processing architectures.","","Electronic:978-1-5090-2380-6; POD:978-1-5090-2381-3; USB:978-1-5090-2379-0","10.1109/SACI.2016.7507375","http://ieeexplore.ieee.org/stamp/stamp.jsp?arnumber=7507375","","Computational intelligence;Context;Informatics;Intelligent robots;Machine learning;Mobile communication;Niobium","intelligent robots;learning (artificial intelligence);robot vision","computer vision;deep learning applications;drones;electronic devices;image processing;intelligent devices;intelligent robots;low-power processing architectures;mobile assistants;mobile phones","","","","","","","12-14 May 2016","","IEEE","IEEE Conference Publications"
"Tutorials","","","2016 24th Signal Processing and Communication Application Conference (SIU)","20160623","2016","","","20","22","Provides an abstract for each of the tutorial presentations and a brief professional biography of each presenter. The complete presentations were not made available for publication as part of the conference proceedings.","","Electronic:978-1-5090-1679-2; POD:978-1-5090-1680-8; USB:978-1-5090-1678-5","10.1109/SIU.2016.7495681","http://ieeexplore.ieee.org/stamp/stamp.jsp?arnumber=7495681","","Computer vision;Computers;Field programmable gate arrays;Machine learning;Signal processing;Wireless communication;Wireless sensor networks","","","","","","","","","16-19 May 2016","","IEEE","IEEE Conference Publications"
"Pedestrian recognition method based on depth hierarchical feature representation","Rui Sun; Guang-Hai Zhang; Jun Gao","School of Computer and Information, Hefei University of Technology, 230009, China","2015 12th International Computer Conference on Wavelet Active Media Technology and Information Processing (ICCWAMTIP)","20160620","2015","","","173","178","For feature representation of pedestrian recognition, a hybrid hierarchical feature representation method which combines representation ability of bag of words model and depth layered with learning adaptability is presented. This method first uses HOG local descriptor for local features extraction, and then encoding the feature by a depth of layered coding method, the layered coding method by spatial aggregating restricted Boltzmann machine (RBM). For each coding layer, we steer the unsupervised RBM learning and apply supervised fine-tuning to enhance the visual features representation in classification task. Finally, we learn high-level image feature representation by the positive and negative max pooling, and then classify with the linear support vector machine, feature extraction of depth architectures effectively improve the accuracy of subsequent recognition. Experimental results show that the proposed method has a high recognition rate.","","Electronic:978-1-4673-8266-3; POD:978-1-4673-8267-0","10.1109/ICCWAMTIP.2015.7493969","http://ieeexplore.ieee.org/stamp/stamp.jsp?arnumber=7493969","Hybrid structure;deep learning;depth hierarchical coding;positive and negative max pooling;restricted Boltzmann machine (RBM)","Dictionaries;Encoding;Feature extraction;Machine learning;Support vector machines;Training;Visualization","Boltzmann machines;feature extraction;image classification;image representation;pedestrians;support vector machines;unsupervised learning","HOG local descriptor;bag of words model;classification task;coding layer;depth architectures;depth hierarchical feature representation;feature encoding;high-level image feature representation;hybrid hierarchical feature representation;layered coding method;learning adaptability;linear support vector machine;local features extraction;negative max pooling;pedestrian recognition method;positive max pooling;spatial aggregating restricted Boltzmann machine;supervised fine-tuning;unsupervised RBM learning;visual features representation","","","","13","","","18-20 Dec. 2015","","IEEE","IEEE Conference Publications"
"A Hybrid Vertex Outlier Detection Method Based on Distributed Representation and Local Outlier Factor","Z. Li; L. Zeng","Coll. of Inf. Syst. & Manage., Nat. Univ. of Defense Technol., Changsha, China","2015 IEEE 12th Intl Conf on Ubiquitous Intelligence and Computing and 2015 IEEE 12th Intl Conf on Autonomic and Trusted Computing and 2015 IEEE 15th Intl Conf on Scalable Computing and Communications and Its Associated Workshops (UIC-ATC-ScalCom)","20160721","2015","","","512","516","Outlier detection is a basic task in network analysis, which is useful in many applications such as intrusion detection, criminal investigation, and information filtering. In this paper we proposed a hybrid outlier detection methods in complex networks based on Vertex Distributed Representation and Local Outlier Factor, with the aim to find abnormal vertexes that are apart from the group or community in complex networks. The proposed outlier detection method based on Vertex Distributed Representation (VDR) and Local Outlier Factor (LOF) is named as VDR-LOF. VDR-LOF maps vertexes or edges into a density continuous real-valued space, and then uses LOF algorithm to detection the outliers. We conducted experiments on American College Football Network and Enron Email Network, visualized the original networks and its corresponding feature map in 2D space, then we found the vertex outliers in the network.","","Electronic:978-1-4673-7211-4; POD:978-1-4673-7212-1","10.1109/UIC-ATC-ScalCom-CBDCom-IoP.2015.104","http://ieeexplore.ieee.org/stamp/stamp.jsp?arnumber=7518283","Deep Learning;Distributed Representation;Local Outlier Factor;Outlier Detection","Complex networks;Electronic mail;Feature extraction;Image edge detection;Linear programming;Machine learning;Visualization","complex networks;network theory (graphs)","American College Football Network;Enron Email Network;LOF algorithm;VDR-LOF;complex networks;criminal investigation;density continuous real-valued space;hybrid vertex outlier detection method;information filtering;intrusion detection;local outlier factor;network analysis;vertex distributed representation","","","","","","","10-14 Aug. 2015","","IEEE","IEEE Conference Publications"
"Deep architecture using Multi-Kernel Learning and multi-classifier methods","I. Rebai; Y. BenAyed; W. Mahdi","Multimedia InfoRmation system and Advanced Computing Laboratory, University of Sfax, Tunisia","2015 IEEE/ACS 12th International Conference of Computer Systems and Applications (AICCSA)","20160709","2015","","","1","6","Kernel Methods have been successfully applied in different tasks and used on a variety of data sample sizes. Multiple Kernel Learning (MKL) and Multilayer Multiple Kernel Learning (MLMKL), as new families of kernel methods, consist of learning the optimal kernel from a set of predefined kernels by using an optimization algorithm. However, learning this optimal combination is considered to be an arduous task. Furthermore, existing algorithms often do not converge to the optimal solution (i.e., weight distribution). They achieve worse results than the simplest method, which is based on the average combination of base kernels, for some real-world applications. In this paper, we present a hybrid model that integrates two methods: Support Vector Machine (SVM) and Multiple Classifier (MC) methods. More precisely, we propose a multiple classifier framework of deep SVMs for classification tasks. We adopt the MC approach to train multiple SVMs based on multiple kernel in a multi-layer structure in order to avoid solving the complicated optimization tasks. Since the average combination of kernels gives high performance, we train multiple models with a predefined combination of kernels. Indeed, we apply a specific distribution of weights for each model. To evaluate the performance of the proposed method, we conducted an extensive set of classification experiments on a number of benchmark data sets. Experimental results show the effectiveness and efficiency of the proposed method as compared to various state-of-the-art MKL and MLMKL algorithms.","","Electronic:978-1-5090-0478-2; POD:978-1-5090-0479-9; USB:978-1-5090-0477-5","10.1109/AICCSA.2015.7507155","http://ieeexplore.ieee.org/stamp/stamp.jsp?arnumber=7507155","Deep Multiple Kernel Learning;Kernel methods;Multiple Classifier;Support Vector Machine","Computer architecture;Kernel;Machine learning;Nonhomogeneous media;Optimization;Support vector machines;Training","learning (artificial intelligence);optimisation;pattern classification;support vector machines","MC methods;MKL;MLMKL;SVM;data sample sizes;deep architecture;multiclassifier methods;multikernel learning;multilayer multiple kernel learning;multilayer structure;multiple classifier methods;multiple kernel learning;optimization algorithm;support vector machine","","","","","","","17-20 Nov. 2015","","IEEE","IEEE Conference Publications"
"Identifying activity boundaries for activity recognition in smart environments","Y. Wang; Z. Fan; A. Bandara","Toshiba Research Europe, Telecommunications Research Laboratory, 32 Queen Square, Bristol, BS1 4ND, UK","2016 IEEE International Conference on Communications (ICC)","20160714","2016","","","1","6","Activity recognition in smart environments is an important technology for assisted living and e-health. Recently there are growing interests in applying machine learning algorithms to activity recognition tasks. In this paper, we combine support vector machine (SVM) and association rule learning to improve the performance of activity recognition based on streaming sensor data in smart homes. The proposed approach allows us to accurately identify the activity boundaries, hence reducing activity recognition errors in the system.","","Electronic:978-1-4799-6664-6; POD:978-1-4799-6665-3","10.1109/ICC.2016.7510732","http://ieeexplore.ieee.org/stamp/stamp.jsp?arnumber=7510732","","Data mining;Itemsets;Machine learning algorithms;Sparse matrices;Support vector machines;Training","assisted living;data mining;learning (artificial intelligence);medical computing;pattern recognition;support vector machines","SVM;activity boundary identification;activity recognition error reduction;activity recognition performance improvement;assisted living;e-health;machine learning algorithm;smart environment;smart homes;streaming sensor data;support vector machine","","","","","","","22-27 May 2016","","IEEE","IEEE Conference Publications"
"N-opcode analysis for android malware classification and categorization","B. Kang; S. Y. Yerima; K. Mclaughlin; S. Sezer","Centre for Secure Information Technologies (CSIT) Queen's University Belfast Belfast, Northern Ireland, United Kingdom","2016 International Conference On Cyber Security And Protection Of Digital Services (Cyber Security)","20160709","2016","","","1","7","Malware detection is a growing problem particularly on the Android mobile platform due to its increasing popularity and accessibility to numerous third party app markets. This has also been made worse by the increasingly sophisticated detection avoidance techniques employed by emerging malware families. This calls for more effective techniques for detection and classification of Android malware. Hence, in this paper we present an n-opcode analysis based approach that utilizes machine learning to classify and categorize Android malware. This approach enables automated feature discovery that eliminates the need for applying expert or domain knowledge to define the needed features. Our experiments on 2520 samples that were performed using up to 10-gram opcode features showed that an f-measure of 98% is achievable using this approach.","","Electronic:978-1-5090-0709-7; POD:978-1-5090-0710-3","10.1109/CyberSecPODS.2016.7502343","http://ieeexplore.ieee.org/stamp/stamp.jsp?arnumber=7502343","Android malware;Dalvik bytecode;malware categorization;malware classification;n-gram;n-opcode","Androids;Entropy;Feature extraction;Humanoid robots;Machine learning algorithms;Malware;Support vector machines","Android (operating system);invasive software;learning (artificial intelligence);mobile computing;pattern classification","10-gram opcode features;Android malware categorization;Android malware classification;Android malware detection;Android mobile platform;automated feature discovery;machine learning;n-opcode analysis;sophisticated detection avoidance;third party app markets","","","","","","","13-14 June 2016","","IEEE","IEEE Conference Publications"
"PANDA: Extreme Scale Parallel K-Nearest Neighbor on Distributed Architectures","M. M. A. Patwary; N. R. Satish; N. Sundaram; J. Liu; P. Sadowski; E. Racah; S. Byna; C. Tull; W. Bhimji; Prabhat; P. Dubey","","2016 IEEE International Parallel and Distributed Processing Symposium (IPDPS)","20160721","2016","","","494","503","Computing k-Nearest Neighbors (KNN) is one of the core kernels used in many machine learning, data mining and scientific computing applications. Although kd-tree based O(log n) algorithms have been proposed for computing KNN, due to its inherent sequentiality, linear algorithms are being used in practice. This limits the applicability of such methods to millions of data points, with limited scalability for Big Data analytics challenges in the scientific domain. In this paper, we present parallel and highly optimized kd*tree based KNN algorithms (both construction and querying) suitable for distributed architectures. Our algorithm includes novel approaches for pruning search space and improving load balancing and partitioning among nodes and threads. Using TB-sized datasets from three science applications: astrophysics, plasma physics, and particle physics, we show that our implementation can construct kd-tree of 189 billion particles in 48 seconds on utilizing ~50,000 cores. We also demonstrate computation of KNN of 19 billion queries in 12 seconds. We demonstrate almost linear speedup both for shared and distributed memory computers. Our algorithms outperforms earlier implementations by more than order of magnitude, thereby radically improving the applicability of our implementation to state-of-the-art Big Data analytics problems.","1530-2075;15302075","Electronic:978-1-5090-2140-6; POD:978-1-5090-2141-3","10.1109/IPDPS.2016.57","http://ieeexplore.ieee.org/stamp/stamp.jsp?arnumber=7516046","Big Data Analytics;Classification;KNN;Parallel Algorithms;and Load Balancing;kd-tree","Complexity theory;Computational modeling;Distributed databases;Machine learning algorithms;Partitioning algorithms;Physics;Plasmas","Big Data;computational complexity;data analysis;data mining;learning (artificial intelligence);pattern classification;physics computing;resource allocation","Big Data analytics;KNN algorithms;O(log n) algorithms;PANDA;astrophysics;data mining;distributed architectures;distributed memory computers;extreme scale parallel K-nearest neighbor;kd-tree;linear algorithms;load balancing;machine learning;particle physics;plasma physics;pruning search space;scientific computing applications","","","","","","","23-27 May 2016","","IEEE","IEEE Conference Publications"
"Deep learning for human activity recognition: A resource efficient implementation on low-power devices","D. Ravi; C. Wong; B. Lo; G. Z. Yang","The Hamlyn Centre, Imperial College London, London","2016 IEEE 13th International Conference on Wearable and Implantable Body Sensor Networks (BSN)","20160721","2016","","","71","76","Human Activity Recognition provides valuable contextual information for wellbeing, healthcare, and sport applications. Over the past decades, many machine learning approaches have been proposed to identify activities from inertial sensor data for specific applications. Most methods, however, are designed for offline processing rather than processing on the sensor node. In this paper, a human activity recognition technique based on a deep learning methodology is designed to enable accurate and real-time classification for low-power wearable devices. To obtain invariance against changes in sensor orientation, sensor placement, and in sensor acquisition rates, we design a feature generation process that is applied to the spectral domain of the inertial data. Specifically, the proposed method uses sums of temporal convolutions of the transformed input. Accuracy of the proposed approach is evaluated against the current state-of-the-art methods using both laboratory and real world activity datasets. A systematic analysis of the feature generation parameters and a comparison of activity recognition computation times on mobile devices and sensor nodes are also presented.","","Electronic:978-1-5090-3087-3; POD:978-1-5090-3088-0","10.1109/BSN.2016.7516235","http://ieeexplore.ieee.org/stamp/stamp.jsp?arnumber=7516235","ActiveMiles;Deep Learning;HAR;Low-Power Devices","Convolution;Data mining;Feature extraction;Machine learning;Spectrogram;Time-frequency analysis","convolution;feature extraction;image recognition;learning (artificial intelligence);sensor placement","contextual information;deep learning;feature generation;human activity recognition;inertial sensor data;low-power wearable devices;machine learning;mobile devices;offline processing;resource efficient implementation;sensor acquisition rates;sensor nodes;sensor placement;spectral domain;temporal convolutions","","","","","","","14-17 June 2016","","IEEE","IEEE Conference Publications"
"A scalable GPU-enabled framework for training deep neural networks","B. Del Monte; R. Prodan","Department of Computer Science, University of Salerno, Italy","2016 2nd International Conference on Green High Performance Computing (ICGHPC)","20160709","2016","","","1","8","In the last fifteen years, Big Data created a new generation of data analysis problems, which does not only involve the problems themselves but also the way these data are handled. Since managing terabytes of data without a proper infrastructure is unfeasible, a smart way to process these data is also necessary. A solution to this aspect deals with the creation of general algorithms that learn from observations. In this context, Deep Learning promises general, powerful, and fast machine learning algorithms, moving them one step closer to artificial intelligence. Nevertheless, fitting a deep learning model may require an huge amount of time, thus, the need of scalable infrastructures for processing large scale data sets has become ever more meaningful. In this paper, we present a framework for training these deep neural networks using heterogeneous computing resources of either grid or cloud infrastructures. The framework lets the end-users define the deep architecture they need for processing their own Big Data, while dealing with the execution of the learning algorithms on a distributed set of nodes (through Apache Flink) as well as with offloading the computation on multiple Graphics Processing Units.","","CD-ROM:978-1-4673-6614-4; Electronic:978-1-4673-6615-1; POD:978-1-4673-6616-8","10.1109/ICGHPC.2016.7508071","http://ieeexplore.ieee.org/stamp/stamp.jsp?arnumber=7508071","","Computational modeling;Computer architecture;Graphics processing units;Instruction sets;Machine learning;Neural networks;Training","cloud computing;data analysis;graphics processing units;grid computing;learning (artificial intelligence);neural nets","Apache Flink;Big Data;GPU-enabled framework;artificial intelligence;cloud infrastructure;data analysis problems;data handling;deep architecture;deep learning;deep neural network training;graphics processing units;grid infrastructure;heterogeneous computing resources;machine learning","","","","","","","26-27 Feb. 2016","","IEEE","IEEE Conference Publications"
"A Novel Sparse Representation Classification Face Recognition Based on Deep Learning","J. Zeng; Y. Zhai; J. Gan","Sch. of Inf. Eng., Wuyi Univ., Jiangmen, China","2015 IEEE 12th Intl Conf on Ubiquitous Intelligence and Computing and 2015 IEEE 12th Intl Conf on Autonomic and Trusted Computing and 2015 IEEE 15th Intl Conf on Scalable Computing and Communications and Its Associated Workshops (UIC-ATC-ScalCom)","20160721","2015","","","1520","1523","The existing face recognition under pose and illumination variations is a challenging problem. A novel sparse recognition face recognition algorithm based on deep learning is presented in this paper. The deep learning network extracted global and local information, the deep learning network adopted the supervised Convolution restricted Boltzmann machine. The features extracted could recover the face image and reduce intraidentity variances, while maintaining discriminativeness between identities. The algorithm obtained the feature by the deep network and realized fast sparse classification by smoothed l0 norm. Experimental results on FERET face database show that the proposed algorithm can improve recognition rate and recognition speed when dealing with various conditions such as pose variation.","","Electronic:978-1-4673-7211-4; POD:978-1-4673-7212-1","10.1109/UIC-ATC-ScalCom-CBDCom-IoP.2015.345","http://ieeexplore.ieee.org/stamp/stamp.jsp?arnumber=7518453","face recognition; deep learning; feature extraction;","Classification algorithms;Face;Face recognition;Feature extraction;Image recognition;Lighting;Machine learning","face recognition;image representation;learning (artificial intelligence);pose estimation","Boltzmann machine;FERET face database;deep learning;deep learning network;deep network;face image;illumination variations;novel sparse representation classification face recognition;pose variation;pose variations;sparse classification","","","","","","","10-14 Aug. 2015","","IEEE","IEEE Conference Publications"
"Deep vessel tracking: A generalized probabilistic approach via deep learning","A. Wu; Z. Xu; M. Gao; M. Buty; D. J. Mollura","Department of Radiology and Imaging Sciences, National Institutes of Health, Bethesda, MD 20892","2016 IEEE 13th International Symposium on Biomedical Imaging (ISBI)","20160616","2016","","","1363","1367","Analysis of vascular geometry is important in many medical imaging applications, such as retinal, pulmonary, and cardiac investigations. In order to make reliable judgments for clinical usage, accurate and robust segmentation methods are needed. Due to the high complexity of biological vasculature trees, manual identification is often too time-consuming and tedious to be used in practice. To design an automated and computerized method, a major challenge is that the appearance of vasculatures in medical images has great variance across modalities and subjects. Therefore, most existing approaches are specially designed for a particular task, lacking the flexibility to be adapted to other circumstances. In this paper, we present a generic approach for vascular structure identification from medical images, which can be used for multiple purposes robustly. The proposed method uses the state-of-the-art deep convolutional neural network (CNN) to learn the appearance features of the target. A Principal Component Analysis (PCA)-based nearest neighbor search is then utilized to estimate the local structure distribution, which is further incorporated within the generalized probabilistic tracking framework to extract the entire connected tree. Qualitative and quantitative results over retinal fundus data demonstrate that the proposed framework achieves comparable accuracy as compared with state-of-the-art methods, while efficiently producing more information regarding the candidate tree structure.","","Electronic:978-1-4799-2349-6; POD:978-1-4799-2351-9","10.1109/ISBI.2016.7493520","http://ieeexplore.ieee.org/stamp/stamp.jsp?arnumber=7493520","Deep Learning;Generalized Probabilistic Tracking;Nearest Neighbor Search;Principal Component Analysis;Vascular Structure","Biomedical imaging;Dictionaries;Image segmentation;Machine learning;Probabilistic logic;Robustness","","","","","","10","","","13-16 April 2016","","IEEE","IEEE Conference Publications"
