"RHadoop-based fuzzy data mining: Architecture, design and system implementation","P. Sun; L. Xu; H. Fan","School of Software Engineering, Tongji University, Shanghai, China","2016 IEEE International Conference on Big Data Analysis (ICBDA)","20160714","2016","","","1","5","Data mining is a challenge for end-users, which requires knowledge and skills on business domains, data mining algorithms and software development. In response to the challenge, we have proposed, designed and implemented a novel data mining system named RFDM (RHadoop-based Fuzzy Data Mining), which supports fuzzy data mining process and experience with user convenience and reduced cost. The system is capable of supporting fully-automated data mining life-cycle activities, with limited user interactions in dataset uploading and data mining configuration. In addition, a RHadoop-based framework has been integrated, which meets the requirements of large-scale datasets in data mining. Experiments have indicated that the RFDM system achieves enhanced performance while supporting fuzzy data mining.","","CD-ROM:978-1-4673-9589-2; Electronic:978-1-4673-9591-5; POD:978-1-4673-9592-2","10.1109/ICBDA.2016.7509796","http://ieeexplore.ieee.org/stamp/stamp.jsp?arnumber=7509796","MapReduce;RHadoop;data mining;fuzzy;large-scale","Algorithm design and analysis;Classification algorithms;Clustering algorithms;Data mining;Data models;Machine learning algorithms;Training","business data processing;data handling;data mining;fuzzy set theory;parallel processing","RFDM;RHadoop-based fuzzy data mining;business domains;data mining algorithms;fully-automated data mining life-cycle activities;fuzzy data mining process;software development;user convenience","","","","","","","12-14 March 2016","","IEEE","IEEE Conference Publications"
"Hyperspectral data classification using deep convolutional neural networks","M. Salman; S. E. Yüksel","T&#252;bitak Bilgem &#304;LTAREN, Ankara, T&#252;rkiye","2016 24th Signal Processing and Communication Application Conference (SIU)","20160623","2016","","","2129","2132","In the last five years, deep learning has been gaining a large amount of interest in the computer vision community due to its capability to perform feature learning and classification at the same time. However, the studies using deep learning for hyperspectral imaging are still very few. In this paper, a deep convolutional neural network structure to classify hyperspectral data is proposed. The results are compared to the support vector machine and K-nearest neighbourhood algorithms and it has been shown that deep learning with the proposed architecture is much more successful in hyperspectral data classification.","","Electronic:978-1-5090-1679-2; POD:978-1-5090-1680-8; USB:978-1-5090-1678-5","10.1109/SIU.2016.7496193","http://ieeexplore.ieee.org/stamp/stamp.jsp?arnumber=7496193","classification;deep learning;feature extraction;hyperspectral image classification","Hyperspectral imaging;Image classification;Machine learning;Neural networks;Support vector machines","","","","","","","","","16-19 May 2016","","IEEE","IEEE Conference Publications"
"Detection of Application Layer DDoS attack by feature learning using Stacked AutoEncoder","S. Yadav; S. Subramanian","Department of Computer Science and Engineering, National Institute of Technology, Tiruchirappalli, Tamil Nadu, India","2016 International Conference on Computational Techniques in Information and Communication Technologies (ICCTICT)","20160718","2016","","","361","366","An Application Layer Distributed Denial of Service Attack (DDoS) is one of the biggest concerns for web security. Many detection methods are designed to mitigate DDoS attack based on IP and TCP layer instead of the Application layer. These methods are not suitable for detection of Application layer DDoS attack since most of the IP and TCP layer DDoS attacks are based on request flooding attack. But Application layer DDoS attacks consist of request flooding, session flooding, and asymmetric attack. The solutions available to detect Application layer DDoS attack, detect only limited number of Application layer DDoS attacks. The solutions that detect all types of Application layer DDoS attacks have huge algorithm complexity. One of the major challenges in the detection of an Application layer DDoS attack is the non-availability of features to detect such attacks. Hence it is difficult to model normal user behavior from attack behavior. In this paper, Deep learning architecture is introduced to learn deep features of Application layer DDoS attack. Deep learning architecture consist of very deep neural network, typically more than three layers. In the proposed work the concept of AutoEncoder is applied, which is one of the deep learning based models that learns deep useful features in the Application layer DDoS attack dataset. The Stacked AutoEncoder deep learning architecture, is aimed to receive high level features. The performance of the proposed method was evaluated in terms of the metrics such as false positive rate and detection rate. Comparison of the proposed method with the existing methods reveals that the proposed method performs better than the existing methods.","","Electronic:978-1-5090-0082-1; POD:978-1-5090-0083-8","10.1109/ICCTICT.2016.7514608","http://ieeexplore.ieee.org/stamp/stamp.jsp?arnumber=7514608","Application Layer DDoS Attack;AutoEncoder;DDoS;Deep learning;Feature learning;Stacked AutoEncoder","Computer crime;Feature extraction;Floods;IP networks;Machine learning;Pattern recognition;Web servers","computer network security;learning (artificial intelligence);neural nets","IP layer;Stacked AutoEncoder;TCP layer;Web security;application layer DDoS attack detection;application layer distributed denial of service attack;deep learning architecture;feature learning;very deep neural network","","","","","","","11-13 March 2016","","IEEE","IEEE Conference Publications"
"Hybrid approach for automatic segmentation of fetal abdomen from ultrasound images using deep learning","H. Ravishankar; S. M. Prabhu; V. Vaidya; N. Singhal","GE Global Research, Bangalore, India","2016 IEEE 13th International Symposium on Biomedical Imaging (ISBI)","20160616","2016","","","779","782","In this paper, we propose a hybrid approach combining traditional texture analysis methods with deep learning for the automatic detection and measurement of abdominal contour from 2-D fetal ultrasound images. Following a learning-based procedure for region of interest (ROI) localization to segment the abdominal boundary, we show that convolutional neural networks (CNNs) outperform other state-of-the-art texture features and conventional classifiers, in addressing the binary classification problem of distinguishing between abdomen versus non-abdomen regions. However, we obtain significantly better segmentation results in identifying the best ROI containing fetal abdomen, when the predictions from CNN are combined with those from gradient boosting machine (GBM) using histogram of oriented gradient (HOG) features. We trained our method on a set of 70 images and tested them on another distinct set of 70 images. We obtained a mean DICE similarity coefficient of 0.90, which shows excellent overlap with the ground truth. We report that the mean computed gestational age difference between our segmentation results and the ground truth, is within two weeks for 90% (and within one week for 70%) of the testing cases.","","Electronic:978-1-4799-2349-6; POD:978-1-4799-2351-9","10.1109/ISBI.2016.7493382","http://ieeexplore.ieee.org/stamp/stamp.jsp?arnumber=7493382","","Abdomen;Feature extraction;Image segmentation;Machine learning;Training;Ultrasonic imaging;Ultrasonic variables measurement","","","","","","14","","","13-16 April 2016","","IEEE","IEEE Conference Publications"
"Optimized Structure of the Traffic Flow Forecasting Model With a Deep Learning Approach","H. F. Yang; T. S. Dillon; Y. P. P. Chen","Department of Computer Science Information Technology, La Trobe University, Melbourne, VIC 3086, Australia.","IEEE Transactions on Neural Networks and Learning Systems","","2016","PP","99","1","11","Forecasting accuracy is an important issue for successful intelligent traffic management, especially in the domain of traffic efficiency and congestion reduction. The dawning of the big data era brings opportunities to greatly improve prediction accuracy. In this paper, we propose a novel model, stacked autoencoder Levenberg-Marquardt model, which is a type of deep architecture of neural network approach aiming to improve forecasting accuracy. The proposed model is designed using the Taguchi method to develop an optimized structure and to learn traffic flow features through layer-by-layer feature granulation with a greedy layerwise unsupervised learning algorithm. It is applied to real-world data collected from the M6 freeway in the U.K. and is compared with three existing traffic predictors. To the best of our knowledge, this is the first time that an optimized structure of the traffic flow forecasting model with a deep learning approach is presented. The evaluation results demonstrate that the proposed model with an optimized structure has superior performance in traffic flow forecasting.","2162-237X;2162237X","","10.1109/TNNLS.2016.2574840","http://ieeexplore.ieee.org/stamp/stamp.jsp?arnumber=7517319","Deep learning;forecasting;neural network (NN) applications;stacked denoising autoencoders.","Artificial neural networks;Computational modeling;Data models;Forecasting;Machine learning;Prediction algorithms;Predictive models","","","","","","","","20160720","","","IEEE","IEEE Early Access Articles"
"Demonstration of Convolution Kernel Operation on Resistive Cross-Point Array","L. Gao; P. Y. Chen; S. Yu","School of Electrical, Computer, and Energy Engineering, Arizona State University, Tempe, AZ, USA","IEEE Electron Device Letters","20160624","2016","37","7","870","873","Convolution is the key operation in the convolutional neural network, one of the most popular deep learning algorithms. The implementation of the convolution kernel on the resistive cross-point array is different than the implementation of the matrix-vector multiplication in prior works. In this letter, we propose a dimensional reduction of 2-D kernel matrix into 1-D column vector, i.e., a column of the array, and enable the parallel readout of multiple 2-D kernels simultaneously. As a proof-of-concept demonstration, we use the Prewitt kernels to detect both horizontal and vertical edges of the 20 × 20 pixels of black and-white MNIST handwritten digits. The experiments were performed on the fabricated 12 × 12 resistive cross-point array based on the Pt/HfO<sub>x</sub>/TiN structure. The experimental results of the Prewitt kernel operation perfectly matches the simulation results, indicating the feasibility of the proposed implementation methodology of the convolution kernel on resistive cross-point array.","0741-3106;07413106","","10.1109/LED.2016.2573140","http://ieeexplore.ieee.org/stamp/stamp.jsp?arnumber=7479502","Convolution kernel;convolution kernel;cross-point array;neuromorphic computing;resistive memory","Convolution;Image edge detection;Kernel;Machine learning;Neurons;Object recognition","convolution;handwriting recognition;image classification;learning (artificial intelligence);matrix algebra;neural nets;vectors","1D column vector;2D kernel matrix;MNIST handwritten digit;Prewitt kernel;classification layer;convolution kernel operation;convolutional neural network;deep learning algorithm;dimensional reduction;proof-of-concept demonstration;resistive cross-point array","","","","18","","20160526","July 2016","","IEEE","IEEE Journals & Magazines"
"Eye detection by using deep learning","Ş. Karahan; Y. S. Akgül","Bilgisayar M&#252;hendisli&#287;i B&#246;l&#252;m&#252;, Gebze Teknik &#220;niversitesi, Kocaeli, 41400, T&#252;rkiye","2016 24th Signal Processing and Communication Application Conference (SIU)","20160623","2016","","","2145","2148","In recent years, deep learning algorithm has been one of the most used method in machine learning. Success rate of the most popular machine learning problems has been increased by using it. In this work, we develop an eye detection method by using a deep neural network. The designed network, which is accepted as an input by Caffe, has 3 convolution layers and 3 max pooling layers. This model has been trained with 16K positive and 52K negative image patches. The last layer of the network is the classification layer which operates a softmax algorithm. The trained model has been tested with images, which were provided on FDDB and CACD datasets, and also compared with Haar eye detection algorithm. Recall value of the method is higher than the Haar algorithm on the two datasets. However, according to the precision rate, the Haar algorithm is successful on FDDB dataset.","","Electronic:978-1-5090-1679-2; POD:978-1-5090-1680-8; USB:978-1-5090-1678-5","10.1109/SIU.2016.7496197","http://ieeexplore.ieee.org/stamp/stamp.jsp?arnumber=7496197","Caffe;Deep Learning;Digits;Eye Detection","Algorithm design and analysis;Classification algorithms;Convolution;Face recognition;Hidden Markov models;Machine learning;Neural networks","eye;gaze tracking;image classification;neural nets","CACD dataset;FDDB dataset;Haar algorithm;Haar eye detection algorithm;classification layer;convolution layers;deep learning algorithm;deep neural network;eye detection method;image patches;machine learning;max pooling layers;recall value;softmax algorithm","","","","","","","16-19 May 2016","","IEEE","IEEE Conference Publications"
"The hidden layer design for staked denoising autoencoder","Qianqian Hao; Hua Zhang; Jinkou Ding","State Key Laboratory of Networking and Switching Technology, Beijing University of Posts and Telecommunications, China","2015 12th International Computer Conference on Wavelet Active Media Technology and Information Processing (ICCWAMTIP)","20160620","2015","","","150","153","Deep learning can achieve the complex function approximation and the characteristics of the input data by studying a deep nonlinear network. At present, one of the most important problems in the study of deep learning is how to construct a reasonable structure. This paper studies the deep learning model of stacked denoising autoencoder (SDA) and the remaining task is to construct its reasonable model. We introduce three effective methods to construct the structure of the SDA. Numerical experiments imply that the structure obtained by the golden section principle performs the best.","","Electronic:978-1-4673-8266-3; POD:978-1-4673-8267-0","10.1109/ICCWAMTIP.2015.7493964","http://ieeexplore.ieee.org/stamp/stamp.jsp?arnumber=7493964","Deep Learning;Hidden Layer;SDA;golden section;nonlinear network","Data models;Machine learning;Mathematical model;Neural networks;Noise reduction;Numerical models;Training","learning (artificial intelligence);neural nets","SDA structure;complex function approximation;deep learning model;deep nonlinear network;golden section principle;hidden layer design;input data characteristics;multilayer neural network;stacked denoising autoencoder;staked denoising autoencoder","","","","12","","","18-20 Dec. 2015","","IEEE","IEEE Conference Publications"
"ModDrop: Adaptive Multi-Modal Gesture Recognition","N. Neverova; C. Wolf; G. Taylor; F. Nebout","INSA-Lyon, LIRIS, UMR5205, F-69621, Universit&#233; de Lyon, CNRS, France","IEEE Transactions on Pattern Analysis and Machine Intelligence","20160630","2016","38","8","1692","1706","We present a method for gesture detection and localisation based on multi-scale and multi-modal deep learning. Each visual modality captures spatial information at a particular spatial scale (such as motion of the upper body or a hand), and the whole system operates at three temporal scales. Key to our technique is a training strategy which exploits: i) careful initialization of individual modalities; and ii) gradual fusion involving random dropping of separate channels (dubbed ModDrop) for learning cross-modality correlations while preserving uniqueness of each modality-specific representation. We present experiments on the ChaLearn 2014 Looking at People Challenge gesture recognition track, in which we placed first out of 17 teams. Fusing multiple modalities at several spatial and temporal scales leads to a significant increase in recognition rates, allowing the model to compensate for errors of the individual classifiers as well as noise in the separate channels. Furthermore, the proposed ModDrop training technique ensures robustness of the classifier to missing signals in one or several channels to produce meaningful predictions from any number of available modalities. In addition, we demonstrate the applicability of the proposed fusion scheme to modalities of arbitrary nature by experiments on the same dataset augmented with audio.","0162-8828;01628828","","10.1109/TPAMI.2015.2461544","http://ieeexplore.ieee.org/stamp/stamp.jsp?arnumber=7169562","Gesture recognition;convolutional neural networks;deep learning;multi-modal learning","Context;Feature extraction;Joints;Machine learning;Streaming media;Training","audio streaming;gesture recognition;learning (artificial intelligence);pattern classification;random processes;sensor fusion","ModDrop training technique;adaptive multimodal gesture recognition;classifier robustness;cross-modality correlations;dubbed ModDrop;gesture detection;gesture localisation;gradual fusion;modality-specific representation;multiple modality fusion;multiscale multimodal deep learning;random dropping;spatial information;spatial scales;temporal scales;training strategy;visual modality","","3","","65","","20150728","Aug. 1 2016","","IEEE","IEEE Journals & Magazines"
"Deep Learning of Transferable Representation for Scalable Domain Adaptation","M. Long; J. Wang; Y. Cao; J. Sun; P. S. Yu","School of Software, Tsinghua National Laboratory for Information Science and Techonolgy (TNList), Tsinghua University, Beijing, China","IEEE Transactions on Knowledge and Data Engineering","20160706","2016","28","8","2027","2040","Domain adaptation generalizes a learning model across source domain and target domain that are sampled from different distributions. It is widely applied to cross-domain data mining for reusing labeled information and mitigating labeling consumption. Recent studies reveal that deep neural networks can learn abstract feature representation, which can reduce, but not remove, the cross-domain discrepancy. To enhance the invariance of deep representation and make it more transferable across domains, we propose a unified deep adaptation framework for jointly learning transferable representation and classifier to enable scalable domain adaptation, by taking the advantages of both deep learning and optimal two-sample matching. The framework constitutes two inter-dependent paradigms, unsupervised pre-training for effective training of deep models using deep denoising autoencoders, and supervised fine-tuning for effective exploitation of discriminative information using deep neural networks, both learned by embedding the deep representations to reproducing kernel Hilbert spaces (RKHSs) and optimally matching different domain distributions. To enable scalable learning, we develop a linear-time algorithm using unbiased estimate that scales linearly to large samples. Extensive empirical results show that the proposed framework significantly outperforms state of the art methods on diverse adaptation tasks: sentiment polarity prediction, email spam filtering, newsgroup content categorization, and visual object recognition.","1041-4347;10414347","","10.1109/TKDE.2016.2554549","http://ieeexplore.ieee.org/stamp/stamp.jsp?arnumber=7452659","Domain adaptation;deep learning;denoising autoencoder;multiple kernel learning;neural network;two-sample test","Adaptation models;Kernel;Labeling;Machine learning;Neural networks;Noise reduction;Object recognition","data mining;learning (artificial intelligence);neural nets","RKHS;abstract feature representation learning;cross-domain data mining;cross-domain discrepancy;deep denoising autoencoders;deep learning;deep neural networks;email spam filtering task;labeled information reuse;labeling consumption mitigation;linear-time algorithm;newsgroup content categorization task;optimal two-sample matching;reproducing kernel Hilbert spaces;scalable domain adaptation;scalable learning;sentiment polarity prediction task;transferable representation learning;visual object recognition task","","1","","49","","20160414","Aug. 1 2016","","IEEE","IEEE Journals & Magazines"
"Student performance analysis using clustering algorithm","I. Singh; A. S. Sabitha; A. Bansal","ASET, CSE, Amity University Uttar Pradesh, Noida, India","2016 6th International Conference - Cloud System and Big Data Engineering (Confluence)","20160709","2016","","","294","299","University and technical organizations are facing high competition and their challenge is in analyzing their performance. The major challenges are in admission, student placement and in the curriculum. The two most important process during which data's are collected and analyzed are admission and placement. The ranking of the university depends on academic performance and placement of the student. Apart from academic performance there are various other factors which help in understanding the overall performance of the student. In this research work, the data mining technique is used to understand the performance of student and group the students under various categories as a student need to consistently improve to compete in today's world.","","CD-ROM:978-1-4673-8202-1; Electronic:978-1-4673-8203-8; POD:978-1-4673-8204-5","10.1109/CONFLUENCE.2016.7508131","http://ieeexplore.ieee.org/stamp/stamp.jsp?arnumber=7508131","K-means algorithm;cluster analysis;data mining;overall performance;silhouette measure;student performance","Algorithm design and analysis;Big data;Clustering algorithms;Data mining;Decision trees;Machine learning algorithms;Performance analysis","data mining;educational administrative data processing;pattern clustering","clustering algorithm;data mining technique;student performance analysis","","","","","","","14-15 Jan. 2016","","IEEE","IEEE Conference Publications"
"Comparing dataset characteristics that favor the Apriori, Eclat or FP-Growth frequent itemset mining algorithms","J. Heaton","College of Engineering and Computing, Nova Southeastern University, Ft. Lauderdale, FL 33314, United States","SoutheastCon 2016","20160709","2016","","","1","7","Frequent itemset mining is a popular data mining technique. Apriori, Eclat, and FP-Growth are among the most common algorithms for frequent itemset mining. Considerable research has been performed to compare the relative performance between these three algorithms, by evaluating the scalability of each algorithm as the dataset size increases. While scalability as data size increases is important, previous papers have not examined the performance impact of similarly sized datasets that contain different itemset characteristics. This paper explores the effects that two dataset characteristics can have on the performance of these three frequent itemset algorithms. To perform this empirical analysis, a dataset generator is created to measure the effects of frequent item density and the maximum transaction size on performance. The generated datasets contain the same number of rows. This provides some insight into dataset characteristics that are conducive to each algorithm. The results of this paper's research demonstrate Eclat and FP-Growth both handle increases in maximum transaction size and frequent itemset density considerably better than the Apriori algorithm.","","Electronic:978-1-5090-2246-5; POD:978-1-5090-2247-2","10.1109/SECON.2016.7506659","http://ieeexplore.ieee.org/stamp/stamp.jsp?arnumber=7506659","","Algorithm design and analysis;Clustering algorithms;Data mining;Itemsets;Machine learning algorithms;Random access memory","data mining","Apriori algorithm;Eclat algorithm;FP-growth frequent itemset mining algorithms;data mining technique;dataset characteristics;dataset generator;frequent itemset density;maximum transaction size","","","","","","","March 30 2016-April 3 2016","","IEEE","IEEE Conference Publications"
