"Improving mispronunciation detection using machine learning","Y. Chen; C. Huang; F. Soong","Department of Computer Science and Engineering, Shanghai Jiao Tong University, China","2009 IEEE International Conference on Acoustics, Speech and Signal Processing","20090526","2009","","","4865","4868","In this paper, we investigate the problem of mispronunciation detection by considering the influence of speaker and syllables. Machine learning techniques are used to make our method more convenient and flexible for new features, such as syllables normalization. The experimental results on our database, consisting of 9898 syllables pronounced by 100 speakers, show the effectiveness of our method by reducing the average false acceptance rate (FAR) by 42.5% using data set generated by model without adaptation to observation set and reducing average FAR by 32.5% using data set generated by model with adaptation to observation set.","1520-6149;15206149","POD:978-1-4244-2353-8","10.1109/ICASSP.2009.4960721","http://ieeexplore.ieee.org/stamp/stamp.jsp?arnumber=4960721","Automatic Mispronunciation Detection (AMD);Computer Aided Language Learning (CALL);Machine Learning","Adaptation model;Asia;Chaos;Computer science;Hidden Markov models;Knowledge engineering;Learning systems;Machine learning;Machine learning algorithms;Support vector machines","computer aided instruction;learning (artificial intelligence);speech processing","Mandarin;automatic mispronunciation detection;computer assisted language learning;database;false acceptance rate;machine learning;syllables normalization","","6","","7","","","19-24 April 2009","","IEEE","IEEE Conference Publications"
"Genetics-Based Machine Learning Approach for Rule Acquisition in an AGV Transportation System","K. Sakakibara; Y. Fukui; I. Nishikawa","Ritsumeikan Univ., Kusatsu","2008 Eighth International Conference on Intelligent Systems Design and Applications","20081208","2008","3","","115","120","We propose an autonomous decentralized method for multiple AGV robots under uncertain delivery requests. Transportation route plans of AGV robots are expected to minimize the transportation time without collisions among the robots in the systems. In our proposed methods, each robot as an agent computes its transportation route by referring to the static path information, and it exchanges its route plan each other. Once collisions are detected, one of the two agents chosen by a negotiation rule modifies its route plan. The rule consists of a condition-part and an action-part, and one rule which matches to the conditions of two agents under negotiation is selected from a set of rules. The rules are generated and improved by a genetic based machine learning approach, where a set of rules is represented symbolically as an individual of genetic algorithms, and fitness of each individual is determined according to the total travel time of the AGVs and the adequacy of the condition-parts of the rules.","2164-7143;21647143","POD:978-0-7695-3382-7","10.1109/ISDA.2008.329","http://ieeexplore.ieee.org/stamp/stamp.jsp?arnumber=4696447","Automated guided vehicle;Autonomous decentralized system;Genetics-based machine learning;Pitt approach;Transportation","Cities and towns;Genetic algorithms;Intelligent robots;Intelligent transportation systems;Learning systems;Machine learning;Production planning;Production systems;Routing;Vehicles","collision avoidance;control engineering computing;genetic algorithms;intelligent robots;knowledge acquisition;learning (artificial intelligence);mobile robots;transportation","automated guided vehicle transportation system;autonomous decentralized method;genetic algorithms;genetics-based machine learning approach;multiple automated guided vehicle robots;rule acquisition;transportation route planning","","4","","10","","","26-28 Nov. 2008","","IEEE","IEEE Conference Publications"
"Research on Semi-Automatic Construction of Domain Ontology Based on Machine Learning and Clustering Technique","L. He; H. q. Hou","Dept. of Inf. Manage., Nanjing Agric. Univ., Nanjing","2008 International Symposium on Intelligent Information Technology Application Workshops","20081230","2008","","","345","348","In this paper we take the approach that constructed the ontology automatically, which attempted to take a method that extremely beneficial for the knowledge acquisition task was the integration of knowledge acquisition with machine learning techniques to increase the ontology construction effect, including domain concepts acquisition, taxonomy relation recognition, non-taxonomy relation recognition and ontology formalization description. This paper adopted an approach of non-dictionary Chinese word Segmentation techniques based on N-Gram to acquire domain candidate concepts, take the method based of NLP in the recognition of domain concept property relation, extracted subject, predicate and object of sentences. This triangle data can be treated as the triplet of data and object type property.","","POD:978-0-7695-3505-0","10.1109/IITA.Workshops.2008.10","http://ieeexplore.ieee.org/stamp/stamp.jsp?arnumber=4731948","Domain Ontology;Hierarchy Relationship;Semi-Automatic Construction;concept Acquisition;domain Relationship","Buildings;Clustering algorithms;Data mining;Decision trees;Knowledge acquisition;Machine learning;Ontologies;Pattern matching;Semantic Web;Vocabulary","knowledge acquisition;learning (artificial intelligence);natural language processing;ontologies (artificial intelligence);word processing","N-Gram;NLP;clustering technique;knowledge acquisition;machine learning techniques;natural language processing;nondictionary Chinese word segmentation techniques;ontology formalization description;semi-automatic domain ontology construction","","0","","8","","","21-22 Dec. 2008","","IEEE","IEEE Conference Publications"
"Cross-Input Learning and Discriminative Prediction in Evolvable Virtual Machines","F. Mao; X. Shen","Comput. Sci. Dept., Coll. of William & Mary, Williamsburg, VA","2009 International Symposium on Code Generation and Optimization","20090505","2009","","","92","101","Modern languages like Java and C# rely on dynamic optimizations in virtual machines for better performance. Current dynamic optimizations are reactive. Their performance is constrained by the dependence on runtime sampling and the partial knowledge of the execution. This work tackles the problems by developing a set of techniques that make a virtual machine evolve across production runs. The virtual machine incrementally learns the relation between program inputs and optimization strategies so that it proactively predicts the optimizations suitable for a new run. The prediction is discriminative, guarded by confidence measurement through dynamic self-evaluation. We employ an enriched extensible specification language to resolve the complexities in program inputs. These techniques, implemented in Jikes RVM, produce significant performance improvement on a set of Java applications.","","POD:978-0-7695-3576-0","10.1109/CGO.2009.10","http://ieeexplore.ieee.org/stamp/stamp.jsp?arnumber=4907654","Adaptive Optimization;Cross-Input Learning;Discriminative Prediction;Evolvable Computing;Input-Centric Optimization;Java Virtual Machine","Computer science;Feature extraction;Java;Machine learning;Predictive models;Production;Programming profession;Runtime;Sampling methods;Virtual machining","learning (artificial intelligence);optimising compilers;specification languages;virtual machines","C# language;Java application;cross-input learning;discriminative prediction;dynamic optimization;incremental learning;specification language;virtual machine","","3","","19","","","22-25 March 2009","","IEEE","IEEE Conference Publications"
"Learning Finite-State Machine Controllers From Motion Capture Data","M. Gillies","Dept. of Comput., Univ. of London, London","IEEE Transactions on Computational Intelligence and AI in Games","20090502","2009","1","1","63","72","With characters in computer games and interactive media increasingly being based on real actors, the individuality of an actor's performance should not only be reflected in the appearance and animation of the character but also in the AI that governs the character's behavior and interactions with the environment. Machine learning methods applied to motion capture data provide a way of doing this. This paper presents a method for learning the parameters of a finite-state machine (FSM) controller. The method learns both the transition probabilities of the FSM and also how to select animations based on the current state.","1943-068X;1943068X","","10.1109/TCIAIG.2009.2019630","http://ieeexplore.ieee.org/stamp/stamp.jsp?arnumber=4812072","3-D animation;Game AI;machine learning;motion capture","","computer animation;finite state machines;learning (artificial intelligence);motion estimation","animations;learning finite-state machine controllers;machine learning methods;motion capture data;transition probabilities","","1","","31","","20090407","March 2009","","IEEE","IEEE Journals & Magazines"
"Adaptive Neuro-Fuzzy Control with Fuzzy Supervisory Learning Algorithm for Speed Regulation of 4-Switch Inverter Brushless DC Machines","A. H. Niasar; H. Moghbelli; A. Vahedi","Department of Electrical Engineering, Iran University of Science & Technology, Tehran, Iran. halvai@iust.ac.ir","2006 CES/IEEE 5th International Power Electronics and Motion Control Conference","20090210","2006","1","","1","5","Principle of a new adaptive neuro-fuzzy inference system (ANFIS) with supervisory learning algorithm is introduced and is used to regulate the speed of a four-switch, three-phase inverter (FSTPI) brushless DC (BLDC) drive. The proposed algorithm has advantages of neural and fuzzy networks. To enhance of drive's performance, instead of well-known back propagation learning method, a fuzzy based supervisory learning algorithm is used. This newly developed design leads to a controller with minimum structure and improved dynamic performance. System implementation is relatively easy since it has minimum fuzzy rules and membership functions as compared with the conventional fuzzy and/or neural networks, used for electrical drive applications. In order to demonstrate the proposed ANFIS controller abilities to follow the reference speed and to reject disturbances, its performance is simulated and compared with that of a conventional PI controller","","POD:1-4244-0448-7","10.1109/IPEMC.2006.4778053","http://ieeexplore.ieee.org/stamp/stamp.jsp?arnumber=4778053","","Adaptive control;Adaptive systems;DC machines;Fuzzy control;Fuzzy neural networks;Fuzzy systems;Inference algorithms;Inverters;Machine learning;Programmable control","DC motor drives;adaptive control;angular velocity control;backpropagation;brushless DC motors;fuzzy control;fuzzy neural nets;inference mechanisms;invertors;machine control;neurocontrollers;switching convertors","ANFIS controller;adaptive neuro-fuzzy inference system;dynamic performance;four-switch three-phase inverter brushless DC drive;fuzzy supervisory learning algorithm;speed regulation","","2","","16","","","14-16 Aug. 2006","","IEEE","IEEE Conference Publications"
"Microarray Analysis of Autoimmune Diseases by Machine Learning Procedures","R. ArmaÑanzas; B. Calvo; I. Inza; M. LÓpez-Hoyos; V. MartÍnez-Taboada; E. Ucar; I. Bernales; A. Fullaondo; P. LarraÑaga; A. M. Zubiaga","Dept. of Comput. Sci. & Artificial Intell., Univ. of the Basque Country, San Sebastian","IEEE Transactions on Information Technology in Biomedicine","20090505","2009","13","3","341","350","Microarray-based global gene expression profiling, with the use of sophisticated statistical algorithms is providing new insights into the pathogenesis of autoimmune diseases. We have applied a novel statistical technique for gene selection based on machine learning approaches to analyze microarray expression data gathered from patients with systemic lupus erythematosus (SLE) and primary antiphospholipid syndrome (PAPS), two autoimmune diseases of unknown genetic origin that share many common features. The methodology included a combination of three data discretization policies, a consensus gene selection method, and a multivariate correlation measurement. A set of 150 genes was found to discriminate SLE and PAPS patients from healthy individuals. Statistical validations demonstrate the relevance of this gene set from an univariate and multivariate perspective. Moreover, functional characterization of these genes identified an interferon-regulated gene signature, consistent with previous reports. It also revealed the existence of other regulatory pathways, including those regulated by PTEN, TNF, and BCL-2, which are altered in SLE and PAPS. Remarkably, a significant number of these genes carry E2F binding motifs in their promoters, projecting a role for E2F in the regulation of autoimmunity.","1089-7771;10897771","","10.1109/TITB.2008.2011984","http://ieeexplore.ieee.org/stamp/stamp.jsp?arnumber=4909497","Antiphospholipid syndrome;DNA microarrays;gene profiling;machine learning;systemic lupus erythematosus","Algorithm design and analysis;DNA;Data analysis;Diseases;Gene expression;Genetics;Hospitals;Machine learning;Machine learning algorithms;Pathogens","cellular biophysics;diseases;genetics;learning (artificial intelligence);medical expert systems;molecular biophysics","autoimmune diseases;data discretization policy;gene selection method;global gene expression profiling;machine learning;microarray analysis;microarray expression;multivariate correlation measurement;pathogenesis;primary antiphospholipid syndrome;statistical algorithms;systemic lupus erythematosus","Analysis of Variance;Antiphospholipid Syndrome;Artificial Intelligence;Bayes Theorem;Cluster Analysis;Female;Gene Expression Profiling;Gene Expression Regulation;Humans;Logistic Models;Lupus Erythematosus, Systemic;Models, Genetic;Oligonucleotide Array Sequence Analysis;Reproducibility of Results;Reverse Transcriptase Polymerase Chain Reaction","8","","78","","","May 2009","","IEEE","IEEE Journals & Magazines"
"An ASM fitting method based on machine learning that provides a robust parameter initialization for AAM fitting","M. Wimmer; S. Fujie; F. Stulp; T. Kobayashi; B. Radig","Perceptual Computing Lab, Waseda University, Tokyo, Japan","2008 8th IEEE International Conference on Automatic Face & Gesture Recognition","20090410","2008","","","1","6","Due to their use of information contained in texture, active appearance models (AAM) generally outperform active shape models (ASM) in terms of fitting accuracy. Although many extensions and improvements over the original AAM have been proposed, on of the main drawbacks of AAMs remains its dependence on good initial model parameters to achieve accurate fitting results. In this paper, we determine the initial model parameters for AAM fitting with ASM fitting, and use machine learning techniques to improve the scope and accuracy of ASM fitting. Combining the precision of AAM fitting with the large radius of convergence of learned ASM fitting improves the results by an order of magnitude, as our empirical evaluation on a database of publicly available benchmark images demonstrates.","","CD-ROM:978-1-4244-2154-1; POD:978-1-4244-2153-4","10.1109/AFGR.2008.4813465","http://ieeexplore.ieee.org/stamp/stamp.jsp?arnumber=4813465","","Active appearance model;Active shape model;Convergence;Data mining;Deformable models;Image databases;Machine learning;Optimization methods;Parameter estimation;Robustness","approximation theory;image sequences;image texture;learning (artificial intelligence)","AAM fitting;ASM fitting;active appearance model fitting method;active shape model fitting method;approximation theory;image sequence;image texture;machine learning;robust parameter initialization","","1","","25","","","17-19 Sept. 2008","","IEEE","IEEE Conference Publications"
"Performance evaluation of a machine learning algorithm for early application identification","G. Verticale; P. Giacomazzi","Dipartimento di Elettronica e Informazione, Politecnico di Milano, Italy","2008 International Multiconference on Computer Science and Information Technology","20090109","2008","","","845","849","The early identification of applications through the observation and fast analysis of the associated packet flows is a critical building block of intrusion detection and policy enforcement systems. The simple techniques currently used in practice, such as looking at the transport port numbers or at the application payload, are increasingly less effective for new applications using random port numbers and/or encryption. Therefore, there is increasing interest in machine learning techniques capable of identifying applications by examining features of the associated traffic process such as packet lengths and inter-arrival times. However, these techniques require that the classification algorithm is trained with examples of the traffic generated by the applications to be identified, possibly on the link where the the classifier will operate. In this paper we provide two new contributions. First, we apply the C4.5 decision tree algorithm to the problem of early application identification (i.e. looking at the first packets of the flow) and show that it has better performance than the algorithms proposed in the literature. Moreover, we evaluate the performance of the classifier when training is performed on a link different from the link where the classifier operates. This is an important issue, as a pre-trained portable classifier would greatly facilitate the deployment and management of the classification infrastructure.","","POD:978-83-60810-14-9","10.1109/IMCSIT.2008.4747340","http://ieeexplore.ieee.org/stamp/stamp.jsp?arnumber=4747340","","Bayesian methods;Classification algorithms;Clustering algorithms;Computer science;Hidden Markov models;Inspection;Machine learning;Machine learning algorithms;Payloads;Peer to peer computing","cryptography;decision trees;learning (artificial intelligence);software performance evaluation;telecommunication traffic","C4.5 decision tree algorithm;associated packet flows;associated traffic process;classification algorithm;encryption;intrusion detection;machine learning algorithm;performance evaluation;policy enforcement systems;random port numbers;transport port numbers","","5","","17","","","20-22 Oct. 2008","","IEEE","IEEE Conference Publications"
"Machine Learning Tools to Time Series Forecasting","K. Ramírez-Amaro; J. C. Chimal-Eguía","Centro de Investig. en Comput., Inst. Politec. Nac., Mexico City","2007 Sixth Mexican International Conference on Artificial Intelligence, Special Session (MICAI)","20081028","2007","","","91","101","In this paper a new input representation of the data of the time series and a new learning approach is presented. The input data representation is based on the information obtained by the division of image axis of the time series into boxes. Then, this new information is implemented in a new learning technique which through probabilistic mechanism this learning could be applied to the interesting forecasting problem. The results indicate that using the methodology proposed in this article it is possible to obtain forecasting results with good enough accuracy.","","POD:978-0-7695-3124-3","10.1109/MICAI.2007.42","http://ieeexplore.ieee.org/stamp/stamp.jsp?arnumber=4659299","Forecasting;Machine Learning;Time Series","Artificial intelligence;Cities and towns;Economic forecasting;Machine learning;Mathematical model;Temperature;Time measurement;Upper bound","data structures;forecasting theory;learning (artificial intelligence);time series","image axis;machine learning tools;probabilistic mechanism;time series forecasting","","0","","11","","","4-10 Nov. 2007","","IEEE","IEEE Conference Publications"
"A Chinese Word Segmentation Based on Machine Learning","W. Hongsheng; C. Mingming","Coll. of Inf. Sci. & Eng., Shenyang Univ. of Technol., Shenyang","2009 First International Workshop on Education Technology and Computer Science","20090526","2009","2","","610","613","Different from English, there are no interval marks between words in Chinese. Segmenting Chinese text to words is the first job for every kind of Chinese information processing, so Chinese word segmentation is a basal and difficult issue in the field of Chinese information processing. Traditional word segmentation systems have to establish the dictionary and add unknown words out of the dictionary with manual work. This paper proposes a new Chinese word segmentation model which can automatically establish a dictionary, gradually update it and perfect it based on machine learning. Four modules of the machine learning model for Chinese word segmentation system are introduced in detail and some improvements of the algorithms are made on some module to improve system performance. After the test of closed corpus and open corpus, the results show that the method alleviates the workload of building and maintaining the dictionary, furthermore, it resolves the issues of ambiguity processing and unknown words recognition.","","POD:978-0-7695-3557-9","10.1109/ETCS.2009.397","http://ieeexplore.ieee.org/stamp/stamp.jsp?arnumber=4959112","Chinese word segmentation;ambiguity processing;artificial dictionary;machine learning;unknown words recognition","Dictionaries;Educational institutions;Educational technology;Information processing;Information science;Machine learning;Machine learning algorithms;Natural languages;Probability;Speech recognition","learning (artificial intelligence);natural language processing;word processing","Chinese information processing;Chinese word segmentation;English;dictionary;machine learning","","0","","4","","","7-8 March 2009","","IEEE","IEEE Conference Publications"
"Self Learning and its Implications for Machine Understanding","W. Dinalankara; D. De Silva; D. Alahakoon","Cognitive and Connectionist Systems Lab, Monash University, Victoria, Australia. wikumdina@yahoo.com","2008 4th International Conference on Information and Automation for Sustainability","20090213","2008","","","507","512","Contemporary machine intelligence is far from realizing prominent hallmarks of human understanding and consciousness. The primary shortcoming of current methods can be attributed to the difficulty or implausibility of foreseeing and pre-programming each and every piece of information or knowledge. Emergent intelligence methods based on principles of self learning and self organization have been successful in infusing traits of understanding in machines. This understanding is in contrast to the constrained intelligence permeated on machines by classical approaches of intelligence following supervised knowledge acquisition mechanisms. The primary objective of this paper is to review current work in emergent intelligence methods and discuss means of orchestrating these in to a practical model that resembles the process of human understanding. The paper delineates intricacies of self-learning in humans from both biological and psychological perspectives. Following a discussion of several artificial models of the human mind that have been researched and documented at the conceptual level, we propose a comparatively pragmatic approach based on a novel unsupervised learning algorithm, the GSOM algorithm. This algorithm has been successfully applied to many real world knowledge acquisition and pattern discovery problems. The paper concludes with a further discussion of research developments in emergent systems, which we perceive to be the stepping stones in the search for true machine understanding.","2151-1802;21511802","CD-ROM:978-1-4244-2900-4; POD:978-1-4244-2899-1","10.1109/ICIAFS.2008.4783985","http://ieeexplore.ieee.org/stamp/stamp.jsp?arnumber=4783985","artificial cognition;growing self organising map algorithm;multi-modal data fusion;self learning;unsupervised learning","Artificial intelligence;Biological system modeling;Cognition;Humans;Image recognition;Knowledge acquisition;Learning systems;Machine learning;Supervised learning;Unsupervised learning","emergent phenomena;knowledge acquisition;learning (artificial intelligence);self-adjusting systems","GSOM algorithm;artificial model;biological perspective;constrained intelligence;contemporary machine intelligence;emergent intelligence;emergent systems;machine understanding;pattern discovery;pragmatic approach;psychological perspective;self learning;self organization;supervised knowledge acquisition;unsupervised learning","","0","","16","","","12-14 Dec. 2008","","IEEE","IEEE Conference Publications"
