"A new approach for automatic quality control of fried potatoes using machine learning","E. Lotfi; M. Yaghoobi; H. R. Pourreza","Islamic Azad University, Mashad Branch, Iran","2008 7th IEEE International Conference on Cybernetic Intelligent Systems","20090306","2008","","","1","4","Frying of potatoes causes some changes in their microstructures. By studying these changes we have presented quite suitable features for automatic analysis of microscopic images taken from fried potatoes, and have also introduced a new mechanism based on machine learning for automatic quality control of fried potatoes. Experimental results show that the presented structure may well be used for controlling the quality of related products.","","CD-ROM:978-1-4244-2915-8; POD:978-1-4244-2914-1","10.1109/UKRICIS.2008.4798934","http://ieeexplore.ieee.org/stamp/stamp.jsp?arnumber=4798934","Machine Vision;Neural networks;Potato microstructures;Quality control;Texture recognition","Automatic control;Image analysis;Image color analysis;Image texture analysis;Machine learning;Microscopy;Microstructure;Neural networks;Quality control;Temperature","food products;image recognition;image texture;learning (artificial intelligence);production engineering computing;quality control","automatic quality control;fried potatoes;machine learning;machine vision;microscopic image;potato microstructure;texture recognition","","0","","12","","","9-10 Sept. 2008","","IEEE","IEEE Conference Publications"
"Machine Learning: The State of the Art","J. Wang; Q. Tao","Chinese Academy of Sciences","IEEE Intelligent Systems","20090109","2008","23","6","49","55","The two fundamental problems in machine learning (ML) are statistical analysis and algorithm design. The former tells us the principles of the mathematical models that we establish from the observation data. The latter defines the conditions on which implementation of data models and data sets rely. A newly discovered challenge to ML is the Rashomon effect, which means that data are possibly generated from a mixture of heterogeneous sources. A simple classification standard can shed light on emerging forms of ML. This article is part of a special issue on AI in China.","1541-1672;15411672","","10.1109/MIS.2008.107","http://ieeexplore.ieee.org/stamp/stamp.jsp?arnumber=4747609","Rashomon effect;algorithm design;feature selection;learning to rank;machine learning;manifold learning;metric learning;multi-instance learning;nonlinear backpropagation;perceptron;relational learning;rule + exception learning;semisupervised learning;statistical analysis;statistical learning methods;structural learning;supervised learning;symbolic learning methods;unsupervised learning","","learning (artificial intelligence)","algorithm design;classification standard;machine learning;statistical analysis","","1","","47","","","Nov.-Dec. 2008","","IEEE","IEEE Journals & Magazines"
"Prediction of Skin Penetration Using Machine Learning Methods","Y. Sun; G. P. Moss; M. Prapopoulou; R. Adams; M. B. Brown; N. Davey","Sci. & Technol. Res. Sch., Univ. of Hertfordshire, Hatfield","2008 Eighth IEEE International Conference on Data Mining","20090210","2008","","","1049","1054","Improving predictions of the skin permeability coefficient is a difficult problem. It is also an important issue with the increasing use of skin patches as a means of drug delivery. In this work, we apply K-nearest-neighbour regression, single layer networks, mixture of experts and Gaussian processes to predict the permeability coefficient. We obtain a considerable improvement over the quantitative structure-activity relationship (QSARs) predictors. We show that using five features, which are molecular weight, solubility parameter, lipophilicity, the number of hydrogen bonding acceptor and donor groups, can produce better predictions than the one using only lipophilicity and the molecular weight. The Gaussian process regression with five compound features gives the best performance in this work.","1550-4786;15504786","POD:978-0-7695-3502-9","10.1109/ICDM.2008.97","http://ieeexplore.ieee.org/stamp/stamp.jsp?arnumber=4781223","Gaussian processes;regression;skin permeability coefficient","Absorption;Bonding;Drug delivery;Gaussian processes;Hydrogen;Learning systems;Lipidomics;Medical treatment;Permeability;Skin","learning (artificial intelligence);medical computing","Gaussian processes;K-nearest-neighbour regression;machine learning methods;permeability coefficient;quantitative structure-activity relationship;skin penetration","","1","","15","","","15-19 Dec. 2008","","IEEE","IEEE Conference Publications"
"A New Method to Alarm Large Scale of Flights Delay Based on Machine Learning","L. Zonglei; W. Jiandong; Z. Guansheng","Coll. of Inf. Sci. & Technol., Nanjing Univ. of Aeronaut. & Astronaut., Nanjing","2008 International Symposium on Knowledge Acquisition and Modeling","20081230","2008","","","589","592","A new method to alarm large scale of flight delays based on machine learning is presented in this paper. This new method first does unsupervised learning on the data of the flights collected from the airport. The standard of each class of delay can be gotten after the learning process. With these classes of delay, the supervised learning method can be used on the data so that the alarm model could be built. Comparing with the recent manual alarm standard, this model synthesizes more factors to do alarm. Since the recent delay standard is only related to the number of flights, which is helpful only in serious delay case, the new model performs will be more practical value than recent ones.","","POD:978-0-7695-3488-6","10.1109/KAM.2008.18","http://ieeexplore.ieee.org/stamp/stamp.jsp?arnumber=4732894","Classification;Clustering;Flights Delay;Machine Learning;Unsupervised Learning","Airports;Delay effects;Educational institutions;Information science;Knowledge acquisition;Large-scale systems;Learning systems;Machine learning;Space technology;Unsupervised learning","aerospace computing;unsupervised learning","flight delays;flights data;machine learning;supervised learning method;unsupervised learning","","8","2","12","","","21-22 Dec. 2008","","IEEE","IEEE Conference Publications"
"Coordinated management of multiple interacting resources in chip multiprocessors: A machine learning approach","R. Bitirgen; E. Ipek; J. F. Martinez","Computer Systems Laboratory, Cornell University, Ithaca, NY 14853 USA","2008 41st IEEE/ACM International Symposium on Microarchitecture","20090202","2008","","","318","329","Efficient sharing of system resources is critical to obtaining high utilization and enforcing system-level performance objectives on chip multiprocessors (CMPs). Although several proposals that address the management of a single microarchitectural resource have been published in the literature, coordinated management of multiple interacting resources on CMPs remains an open problem. We propose a framework that manages multiple shared CMP resources in a coordinated fashion to enforce higher-level performance objectives. We formulate global resource allocation as a machine learning problem. At runtime, our resource management scheme monitors the execution of each application, and learns a predictive model of system performance as a function of allocation decisions. By learning each application's performance response to different resource distributions, our approach makes it possible to anticipate the system-level performance impact of allocation decisions at runtime with little runtime overhead. As a result, it becomes possible to make reliable comparisons among different points in a vast and dynamically changing allocation space, allowing us to adapt our allocation decisions as applications undergo phase changes. Our evaluation concludes that a coordinated approach to managing multiple interacting resources is key to delivering high performance in multiprogrammed workloads, but this is possible only if accompanied by efficient search mechanisms. We also show that it is possible to build a single mechanism that consistently delivers high performance under various important performance metrics.","1072-4451;10724451","CD-ROM:978-1-4244-2837-3; POD:978-1-4244-2836-6","10.1109/MICRO.2008.4771801","http://ieeexplore.ieee.org/stamp/stamp.jsp?arnumber=4771801","","Bandwidth;High performance computing;Laboratories;Machine learning;Measurement;Microarchitecture;Proposals;Quality of service;Resource management;Runtime","learning (artificial intelligence);microprocessor chips","chip multiprocessors;coordinated management;global resource allocation;machine learning;microarchitectural resource;multiple interacting resources;open problem;resource management scheme;system-level performance objectives","","52","7","27","","","8-12 Nov. 2008","","IEEE","IEEE Conference Publications"
"Decision Fusion of Machine Learning Models to Predict Radiotherapy-Induced Lung Pneumonitis","S. K. Das; S. Chen; J. O. Deasy; S. Zhou; F. F. Yin; L. B. Marks","Dept. of Radiat. Oncology, Duke Univ. Med. Center, Durham, NC, USA","2008 Seventh International Conference on Machine Learning and Applications","20081222","2008","","","545","550","Combining different machine learning models (decision fusion) has been shown to be an effective method for estimating the underlying physical mechanism by allowing the models to reinforce each other when consensus exists, or, conversely, negate each other when there is no consensus. To be effective, decision fusion requires that the different models provide some degree of complementary information. In this work, we fuse the results of four different machine learning models (Boosted Decision Trees, Neural Networks, Support Vector Machines, Self Organizing Maps) to predict the risk of lung pneumonitis in patients undergoing thoracic radiotherapy. Fusion was achieved by simple averaging of the 10-fold cross validated predictions for each patient from all four models. To reduce prediction dependence on the manner in which the data set was split, 10-fold cross-validation was repeated 100 times for random data splitting. The area under the receiver operating characteristics curve for the fused cross-validated results was 0.79, higher than the individual models and with (generally) lower variance. The fusion extracted three important features as the consensus among all four models in predicting radiation pneumonitis risk: chemotherapy prior to radiotherapy, equivalent Uniform Dose (EUD) for exponent a = 1.2 to 3, and female gender. The results show great promise for machine learning in radiotherapy outcomes modeling.","","POD:978-0-7695-3495-4","10.1109/ICMLA.2008.122","http://ieeexplore.ieee.org/stamp/stamp.jsp?arnumber=4725027","decision fusion;machine learning;modeling;pneumonitis;radiotherapy","Data mining;Decision trees;Feature extraction;Fuses;Lungs;Machine learning;Neural networks;Predictive models;Self organizing feature maps;Support vector machines","decision trees;diseases;medical computing;neural nets;patient treatment;radiation therapy;self-organising feature maps;support vector machines","boosted decision trees;complementary information;decision fusion;machine learning;neural networks;radiotherapy-induced lung pneumonitis;self organizing maps;support vector machines;thoracic radiotherapy","","0","","18","","","11-13 Dec. 2008","","IEEE","IEEE Conference Publications"
"Email classification and summarization: A machine learning approach","T. Ayodele; R. Khusainov; D. Ndzi","Department of Electronics and Computer Engineering, University of Portsmouth, United Kingdom","2007 IET Conference on Wireless, Mobile and Sensor Networks (CCWMSN07)","20090220","2007","","","805","808","This paper presents the design and implementation of a system to group and summarize email messages. The system uses the subject and content of email messages to classify emails based on users' activities and generate summaries of each incoming message with unsupervised learning approach. Our framework solves the problem of email overload, congestion, difficulties in prioritizing and difficulties in finding previously archived messages in the mail box.","0537-9989;05379989","Paper:978-0-86341-836-5","10.1049/cp:20070271","http://ieeexplore.ieee.org/stamp/stamp.jsp?arnumber=4786325","Classification;Email;activities;algorithms;email summarization","","classification;electronic mail;electronic messaging;unsupervised learning","email classification;email congestion;email message summarization;email overload;unsupervised machine learning approach","","0","4","","","","12-14 Dec. 2007","","IET","IET Conference Publications"
"Signal processing and machine learning for real-time classification of ergonomic posture with unobtrusive on-body sensors; application in dental practice","G. F. Olsen; S. S. Brilliant; D. Primeaux; K. Najarian","Virginia Commonwealth University, Richmond, 23285 USA","2009 ICME International Conference on Complex Medical Engineering","20090502","2009","","","1","11","Over 80% of dentists report having some type of back, neck or shoulder pain. Research has identified significant costs linked to a very high rate of Work-Related Musculoskeletal Disorders (WMSDs) associated with poor ergonomic positioning in dentists. The annual costs of WMSDs across all occupations are estimated to be between 13 and 54 billion dollars. Little research has been done to explore the design of portable, inexpensive, non-invasive and unobtrusive real-time systems to measure posture. This paper details the design and testing of our proposed system that applies signal processing and robust machine learning techniques to improve the ergonomics of dental practitioners. We outline a number of different signal processing and classification techniques tested and analytically compared with our proposed system. Our system makes use of commercial inclinometers embedded into a standard laboratory coat. The ability of the system to measure posture accurately in practical settings, without needing exact and obtrusive placement of sensors or extensive calibration, is demonstrated through a set of experiments with human subjects.","","POD:978-1-4244-3315-5","10.1109/ICCME.2009.4906675","http://ieeexplore.ieee.org/stamp/stamp.jsp?arnumber=4906675","","Costs;Dentistry;Ergonomics;Machine learning;Musculoskeletal system;Neck;Pain;Real time systems;Signal processing;System testing","biomechanics;biomedical measurement;body area networks;ergonomics;learning (artificial intelligence);medical signal processing;occupational health;signal classification;spatial variables measurement","WMSD;dental practice;dentists;machine learning;poor ergonomic positioning;posture measurement;real time ergonomic posture classification;signal classification techniques;signal processing techniques;unobtrusive on body sensors;work related musculoskeletal disorders","","0","","28","","","9-11 April 2009","","IEEE","IEEE Conference Publications"
"Improved machine learning techniques for low complexity MPEG-2 to H.264 transcoding using optimized codecs","C. Holder; Tao Pin; H. Kalva","Department of Computer Science and Engineering, Florida Atlantic University, Boca Raton, USA","2009 Digest of Technical Papers International Conference on Consumer Electronics","20090529","2009","","","1","2","This paper discusses techniques for efficiently implementing a Mpeg-2 to H.264 video transcoder. The transcoding results reported in the literature are based on a reference implementation and may not reflect the true performance gains obtained in real world systems. We have developed low complexity transcoding algorithms and have implemented these solutions using highly optimized encoder and decoder implementations available from Intel. The transcoding algorithms are based on exploiting the mode decision knowledge inherent in the decoded MPEG-2 data. Machine learning techniques are used to make accurate and low-complexity H.264 MB encoding mode decisions. The results show that the proposed transcoder reduces the complexity by 50% without a significant loss in PSNR. This performance improvement in production quality transcoders, and demonstrates the practicality of machine learning based video transcoding algorithms.","2158-3994;21583994","POD:978-1-4244-2558-7","10.1109/ICCE.2009.5012345","http://ieeexplore.ieee.org/stamp/stamp.jsp?arnumber=5012345","H.264;Mpeg-2;machine learning;transcoding","Codecs;Computer science;Decoding;Encoding;Machine learning;Machine learning algorithms;Performance gain;Production;Testing;Transcoding","learning (artificial intelligence);transcoding;video codecs;video coding","H.264 video transcoding;Intel;decoder implementations;low-complexity MPEG-2 encoding mode decisions;machine learning techniques;mode decision knowledge;optimized codecs","","3","","6","","","10-14 Jan. 2009","","IEEE","IEEE Conference Publications"
"Development of a New Broadcast Protocol Based on Machine Learning for Wide-Ranging MANET Environments","Y. Deng; Y. Shen; G. Zhang; X. Zhang","Sch. of Inf. Sci. & Eng., Lanzhou Univ., Lanzhou","2008 International Symposium on Information Science and Engineering","20081230","2008","1","","206","209","A new broadcast protocol have been developed in this paper. Itpsilas based on a new method in which rebroadcasting a packet is decided by an intelligent classification scheme. Each MN builds a classifier and uses it on data collected from the network environment. For an input vector describing a broadcast packet and current network conditions, the classifier returns a result of ""rebroadcast"" or ""drop"". Through the simulation, we can identify a more energetic communication protocol and more efficient use because of each MNpsilas fitting various network condition.","2160-1283;21601283","POD:978-0-7695-3494-7","10.1109/ISISE.2008.185","http://ieeexplore.ieee.org/stamp/stamp.jsp?arnumber=4732201","Naïve Bayes;broadcast;machine learning;protocol","","learning (artificial intelligence);protocols","MANET environment;broadcast packet;broadcast protocol;energetic communication protocol;intelligent classification;machine learning","","0","","11","","","20-22 Dec. 2008","","IEEE","IEEE Conference Publications"
"A machine learning based scheme for double JPEG compression detection","C. Chen; Y. Q. Shi; W. Su","New Jersey Institute of Technology, Newark, USA 07102","2008 19th International Conference on Pattern Recognition","20090123","2008","","","1","4","Double JPEG compression detection is of significance in digital forensics. We propose an effective machine learning based scheme to distinguish between double and single JPEG compressed images. Firstly, difference JPEG 2D arrays, i.e., the difference between the magnitude of JPEG coefficient 2D array of a given JPEG image and its shifted versions along various directions, are used to enhance double JPEG compression artifacts. Markov random process is then applied to modeling difference 2-D arrays so as to utilize the second-order statistics. In addition, a thresholding technique is used to reduce the size of the transition probability matrices, which characterize the Markov random processes. All elements of these matrices are collected as features for double JPEG compression detection. The support vector machine is employed as the classifier. Experiments have demonstrated that our proposed scheme has outperformed the prior arts.","1051-4651;10514651","CD-ROM:978-1-4244-2175-6; POD:978-1-4244-2174-9","10.1109/ICPR.2008.4761645","http://ieeexplore.ieee.org/stamp/stamp.jsp?arnumber=4761645","","Art;Digital forensics;Image coding;Machine learning;Probability;Random processes;Statistics;Support vector machine classification;Support vector machines;Transform coding","Markov processes;data compression;higher order statistics;image classification;image coding;image segmentation;learning (artificial intelligence);probability;random processes;support vector machines","JPEG 2D array;Markov random process;double JPEG compression detection;image classification;machine learning based scheme;probability matrix;second-order statistic;support vector machine;thresholding technique","","22","1","9","","","8-11 Dec. 2008","","IEEE","IEEE Conference Publications"
"Cognitive ecology and social learning inspired machine learning: with particular reference to the evolving of resilient Airborne Networks (AN)","Zhanshan Ma","Computer Science Department, University of Idaho Moscow, 83844, USA","2009 IEEE Aerospace conference","20090424","2009","","","1","14","This paper tries to bring together three seemingly only remotely related fields: animal cognition in biology, machine learning in computer science, and the planning and deployment of resilient Airborne Networks. The underlying motivation is that the latest advances in animal behavior ecology such as social learning, innovation, and cognitive ecology may offer some meaningful insights for computational intelligence such as machine learning. Motivated by this expectation, I first review some of the latest advances in the field of animal cognition, with focusing on social learning, teaching, innovation and cognitive ecology. The justification for this focus is not only because they are interesting and are among the most actively studied topics in behavior biology, but also because the existing machine learning research, which from time to time takes cues from cognitive science, seems to only incorporate the traditional learning theory such as associative learning and reinforcement learning. After a briefly review of the major advances in animal learning and cognitive ecology, I look into the possibility to incorporate the principles and mechanisms from social learning and cognitive ecology into a typical machine learning architecture. By examining the Gadanho's (2001, 2003) ALEC (asynchronous learning by emotion and cognition) architecture, I propose to add a high layer to the ALEC architecture, and the resulting CEML (cognitive ecology and social learning inspired machine learning) offers a framework that uses a population of agents and can readily consider social learning, teaching, and innovation as well as the influences of environment in a comprehensive manner. Finally, I consider the problem of planning and deployment of airborne networks (AN) and suggests that the new CEML should be ideal for tackling the AN problem.","1095-323X;1095323X","POD:978-1-4244-2621-8","10.1109/AERO.2009.4839429","http://ieeexplore.ieee.org/stamp/stamp.jsp?arnumber=4839429","","Animal behavior;Biology;Cognition;Cognitive science;Computational intelligence;Computer science;Education;Environmental factors;Machine learning;Technological innovation","cognition;learning (artificial intelligence);network theory (graphs);zoology","animal behavior ecology;animal cognition;animal learning;associative learning;behavior biology;cognitive ecology;computational intelligence;computer science;learning theory;machine learning architecture;reinforcement learning;remotely related fields;resilient airborne networks;social learning;teaching","","1","","52","","","7-14 March 2009","","IEEE","IEEE Conference Publications"
"Chinese New Words Extraction Based on Machine Learning Approach","Z. r. Zhang; Q. j. Wang; X. d. Tian","College of Humanities, Hebei University, Baoding 071002, China. E-MAIL: zhangziruls@sohu.com","2006 International Conference on Machine Learning and Cybernetics","20090304","2006","","","3380","3384","Chinese new words extraction is an important problem for Chinese information processing. In this paper a new words extraction method based on machine learning is proposed, where the context information, the word construction rules and statistic information are combined to extract new words. An experiment, based on two-character-nouns, shows that this method can well improve the efficiency and accuracy of extracting new words","2160-133X;2160133X","POD:1-4244-0061-9","10.1109/ICMLC.2006.258498","http://ieeexplore.ieee.org/stamp/stamp.jsp?arnumber=4028652","New words extraction;machine learning;word construction rules;word segmentation","Cybernetics;Data mining;Dictionaries;Educational institutions;Information processing;Machine learning;Mathematics;Natural languages;Probability;Statistics;Text processing","dictionaries;learning (artificial intelligence);natural languages;text analysis","Chinese information processing;Chinese new word extraction;context information;dictionary;machine learning approach;statistic information;two-character-nouns;word construction rules","","1","","9","","","13-16 Aug. 2006","","IEEE","IEEE Conference Publications"
"Research on ""Inaccurate Learning"" and Its Countermeasure in Machine Learning","G. C. Li","Coll. of Econ. & Manage., Hebei Univ. of Sci. & Technol., Shijiazhuang","2008 Fourth International Conference on Natural Computation","20081107","2008","1","","227","231","The knowledge you gained after learning is false, this learning is ""inaccurate learning"". The false knowledge is the knowledge not according to practice. Human always have ""inaccurate learning"" in learning, though they through more learning and study will correct the false knowledge they had learned, Compared to human learning, the machine learning is simple, so deal with ldquoinaccurate learningrdquo is easy. Aim at the ""inaccurate learning"" in machine learning, this paper discussed its characteristic and solve method, and improve the knowledge quality of machine learning.","2157-9555;21579555","POD:978-0-7695-3304-9","10.1109/ICNC.2008.879","http://ieeexplore.ieee.org/stamp/stamp.jsp?arnumber=4666844","","Conference management;Educational institutions;Eyes;Feeds;Fires;Humans;Knowledge management;Machine learning;Pain;Technology management","learning (artificial intelligence)","false knowledge;inaccurate learning;knowledge quality;machine learning","","0","","4","","","18-20 Oct. 2008","","IEEE","IEEE Conference Publications"
