"License plate reader, data acquisition and analysis","P. Rawat","Data Analysis and Simulation Services, LLC, Columbia, MD 21044, USA","2015 IEEE International Symposium on Technologies for Homeland Security (HST)","20150827","2015","","","1","6","Because of the design diversity, elaborate color schemes, and artwork of the North American license plates, the license plate reader (LPR) systems used to monitor the inbound traffic at international borders become a subject of special interest. Unique problems arise in extracting the plate from a car's photographic image and then locating and reading the number of the plate and the name of its issuing jurisdiction for screening purposes. License plates used in other parts of the world do not pose as many problems in plate recognition as the North American plates do because of their simpler design and minimal design variations. The recent developments in cameras, microprocessors, image processing and pattern recognition capabilities, and secure high-data-rate data communication systems make it worthwhile to explore opportunities for improving the speed and accuracy of the American LPR systems. This paper is devoted to such an exploration.","","Electronic:978-1-4799-1737-2; POD:978-1-4799-1738-9","10.1109/THS.2015.7225339","http://ieeexplore.ieee.org/stamp/stamp.jsp?arnumber=7225339","License plate reader (LPR);image processing;law enforcement;machine learning;optical character recognition (OCR);pattern recognition","Character recognition;Complexity theory;Image color analysis;Image segmentation;Licenses;Microprocessors;Monitoring","data acquisition;data analysis;image colour analysis;optical character recognition","American LPR system;North American license plate;cameras;color scheme;data acquisition;data analysis;design diversity;high-data-rate data communication system;image processing;international border;license plate reader system;microprocessor;pattern recognition capability;photographic image;plate recognition;screening purpose","","1","","16","","","14-16 April 2015","","IEEE","IEEE Conference Publications"
"High-frequency trading strategies using wavelet-transformed order book information and dynamic Bayesian networks","J. Sandoval; G. Hernandez","School of Systems and Computer Engineering, Universidad Nacional de Colombia, Bogot&#x00E1;, Colombia","2015 Science and Information Conference (SAI)","20150903","2015","","","435","442","This paper presents a feature vector representing intraday USD/COP transaction prices and order book dynamics using zig-zag patterns. A Hierarchical Hidden Markov Model is used to capture the market sentiment dynamics choosing from uptrend or downtrend latent regimes based on observed feature vector realizations calculated from transaction prices and wavelet-transformed order book volume dynamics. The HHMM learned a natural switching buy/uptrend sell/downtrend trading strategy using a training-validation framework over one month of market data. The model was tested on the following two months, and its performance was reported and compared to results obtained from randomly classified market states and a feed-forward Neural Network. This paper also separately assessed the contribution to the model's performance of the order book information and the wavelet transformation.","","Electronic:978-1-4799-8547-0; POD:978-1-4799-8548-7; USB:978-1-4799-8546-3","10.1109/SAI.2015.7237178","http://ieeexplore.ieee.org/stamp/stamp.jsp?arnumber=7237178","Hierarchical Hidden Markov Model;Machine Learning;Order Book Information;Price Prediction;Wavelet Transform","Bayes methods;Data models;Hidden Markov models;Market research;Training;Wavelet transforms","belief networks;feature extraction;feedforward neural nets;foreign exchange trading;hidden Markov models;learning (artificial intelligence);pricing;wavelet transforms","HHMM;downtrend latent regime;dynamic Bayesian networks;feature vector realizations;feed-forward neural network;hierarchical hidden Markov model;high-frequency trading strategy;intraday USD/COP transaction prices;learning;market data;market sentiment dynamics;market state;natural switching buy-uptrend sell-downtrend trading strategy;order book dynamics;training-validation framework;uptrend latent regime;wavelet transformation;wavelet-transformed order book information;zig-zag pattern","","0","","16","","","28-30 July 2015","","IEEE","IEEE Conference Publications"
"Gradient-descent-based learning in memristive crossbar arrays","M. V. Nair; P. Dudek","School of Electrical and Electronic Engineering, The University of Manchester, UK","2015 International Joint Conference on Neural Networks (IJCNN)","20151001","2015","","","1","7","This paper describes techniques to implement gradient-descent-based machine learning algorithms on crossbar arrays made of memristors or other analog memory devices. We introduce the Unregulated Step Descent (USD) algorithm, which is an approximation of the steepest descent algorithm, and discuss how it addresses various hardware implementation issues. We discuss the effect of device parameters and their variability on performance of the algorithm by using artificially generated and real-world datasets. In addition to providing insights on the effect of device parameters on learning, we illustrate how the USD algorithm partially offsets the effect of device variability. Finally, we discuss how the USD algorithm can be implemented in crossbar arrays using a simple 4-phase training scheme. The method allows parallel update of crossbar memory elements and reduces the hardware cost and complexity of the training architecture significantly.","2161-4393;21614393","Electronic:978-1-4799-1960-4; POD:978-1-4799-1961-1","10.1109/IJCNN.2015.7280658","http://ieeexplore.ieee.org/stamp/stamp.jsp?arnumber=7280658","back propagation;crossbar arrays;deep learning;gradient descent;machine learning;memristor;neural networks","Approximation methods;Integrated optics;Optical devices","gradient methods;learning (artificial intelligence);memristors","4-phase training scheme;USD algorithm;analog memory device;crossbar memory element;gradient-descent-based learning;machine learning algorithm;memristive crossbar array;memristors;real-world dataset;unregulated step descent algorithm","","2","","26","","","12-17 July 2015","","IEEE","IEEE Conference Publications"
"Predicting Pure Amnestic Mild Cognitive Impairment Conversion to Alzheimer's Disease Using Joint Modeling of Imaging and Clinical Data","V. Kebets; J. Richiardi; M. v. Assche; R. Goldstein; M. v. d. Meulen; P. Vuilleumier; D. V. d. Ville; F. Assal","Univ. of Geneva, Geneva, Switzerland","2015 International Workshop on Pattern Recognition in NeuroImaging","20150917","2015","","","85","88","Predicting the conversion of amnestic mild cognitive impairment (aMCI) to Alzheimer's disease (AD) is a challenging problem for which machine learning could be of great use. In this work, we aim at assessing the independent and joint value of imaging (structural MRI, resting-state functional MRI (rsfMRI)) and clinical data in classifying stable versus progressive aMCI. Surprisingly, we found no previous studies using rsfMRI to predict conversion of MCI to AD. We use singular value decomposition as a feature extractor before combining modalities. We reach accuracies of up to 82% using rsfMRI, 86% using sMRI and rsfMRI combined, and 77% using a combination of all modalities.","","Electronic:978-1-4673-7145-2; POD:978-1-4673-7146-9","10.1109/PRNI.2015.23","http://ieeexplore.ieee.org/stamp/stamp.jsp?arnumber=7270854","Alzheimer's disease;amnestic mild cognitive impairment;machine learning;magnetic resonance imaging;singular value decomposition","Accuracy;Alzheimer's disease;Feature extraction;Joints;Magnetic resonance imaging","biomedical MRI;diseases;feature extraction;medical image processing;singular value decomposition","AD;Alzheimers disease;aMCI;amnestic mild cognitive impairment;clinical data;feature extractor;magnetic resonance imaging;resting-state functional MRI;rsfMRI;sMRI;singular value decomposition;structural MRI","","1","","25","","","10-12 June 2015","","IEEE","IEEE Conference Publications"
"The MC-ELM: Learning an ELM-like network with minimum VC dimension","Jayadeva; S. Soman; A. Bhaya","Dept. of Electr. Eng., Indian Inst. of Technol., Delhi, Delhi, India","2015 International Joint Conference on Neural Networks (IJCNN)","20151001","2015","","","1","7","Though the Extreme Learning Machine (ELM) has become quite popular in recent years, there are no performance guarantees; the resultant networks also tend to be densely connected. The complexity of a learning machine may be measured by the Vapnik-Chervonenkis (VC) dimension, and a small VC dimension leads to good generalization and lower test set errors. The Minimal Complexity Machine (MCM), that has been proposed very recently, shows that it is possible to learn a classifier with minimal VC dimension, leading to sparse representations and good generalization. In this paper, we draw on results from the MCM to propose a hybrid variant of the ELM, termed the Minimal Complexity - Extreme Learning Machine (MC-ELM), in order to realize a robust classifier that minimizes an exact bound on the VC dimension. The MC-ELM solves a linear programming problem for the last layer and offers the advantages of large margin and low VC dimension. In effect, the learning paradigm elucidated in this paper helps us build a classifier which is based on a minimal representation of the training data owing to MCM, and high training speed attributed to ELM. This makes it feasible for use in complex machine learning applications, where these advantages are of significance.","2161-4393;21614393","Electronic:978-1-4799-1960-4; POD:978-1-4799-1961-1","10.1109/IJCNN.2015.7280663","http://ieeexplore.ieee.org/stamp/stamp.jsp?arnumber=7280663","Extreme Learning Machine;Hybrid Models;Linear Programming;Minimal Complexity Machine;Performance Bounds;Support Vectors;VC Dimension","Complexity theory;Ionosphere;Neurons;Training","generalisation (artificial intelligence);learning (artificial intelligence);linear programming;pattern classification","ELM-like network learning;MC-ELM;Vapnik-Chervonenkis dimension;classifier learning;complex machine learning applications;generalization;hybrid ELM;linear programming problem;minimal complexity machine;minimal complexity-extreme learning machine;minimum VC dimension;robust classifier;sparse representation;test set errors;training data;training speed","","","","40","","","12-17 July 2015","","IEEE","IEEE Conference Publications"
"Four Decades of Data Mining in Network and Systems Management","K. Kalegele; K. Sasai; H. Takahashi; G. Kitagata; T. Kinoshita","School of Computational and Communication Sciences and Engineering, Nelson Mandela African Institution of Science and Technology, Arusha, Tanzania","IEEE Transactions on Knowledge and Data Engineering","20150909","2015","27","10","2700","2716","How has the interdisciplinary data mining field been practiced in Network and Systems Management (NSM)? In Science and Technology, there is a wide use of data mining in areas like bioinformatics, genetics, Web, and, more recently, astroinformatics. However, the application in NSM has been limited and inconsiderable. In this article, we provide an account of how data mining has been applied in managing networks and systems for the past four decades, presumably since its birth. We look into the field's applications in the key NSM activities-discovery, monitoring, analysis, reporting, and domain knowledge acquisition. In the end, we discuss our perspective on the issues that are considered critical for the effective application of data mining in the modern systems which are characterized by heterogeneity and high dynamism.","1041-4347;10414347","","10.1109/TKDE.2015.2426713","http://ieeexplore.ieee.org/stamp/stamp.jsp?arnumber=7095599","Data Mining;Machine Learning;Network and Systems Management;machine learning;network and systems management","Algorithm design and analysis;Computational modeling;Data mining;Data models;Monitoring;Proposals;Time series analysis","data mining;knowledge acquisition;systems analysis","NSM;analysis;data mining;discovery;domain knowledge acquisition;monitoring;network and systems management;reporting","","2","","109","","20150427","Oct. 1 2015","","IEEE","IEEE Journals & Magazines"
"Joint unscented Kalman filter for dual estimation in a bifilar pendulum for a small UAV","C. Ma; M. Z. Q. Chen; J. Lam; K. C. Cheung","Department of Mechanical Engineering, The University of Hong Kong, Pokfulam, Hong Kong, and the Shenzhen Institute of Research and Innovation, University of Hong Kong, Shenzhen, China","2015 10th Asian Control Conference (ASCC)","20150910","2015","","","1","6","It has always been difficult to accurately estimate the moment of inertia of an object, e.g. an unmanned aerial vehicle (UAV). Whilst various offline estimation methods exist to allow accurate parametric estimation by minimizing an error cost function, they require large memory consumption, high computational effort, and a long convergence time. The initial estimate's accuracy is also vital in attaining convergence. In this paper, a new real time solution to the model identification problem is provided with the use of a Joint Unscented Kalman Filter for dual estimation. The identification procedures can be easily implemented using a microcontroller, a gyroscope sensor, and a simple bifilar pendulum setup. Accuracy, robustness, and convergence speed are achieved.","","Electronic:978-1-4799-7862-5; POD:978-1-4799-7863-2","10.1109/ASCC.2015.7244614","http://ieeexplore.ieee.org/stamp/stamp.jsp?arnumber=7244614","Joint Unscented Kalman Filter;UAV;dual estimation;machine learning;model identification;quadrotor","Accuracy;Computational modeling;Convergence;Estimation;Kalman filters;Noise;Noise measurement","Kalman filters;autonomous aerial vehicles;estimation theory;minimisation;mobile robots;nonlinear filters;parameter estimation;pendulums","UAV;bifilar pendulum;dual estimation;error cost function minimization;model identification problem;parameter estimation;unmanned aerial vehicle;unscented Kalman filter","","1","","17","","","May 31 2015-June 3 2015","","IEEE","IEEE Conference Publications"
"Performance analysis of path planning techniques for autonomous mobile robots","S. Zaheer; Jayaraju M; T. Gulrez","Department of Electrical & Electronics Engineering, T.K.M College of Engineering, Kerala, India","2015 IEEE International Conference on Electrical, Computer and Communication Technologies (ICECCT)","20150827","2015","","","1","5","This paper presents a comparative study on path planning techniques for autonomous mobile robots in a cluttered environment. It investigates four well known path planning algorithms and compares their performance with the proposed free configuration eigen-spaces (FCE) path planning method. In total, five path planning algorithms are considered towards the solution of the path planning problem under certain working parameters. These working parameters are the computation time needed to find a solution, the distance traveled and the amount of turning by the autonomous mobile robot. A comparison of results has been analyzed. This study will enable readers to identify, which of the proposed methods is most suitable for application under the working parameters the user wants to optimize. The findings have been summarized in the conclusion section. The techniques were implemented in the real-time robotic software Player/Stage. Further analysis were done using MATLAB mathematical computation software.","","Electronic:978-1-4799-6085-9; POD:978-1-4799-6086-6","10.1109/ICECCT.2015.7226205","http://ieeexplore.ieee.org/stamp/stamp.jsp?arnumber=7226205","Trajectory;eigenvector;free-configuration;machine-learning;mobile Robotics","Mobile robots;Robot kinematics;Robot sensing systems;Trajectory","eigenvalues and eigenfunctions;mobile robots;optimisation;path planning","FCE path planning method;autonomous mobile robot;cluttered environment;free configuration eigenspace;parameter optimization;performance analysis","","0","","18","","","5-7 March 2015","","IEEE","IEEE Conference Publications"
"Deep data fusion model for risk perception and coordinated control of smart grid","X. Z. Wang; X. L. Bi; Z. Q. Ge; L. Li","East China Electric Power Dispatching and Control Center, East China Grid Company Limited, Shanghai, China","2015 International Conference on Estimation, Detection and Information Fusion (ICEDIF)","20151001","2015","","","110","113","This paper presents a deep data fusion model for risk perception and coordinated control in a regional power system control center. A knowledge learning data fusion approach has been used to find an efficient state representation based on prior knowledge from cross-domain energy management systems. In particular, a kernel principal components analysis technique is presented for nonlinear dimensionality reduction of knowledge learning. The control strategy we study is based on cross-domain global optimization approach, which regards the contingencies and control actions of mutual backup systems as constraints. The objective function is defined as the product of cross-domain assessment and control factors. The method for obtaining optimal solution is given by interior point code. To show the applicability, different machine learning method has been studied. The experimental results show that the proposed knowledge learning approach consistently outperforms the traditional machine learning method. In addition, the proposed coordinated control approach is verified effective on large-scale smart grid decision support system for East China project.","","CD-ROM:978-1-4799-6417-8; Electronic:978-1-4799-6418-5; POD:978-1-4799-6419-2","10.1109/ICEDIF.2015.7280172","http://ieeexplore.ieee.org/stamp/stamp.jsp?arnumber=7280172","information analysis;machine learning;power system control;smart grid","Kernel;Next generation networking;Power system control;Principal component analysis;Support vector machines","control engineering computing;decision support systems;energy management systems;learning (artificial intelligence);optimisation;power engineering computing;power system control;principal component analysis;risk management;sensor fusion;smart power grids","East China project;control factors;coordinated control;cross-domain assessment;cross-domain energy management systems;cross-domain global optimization approach;deep data fusion model;kernel principal components analysis technique;knowledge learning data fusion approach;large-scale smart grid decision support system;machine learning method;mutual backup systems;nonlinear dimensionality reduction;objective function;regional power system control center;risk perception;state representation","","","","16","","","10-11 Jan. 2015","","IEEE","IEEE Conference Publications"
"Strategies for addressing class imbalance in ensemble classification of thermography breast cancer features","G. Schaefer; T. Nakashima","Department of Computer Science, Loughborough University, Loughborough, U.K.","2015 IEEE Congress on Evolutionary Computation (CEC)","20150914","2015","","","2362","2367","Thermography provides an interesting alternative to mammography for diagnosing breast cancer as it is a noncontact, non-invasive and passive technique that is able to detect small tumors and thus can lead to earlier diagnosis. Computer-aided diagnostic approaches based on thermography are typically split into a feature extraction stage that derives useful information from the thermogram images, and a classification stage that distinguishes between malignant and benign cases. The latter is challenging since, as is the case for many medical decision making problems, there are (many) more benign cases available for classifier training compared to malignant cases, leading to an imbalanced classification problem. In this paper, we first perform image analysis to identify features describing bilateral differences in regions of interest in the thermogram. These features then form the input for a pattern classification stage for which we present several strategies to address the existing class imbalance in the context of ensemble classifiers. In particular, we discuss an ensemble constructed of cost-sensitive decision tree classifiers, an ensemble whose base classifiers are trained on balanced subspaces, and an ensemble that is based on the combination of one-class classifiers. All three strategies are evaluated on a challenging dataset of about 150 thermograms and it is shown that they provide very good classification performance and furthermore perform favourably compared to other state-of-the-art classifier ensembles for imbalanced data.","1089-778X;1089778X","Electronic:978-1-4799-7492-4; POD:978-1-4799-7493-1","10.1109/CEC.2015.7257177","http://ieeexplore.ieee.org/stamp/stamp.jsp?arnumber=7257177","breast cancer;breast thermogram;ensemble classification;imbalanced classification;machine learning","Breast cancer;Feature extraction;Sensitivity;Support vector machines;Training","CAD;cancer;decision making;infrared imaging;medical diagnostic computing","CAD;balanced subspaces;base classifiers;benign cases;computer-aided diagnostic approaches;ensemble classification;imbalanced classification problem;malignant cases;medical decision making problems;non-invasive technique;noncontact technique;one-class classifiers;passive technique;thermogram images;thermography breast cancer features","","","","36","","","25-28 May 2015","","IEEE","IEEE Conference Publications"
"Online playtime prediction for cognitive video streaming","D. Pasupuleti; P. Mannaru; B. Balasingam; M. Baum; K. Pattipati; P. Willett; C. Lintz; G. Commeau; F. Dorigo; J. Fahrny","University of Connecticut, CT, USA","2015 18th International Conference on Information Fusion (Fusion)","20150917","2015","","","1886","1891","In this paper, we consider the problem of cognitive video streaming in video on demand (VoD) services. The focus lies on quantities that are indicative of the quality of experience (QoE) of the subscriber, such as playtime ratio, probability of return, probability of replay and startup time. Especially, in this paper, we develop and evaluate a playtime prediction tool. For this purpose, the applicability of different machine learning algorithms such as k-nearest neighbor, neural network regression, and survival models is investigated; then, we develop an approach to identify the most relevant factors that contributed to the prediction. The proposed approaches are tested by means of a data set provided by Comcast.","","Electronic:978-0-9824-4386-6; POD:978-1-4799-7404-7; USB:978-0-9824-4387-3","","http://ieeexplore.ieee.org/stamp/stamp.jsp?arnumber=7266785","Video quality of service (QoS);human factors;internet video;machine learning;mean opinion score (MOS);nearest neighbor classification;neural networks;quality of experience (QoE);survival models;video quality metrics","Bit rate;Hazards;Neural networks;Predictive models;Quality of service;Streaming media","learning (artificial intelligence);neural nets;probability;quality of experience;regression analysis;telecommunication computing;video on demand;video streaming","Comcast;QoE;VoD services;cognitive video streaming;k-nearest neighbor;machine learning algorithms;neural network regression;online playtime prediction;playtime prediction tool;playtime ratio;quality of experience;replay probability;return probability;startup time;subscriber;survival models;video on demand","","","","23","","","6-9 July 2015","","IEEE","IEEE Conference Publications"
"Affective State Classification Using Bayesian Classifier","A. S. Ghazali; S. N. Sidek; S. Wok","Dept. of Mechatron., Int. Islamic Univ. Malaysia, Kuala Lumpur, Malaysia","2014 5th International Conference on Intelligent Systems, Modelling and Simulation","20151001","2014","","","154","158","This paper elaborates the basic structure of a machine learning system in classifying affective state. There are several techniques in classifying the states depending on the type of input-output dataset. A proper selection of techniques is crucial in determining the success rate of the system prediction. The paper proposes a machine learning technique in classifying affective states of human subjects by using Bayesian Network (BN). A structured experimental setup is designed to induce the affective states of the subjects by using a set of audiovisual stimulants. The affective states under study are happy, sad, and nervous. Preliminary results demonstrate the ability of the BN to predict human affective state with 86% accuracy.","2166-0662;21660662","Electronic:978-1-4799-3858-2; POD:978-1-4799-3859-9","10.1109/ISMS.2014.32","http://ieeexplore.ieee.org/stamp/stamp.jsp?arnumber=7280897","Bayesian network;affective state;emotion detection;machine learning system","Bayes methods;Emotion recognition;Learning (artificial intelligence);Robots;Software;Support vector machines;Training","belief networks;learning (artificial intelligence);pattern classification","Bayesian classifier;Bayesian network;affective state classification;audiovisual stimulants;input-output dataset;machine learning system","","1","","23","","","27-29 Jan. 2014","","IEEE","IEEE Conference Publications"
