"Churn Prediction in Online Games Using Players’ Login Records: A Frequency Analysis Approach","E. G. Castro; M. S. G. Tsuzuki","Computational Geometry Laboratory, Escola Polit&#x00E9;cnica, University of S&#x00E3;o Paulo, Brazil","IEEE Transactions on Computational Intelligence and AI in Games","20150910","2015","7","3","255","265","The rise of free-to-play and other service-based business models in the online gaming market brought to game publishers problems usually associated to markets like mobile telecommunications and credit cards, especially customer churn. Predictive models have long been used to address this issue in these markets, where companies have a considerable amount of demographic, economic, and behavioral data about their customers, while online game publishers often only have behavioral data. Simple time series' feature representation schemes like RFM can provide reasonable predictive models solely based on online game players' login records, but maybe without fully exploring the predictive potential of these data. We propose a frequency analysis approach for feature representation from login records for churn prediction modeling. These entries (from real data) were converted into fixed-length data arrays using four different methods, and then these were used as input for training probabilistic classifiers with the k-nearest neighbors machine learning algorithm. The classifiers were then evaluated and compared using predictive performance metrics. One of the methods, the time-frequency plane domain analysis, showed satisfactory results, being able to theoretically increase the retention campaigns profits in more than 20% over the RFM approach.","1943-068X;1943068X","","10.1109/TCIAIG.2015.2401979","http://ieeexplore.ieee.org/stamp/stamp.jsp?arnumber=7055316","Data mining;games;machine learning;predictive models;wavelet transforms","Companies;Games;Mobile communication;Predictive models;Time-frequency analysis","computer games;learning (artificial intelligence);time series;time-frequency analysis","RFM approach;behavioral data;churn prediction modeling;credit cards;demographic data;economic data;feature representation schemes;fixed-length data arrays;free-to-play models;k-nearest neighbors machine learning algorithm;mobile telecommunications;online game publishers;online gaming market;players login records;predictive performance metrics;service-based business models;time series;time-frequency plane domain analysis;training probabilistic classifiers","","1","","22","","20150305","Sept. 2015","","IEEE","IEEE Journals & Magazines"
"Optimizing response time and synchronization in User Virtualization via adaptive memory compression","M. Kulkarni; R. Ghatpande; N. Karnani; J. Abraham","Department of Computer Engineering and Information Technology, College of Engineering, Pune (COEP), India","2015 International Conference on Advances in Computing, Communications and Informatics (ICACCI)","20150928","2015","","","469","477","In this paper, we address the problem of prolonged latency periods for user log-in and log-off in User Virtualization using Virtual Pooled Desktops. These latency periods are caused due to large chunks of User Profile data transferred over the network in order to achieve User Virtualization. Thus we require efficient and quick `synchronization' of data from the client to the server. Data transfer time and file characteristics are factors that assist us to determine how synchronization can be improved. File type and File size are the key characteristics used to determine which compression algorithms will be applicable. Our contribution in this paper is the development of a new system for synchronization, using various compression algorithms and a `learning' based model. The learning model helps to determine whether or not to compress the file and plays an integral part in building a ranking system of compression algorithms, based on their performance on a specific type and size of a file.","","Electronic:978-1-4799-8792-4; POD:978-1-4799-8793-1; USB:978-1-4799-8791-7","10.1109/ICACCI.2015.7275653","http://ieeexplore.ieee.org/stamp/stamp.jsp?arnumber=7275653","Cloud Computing;Machine Learning;Memory Compression;User Virtualization","Algorithm design and analysis;Compression algorithms;Servers;Supervised learning;Synchronization;Virtual machining;Virtualization","client-server systems;cloud computing;data compression;learning (artificial intelligence);synchronisation;virtual storage;virtualisation","adaptive memory compression;client server system;compression algorithm;data synchronization;data transfer time;file characteristics;file size;file type;learning based model;optimizing response time;user log-in;user log-off;user profile data;user virtualization;virtual pooled desktop","","","","19","","","10-13 Aug. 2015","","IEEE","IEEE Conference Publications"
"Big data biology-based predictive models Via DNA-metagenomics binning for WMD events applications","H. Saghir; D. B. Megherbi","Center for Human/Machine Intelligence, Networking and Distributed Systems, Department of Electrical and Computer, Engineering, University of Massachusetts, Lowell, USA","2015 IEEE International Symposium on Technologies for Homeland Security (HST)","20150827","2015","","","1","6","In WMD events or natural disasters, identifying bio-chemicals and microorganisms rapidly is crucial. Metagenomics is the study of microorganisms collected directly from natural environments using whole genome shotgun (WGS) sequencing. Metagenomics methods allow sequencing of organism genomes which cannot be cultured in a laboratory. Grouping random fragments obtained from whole shotgun genome data into groups is known as binning. Metagenomics methods allow quick sequencing of microbes obtained from natural disaster sites to identify microbes and provide rapid and timely response, in terms, for examples, for rapid environment cleanup/restoration, rapid quarantine of objects/animals/humans, recovery, etc. In this paper we propose machine learning related predictive DNA sequence feature selection algorithms to solve binning problems in more accurate and efficient ways. Here we use sub-sequences blocks extracted from organism protein domains as features. We analyze and compare binning prediction results obtained by using k-mers, by using codons, and by using sub-sequences blocks derived from conserved protein domains. We show here, that sub-sequences blocks derived from conserved protein domains give better prediction accuracy than k-mers or codons. We also showed comparative analysis of binning predictive models using Naïve Bayes Classifier and Random Forest Classifier with feature set derived from conserved protein domain. Our analysis shows that using the Random Forest classifier, results in better classification accuracy than using the Naïve Bayes classifier.","","Electronic:978-1-4799-1737-2; POD:978-1-4799-1738-9","10.1109/THS.2015.7225313","http://ieeexplore.ieee.org/stamp/stamp.jsp?arnumber=7225313","Machine learning;bagged decision tree;binning;bioinformatics;codon;conserve protein domain;forwaord sequential feature selection;k-mers;metagenomics;next generation sequencing;random forest;reduction methods","Accuracy;Bioinformatics;DNA;Feature extraction;Genomics;Organisms;Proteins","Bayes methods;Big Data;DNA;biology computing;disasters;genomics;learning (artificial intelligence);pattern classification;proteins","DNA-metagenomics binning;WGS;WMD events applications;big data biology-based predictive models;biochemicals;codons;conserved protein domain;conserved protein domains;k-mers;machine learning related predictive DNA sequence feature selection algorithms;naïve Bayes classifier;natural disaster sites;natural disasters;natural environments;organism genomes;organism protein domains;random forest classifier;random fragments;rapid environment cleanup-restoration;rapid quarantine;shotgun genome data;whole genome shotgun sequencing","","0","","33","","","14-16 April 2015","","IEEE","IEEE Conference Publications"
"A computational framework for Tamil document classification using Random Kitchen Sink","Sanjanasri J. P; Anand Kumar M","Center for Excellence in Computational Engineering and Networking, Amrita School of Engineering, Amrita Vishwa Vidyapeetham, India","2015 International Conference on Advances in Computing, Communications and Informatics (ICACCI)","20150928","2015","","","1571","1577","Along the prompt growth in World Wide Web, the availability and accessibility of regional language contents such as e-books, web pages, e-mails, and digital repositories has grown exponentially. As a result, the automatic document classification has become the hotspot for fetching information among the millions of web documents. The idea of classifying the text, forms the baseline for many NLP applications such as information extraction, query response, information summarization, etc. The main objective of this paper is to develop an computational framework for supervised Tamil document classification task. This paper highlights the performance of Random Kitchen Sink, a randomization algorithm, in Grand Unified Regularized Least Squares (GURLS), a Machine Learning Library, is proven to be comparably better than the conventional kernel based classifier in terms of accuracy. Henceforth, we claim that Random Kitchen Sink can be an effective alternative to the kernels for a classifier.","","Electronic:978-1-4799-8792-4; POD:978-1-4799-8793-1; USB:978-1-4799-8791-7","10.1109/ICACCI.2015.7275837","http://ieeexplore.ieee.org/stamp/stamp.jsp?arnumber=7275837","Machine Learning;Natural Language Processing;Proximal Support Vector Machine;Random Kitchen Sink;Regularized Least Square;Support Vector Machine","Frequency measurement;Kernel;Machine learning algorithms;Natural language processing;Support vector machines;Training;Vocabulary","Internet;document handling;learning (artificial intelligence);query processing;random processes","NLP applications;Web documents;Web pages;World Wide Web;digital repositories;e-books;e-mails;grand unified regularized least squares;information extraction;information fetching;information summarization;machine learning library;query response;random kitchen sink;randomization algorithm;regional language contents;supervised Tamil document classification task;text classification","","","","20","","","10-13 Aug. 2015","","IEEE","IEEE Conference Publications"
"An optimal clustering for fuzzy categorization of cursive handwritten text with weight learning in textual attributes","G. Sarker; S. Dhua; M. Besra","Dept. of CSE, NIT Durgapur, India","2015 IEEE 2nd International Conference on Recent Trends in Information Systems (ReTIS)","20150903","2015","","","6","11","A new method for fuzzy categorization of cursive handwritten text has been addressed in the present work. This is based on input text clustering and subsequent learning of weighted attributes in each subject cluster. The system first employs a new algorithm to detect the letter boundary in each cursive word in the textual sentences. A Modified Optimal Clustering Algorithm (MOCA) and Back Propagation (BP) Network combination converts the handwritten texts into printed ones. Subject wise grouping of printed texts are then made with Optimal Clustering Algorithm (OCA). The weighted attributes of each subject is thereafter learned to finally find out the fuzzy categorization of each input text. Different performance metrics of the system is computed with a newly introduced concept of Fuzzy Confusion Matrix. The performance evaluation of the fuzzy categorization of text with Holdout Method in terms of accuracy, precision, recall and f-score is appreciably high. Also, the learning and categorization time is quiet affordable.","","DVD:978-1-4799-8348-3; Electronic:978-1-4799-8349-0; POD:978-1-4799-8350-6","10.1109/ReTIS.2015.7232843","http://ieeexplore.ieee.org/stamp/stamp.jsp?arnumber=7232843","Accuracy;BP Network;F-Score;Fuzzy Categorization;Fuzzy Clustering;Fuzzy Confusion Matrix;Holdout Method;MOCA;Machine Learning;OCA;Precision;Recall;Subject Glossary;Textual Attributes","Accuracy;Clustering algorithms;Feature extraction;Image segmentation;Performance evaluation;Terminology;Training","backpropagation;fuzzy set theory;handwriting recognition;matrix algebra;pattern clustering;performance evaluation;text detection","BP network combination;MOCA;backpropagation network;categorization time;cursive handwritten text;cursive word;fuzzy categorization;fuzzy confusion matrix;holdout method;letter boundary;modified optimal clustering algorithm;performance evaluation;performance metrics;printed text;subsequent learning;text clustering;textual attribute;textual sentence;weight learning;weighted attribute","","1","","13","","","9-11 July 2015","","IEEE","IEEE Conference Publications"
"A fast K-Means clustering using prototypes for initial cluster center selection","K. M. Kumar; A. R. M. Reddy","Department of Computer Science and Engineering, S.V.U College of Engineering, SV University, Tirupati-517502, A.P., India","2015 IEEE 9th International Conference on Intelligent Systems and Control (ISCO)","20151001","2015","","","1","4","K-Means clustering is a well studied algorithm in literature because of its linear time and space complexity. K-means clustering algorithm selects the initial seed points randomly. The final cluster results obtained and the speed of convergence of solution depends on the initial seed points selected. In this paper we present leaders community based k-means clustering (lc k-means) algorithm that selects good initial cluster centers for k-means clustering to start with. The proposed algorithm runs in two phases where in the first phase a set of prototypes of original dataset are derived by scanning the entire dataset once. The prototypes are grouped further into communities. Initial seed points are derived from these communities. In the second phase k-means algorithm is run over the prototypes derived in the first phase and once solution is converged the prototypes are replaced by its respective followers. Experimental results show that proposed algorithm is very accurate in detecting well separated clusters and also converges solution faster than traditional k-means algorithm.","","Electronic:978-1-4799-6480-2; POD:978-1-4799-6481-9","10.1109/ISCO.2015.7282319","http://ieeexplore.ieee.org/stamp/stamp.jsp?arnumber=7282319","Knowledge discovery;Nearest-neighbour search;k-means Clustering;machine learning;pattern recognition","Complexity theory;Indexes;Lead;Optical character recognition software;Prototypes","computational complexity;convergence;data analysis;pattern clustering","cluster center selection;convergence;fast K-means clustering;initial seed point selection;leaders community based k-means clustering algorithm;linear time complexity;space complexity","","","","8","","","9-10 Jan. 2015","","IEEE","IEEE Conference Publications"
"Mitigating Mimicry Attacks Against the Session Initiation Protocol","S. Marchal; A. Mehta; V. K. Gurbani; R. State; T. Kam Ho; F. Sancier-Barbosa","Interdiscipl. Centre for Security, Reliability & Trust, Univ. of Luxembourg, Luxembourg City, Luxembourg","IEEE Transactions on Network and Service Management","20150904","2015","12","3","467","482","The U.S. National Academies of Science's Board on Science, Technology and Economic Policy estimates that the Internet and voice-over-IP (VoIP) communications infrastructure generates 10% of U.S. economic growth. As market forces move increasingly towards Internet and VoIP communications, there is proportional increase in telephony denial of service (TDoS) attacks. Like denial of service (DoS) attacks, TDoS attacks seek to disrupt business and commerce by directing a flood of anomalous traffic towards key communication servers. In this work, we focus on a new class of anomalous traffic that exhibits a mimicry TDoS attack. Such an attack can be launched by crafting malformed messages with small changes from normal ones. We show that such malicious messages easily bypass intrusion detection systems (IDS) and degrade the goodput of the server drastically by forcing it to parse the message looking for the needed token. Our approach is not to parse at all; instead, we use multiple classifier systems (MCS) to exploit the strength of multiple learners to predict the true class of a message with high probability (98.50% ≤ p ≤ 99.12%). We proceed systematically by first formulating an optimization problem of picking the minimum number of classifiers such that their combination yields the optimal classification performance. Next, we analytically bound the maximum performance of such a system and empirically demonstrate that it is possible to attain close to the maximum theoretical performance across varied datasets. Finally, guided by our analysis we construct an MCS appliance that demonstrates superior classification accuracy with O(1) runtime complexity across varied datasets.","1932-4537;19324537","","10.1109/TNSM.2015.2459603","http://ieeexplore.ieee.org/stamp/stamp.jsp?arnumber=7163619","SIP;anomaly;classification;machine learning;mimicry attacks;multiple classifier systems","Computer crime;Degradation;Electronic mail;Grammar;Internet;Protocols;Servers","Internet telephony;computational complexity;computer network security;optimisation;pattern classification;telecommunication traffic","IDS;Internet communications infrastructure;MCS;MCS appliance;US economic growth;US national academies of science board;VoIP;anomalous traffic;communication servers;intrusion detection systems;mimicry TDoS attack;mimicry attacks mitigation;multiple classifier systems;optimization problem;runtime complexity;session initiation protocol;telephony denial of service attacks;voice-over-IP communications infrastructure","","0","","48","","20150721","Sept. 2015","","IEEE","IEEE Journals & Magazines"
"Ranking algorithm based on relational topic model","Y. Ding; Shengli Yan; Yang Xiao; Tingting Tao","Department of Computer Science and Technology Harbin Institute of Technology Shenzhen Graduate School, China","2015 International Joint Conference on Neural Networks (IJCNN)","20151001","2015","","","1","8","In this paper a supervised topic model is proposed for rank learning. The original supervised topic model can only learn from positive samples. For rank learning problem, training data have different ranking labels. To solve this issue, we extend the supervised topic model and make it learn from training data with different ranking labels. The experiments show that the proposed topic models can find the hidden relationships among words, and have higher ranking accuracy than word based models. In addition, the supervised topic models have higher ranking accuracy than the unsupervised topic models.","2161-4393;21614393","Electronic:978-1-4799-1960-4; POD:978-1-4799-1961-1","10.1109/IJCNN.2015.7280376","http://ieeexplore.ieee.org/stamp/stamp.jsp?arnumber=7280376","Information Retrieval;Machine Learning;Ranking;Topic Relation Model","Data models;Manganese","information retrieval;learning (artificial intelligence)","information retrieval;machine learning;rank learning problem;ranking algorithm;ranking labels;relational topic model;supervised topic model","","","","19","","","12-17 July 2015","","IEEE","IEEE Conference Publications"
"Forward–Backward Greedy Algorithms for Atomic Norm Regularization","N. Rao; P. Shah; S. Wright","University of Wisconsin, Madison, WI, USA","IEEE Transactions on Signal Processing","20151001","2015","63","21","5798","5811","In many signal processing applications, the aim is to reconstruct a signal that has a simple representation with respect to a certain basis or frame. Fundamental elements of the basis known as “atoms” allow us to define “atomic norms” that can be used to formulate convex regularizations for the reconstruction problem. Efficient algorithms are available to solve these formulations in certain special cases, but an approach that works well for general atomic norms, both in terms of speed and reconstruction accuracy, remains to be found. This paper describes an optimization algorithm called CoGEnT that produces solutions with succinct atomic representations for reconstruction problems, generally formulated with atomic-norm constraints. CoGEnT combines a greedy selection scheme based on the conditional gradient approach with a backward (or “truncation”) step that exploits the quadratic nature of the objective to reduce the basis size. We establish convergence properties and validate the algorithm via extensive numerical experiments on a suite of signal processing applications. Our algorithm and analysis also allow for inexact forward steps and for occasional enhancements of the current representation to be performed. CoGEnT can outperform the basic conditional gradient method, and indeed many methods that are tailored to specific applications, when the enhancement and truncation steps are defined appropriately. We also introduce several novel applications that are enabled by the atomic-norm framework, including tensor completion, moment problems in signal processing, and graph deconvolution.","1053-587X;1053587X","","10.1109/TSP.2015.2461515","http://ieeexplore.ieee.org/stamp/stamp.jsp?arnumber=7169598","Greedy algorithms;machine learning","Atomic measurements;Convergence;Image reconstruction;Optimization;Signal processing;Signal processing algorithms;Tensile stress","gradient methods;greedy algorithms;optimisation;signal reconstruction;signal representation","CoGEnT;atomic norm regularization;atomic representations;conditional gradient approach;convex regularization;forward-backward greedy algorithm;greedy selection scheme;optimization algorithm;signal processing application;signal processing applications;signal reconstruction;signal representation;truncation steps","","0","","60","","20150728","Nov.1, 2015","","IEEE","IEEE Journals & Magazines"
"Personalizing learning materials for students with multiple disabilities in virtual learning environments","J. T. Nganji; M. Brayshaw","University of Ottawa, 120 University Ottawa ON, Canada","2015 Science and Information Conference (SAI)","20150903","2015","","","69","76","Current efforts towards including students with disabilities in web-based higher education are well established. However, existing learning environments are not fully inclusive, particularly for those with multiple disabilities. Most learning environments built for students with disabilities limit themselves to meeting the needs of specific disabilities and do not attempt to scale up to the difficulties of designing for those with multiple disabilities. This paper seeks to address how virtual learning environments (VLEs) can be designed to include the needs of learners with multiple disabilities. Specifically, it employs AI to show how specific learning materials from a huge repository of learning materials can be recommended to learners with various disabilities. This is made possible through employing semantic web technology to model the learner and their needs. Three techniques are discussed to combine requirements. Simple logical operators, knowledge based rules, and machine learning based rule induction are combined in this integrated approach. It is hoped that developers of e-learning systems will be encouraged from this approach to design fully inclusive virtual learning environments.","","Electronic:978-1-4799-8547-0; POD:978-1-4799-8548-7; USB:978-1-4799-8546-3","10.1109/SAI.2015.7237128","http://ieeexplore.ieee.org/stamp/stamp.jsp?arnumber=7237128","AI Agency;adaptation;e-learning;inclusion;machine learning;multiple disabilities;ontologies;personalization","Assistive technology;Auditory system;Electronic learning;Ontologies;Semantic Web;Visualization","Internet;computer aided instruction;further education;handicapped aids;knowledge based systems;learning (artificial intelligence);student experiments","AI;VLE;Web-based higher education;e-learning systems;knowledge based rules;learning materials;machine learning;multiple disabilities;rule induction;students;virtual learning environments","","2","","31","","","28-30 July 2015","","IEEE","IEEE Conference Publications"
"Android malware detection: An eigenspace analysis approach","S. Y. Yerima; S. Sezer; I. Muttik","Centre for Secure Information Technologies (CSIT), Queen's University Belfast, Belfast, Northern Ireland","2015 Science and Information Conference (SAI)","20150903","2015","","","1236","1242","The battle to mitigate Android malware has become more critical with the emergence of new strains incorporating increasingly sophisticated evasion techniques, in turn necessitating more advanced detection capabilities. Hence, in this paper we propose and evaluate a machine learning based approach based on eigenspace analysis for Android malware detection using features derived from static analysis characterization of Android applications. Empirical evaluation with a dataset of real malware and benign samples show that detection rate of over 96% with a very low false positive rate is achievable using the proposed method.","","Electronic:978-1-4799-8547-0; POD:978-1-4799-8548-7; USB:978-1-4799-8546-3","10.1109/SAI.2015.7237302","http://ieeexplore.ieee.org/stamp/stamp.jsp?arnumber=7237302","Android;eigenspace;eigenvectors;malware detection;mobile security;statistical machine learning","Accuracy;Androids;Feature extraction;Humanoid robots;Machine learning algorithms;Malware;Training","eigenvalues and eigenfunctions;invasive software;learning (artificial intelligence);mobile computing;program diagnostics","Android applications;Android malware detection;detection capabilities;eigenspace analysis approach;evasion techniques;machine learning based approach;mobile security;static analysis characterization","","2","","21","","","28-30 July 2015","","IEEE","IEEE Conference Publications"
