"A comparison of sensitivity definitions based on expectation and variance","N. Xu; C. G. Li","School's Conciliation Board, Hebei University, Baoding 071002, China","2011 International Conference on Machine Learning and Cybernetics","20110912","2011","2","","644","647","The sensitivity analysis plays a very important role in the construct of a network and its application. There has been two statistical definitions based on expectation and variance respectively. This paper compares the two definitions and tries to find which definition is more suitable to define the sensitivity of one network. According to the immediate aspect and simulation experiments, mathematical expectation fits the definition more accurately.","2160-133X;2160133X","Electronic:978-1-4577-0308-9; POD:978-1-4577-0305-8","10.1109/ICMLC.2011.6016814","http://ieeexplore.ieee.org/stamp/stamp.jsp?arnumber=6016814","MLP;Mathematical expectation;Sensitivity definition;variance","Biological neural networks;Cybernetics;Machine learning;Probability distribution;Random variables;Sensitivity analysis","mathematical analysis;sensitivity analysis;statistical analysis","mathematical expectation;sensitivity analysis;sensitivity definition;statistical definition","","0","","14","","","10-13 July 2011","","IEEE","IEEE Conference Publications"
"Analysis of three methods for web-based opinion mining","H. B. Ma; Y. B. Geng; J. R. Qiu","Department of Political Work, Armed Police Force Political Academy of Shanghai, Shanghai, China","2011 International Conference on Machine Learning and Cybernetics","20110912","2011","2","","915","919","For the purpose of measuring semantic orientation of documents, we implemented an opinion mining tool which hybrids three different methods: The first one is based on semantic patterns, which simplify the structure of the natural language syntax; the second is based on the weighted sentiment lexicon, which used as semantic feature words; and the third one is based on traditional KNN or SVM text classification method. Our experiments show that each method has its own shorts and advantages.","2160-133X;2160133X","Electronic:978-1-4577-0308-9; POD:978-1-4577-0305-8","10.1109/ICMLC.2011.6016768","http://ieeexplore.ieee.org/stamp/stamp.jsp?arnumber=6016768","Natural language processing;semantic orientation;text classification","Algorithm design and analysis;Feature extraction;Machine learning;Pattern matching;Semantics;Support vector machines;Text categorization","Internet;classification;data mining;natural language processing;support vector machines;text analysis","KNN;SVM text classification method;Web-based opinion mining;document;measuring semantic orientation;natural language syntax;opinion mining tool;semantic feature word;semantic pattern;weighted sentiment lexicon","","5","","8","","","10-13 July 2011","","IEEE","IEEE Conference Publications"
"Aircraft landing control in wind shear condition","C. L. Lee; J. G. Juang","Department of Communications, Navigation and Control Engineering, National Taiwan Ocean University, Keelung, Taiwan","2011 International Conference on Machine Learning and Cybernetics","20110912","2011","3","","1180","1185","Most aircraft accidents occurred during final approach or landing. This study proposes cerebellar model articulation controller (CMAC) to improve the performance of automatic landing system (ALS). The atmospheric disturbances affect not only flying qualities of an airplane but also flight safety. If the flight conditions are beyond the preset envelope, the automatic landing system (ALS) is disabled and the pilot takes over. An inexperienced pilot may not be able to guide the aircraft to a safe landing at the airport when wind shear is encountered. An adaptive type-2 fuzzy CMAC (FCMAC) is applied to PID control to construct intelligent landing system which can guide the aircraft to a safe landing in severe wind shear environment.","2160-133X;2160133X","Electronic:978-1-4577-0308-9; POD:978-1-4577-0305-8","10.1109/ICMLC.2011.6016885","http://ieeexplore.ieee.org/stamp/stamp.jsp?arnumber=6016885","Automatic landing system;Fuzzy CMAC;PID control;Wind shear","Accidents;Aerospace control;Aircraft;Atmospheric modeling;Machine learning;Wind","accidents;adaptive control;air safety;aircraft landing guidance;cerebellar model arithmetic computers;fuzzy control;neurocontrollers;three-term control","PID control;adaptive type-2 fuzzy CMAC;aircraft accidents;aircraft landing control;airplane;atmospheric disturbances;automatic landing system;cerebellar model articulation controller;flight safety;intelligent landing system;landing safety;wind shear condition","","1","","17","","","10-13 July 2011","","IEEE","IEEE Conference Publications"
"Stock investment decision support for Hong Kong market using RBFNN based candlestick models","W. W. Y. Ng; X. L. Liang; P. P. K. Chan; D. S. Yeung","Machine Learning and Cybernetic Research Center, School of Computer Science and Engineering, South China University of Technology, Guangzhou, China","2011 International Conference on Machine Learning and Cybernetics","20110912","2011","2","","538","543","Candlestick pattern, as an efficient method in technical analysis, is widely used in decision support of stock investment. From historical data, there is a no 100% guarantee for a stock price increasing after the appearance of a bullish candlestick pattern. The main aim of this paper is to enhance the prediction ability of Candlestick Patterns using a Multiple Classifier System (MCS) consisting of Radial Basis Function Neural Network (RBFNN) trained by a Localized Generalization Error Model (L-GEM). The RBFNN classifies particular candlestick pattern to be a real bullish candlestick pattern or not based on training with past data. The MCS fusing RBFNN for different patterns makes the final prediction of the stock price trend. In this paper, stock price data of 40 stocks in Hong Kong Hang Seng Component Index is collected to carry out the investment simulation experiment. Experimental result shows that the proposed method yields statistically significant profit when compared with a random investment strategy and candlestick investment without RBFNN.","2160-133X;2160133X","Electronic:978-1-4577-0308-9; POD:978-1-4577-0305-8","10.1109/ICMLC.2011.6016839","http://ieeexplore.ieee.org/stamp/stamp.jsp?arnumber=6016839","Candlestick Pattern;Localized Generalization Error Model;Radial Basis Function Neural Network;Stock Investment","Biological system modeling;Cybernetics;Investments;Machine learning;Neurons;Stock markets;Training","decision support systems;generalisation (artificial intelligence);investment;pattern classification;radial basis function networks;share prices;stock markets","Hong Kong Hang Seng component index;Hong Kong market;MCS fusing RBFNN;RBFNN based candlestick models;bullish candlestick pattern;localized generalization error model;multiple classifier system;radial basis function neural network;random investment strategy;stock investment decision support;stock price;technical analysis","","2","","16","","","10-13 July 2011","","IEEE","IEEE Conference Publications"
"Using the group decision making matrix in the selection of business location","T. C. Wang; S. C. Hsu; H. C. Chen","Department of International Business, National Kaohsiung University of Applied Sciences, Kaohsiung, Taiwan","2011 International Conference on Machine Learning and Cybernetics","20110912","2011","3","","1072","1076","Location is a significant factor leads to the success of a restaurant operation and management. This study uses the group decision making Matrix to select business location. Compared with the AHP, the major contributions of this proposed framework are: 1) it just takes n-1 comparisons rather than n(n-1)/2 comparisons to obtain a complete decision matrix which has n elements; 2) the inconsistency is not occurred in this process because of additive reciprocity transitivity.","2160-133X;2160133X","Electronic:978-1-4577-0308-9; POD:978-1-4577-0305-8","10.1109/ICMLC.2011.6016874","http://ieeexplore.ieee.org/stamp/stamp.jsp?arnumber=6016874","Group Decision Making;Incomplete Linguistic Preference Relations;InlinPreRa;Restaurant location","Additives;Cybernetics;Decision making;Educational institutions;Indexes;Machine learning;Pragmatics","catering industry;decision making;facility location;matrix algebra","AHP;additive reciprocity transitivity;business location selection;group decision making matrix;incomplete linguistic preference relations;restaurant management;restaurant operation","","0","","9","","","10-13 July 2011","","IEEE","IEEE Conference Publications"
"Research on the efficiency of R&D resource allocation based on DEA approach","Q. L. Liu; L. H. Han; W. W. Zhuang","School of economics and management, Hebei University of science and technology, Shijiazhuang 050018, China","2011 International Conference on Machine Learning and Cybernetics","20110912","2011","2","","621","626","The R&D (Research and Development) investment in China has increased significantly and the proportion of the industrial investments in R&D activities compared with national R&D investments has increased rapidly. R&D activities play a crucial role in enhancing the ability of companies to achieve rapid and sustainable growth. To investigate the effectiveness of these R&D investments, we make use of the DEA (Data Envelopment Analysis) models to evaluate the efficiency of R&D investments using Data from 1991 to 2008. Through analyzing the input and output by DEA approach, we can draw the conclusion that the efficiency of the R&D resources allocation is relatively low which presented the tendency firstly rise then fall. The result of the present work implied that only enhancing efficiency of the R&D resources allocation, can make our country into the innovation nation.","2160-133X;2160133X","Electronic:978-1-4577-0308-9; POD:978-1-4577-0305-8","10.1109/ICMLC.2011.6016801","http://ieeexplore.ieee.org/stamp/stamp.jsp?arnumber=6016801","DEA approach;Efficiency;R&D investment;Resource allocation","Economic indicators;Indexes;Investments;Machine learning;Marketing and sales;Redundancy;Resource management","data envelopment analysis;innovation management;investment;sustainable development","China;DEA approach;R and D resource allocation;data envelopment analysis models;innovation nation;rapid growth;research and development investment;sustainable growth","","0","","10","","","10-13 July 2011","","IEEE","IEEE Conference Publications"
"Analysis of industuial competetive power of high-tech industry of Baoding national hign-tech zone","Q. Li; H. Z. Kong","School of Economics and Management, Hebei University of Science and Technology, Shijiazhuang 050018, China","2011 International Conference on Machine Learning and Cybernetics","20110912","2011","3","","974","978","Baoding national high-tech zone which takes the new energy as the direction is the only one of the 56 national high-tech zones in China, and it has made great progress in recent years. Data envelopment analysis is a linear programming method of assessing the relative effectiveness, it is often used in multiple inputs, multiple output cases, the efficiency of input-output analysis, and scale effect analysis can be carried out. This method excludes a lot of subjective factors, with a strong objectivity, and it has been applied in many areas. In this paper, we used the method of data envelopment analysis, took the national high-tech zones which are not capital-city high-tech national zones like Baoding, collected the 2009 annual financial data, to analyze the industry competitive power of high-tech industry. On basis of the above analysis, we developed countermeasures for high-tech industry of Baoding national high-tech zone.","2160-133X;2160133X","Electronic:978-1-4577-0308-9; POD:978-1-4577-0305-8","10.1109/ICMLC.2011.6016908","http://ieeexplore.ieee.org/stamp/stamp.jsp?arnumber=6016908","Industrial competitive power;data envelopment analysis;industry high-tech industry;national high-tech zones","Cybernetics;Data envelopment analysis;Educational institutions;Finance;Indexes;Industries;Machine learning","data envelopment analysis;innovation management;linear programming","Baoding national high-tech zone;data envelopment analysis;financial data;high-tech industry;industrial competitive power;input-output analysis;linear programming method;scale effect analysis","","0","","9","","","10-13 July 2011","","IEEE","IEEE Conference Publications"
"Blind biosignal classification framework based on DTW algorithm","S. Chao; F. Wong; H. L. Lam; M. I. Vai","Department of Computer and Information Science, Faculty of Science and Technology, University of Macau, Macau","2011 International Conference on Machine Learning and Cybernetics","20110912","2011","4","","1684","1689","Biosignal is a noninvasive measurement of the status of internal organism, such as electrocardiogram (ECG), electroencephalogram (EEG), and electromyogram (EMG), etc. With machine learning techniques, these biosignals are normally classified into one of a number of disease categories. Hence, they are ideally suited to support clinician in making diagnostic decision. However, if a given biosignal is an unknown type, none of the existing classification algorithms can be considered workable. In this paper, an intelligent framework that is able to automatically identify ECG from an unknown biosignal is described. In which, the first phase of the research is illustrated in detail, which focuses on classifying an unknown biosignal into ECG or other categories, by employing dynamic time warping (DTW), combined with clustering algorithm. The proposed framework consists of two major components: biosignal template construction and classification process. Biosignal template construction includes biosignal acquisition and segmentation, template optimization and management; while the classification process involves several sub-processes: biosignal preprocessing, biosignal pattern matching and majority voting. The experimental results demonstrate the effectiveness of the framework as well as the classification methodology.","2160-133X;2160133X","Electronic:978-1-4577-0308-9; POD:978-1-4577-0305-8","10.1109/ICMLC.2011.6017023","http://ieeexplore.ieee.org/stamp/stamp.jsp?arnumber=6017023","Biosignal;Classification;Clustering;Data mining;Dynamic time warping (DTW)","Classification algorithms;Clustering algorithms;Electrocardiography;Electroencephalography;Heuristic algorithms;Machine learning;Time series analysis","electrocardiography;medical signal processing;signal classification","DTW;DTW algorithm;ECG;EEG;EMG;biosignal acquisition;biosignal pattern matching;biosignal preprocessing;biosignal template construction;blind biosignal classification framework;classification process;clustering algorithm;diagnostic decision;disease categories;dynamic time warping;electrocardiogram;electroencephalogram;electromyogram;intelligent framework;machine learning techniques;majority voting;segmentation;template management;template optimization","","0","","22","","","10-13 July 2011","","IEEE","IEEE Conference Publications"
"Image scene categorization using multi-bag-of-features","W. Zhang; Z. Qin; T. Wan","Intelligent Computing and Machine Learning Lab (ICMLL), School of ASEE, Beihang University, China","2011 International Conference on Machine Learning and Cybernetics","20110912","2011","4","","1804","1808","Image scene classification, the classification of images into semantic categories, e.g. city, urban, sea, etc, has recently become a vigorous research focus in computer vision for its broad application prospect. In this paper, we propose a novel approach to understand image semantic scene based on multi-bag-of-features. We aim to design an efficient but simple scene classification algorithm via fusing multiple low-level image features. Experimental results demonstrate that the proposed approach offers an effective way to classify the complex image scenes by using a multi-bag-of-features model.","2160-133X;2160133X","Electronic:978-1-4577-0308-9; POD:978-1-4577-0305-8","10.1109/ICMLC.2011.6017012","http://ieeexplore.ieee.org/stamp/stamp.jsp?arnumber=6017012","SVM classifier;image scene classification;multi-bag-of-features","Books;Image segmentation;Quantization;Support vector machines;Wide area networks","computer vision;feature extraction;image classification","computer vision;image classification;image scene categorization;multibag-of-features;semantic categories","","3","","17","","","10-13 July 2011","","IEEE","IEEE Conference Publications"
"An extensional fuzzy c-means clustering algorithm based on intuitionistic extension index","H. C. Liu; Y. K. Yu; H. C. Tsai; T. S. Liu; B. C. Jeng","Department of Bioinformatics and Medical Informatics, Asia University, Taichung, 41354, Taiwan","2011 International Conference on Machine Learning and Cybernetics","20110912","2011","1","","199","203","In this paper, a novel fuzzy c-means algorithm based on an intuitionistic extension index for any n-dimensional point set, namely the E-FCM algorithm, is being proposed. If the intuitionistic extension index is equal to 0, then the proposed new algorithm is just the traditional fuzzy c-means algorithm (FCM), in other words, the E-FCM algorithm is a generalization of the FCM algorithm. It is quite different from Xu and Wu's intuitionistic fuzzy C-means clustering algorithm (IFCM algorithm), since the latter can only be used for intuitionistic fuzzy sets, but not for any n-dimensional point set. The experimental results of three benchmark data sets show that the proposed E-FCM algorithm outperforms the FCM algorithm.","2160-133X;2160133X","Electronic:978-1-4577-0308-9; POD:978-1-4577-0305-8","10.1109/ICMLC.2011.6016708","http://ieeexplore.ieee.org/stamp/stamp.jsp?arnumber=6016708","E-FCM algorithm;Fuzzy c-means;IFCM algorithm;Iintuitionistic fuzzy membership;Intuitionistic extension index","Algorithm design and analysis;Clustering algorithms;Educational institutions;Equations;Fuzzy sets;Indexes;Machine learning","data analysis;fuzzy set theory;pattern clustering","E-FCM algorithm;IFCM algorithm;data analysis;data interpretation;extensional fuzzy c-means clustering algorithm;intuitionistic extension index;intuitionistic fuzzy c-means clustering algorithm;n-dimensional point set","","0","","12","","","10-13 July 2011","","IEEE","IEEE Conference Publications"
"Financial performance evaluation study of the listed power companies based on principal component","Y. R. Su; Y. P. Nie; M. J. Li","College of Business Administration, North China Electric Power University, Beijing 102200, China","2011 International Conference on Machine Learning and Cybernetics","20110912","2011","3","","1001","1005","The financial performance of power industry as a basic industry of national economy is paid more attention by all kinds of users. Its objectivity and impartiality will directly affect the users'interests and making-decision. Method of financial performance evaluation based on principal components can reduce the effect of subjective factors. The evaluation result may reflect the facts more objectively. To verify the accuracy of new evaluation model, financial performance evaluation is carried out based on the data set of listed power companies. The result shows that the new evaluation method run well and can provide more useful information.","2160-133X;2160133X","Electronic:978-1-4577-0308-9; POD:978-1-4577-0305-8","10.1109/ICMLC.2011.6016922","http://ieeexplore.ieee.org/stamp/stamp.jsp?arnumber=6016922","Earning ability;Financial performance;Listed power company;Principal component","Companies;Cybernetics;Indexes;Machine learning;Power industry;Principal component analysis","electricity supply industry;financial data processing;principal component analysis","financial performance evaluation;listed power companies;national economy;power industry;principal component analysis","","0","","9","","","10-13 July 2011","","IEEE","IEEE Conference Publications"
"Research on cost information divulgence mechanism in supply chain","L. N. Tian; S. H. Dong; L. Wang","School of Economy and Management, Hebei University of Science and Technology, Shijiazhuang 050018, China","2011 International Conference on Machine Learning and Cybernetics","20110912","2011","3","","1136","1140","Aimed at the information divulgence in supply chain cost information sharing, a cost information divulgence model in a supply chain composed of a single supplier and two Cournot competing retailers was built. Based on the model, the generation mechanism of cost information divulgence under information asymmetry was studied. The result shows that the retailer with information superiority whose cost information will be divulged to the other retailer by supplier in order to obtain more profit. On the base of this, the influence of retailers' cost condition on supplier's information divulgence behavior was discussed.","2160-133X;2160133X","Electronic:978-1-4577-0308-9; POD:978-1-4577-0305-8","10.1109/ICMLC.2011.6016915","http://ieeexplore.ieee.org/stamp/stamp.jsp?arnumber=6016915","Cost information divulgence;Information asymmetry;Information sharing;Ordering decision","Contracts;Cybernetics;Economics;Educational institutions;Games;Machine learning;Supply chains","costing;supply chain management","cost information divulgence;cost information divulgence mechanism;generation mechanism;information asymmetry;supply chain cost information","","0","","7","","","10-13 July 2011","","IEEE","IEEE Conference Publications"
"A novel method to reduce redundancy in adaptive threshold clustering key frame extraction systems","P. P. K. Chan; H. Yu; W. W. Y. Ng; D. S. Yeung","Machine Learning and Cybernetics Research Center, School of Computer Science and Engineering, South China University of Technology, Guangzhou 510006, China","2011 International Conference on Machine Learning and Cybernetics","20110912","2011","4","","1637","1642","In adaptive threshold clustering key frame extraction systems, the video is sliced into different segments according to the adaptive threshold. One or more frames are selected from each segment as key fames to represent the video. However, those key frames may very similar. These redundant key frames provide limited information. In this paper, we propose a novel method to handle this problem which removes redundancy based on the edge structure similar measure. Experiment results show that this method is effective in reducing the redundancy comparing with methods based on low-level color information in term of accuracy and the time complexity.","2160-133X;2160133X","Electronic:978-1-4577-0308-9; POD:978-1-4577-0305-8","10.1109/ICMLC.2011.6017035","http://ieeexplore.ieee.org/stamp/stamp.jsp?arnumber=6017035","Key Frame;adaptive threshold;image edge","Cybernetics;Histograms;Image color analysis;Image edge detection;Machine learning;Motion pictures;Redundancy","edge detection;feature extraction;image segmentation;pattern clustering;video signal processing","adaptive threshold clustering key frame extraction systems;edge structure;video representation;video signal processing","","2","","16","","","10-13 July 2011","","IEEE","IEEE Conference Publications"
"Improved feature selection based on scatter degree","A. Zare; S. H. Fouladi","Department of electronic engineering, Faculty of Electrical Engineering, Amirkabir University, Tehran, Iran","2011 International Conference on Machine Learning and Cybernetics","20110912","2011","1","","97","101","Feature reduction is important in machine learning, data mining and pattern recognition fields. Feature reduction consists of two methods: 1. Feature Extraction 2. Feature Selection. Feature selection methods try to select feature subset from feature set. Thus high dimension documents are projected on to lower dimension documents. The goal is selection of best subset that causes minimum error in classification. Scatter degree is one of the feature selection methods which attributes a degree of scattering for each feature. Features are selected that have higher scatter degree. In this paper, classification error has been reduced by considering other aspects in computing scatter degree (Improved Scatter Degree). Obtained results from this method have been compared with Scatter degree method.","2160-133X;2160133X","Electronic:978-1-4577-0308-9; POD:978-1-4577-0305-8","10.1109/ICMLC.2011.6016668","http://ieeexplore.ieee.org/stamp/stamp.jsp?arnumber=6016668","Feature selection;Pattern recognition;Scatter degree","Algorithm design and analysis;Cybernetics;Equations;Feature extraction;Machine learning;Mathematical model;Principal component analysis","data mining;document handling;feature extraction;learning (artificial intelligence);pattern classification","classification error;data mining;feature extraction;feature reduction;feature selection methods;improved feature selection;machine learning;pattern recognition;scatter degree","","0","","14","","","10-13 July 2011","","IEEE","IEEE Conference Publications"
