"Machine Learning Methods for Protein Structure Prediction","J. Cheng; A. N. Tegge; P. Baldi","Comput. Sci. Dept., Univ. of Missouri, Columbia, MO","IEEE Reviews in Biomedical Engineering","20081209","2008","1","","41","49","Machine learning methods are widely used in bioinformatics and computational and systems biology. Here, we review the development of machine learning methods for protein structure prediction, one of the most fundamental problems in structural biology and bioinformatics. Protein structure prediction is such a complex problem that it is often decomposed and attacked at four different levels: 1-D prediction of structural features along the primary sequence of amino acids; 2-D prediction of spatial relationships between amino acids; 3-D prediction of the tertiary structure of a protein; and 4-D prediction of the quaternary structure of a multiprotein complex. A diverse set of both supervised and unsupervised machine learning methods has been applied over the years to tackle these problems and has significantly contributed to advancing the state-of-the-art of protein structure prediction. In this paper, we review the development and application of hidden Markov models, neural networks, support vector machines, Bayesian methods, and clustering methods in 1-D, 2-D, 3-D, and 4-D protein structure predictions.","1937-3333;19373333","","10.1109/RBME.2008.2008239","http://ieeexplore.ieee.org/stamp/stamp.jsp?arnumber=4664428","Bioinformatics;machine learning;protein folding;protein structure prediction","Amino acids;Bioinformatics;Biology computing;Hidden Markov models;Learning systems;Neural networks;Protein engineering;Sequences;Support vector machines;Systems biology","Bayes methods;bioinformatics;hidden Markov models;learning (artificial intelligence);medical expert systems;molecular biophysics;neural nets;proteins;support vector machines","3D prediction;4D quaternary structure prediction;Bayesian methods;amino acids;bioinformatics;clustering methods;computational biology;hidden Markov models;machine learning methods;multiprotein complex;neural networks;protein structure prediction;protein tertiary structure;spatial relationship prediction;structural biology;support vector machines;systems biology","Bayes Theorem;Markov Chains;Models, Molecular;Neural Networks (Computer);Protein Conformation;Proteins;Sequence Analysis, Protein","15","","123","","20081105","2008","","IEEE","IEEE Journals & Magazines"
"Building virtual community in computational intelligence and machine learning [Research Frontier]","J. M. Zurada; M. A. Mazurowski; R. Ragade; A. Abdullin; J. Wojtudiak; J. Gentle","University of Louisville, USA","IEEE Computational Intelligence Magazine","20090123","2009","4","1","43","54","This paper tackles the issue of building a large-scale virtual organization for individuals and institutions that are associated with the field of computational intelligence (CI) and machine learning (ML). It begins with a few scenarios that will help illustrate the need for a virtual community in CIML.","1556-603X;1556603X","","10.1109/MCI.2008.930986","http://ieeexplore.ieee.org/stamp/stamp.jsp?arnumber=4762310","","Collaboration;Collaborative software;Collaborative work;Computational intelligence;Geoscience;Grid computing;Machine learning;Pattern analysis;Search engines;Wikipedia","commerce;learning (artificial intelligence)","computational intelligence;large-scale virtual organization;machine learning;virtual community","","5","","8","","","February 2009","","IEEE","IEEE Journals & Magazines"
"A Machine Learning Based Reputation System for Defending Against Malicious Node Behavior","R. Akbani; T. Korkmaz; G. V. S. Raju","Dept. of Comput. Sci., Univ. of Texas, San Antonio, TX","IEEE GLOBECOM 2008 - 2008 IEEE Global Telecommunications Conference","20081208","2008","","","1","5","Reputation systems (RS) are designed to detect malicious nodes in a network and thwart their attacks, such as the spreading of viruses or worms, or attacking known vulnerabilities. They do this by collecting information about past transactions of a node and utilizing that to predict its future behavior. Traditionally, RSs have been designed by manually devising specific models or equations that use historical data to defend against certain types of attacks. In this paper, we propose a machine learning based RS that automates the process of devising the RS model and defends against many patterns of attacks. We discuss the merits of this approach and propose using support vector machines as the basis of the RS. We delineated the factors associated with building the SVM based RS and then proposed and evaluated our technique. We compared the performance of our RS with another RS found in the literature, called TrustGuard, and showed that our RS significantly outperforms TrustGuard. Our RS correctly distinguishes between good and malicious nodes with high accuracy, even when the proportion of malicious nodes in the network is very high.","1930-529X;1930529X","POD:978-1-4244-2324-8","10.1109/GLOCOM.2008.ECP.408","http://ieeexplore.ieee.org/stamp/stamp.jsp?arnumber=4698183","","Buffer overflow;Feedback;Integral equations;Machine learning;Network servers;Peer to peer computing;Protocols;Support vector machines;System testing;Wireless sensor networks","computer viruses;learning (artificial intelligence);support vector machines;telecommunication security","TrustGuard;attack thwarting;machine learning based reputation system;malicious node behavior detection;support vector machine;virus spread;worms spread","","2","","11","","","Nov. 30 2008-Dec. 4 2008","","IEEE","IEEE Conference Publications"
"Adapting Pervasive Environments through Machine Learning and Dynamic Personalization","S. McBurney; E. Papadopoulou; N. Taylor; H. Williams","Heriot-Watt Univ., Edinburgh, UK","2008 IEEE International Symposium on Parallel and Distributed Processing with Applications","20081222","2008","","","395","402","Current pervasive environments should contain mechanisms, such as personalization, that adapt the environment to help the user meet their individual needs. However, manually creating, maintaining and utilizing a preference set is no easy task for a user, requiring continued time and effort. A more desirable approach is to implicitly build and maintain the preference set by using monitoring and learning mechanisms and apply such preferences when required on behalf of the user. This paper introduces the Daidalos Personalization and Learning system which monitors user behaviour and context to not only build and maintain dynamic preferences but also to apply them in a dynamic fashion. An example scenario is presented to demonstrate how such mechanisms are used to adapt a pervasive environment on a userÂ¿s behalf.","2158-9178;21589178","POD:978-0-7695-3471-8","10.1109/ISPA.2008.63","http://ieeexplore.ieee.org/stamp/stamp.jsp?arnumber=4725172","Dynamic;learning;personalization;pervasive;preferences","Computer network management;Distributed processing;Environmental management;Intelligent networks;Learning systems;Machine learning;Monitoring;Pervasive computing;Proposals;Technological innovation","learning (artificial intelligence);ubiquitous computing","Daidalos Personalization and Learning system;adapting pervasive environments;context;dynamic personalization;dynamic preferences;learning mechanisms;machine learning;user behaviour","","3","","18","","","10-12 Dec. 2008","","IEEE","IEEE Conference Publications"
"Improvement of MicroRNA Target Prediction Using An Enhanced Feature Set: A Machine Learning Approach","R. Mitra; S. Bandyopadhyay","Machine Intelligence Unit, Indian Statistical Institute 203, B. T. Road, Kolkata-700108, India. Email: rmitra","2009 IEEE International Advance Computing Conference","20090331","2009","","","428","433","MicroRNAs (miRNAs) are small non-coding RNA molecules that post-transcrlptionally regulate gene expression by base-pairing to mRNAs. Prediction of microRNA (miRNA)- target transcript pair is now in the forefront of current research. A number of experimental and computational approaches have already detected thousands of targets for hundreds of human miRNAs. However, most of the computational target prediction methods suffer from high false positive and false negative rate. One reason for this is the marked deficiency of negative examples or non-target data. Current machine learning based target prediction algorithms suffer from lack of sufficient number of negative examples to train the machine properly because only a limited number of biologically verified negative miRNA-target transcripts have been identified with respect to true miRNA- target examples. Hence researchers have to rely on artificial negative examples. But, it has been observed that these artificially generated negative examples can not provide a good prediction accuracy for the independent test data set. Therefore it is necessary to generate more confident artificial negative examples. In the proposed article we have predicted potential miRNA- target pairs with higher sensitivity and specificity based on a new way of generating negative examples. Firstly, artificial miRNAs are generated that are believed not to be a true miRNA. In this regard, we use a novel approach K-mer exchange between key and non-key regions of the miRNA. Based on the false miRNAs we search their potential targets by scanning entire 3' untranslated regions (UTRs) using the target prediction algorithm miRanda. Based on the newly generated negative examples and a set of biologically verified positive examples we trained the classifier SVM and classify a set of independent test samples. In this regard we have generated a set of 90 experimentally verified context specific features. Our prediction algorithm has been validated with - - an independent experimental data and we obtained a much higher prediction accuracy. The robust performance of the proposed method is mainly the result of using a large high-quality artificial negative examples and the integration of many biologically verified known and novel context specific features.","","POD:978-1-4244-2927-1","10.1109/IADCC.2009.4809049","http://ieeexplore.ieee.org/stamp/stamp.jsp?arnumber=4809049","","Accuracy;Gene expression;Humans;Machine learning;Machine learning algorithms;Prediction algorithms;Prediction methods;RNA;Sensitivity and specificity;Testing","biology computing;learning (artificial intelligence);macromolecules;molecular biophysics;support vector machines","artificial miRNA;classifier SVM;enhanced feature set;high-quality artificial negative examples;machine learning;microRNA target prediction","","1","","21","","","6-7 March 2009","","IEEE","IEEE Conference Publications"
"A machine learning based system for multichannel fluorescence analysis in pancreatic tissue bioimages","J. Herold; S. Abouna; L. Zhou; S. Pelengaris; D. B. A. Epstein; M. Khan; T. W. Nattkemper","Faculty of Technology, Biodata Mining & Applied Neuroinformatics Group, University of Bielefeld, 33615 Germany","2008 8th IEEE International Conference on BioInformatics and BioEngineering","20081208","2008","","","1","6","Fluorescence microscopy has regained much attention in the last years especially in the field of systems biology. It has been recognized as a rich source of information extending the existing sources since it allows simultaneous collection of spatial and temporal protein information. In order to enable a high-throughput and high-content image analysis, sophisticated image processing routines become essential. We present a machine learning based approach for semantic image annotation i.e. identifying biologically meaningful objects. A semantic annotation becomes necessary, if image variables have to be associated to single biological objects, for example cells. We apply our method to pancreatic tissue sample images to detect and annotate cells of the Islets of Langerhans and whole pancreas. Based on the annotation, aligned multichannel fluorescence images are evaluated for cell type classification allowing accurate and rapid determination of the cell number and mass. This high-throughput analytical technique, requiring only few parameters, should be of great value in diabetes studies and for screening of new anti-diabetes treatments.","","CD-ROM:978-1-4244-2845-8; POD:978-1-4244-2844-1","10.1109/BIBE.2008.4696798","http://ieeexplore.ieee.org/stamp/stamp.jsp?arnumber=4696798","","Fluorescence;Image analysis;Image processing;Information resources;Learning systems;Machine learning;Microscopy;Pancreas;Proteins;Systems biology","biological tissues;bioluminescence;cellular biophysics;diseases;fluorescence;image classification;learning (artificial intelligence);medical computing;medical image processing;molecular biophysics","Islets of Langerhans cells;diabetes treatment;fluorescence microscopy;high content image analysis;image processing routines;machine learning based system;multichannel fluorescence analysis;pancreas cells;pancreatic tissue bioimages;protein information;semantic image annotation;systems biology","","1","","20","","","8-10 Oct. 2008","","IEEE","IEEE Conference Publications"
"Clustering Description Extraction Based on Statistical Machine Learning","C. Zhang; H. Xu","Dept. of Inf. Manage., Nanjing Univ. of Sci. & Technol., Nanjing","2008 Second International Symposium on Intelligent Information Technology Application","20090106","2008","2","","22","26","Clustering description problem is one of key issues of the traditional document clustering algorithm. The traditional document algorithm can cluster the objects, but it can not give concept description for the clustered results. Document clustering description is a problem of labeling the clustered results of document collection clustering. It can help users determine whether one of the clusters is relevant to users' information requirement. Therefore, labeling a clustered set of documents is an important and challenging work in document clustering applications. To resolve the problem of the weak readability of the traditional document clustering results, a method of automatic labeling documents clusters based on machine learning is put forward. Experimental results show that the method based on SVM will provide users with more concise and comprehensive document clustering results. It also reflects the linear trend of clustering description problem.","","POD:978-0-7695-3497-8","10.1109/IITA.2008.114","http://ieeexplore.ieee.org/stamp/stamp.jsp?arnumber=4739719","Clustering Description;Document Clustering;Statistical Machine Learning","Clustering algorithms;Data mining;Frequency;Information management;Information technology;Labeling;Learning systems;Machine learning;Machine learning algorithms;Support vector machines","document handling;learning (artificial intelligence);pattern clustering;statistical analysis","clustered document labeling;document clustering description extraction;document collection clustering;statistical machine learning","","2","","15","","","20-22 Dec. 2008","","IEEE","IEEE Conference Publications"
"feedback free DVC architecture using machine learning","J. L. Martinez; G. Fernandez-Escribano; H. Kalva; W. A. R. J. Weerakkody; W. A. C. Fernando; A. Garrido","Albacete Research Institute of Informatics. Universidad de Castilla-La Mancha. 02071, Spain","2008 15th IEEE International Conference on Image Processing","20081212","2008","","","1140","1143","Most of the reported distributed video coding (DVC) architectures have a serious limitation that hinders its practical application. The uses of a feedback channel between the encoder and the decoder require an interactive decoding procedure which is a limitation for applications such as offline processing. On the other hand, the decoder needs an efficient way to estimate the probability of error without assuming the availability of the original video at the decoder. In this paper we continue with our previous works into a more practical DVC architecture which solves both problems based on the use of machine learning. The proposed approach is based on extracting the relationships that exist between the residual frame and the number of requests over this feedback channel. We apply these concepts to pixel-domain Wyner-Ziv coding demonstrating significant savings in bitrates with a little loss of quality.","1522-4880;15224880","POD:978-1-4244-1765-0","10.1109/ICIP.2008.4711961","http://ieeexplore.ieee.org/stamp/stamp.jsp?arnumber=4711961","DVC;Feedback Channel;Machine Learning;Turbo Codes;Wyner-Ziv coding","Bit error rate;Cameras;Computer architecture;Computer science;Feedback;Informatics;Iterative decoding;Machine learning;Video coding;Wireless sensor networks","decoding;error statistics;estimation theory;learning (artificial intelligence);probability;video coding","distributed video coding architectures;feedback channel;interactive decoding procedure;machine learning;offline processing;pixel-domain Wyner-Ziv coding","","13","","9","","","12-15 Oct. 2008","","IEEE","IEEE Conference Publications"
"Corrections to “Pareto-Based Multiobjective Machine Learning: An Overview and Case Studies” [May 08 397-415]","Y. Jin; B. Sendhoff","","IEEE Transactions on Systems, Man, and Cybernetics, Part C (Applications and Reviews)","20090414","2009","39","3","373","373","In the above titled paper (ibid., vol. 38, no. 3, pp. 397-415, May 08), there are three sites where an inequality is put wrongly. The corrections are presented here.","1094-6977;10946977","","10.1109/TSMCC.2009.2018893","http://ieeexplore.ieee.org/stamp/stamp.jsp?arnumber=4813238","","","","","","6","","1","","20090410","May 2009","","IEEE","IEEE Journals & Magazines"
"Machine Learning Techniques Applied to Dynamic Video Adapting","R. Eisinger; R. A. F. Romero; R. Goularte","Adapmedia","2008 Seventh International Conference on Machine Learning and Applications","20081222","2008","","","819","822","In the past years, mobile devices were limited to textual content. However, the current generation has started to access richer multimedia content such as video, increasing the diversity of devices accessing the Web. Then, a problem arises as some of those devices characteristics like memory capacity or screen resolution turn the access to a content restricted. The present work considers the use of machine learning techniques as part of a dynamic video adaptation process, comparing the results from two of the most used approaches for data analysis, Multilayer Perceptron and Bayesian Inference, as part of a Decision Engine, analyzing data like device's capabilities, user's preferences and network condition in order to take the most appropriate way to adapt a video stream.","","POD:978-0-7695-3495-4","10.1109/ICMLA.2008.42","http://ieeexplore.ieee.org/stamp/stamp.jsp?arnumber=4725073","Bayesian Inference;Context-Aware Computing;Machine Learning;Neural Netqwork;Ubiquitous Computing;Video Adapting","Bandwidth;Bayesian methods;Computational efficiency;Data analysis;IPTV;Machine learning;Multilayer perceptrons;Search engines;Streaming media;Videoconference","Bayes methods;Internet;data analysis;inference mechanisms;learning (artificial intelligence);mobile handsets;multilayer perceptrons;video signal processing;video streaming","Bayesian inference;World Wide Web;content restricted;data analysis;decision engine;dynamic video adaptation process;dynamic video adapting;machine learning techniques;memory capacity;mobile devices;multilayer perceptron;multimedia content;screen resolution;textual content;video stream","","0","","13","","","11-13 Dec. 2008","","IEEE","IEEE Conference Publications"
"A Class-Incremental Learning Method for Multi-Class Support Vector Machines in Text Classification","B. f. Zhang; J. s. Su; X. Xu","School of Computer, National University of Defense Technology, Changsha 410073, China. E-MAIL: bfzhang@nudt.edu.cn","2006 International Conference on Machine Learning and Cybernetics","20090304","2006","","","2581","2585","To solve multi-class problems of support vector machines (SVM) more efficiently, a novel framework, which we call class-incremental learning (CIL), is proposed in this paper. CIL consists of two phases: incremental feature selection and incremental training, for updating the knowledge of old SVM classifiers in text classification when new classes are added to the system. CIL reuses the old models of the classifier and learns only one binary sub-classifier with an additional phase of feature selection when a new class comes. In the testing phase, current classifier is applied to the vectors' projections on the sub-spaces concerned. CIL can serve as a flexible approach for all binary classification algorithms in text classification. Our experiment shows that the CIL-based SVM was not only substantially faster in training time than the popular batch SVM learning methods such as 1-against-rest, 1-against-1 and divide-by-2 but also almost competed to the best performances in effectiveness of them","2160-133X;2160133X","POD:1-4244-0061-9","10.1109/ICMLC.2006.258853","http://ieeexplore.ieee.org/stamp/stamp.jsp?arnumber=4028499","Internet information filtering;Machine learning;class-incremental learning;feature selection;support vector machines;text classification","Automation;Cybernetics;Decision trees;Electronic mail;Information filtering;Information filters;Learning systems;Machine learning;Support vector machine classification;Support vector machines;Text categorization","Internet;classification;feature extraction;information filtering;learning (artificial intelligence);support vector machines;text analysis","Internet information filtering;SVM classifier;binary classification algorithm;class-incremental learning method;incremental feature selection;incremental training;multiclass support vector machine;text classification","","9","","10","","","13-16 Aug. 2006","","IEEE","IEEE Conference Publications"
"Applying Machine learning Algorithms for Email Management","T. Ayodele; S. Zhou","Department of Electronics and Computer Engineering, University of Portsmouth, United Kingdom. taiwo.ayodele@port.ac.uk","2008 Third International Conference on Pervasive Computing and Applications","20090213","2008","1","","339","344","This paper presents the design and implementation of a new system to predict whether email received require a reply, group emails and summarize email messages. The system uses not only subjects and headers fields but also content of email messages to classify emails based on users' activities and generate summaries of each incoming message with unsupervised learning approach. Our framework tackles the problem of email overload, congestion, difficulties in prioritizing and difficulties in finding previously archived messages in the mail box.","","CD-ROM:978-1-4244-2021-6; POD:978-1-4244-2020-9","10.1109/ICPCA.2008.4783606","http://ieeexplore.ieee.org/stamp/stamp.jsp?arnumber=4783606","email grouping;emails;reply prediction;summarization;unsupervised learning","Algorithm design and analysis;Business communication;Costs;Design engineering;Engineering management;Frequency;Machine learning algorithms;Postal services;Productivity;Unsupervised learning","electronic mail;learning (artificial intelligence)","email management;email overload;group emails;machine learning algorithms;summarize email messages;unsupervised learning","","1","","9","","","6-8 Oct. 2008","","IEEE","IEEE Conference Publications"
"A Machine Learning Approach to Fault Diagnosis of Rolling Bearings","M. Cococcioni; P. Forte; S. Manconi; C. Sacchi","Dipartimento di Ingegneria, dell'Informazione, University of Pisa, Via Diotisalvi, 2, 56122 Pisa, Italy, m.cococcioni@iet.unipi.it","2008 IEEE International Conference on Computational Cybernetics","20081222","2008","","","209","214","This paper presents a method based on classification techniques for automatic fault diagnosis of rolling element bearings. Experimental results achieved on vibration signals collected by an accelerometer on an experimental test rig show that the method can automatically detect different types of faults. Furthermore, the method is able, once trained on an appropriate representative set of basic faults, to recognize more serious faults, provided they are of the same type. We also analyzed the trend of correct classification of bearing faults on variation of the signal-to-noise ratio achieving high levels of robustness.","","CD-ROM:978-1-4244-2875-5; POD:978-1-4244-2874-8","10.1109/ICCCYB.2008.4721407","http://ieeexplore.ieee.org/stamp/stamp.jsp?arnumber=4721407","Automatic Fault Detection;Pattern Classification;Rolling Bearings Vibrations Analysis","Fault detection;Fault diagnosis;Frequency;Machine learning;Monitoring;Robustness;Rolling bearings;Signal analysis;Testing;Vibrations","fault diagnosis;learning (artificial intelligence);pattern classification;rolling bearings;vibrations","accelerometer;fault diagnosis;machine learning;pattern classification;rolling bearings;vibration signals","","2","","9","","","27-29 Nov. 2008","","IEEE","IEEE Conference Publications"
