"Ensemble of distributed learners for online classification of dynamic data streams","L. Canzian; Y. Zhang; M. van der Schaar","Qascom, Bassano del Grappa, Italy","IEEE Transactions on Signal and Information Processing over Networks","20150928","2015","1","3","180","194","We present a distributed online learning scheme to classify data captured from distributed and dynamic data sources. Our scheme consists of multiple distributed local learners, which analyze different streams of data that are correlated to a common event that needs to be classified. Each learner uses a local classifier to make a local prediction. The local predictions are then collected by each learner and combined using a weighted majority rule to output the final prediction. We propose a novel online ensemble learning algorithm to update the aggregation rule in order to adapt to the underlying data dynamics. We rigorously determine an upper bound for the worst-case mis-classification probability of our algorithm, which tends asymptotically to 0 if the misclassification probability of the best (unknown) static aggregation rule is 0. Then we extend our algorithm to address challenges specific to the distributed implementation and prove new bounds that apply to these settings. Finally, we test our scheme by performing an evaluation study on several data sets.","2373-776X;2373776X","","10.1109/TSIPN.2015.2470125","http://ieeexplore.ieee.org/stamp/stamp.jsp?arnumber=7274771","Big data;Online learning;big data;classification;concept drift;distributed learning;dynamic streams;ensemble of classifiers;machine learning;online learning","Distributed databases;Heuristic algorithms;Indexes;Information processing;Prediction algorithms;Pulse width modulation;Training","data handling;distributed processing;learning (artificial intelligence);pattern classification","data dynamics;distributed learners;distributed online learning;dynamic data sources;dynamic data streams;multiple distributed local learners;online classification;online ensemble learning algorithm","","2","","46","","20150923","Sept. 2015","","IEEE","IEEE Journals & Magazines"
"Self-Organizing Map-Based Feature Visualization and Selection for Defect Depth Estimation in Oil and Gas Pipelines","A. Mohamed; M. S. Hamdi; S. Tahar","Inf. Syst. Dept., Ahmed Bin Mohammed Mil. Coll., Doha, Qatar","2015 19th International Conference on Information Visualisation","20150921","2015","","","235","240","Magnetic Flux Leakage (MFL) sensors are commonly utilized to detect defects in oil and gas pipelines and determine their depths and sizes. As a preprocessing step, MFL data are often reduced into a representative feature set that is capable of accurately estimating pipeline defect depths. However, this estimation capability may vary depending on the features used, which necessitates the need for selecting the most relevant ones. In this paper, self-organizing maps (SOMs) are used as feature visualization tool for the purpose of selecting the most appropriate features. First, a self-organizing map (SOM), i.e., A two-dimensional discretized representation of the input space of the training samples for the features, is produced. The SOM weights for each individual input feature (weight plane) are displayed then visually analyzed. Irrelevant and redundant features can be efficiently spotted and removed. The remaining ""good"" features (i.e., Selected features) are then used as an input to a feed forward neural network for defect depth estimation. Experimental work has shown the effectiveness of the proposed approach. For instance, within ±5% error-tolerance range, the obtained estimation accuracy, using the SOM-based feature selection, is 93.1%, compared to 74% when all input features are used (i.e., No feature selection is performed), and within ±10% error-tolerance range, the obtained estimation accuracy, using the SOM-based feature selection, is 97.5%, compared to 86% when all the input features are used (i.e., No feature selection is performed).","1550-6037;15506037","Electronic:978-1-4673-7568-9; POD:978-1-4673-7569-6","10.1109/iV.2015.50","http://ieeexplore.ieee.org/stamp/stamp.jsp?arnumber=7272608","data visualization;feature selection;machine learning;neural networks;self-organizing map","Accuracy;Artificial neural networks;Estimation;Feature extraction;Magnetic flux leakage;Neurons;Pipelines","data visualisation;feature selection;feedforward neural nets;magnetic leakage;mechanical engineering computing;pipelines;pipes","MFL sensors;SOM-based feature selection;defect detection;feature visualization tool;feed forward neural network;gas pipeline;magnetic flux leakage sensors;oil pipeline;pipeline defect depth estimation;self-organizing map","","1","","30","","","22-24 July 2015","","IEEE","IEEE Conference Publications"
"Spam filtering using hybrid local-global Naive Bayes classifier","R. K. Solanki; K. Verma; R. Kumar","Department of computer science, Thapar University, Patiala, India","2015 International Conference on Advances in Computing, Communications and Informatics (ICACCI)","20150928","2015","","","829","833","This paper propose a novel learning framework for classification of messages into spam and legit. We introduce a classification method based on feature space segmentation. Naive Bayes (NB) model is a statistical filtering process which uses previously gathered knowledge. Instead of using a single classifier, we propose the use of local and global classifier, based on Bayesian hierarchal framework. This helps in achieving multi-task learning, as simultaneous extraction of knowledge can be achieved while achieving classification accuracy. Knowledge among different task can be shared while learning for task specific.","","Electronic:978-1-4799-8792-4; POD:978-1-4799-8793-1; USB:978-1-4799-8791-7","10.1109/ICACCI.2015.7275713","http://ieeexplore.ieee.org/stamp/stamp.jsp?arnumber=7275713","Naive Bayes;hybrid classifier;machine learning;spam filtration","Accuracy;Bayes methods;Data models;Filtering;Filtration;Training;Unsolicited electronic mail","Bayes methods;feature extraction;information filtering;knowledge acquisition;learning (artificial intelligence);pattern classification;unsolicited e-mail","feature space segmentation;hybrid local-global naive Bayes classifier;knowledge extraction;legit message;message classification;multitask learning;spam filtering;spam message;statistical filtering process","","1","","9","","","10-13 Aug. 2015","","IEEE","IEEE Conference Publications"
"Mining defect reports for predicting software maintenance effort","R. Jindal; R. Malhotra; A. Jain","Department of Computer Science and Engineering, Delhi Technological University, Shahbad Daulatpur, Main Bawana Road, 110042, India","2015 International Conference on Advances in Computing, Communications and Informatics (ICACCI)","20150928","2015","","","270","276","Software Maintenance is the crucial phase of software development lifecycle, which begins once the software has been deployed at the customer's site. It is a very broad activity and includes almost everything that is done to change the software if required, to keep it operational after its delivery at the customer's end. A lot of maintenance effort is required to change the software after it is in operation. Therefore, predicting the effort and cost associated with the maintenance activities such as correcting and fixing the defects has become one of the key issues that need to be analyzed for effective resource allocation and decision-making. In view of this issue, we have developed a model based on text mining techniques using the statistical method namely, Multi-nominal Multivariate Logistic Regression (MMLR). We apply text mining techniques to identify the relevant attributes from defect reports and relate these relevant attributes to software maintenance effort prediction. The proposed model is validated using `Camera' application package of Android Operating System. Receiver Operating Characteristics (ROC) analysis is done to interpret the results obtained from model prediction by using the value of Area Under the Curve (AUC), sensitivity and a suitable threshold criterion known as the cut-off point. It is evident from the results that the performance of the model is dependent on the number of words considered for classification and therefore shows the best results with respect to top-100 words. The performance is irrespective of the type of effort category.","","Electronic:978-1-4799-8792-4; POD:978-1-4799-8793-1; USB:978-1-4799-8791-7","10.1109/ICACCI.2015.7275620","http://ieeexplore.ieee.org/stamp/stamp.jsp?arnumber=7275620","Defect reports;Machine Learning;Receiver Operating Characteristics;Software Maintenance Effort Prediction;Text mining","Feature extraction;Logistics;Predictive models;Software maintenance;Testing;Text mining","Android (operating system);data mining;decision making;logistics;regression analysis;sensitivity analysis;software maintenance","AUC;Android operating system;MMLR;ROC analysis;area under the curve;cost association;decision making;defect reports mining;multinominal multivariate logistic regression;receiver operating characteristics;software development lifecycle;software maintenance;text mining","","","","35","","","10-13 Aug. 2015","","IEEE","IEEE Conference Publications"
"The study of fear-induced power modulations for Cognitive Man-Machine Communication","N. Irtiza; H. Farooq","Department of Electrical Engineering, Bahria University, Karachi, Pakistan","2015 IEEE 14th International Conference on Cognitive Informatics & Cognitive Computing (ICCI*CC)","20150914","2015","","","346","351","The efficient development of a Brain Computer Interface is based on rapid and effective discrimination of brain signals based on Electroencephalography (EEG) patterns. Any specific mental state or thinking activity results in specific pattern of brain signals. In this paper, a method has been proposed that combines recent advances in brain imaging and machine learning techniques to predict the cognitive state of the subjects whether they are feeling themselves in a safe or dangerous environment. This method is based on the mechanism of neuroception. The changes in this state are correlated with power modulations of oscillatory rhythms in the human EEG called ERD / ERS (Event-related De-synchronization / Synchronization). In order to predict these changes, it is of high significance to find the spatio-temporal distribution of EEG band-power modulations induced by the feeling of fear or danger.","","CD-ROM:978-1-4673-7289-3; Electronic:978-1-4673-7290-9; POD:978-1-4673-7291-6","10.1109/ICCI-CC.2015.7259409","http://ieeexplore.ieee.org/stamp/stamp.jsp?arnumber=7259409","Cognitive Computing;Cognitive Machine Learning;Signal Processing","Accuracy;Bioinformatics;Electroencephalography;Games;Genetic algorithms;Genomics;Support vector machines","brain-computer interfaces;electroencephalography;learning (artificial intelligence);man-machine systems;medical signal processing","EEG patterns;ERD;ERS;band-power modulations;brain computer interface;brain imaging;brain signals;cognitive man-machine communication;electroencephalography patterns;event-related desynchronization;event-related synchronization;fear-induced power modulations;machine learning techniques;mental state;neuroception;oscillatory rhythms;spatio-temporal distribution;thinking activity","","","","28","","","6-8 July 2015","","IEEE","IEEE Conference Publications"
"Information retrieval: A new multilingual stemmer based on a statistical approach","S. Gadri; A. Moussaoui","Department of ICST, University of M'sila, M'sila, 28000, Algeria","2015 3rd International Conference on Control, Engineering & Information Technology (CEIT)","20150903","2015","","","1","6","Stemming is a technique used to reduce inflected and derived words to their basic forms (stem or root). It is a very important step of pre-processing in text mining, and generally used in many areas of research such as: Natural language Processing NLP, Text Categorization TC, Text Summarizing TS, Information Retrieval IR, and other tasks in text mining. Stemming is frequently useful in text categorization to reduce the size of terms vocabulary, and in information retrieval to improve the search effectiveness and then gives us relevant results. In this paper, we propose a new multilingual stemmer based on the extraction of word root and in which we use the technique of n-grams. We validated our stemmer on three languages which are: Arabic, French and English.","","Electronic:978-1-4799-8212-7; POD:978-1-4799-8213-4","10.1109/CEIT.2015.7233113","http://ieeexplore.ieee.org/stamp/stamp.jsp?arnumber=7233113","Bigrams technique;Information retrieval;Machine learning;Natural language processing;Root extraction;Stemming;Text mining","Error analysis;Information retrieval;Integrated circuits;Natural language processing;Statistical analysis;Text categorization;Text mining","data mining;information retrieval;natural language processing;statistical analysis;text analysis;vocabulary","Arabic language;English language;French language;NLP;information retrieval;multilingual stemmer;natural language processing;statistical approach;terms vocabulary;text categorization;text mining;text summarizing;word root extraction","","2","","32","","","25-27 May 2015","","IEEE","IEEE Conference Publications"
"A scalable framework to transform samples from one continuous distribution to another","D. Mesa; S. Kim; T. Coleman","Dept. of Bioengineering, University of California: San Diego, La Jolla, 92037, USA","2015 IEEE International Symposium on Information Theory (ISIT)","20151001","2015","","","676","680","We present a framework to transform a sample from one continuous distribution P to another ℚ. Our previous work considered the special case of Bayesian inference where P is the prior and ℚ is the posterior, showing that this can be solved with convex optimization under appropriate conditions. Here, our contribution is two fold: (i) we consider the more general case of arbitrary P and ℚ and show using optimal transport theory and KL divergence minimization that convexity holds provided that ℚ has a log-concave density; (ii) we develop a largescale distributed solver. With this general framework finding the optimal Bayesian map is done through a series of MAP estimation problems. Interesting applications are also presented.","2157-8095;21578095","Electronic:978-1-4673-7704-1; POD:978-1-4673-7705-8; USB:978-1-4673-7703-4","10.1109/ISIT.2015.7282540","http://ieeexplore.ieee.org/stamp/stamp.jsp?arnumber=7282540","Bayesian inference;KL divergence;convex optimization;machine learning;optimal transport","Approximation methods;Bayes methods;Convergence;Convex functions;Indexes;Logistics;Uncertainty","convex programming;learning (artificial intelligence);minimisation;transport processes","Bayesian inference;Bayesian map;KL divergence minimization;MAP estimation;convex optimization;distributed solver;log-concave density;transform samples;transport theory","","1","","22","","","14-19 June 2015","","IEEE","IEEE Conference Publications"
"Towards a Multi-label Classification of Open Educational Resources","M. M. García; R. P. Rodríguez; L. A. Rifón; M. V. Ferro","Dept. of Telematics Eng., Univ. of Vigo, Vigo, Spain","2015 IEEE 15th International Conference on Advanced Learning Technologies","20150917","2015","","","407","408","Nowadays, there are a lot of online repositories containing thousands of very useful educational resources for the educational community. To take full advantage of these resources requires a simple, direct and effective access to those resources that are of interest, therefore, it is necessary that those resources are ordered or ranked based on some criteria?-that is to say, they have to be classified. Classification is usually done manually by the resource provider, which directly implies a main problem: the time spent categorising resources. In this paper we propose a solution to this problem through the design and implementation of a multi-label classifier that enables the automatic classification of a set of educational resources in their most suitable category or categories, thus eliminating the need to manually perform this classification. Evaluation results show that the performance of the OER classifier is comparable to classification of a de-facto standard corpus: OHSUMED.","2161-3761;21613761","Electronic:978-1-4673-7334-0; POD:978-1-4673-7335-7","10.1109/ICALT.2015.55","http://ieeexplore.ieee.org/stamp/stamp.jsp?arnumber=7265364","Machine Learning;Multi-label classification;Open Educational Resources","Algorithm design and analysis;Classification algorithms;Conferences;Measurement;Standards;Support vector machines;Training","educational administrative data processing;pattern classification","OER classifier;educational community;multilabel classification;online repositories;open educational resources","","","","15","","","6-9 July 2015","","IEEE","IEEE Conference Publications"
"Twitter mining for traffic events detection","C. Gutiérrez; P. Figuerias; P. Oliveira; R. Costa; R. Jardim-Goncalves","Centre of Technology and Systems Faculdade de Ci&#x00EA;ncias e Tecnologia, Universidade Nova de Lisboa, UNINOVA, Lisboa, Portugal","2015 Science and Information Conference (SAI)","20150903","2015","","","371","378","Nowadays with the proliferation of smartphones and tablets on the market, almost everyone has access to mobile devices that offer better processing capabilities and access to new information and services. The Web is undoubtedly the best tool for sharing content, especially through social networks. One of the most useful information that can be extracted is the geographical one. Current navigation systems lack in several ways to satisfy the need to process and reason upon such volumes of data, namely, to accurately provide information about urban traffic in real-time and the possibility to personalize the information used by such systems. This paper describes an approach to integrate and fuse tweet messages from traffic agencies in UK, with the objective of detecting the geographical focus of traffic events. Tweet messages are considered in this work given its uniqueness, the real time nature of tweets which may be used to quickly detect a traffic event and its simplicity; it only cost 140 characters to generate a message (called “tweet”) for any user. The approach presented here is composed by several steps: tweet classification, event type classification, name entity recognition, geolocation and event tracking. Finally, we do an experimental study on a real dataset composed by traffic related tweet messages to access the accuracy of proposed approach. We present some inaccuracies ranging from lack of geographical information, imprecise and ambiguous toponyms, overlaps and repetitions as well as visualization to our data set in UK. We finally give an outlook into potential corrections. The work presented here is still part of on-going work. Results achieved so far do not address the final conclusions but form the basis for the formalization of a domain knowledge along with the services.","","Electronic:978-1-4799-8547-0; POD:978-1-4799-8548-7; USB:978-1-4799-8546-3","10.1109/SAI.2015.7237170","http://ieeexplore.ieee.org/stamp/stamp.jsp?arnumber=7237170","classification;geo-parsing;information retrieval;machine learning;social networks;traffic events","Data mining;Engines;Event detection;Geology;Real-time systems;Twitter","Internet;data mining;geography;mobile computing;pattern classification;social networking (online);traffic engineering computing","Twitter mining;World Wide Web;content sharing;domain knowledge;event tracking;event type classification;geographical focus detection;geographical information;geolocation;mobile devices;name entity recognition;navigation systems;smartphones;social networks;tablets;traffic events detection;tweet classification;urban traffic","","3","","21","","","28-30 July 2015","","IEEE","IEEE Conference Publications"
"A Novel RBF Training Algorithm for Short-Term Electric Load Forecasting and Comparative Studies","C. Cecati; J. Kolbusz; P. Różycki; P. Siano; B. M. Wilamowski","Dept. of Ind. & Inf. Eng. & Econ., Univ. of L'Aquila, L'Aquila, Italy","IEEE Transactions on Industrial Electronics","20150909","2015","62","10","6519","6529","Because of their excellent scheduling capabilities, artificial neural networks (ANNs) are becoming popular in short-term electric power system forecasting, which is essential for ensuring both efficient and reliable operations and full exploitation of electrical energy trading as well. For such a reason, this paper investigates the effectiveness of some of the newest designed algorithms in machine learning to train typical radial basis function (RBF) networks for 24-h electric load forecasting: support vector regression (SVR), extreme learning machines (ELMs), decay RBF neural networks (DRNNs), improves second order, and error correction, drawing some conclusions useful for practical implementations.","0278-0046;02780046","","10.1109/TIE.2015.2424399","http://ieeexplore.ieee.org/stamp/stamp.jsp?arnumber=7089261","Decay RBF Neural Networks;Decay radial basis function (RBF) neural networks;Error Correction;Extreme Learning Machines;Improved Second Order;Neural Networks;RBF;Radial Basis Function;Short-Term Load Forecasting;Support Vector Regression;error correction (ErrCor);extreme learning machines (ELMs);improved second order (ISO);neural networks;short-term load forecasting (STLF);support vector regression (SVR)","Biological neural networks;ISO;Load forecasting;Radial basis function networks;Support vector machines;Training","learning (artificial intelligence);load forecasting;power engineering computing;power markets;radial basis function networks;regression analysis;support vector machines","DRNN;ELM;RBF training algorithm;artificial neural networks;decay RBF neural network;electrical energy trading;extreme learning machine;machine learning;radial basis function network;short-term electric load forecasting;short-term electric power system forecasting;support vector regression","","14","","57","","20150420","Oct. 2015","","IEEE","IEEE Journals & Magazines"
"On Learning From Game Annotations","C. Wirth; J. Fürnkranz","Knowledge Engineering, TU Darmstadt, Darmstadt, Germany","IEEE Transactions on Computational Intelligence and AI in Games","20150910","2015","7","3","304","316","Most of the research in the area of evaluation function learning is focused on self-play. However in many domains, like Chess, expert feedback is amply available in the form of annotated games. This feedback usually comes in the form of qualitative information because human annotators find it hard to determine precise utility values for game states. The goal of this work is to investigate inasmuch it is possible to leverage this qualitative feedback for learning an evaluation function for the game. To this end, we show how the game annotations can be translated into preference statements over moves and game states, which in turn can be used for learning a utility function that respects these preference constraints. We evaluate the resulting function by creating multiple heuristics based upon different sized subsets of the training data and compare them in a tournament scenario. The results showed that learning from game annotations is possible, but, on the other hand, our learned functions did not quite reach the performance of the original, manually tuned function of the Chess program. The reason for this failure seems to lie in the fact that human annotators only annotate “interesting” positions, so that it is hard to learn basic information, such as material advantage from game annotations alone.","1943-068X;1943068X","","10.1109/TCIAIG.2014.2332442","http://ieeexplore.ieee.org/stamp/stamp.jsp?arnumber=6861960","Computer Chess;machine learning in games;preference learning","Computers;Databases;Engines;Games;Machine learning algorithms;Support vector machines;Time factors","","","","0","","52","","20140722","Sept. 2015","","IEEE","IEEE Journals & Magazines"
