"Teeth periapical lesion prediction using machine learning techniques","Y. E. Mahmoud; S. S. Labib; H. M. O. Mokhtar","Faculty of Computer Sciences, Modern Sciences and Arts University, Giza, Egypt","2016 SAI Computing Conference (SAI)","20160901","2016","","","129","134","Teeth Periapical lesion is used to be diagnosed by dentists according to patient's x-ray. But most of the time there were a problematic issue to reach a definitive diagnosis. It takes too much time, case and chief complaint history needed, many tests and tools are needed and sometimes taking too many radiographs is required. Even though, before starting the treatment sometimes reaching definitive diagnosis is difficult. Therefore, the objective of this research is to predict whether the patient has teeth periapical lesion or not and its type using machine learning techniques. The proposed system consists of four main steps: Data collection, image preprocessing using median and average filters for removing noise and Histogram equalization for image enhancement, feature extraction using two dimensional discrete wavelet transform algorithm, and finally machine learning (classification) using Feed Forward Neural Networks and K-Nearest Neighbor Classifier. It has been concluded from the results that the K-Nearest Neighbor Classifier performs better than Feed Forward Neural Network on our real database.","","Electronic:978-1-4673-8460-5; POD:978-1-4673-8461-2","10.1109/SAI.2016.7555972","http://ieeexplore.ieee.org/stamp/stamp.jsp?arnumber=7555972","Classification;Discrete Wavelet Transform;Histogram Equalization","Dentistry;Digital filters;Discrete wavelet transforms;Filtering algorithms;Histograms;Lesions;Teeth","dentistry;discrete wavelet transforms;feature extraction;feedforward neural nets;image enhancement;image filtering;learning (artificial intelligence);median filters;medical image processing","average filter;data collection;feature extraction;feedforward neural network;histogram equalization;image enhancement;image preprocessing;k-nearest neighbor classifier;machine learning;median filter;noise removal;teeth periapical lesion prediction;two dimensional discrete wavelet transform","","","","","","","13-15 July 2016","","IEEE","IEEE Conference Publications"
"Comparative analysis of machine learning algorithms in OCR","V. Jain; A. Dubey; A. Gupta; S. Sharma","Dept of IT, Bharati Vidyapeeth's College of Engineering, New Delhi, India","2016 3rd International Conference on Computing for Sustainable Global Development (INDIACom)","20161031","2016","","","1089","1092","The purpose of this research is to implement different machine learning algorithms in optical character recognition. The algorithms used the pixel density of image of handwritten digits as an input. The algorithms when implemented produced the value of labels of each handwritten digit. The value of labels generated, was then matched with the actual value of labels of the MNIST handwritten digits to determine the accuracy of an algorithm. Machine learning algorithms that have been used for this research are NaiÌˆve Bayes, NaiÌˆve Bayes with Laplace Smoothing, Sequential Minimal Optimization, C4.5 decision trees and Logistic Regression. The accuracy for each of the algorithm was calculated and Logistic regression was found out to be the most accurate of them all for handwritten digits.","","","","http://ieeexplore.ieee.org/stamp/stamp.jsp?arnumber=7724430","Logistic Regression;Machine Learning;NaÃ¯ve Bayes;Optical Character Recognition","Algorithm design and analysis;Classification algorithms;Decision trees;Logistics;Machine learning algorithms;Optical character recognition software;Training","Bayes methods;decision trees;handwritten character recognition;image matching;learning (artificial intelligence);optical character recognition;optimisation;regression analysis;smoothing methods","C4.5 decision tree algorithm;MNIST handwritten digits;OCR;image matching;image pixel density;logistic regression algorithm;machine learning algorithm;naiÌˆve Bayes-with-Laplace smoothing algorithm;optical character recognition;sequential minimal optimization algorithm","","","","","","","16-18 March 2016","","IEEE","IEEE Conference Publications"
"Extreme Learning Machines for approximating nonlinear dimensionality reduction mappings: Application to Haptic handwritten signatures","J. J. ValdÃ©s; F. A. Alsulaiman; A. El Saddik","National Research Council Canada, Information and Communications Technologies, Ottawa, Ontario, Canada","2016 International Joint Conference on Neural Networks (IJCNN)","20161103","2016","","","2915","2922","The abundance of computing and mobile devices makes the problem of user identification and verification an essential requirement for many applications. Haptics devices include the sense of touch in the form of kinesthetic and tactile feedback which provide additional features within handwritten signatures. However, they generate high dimensional data and dimensionality reduction techniques become useful for data mining, machine learning and visualization. Nonlinear transformations have been used for this, but in present day scenarios (Big Data, the Internet of Things, massive data streams, etc.) the computation becomes more complex, time consuming or impractical. Moreover, the relationships between the features of the original and the target spaces are more difficult to uncover. Extreme Learning Machines (ELM) are used for approximating nonlinear manifold learning methods in two ways: as a functional representation for implicit methods, and as simpler surrogate models for explicit mapping techniques. In the context of Haptic handwritten signatures, five implicit and explicit nonlinear transformation methods are investigated. In all cases it was found that ELM approximations to the mappings obtained with the original methods exhibit very good behavior and can be used either as functional representations for the implicit methods or as simpler surrogate models for explicit techniques.","","","10.1109/IJCNN.2016.7727568","http://ieeexplore.ieee.org/stamp/stamp.jsp?arnumber=7727568","","Aerospace electronics;Data visualization;Electronic mail;Haptic interfaces;Manifolds;Mobile handsets;Neural networks","data mining;data reduction;formal verification;handwriting recognition;haptic interfaces;identification technology;learning (artificial intelligence)","ELM approximations;complex computation;data mining;dimensional data generation;dimensionality reduction techniques;explicit mapping techniques;extreme learning machines;haptic handwritten signatures;haptics devices;implicit method functional representation;kinesthetic feedback;machine learning;mobile devices;nonlinear dimensionality reduction mappings approximation;nonlinear manifold learning method approximation;nonlinear transformations;surrogate models;tactile feedback;user identification;user verification;visualization","","","","","","","24-29 July 2016","","IEEE","IEEE Conference Publications"
"A machine learning based approach for identifying traumatic brain injury patients for whom a head CT scan can be avoided","S. Molaei; F. K. Korley; S. M. R. Soroushmehr; H. Falk; H. Sair; K. Ward; K. NajarÃ­an","Emergency Medicine Department, University of Michigan, Ann Arbor, MI, USA","2016 38th Annual International Conference of the IEEE Engineering in Medicine and Biology Society (EMBC)","20161018","2016","","","2258","2261","Head CT scan is more often used to evaluate patients with suspected traumatic brain injury (TBI). However, the use of head CT scans in evaluating TBI is costly with low value endeavor. In this paper, we propose a new algorithm and a set of features to help clinicians determine which patients evaluated for TBI need a head CT scan using cost sensitive random forest (CSRF) classifier. We show that random forest (RF) and CSRF are useful methods for identifying patients likely to have a positive head CT scan. The proposed algorithm has superior diagnostic accuracy in comparison to the Canadian head CT algorithm, which is currently the most accurate and widely used algorithm for determining which TBI patients need a head CT scan. In the highest sensitivity (i.e. 100%), our method outperforms the Canadian rule in terms of specificity, accuracy and area under ROC curve using cost sensitive classifier. Clinical implementation of this algorithm can help decrease financial costs associated with Emergency Department evaluations for traumatic brain injury, while decreasing patient exposure to avoidable ionizing radiation.","1557-170X;1557170X","Electronic:978-1-4577-0220-4; POD:978-1-4577-0219-8","10.1109/EMBC.2016.7591179","http://ieeexplore.ieee.org/stamp/stamp.jsp?arnumber=7591179","Canadian head CT rule;Classification;Head CT scan;Random forest;Traumatic brain injury","Brain injuries;Computed tomography;Head;Magnetic heads;Radio frequency;Sensitivity","brain;computerised tomography;image classification;injuries;learning (artificial intelligence);medical image processing","Canadian head CT algorithm;computed tomography;cost sensitive random forest classifier;diagnostic accuracy;head CT scan;ionizing radiation;machine learning-based approach;patient exposure;suspected traumatic brain injury","","","","","","","16-20 Aug. 2016","","IEEE","IEEE Conference Publications"
"Heterogeneous extreme learning machines","J. J. ValdÃ©s","National Research Council Canada, Information and Communications Technologies, Ottawa, Ontario, Canada","2016 International Joint Conference on Neural Networks (IJCNN)","20161103","2016","","","1678","1685","The developments in communication, sensor and computing technologies are generating information at increasing rates and the nature of the data is becoming highly heterogeneous. Accordingly, the objects under study are described by collections of variables of very different kinds (e.g. numeric, non-numeric, images, signals, videos, documents, etc.) with different degrees of imprecision and incompleteness. Many data mining and machine learning methods do not handle heterogeneity well, requiring variables of the same type, information completeness (or imputation), also assuming no imprecision. Extreme learning machines (ELM) are very interesting computational algorithms because of their structural simplicity, their good performance and their speed. Accordingly, extending their scope by making them capable of processing heterogeneous information may increase their attractiveness as a modeling tool for addressing complex problems. ELMs are discussed in the context of heterogeneous data and approaches to build ELMs capable of performing classification and regression tasks in such cases are presented. Their performance is illustrated with real world examples of classification and regression involving heterogeneous information with scalar data described by nominal, ordinal, interval, ratio, and fuzzy variables as well as with entire empirical probability distributions as predictor variables.","","","10.1109/IJCNN.2016.7727400","http://ieeexplore.ieee.org/stamp/stamp.jsp?arnumber=7727400","","Artificial neural networks;Manganese","data mining;feedforward neural nets;fuzzy set theory;learning (artificial intelligence);pattern classification;probability;regression analysis","classification tasks;data mining;fuzzy variables;heterogeneous ELM;heterogeneous data;heterogeneous extreme learning machines;imputation;information completeness;interval variables;machine learning;nominal variables;ordinal variables;predictor variables;probability distributions;ratio variables;regression tasks;scalar data","","","","","","","24-29 July 2016","","IEEE","IEEE Conference Publications"
"Comparative analysis of features based machine learning approaches for phishing detection","A. K. Jain; B. B. Gupta","Department of Computer Engineering, National Institute of Technology, Kurukshetra, India","2016 3rd International Conference on Computing for Sustainable Global Development (INDIACom)","20161031","2016","","","2125","2130","Machine learning based anti-phishing techniques are based on various features extracted from different sources. These features differentiate a phishing website from a legitimate one. Features are taken from various sources like URL, page content, search engine, digital certificate, website traffic, etc, of a website to detect it as a phishing or non-phishing. The websites are declared as phishing sites if the heuristic design of the websites matches with the predefined rules. The accuracy of the anti-phishing solution depends on features set, training data and machine learning algorithm. This paper presents a comprehensive analysis of Phishing attacks, their exploitation, some of the recent machine learning based approaches for phishing detection and their comparative study. It provides a better understanding of the phishing problem, current solution space in machine learning domain, and scope of future research to deal with Phishing attacks efficiently using machine learning based approaches.","","","","http://ieeexplore.ieee.org/stamp/stamp.jsp?arnumber=7724641","Domain Name System;Machine learning;Phishing;Support vector machine;neural networks;soft computing","Data mining;Electronic mail;Feature extraction;Machine learning algorithms;Online banking;Support vector machines;Uniform resource locators","Web sites;computer crime;feature extraction;learning (artificial intelligence)","feature extraction;machine learning;phishing Web site;phishing attack;phishing detection","","","","","","","16-18 March 2016","","IEEE","IEEE Conference Publications"
"A machine learning approach to edge type inference in Internet AS graphs","J. S. Varghese; Lu Ruan","Department of Computer Science, Iowa State University, United States of America","2016 IEEE Conference on Computer Communications Workshops (INFOCOM WKSHPS)","20160908","2016","","","71","76","The Internet AS topology can be represented by AS graphs where nodes represent ASes and edges represent business relationships between ASes. AS relationship can be broadly classified into two types: provider-to-customer (p2c) and peer-to-peer (p2p). In this paper we present a machine learning approach to edge type inference in AS graphs. Given an AS graph derived from publicly available data source, we use the Gentle AdaBoost machine learning algorithm to train a classifier that classifies the edge types (p2c and p2p) based on a set of node features. We use our method to train classifiers for three AS graphs derived from different data sources-a BGP graph, a traceroute graph, and an IRR graph. The three classifiers achieve 93.97%-97.73% accuracy when validated against ground truth and achieve 81.76%-95.66% accuracy when validated against CAIDA's AS relationship inference dataset. We merge the three individual graphs to obtain a combined graph and propose a method to compute edge types in the combined graph. We analyze the characteristics of the three individual graphs and the combined graph and show that combining the three individual graphs gives us a significantly more complete view of both the p2p and p2c ecosystems in the Internet.","","Electronic:978-1-4673-9955-5; POD:978-1-4673-9956-2","10.1109/INFCOMW.2016.7562048","http://ieeexplore.ieee.org/stamp/stamp.jsp?arnumber=7562048","","Data mining;Internet;Machine learning algorithms;Peer-to-peer computing;Routing;Topology;Training","Internet;graph theory;inference mechanisms;learning (artificial intelligence);peer-to-peer computing;telecommunication network topology","AS relationship;BGP graph;IRR graph;Internet AS graphs;Internet AS topology;business relationships;edge type inference;gentle AdaBoost machine learning algorithm;machine learning approach;node features;peer-to-peer;provider-to-customer;publicly available data source;traceroute graph","","","","","","","10-14 April 2016","","IEEE","IEEE Conference Publications"
"LBP-HF features and machine learning applied for automated monitoring of insulators for overhead power distribution lines","P. S. Prasad; B. P. Rao","Department of ECE, MVGR College of Engineering, Vizianagaram, India","2016 International Conference on Wireless Communications, Signal Processing and Networking (WiSPNET)","20160915","2016","","","808","812","With ever-increasing awareness on quality and reliable power distribution, the research in the area of automation of distribution system has great relevance from the practical point of view. Electric power utilities throughout the world are more and more adopting computer aided control, monitoring and management of electric power distribution system to offer improved services to the consumers of electricity. The purpose of on-line condition monitoring of cables or any electrical equipment is to predict possible failures before they actually occur. With phenomenal growth of distribution network even to remote areas, the traditional methods of inspecting the lines by foot-patrolling and pole-climbing to check them in close proximity do not seem to be viable. Since the damaged insulators of the distribution system affects the performance of distribution system significantly in terms of reduction in voltage, aerial patrolling has been adopted in developed countries for the purpose of insulator monitoring. The development of an efficient and alternative method for insulator condition monitoring uses image processing and machine learning techniques and is found to be a sustainable method. This work covers automatic defect detection and classification of insulator systems of electric power lines using vision-based techniques.","","","10.1109/WiSPNET.2016.7566245","http://ieeexplore.ieee.org/stamp/stamp.jsp?arnumber=7566245","Classification;LBP-HF;feature extraction;rotation invariance","Condition monitoring;Discrete Fourier transforms;Feature extraction;Histograms;Insulators;Monitoring;Support vector machines","insulators;learning (artificial intelligence);power engineering computing;power overhead lines;power system measurement","LBP-HF features;automatic defect detection;electric power lines;insulator automated monitoring;insulator system classification;machine learning;overhead power distribution lines;vision-based techniques","","","","","","","23-25 March 2016","","IEEE","IEEE Conference Publications"
"Airline Passenger Profiling Based on Fuzzy Deep Machine Learning","Y. J. Zheng; W. G. Sheng; X. M. Sun; S. Y. Chen","College of Computer Science and Technology, Zhejiang University of Technology, Hangzhou 310023, China.","IEEE Transactions on Neural Networks and Learning Systems","","2016","PP","99","1","13","Passenger profiling plays a vital part of commercial aviation security, but classical methods become very inefficient in handling the rapidly increasing amounts of electronic records. This paper proposes a deep learning approach to passenger profiling. The center of our approach is a Pythagorean fuzzy deep Boltzmann machine (PFDBM), whose parameters are expressed by Pythagorean fuzzy numbers such that each neuron can learn how a feature affects the production of the correct output from both the positive and negative sides. We propose a hybrid algorithm combining a gradient-based method and an evolutionary algorithm for training the PFDBM. Based on the novel learning model, we develop a deep neural network (DNN) for classifying normal passengers and potential attackers, and further develop an integrated DNN for identifying group attackers whose individual features are insufficient to reveal the abnormality. Experiments on data sets from Air China show that our approach provides much higher learning ability and classification accuracy than existing profilers. It is expected that the fuzzy deep learning approach can be adapted for a variety of complex pattern analysis tasks.","2162-237X;2162237X","","10.1109/TNNLS.2016.2609437","http://ieeexplore.ieee.org/stamp/stamp.jsp?arnumber=7577870","Biogeography-based optimization (BBO);Pythagorean fuzzy set (PFS).;deep Boltzmann machine (DBM);deep learning;evolutionary neural networks;passenger profiling","Airports;Atmospheric modeling;Fuzzy sets;Inspection;Machine learning;Terrorism","","","","","","","","20160927","","","IEEE","IEEE Early Access Articles"
"Ultra-Lightweight Malware Detection of Android Using 2-Level Machine Learning","L. Ma; Y. Yang; X. Wang; J. He","Coll. of Comput., Nat. Univ. of Defense Technol., Changsha, China","2016 3rd International Conference on Information Science and Control Engineering (ICISCE)","20161103","2016","","","729","733","As Android becoming the most popular smart phone operating system, malicious applications running on the Android platform appears very frequently and poses the major threat to the security of Android. Considering the resources of smart phone are severely limited, a stable, simple and quick malware detection method for Android is indispensable. In this paper, we propose an ultra-lightweight malware detection method which is able to detect unknown malicious Android applications with limited resources. Firstly, a few features are extracted and divided into three sets for every application. Then, these three feature sets are embedded in the corresponding joint vector spaces and we can get apps's feature vectors. After that, feature vectors of every vector space are classified using a machine learning algorithm. Finally, the three classification results are considered as a group and embedded in a new space and classified again. We evaluate our detection with 3427 malicious samples and 1550 benign applications. Experimental results show that our detection approach has a stable performance that the detection accuracy (true-positive rate) is always higher than 98% and the detection procedure costs only 30ms per sample.","","","10.1109/ICISCE.2016.161","http://ieeexplore.ieee.org/stamp/stamp.jsp?arnumber=7726258","2-levelmachine learning;Android;SVM;smart-phone malware detection;ultra-lightweight","Androids;Feature extraction;Humanoid robots;Machine learning algorithms;Malware;Smart phones;Support vector machines","Android (operating system);invasive software;learning (artificial intelligence);smart phones;vectors","2-level machine learning;feature vectors;joint vector spaces;malicious Android applications;security;smart phone operating system;ultra-lightweight malware detection","","","","","","","8-10 July 2016","","IEEE","IEEE Conference Publications"
"Comparison of machine learning algorithms for classification of Penaeid prawn species","V. Sucharita; S. Jyothi; P. V. Rao","K.L. University, Vaddeswaram, India","2016 3rd International Conference on Computing for Sustainable Global Development (INDIACom)","20161031","2016","","","1610","1613","Classification of Penaeid prawn species is an important research problem in the area of aquaculture. In literature, many ML algorithms have been proposed for classification. In this paper, performance and usability of penaied prawn species are compared using K-Nearest Neighbourhood (KNN) algorithm, Support Vector Machines (SVM) and Back Propagation Neural Networks (BPNN). For experimental evaluation a dataset containing 100 samples of each species are classified. Also the classification accuracy of each species is analyzed using the above mentioned three classifiers. Experimental results indicate that the SVM out performs KNN classifier and ANN classifiers and may potentially fill gap for the current use or for future.","","","","http://ieeexplore.ieee.org/stamp/stamp.jsp?arnumber=7724539","BPNN;Classifier;KNN;Neural Network;Penaeid Prawns;SVM","Decision support systems;Handheld computers;Support vector machines","aquaculture;backpropagation;learning (artificial intelligence);neural nets;pattern classification;support vector machines","BPNN;K-nearest neighbourhood algorithm;KNN algorithm;KNN classifier;ML algorithms;SVM;aquaculture;back propagation neural networks;machine learning algorithms;penaeid prawn species classification;support vector machines","","","","","","","16-18 March 2016","","IEEE","IEEE Conference Publications"
"Machine Learning In Incremental Sheet Forming","D. D. Stoerkle; P. Seim; L. Thyssen; B. Kuhlenkoetter","","Proceedings of ISR 2016: 47st International Symposium on Robotics","20160905","2016","","","1","7","Within this article, the authors propose a new methodology to increase the geometric accuracy in the robot-based, incremental sheet forming process ROBOFORMING. This process addresses the production of sheet metal components in small lot sizes and prototypes. In ROBOFORMING, two cooperating industrial robots are applied for the kinematic-based forming of sheet metal workpieces. Hereby, workpiece-dependent tooling and dies are omitted. This offers very high flexibility for the geometrical design of the sheet metal workpieces. One of the major drawbacks of incremental sheet forming processes is the low geometrical accuracy, which limits the widespread industrial application of these. Responding to these constraints, the authors propose the application of machine learning techniques to increase the geometric accuracy in incremental sheet forming processes. In this context, they present a learning approach which applies reinforcement learning as a flexible and promising solution.","","Paper:978-3-8007-4231-8","","http://ieeexplore.ieee.org/stamp/stamp.jsp?arnumber=7559184","","","","","","","","","","","21-22 June 2016","","VDE","VDE Conference Publications"
