"Mechanism for Constructing the Dynamic Collision Avoidance Knowledge-Base by Machine Learning","L. Li; S. Yang; W. Zhou; G. Chen","Navig. Coll., Jimei Univ., Xiamen, China","2010 International Conference on Manufacturing Automation","20110120","2010","","","279","285","Machine learning is the key technology for constructing a dynamic collision avoidance knowledge-base and realizing the Personifying Intelligent Decision-making for Vessel Collision Avoidance (short form for PIDVCA). Based on the aim and realization method of PIDVCA, this thesis puts forwards a Meta-Knowledge representation integrated method, which is carried by procedural knowledge, combined with the knowledge of the facts on basis of the database technology and the knowledge of the cause and effect on basis of the formation rule, integrated by the intelligent decision-making chart and tree or rule set, The mechanism for constructing a dynamic collision avoidance knowledge base by the integrated machine learning strategy are discussed by combination of collision avoidance simulation instance. Simulation results show that the dynamic collision avoidance knowledge-base can make the effects of the PIDVCA.","","Electronic:978-0-7695-4293-5; POD:978-1-4244-9018-9","10.1109/ICMA.2010.4","http://ieeexplore.ieee.org/stamp/stamp.jsp?arnumber=5695192","PIDVCA;dynamic collision avoidance knowledge base;heterogeneous knowledge representation;machine learning","","collision avoidance;decision making;knowledge based systems;knowledge representation;learning (artificial intelligence);ships","PIDVCA;dynamic collision avoidance knowledge-base construction;machine learning;meta-knowledge representation integrated method;personifying intelligent decision making;rule set;vessel collision avoidance","","0","","10","","","13-15 Dec. 2010","","IEEE","IEEE Conference Publications"
"Pre-Processing Structured Data for Standard Machine Learning Algorithms by Supervised Graph Propositionalization - A Case Study with Medicinal Chemistry Datasets","T. Karunaratne; H. Bostrom; U. Norinder","Dept. of Comput. & Syst. Sci., Stockholm Univ., Stockholm, Sweden","2010 Ninth International Conference on Machine Learning and Applications","20110204","2010","","","828","833","Graph propositionalization methods can be used to transform structured and relational data into fixed-length feature vectors, enabling standard machine learning algorithms to be used for generating predictive models. It is however not clear how well different propositionalization methods work in conjunction with different standard machine learning algorithms. Three different graph propositionalization methods are investigated in conjunction with three standard learning algorithms: random forests, support vector machines and nearest neighbor classifiers. An experiment on 21 datasets from the domain of medicinal chemistry shows that the choice of propositionalization method may have a significant impact on the resulting accuracy. The empirical investigation further shows that for datasets from this domain, the use of the maximal frequent item set approach for propositionalization results in the most accurate classifiers, significantly outperforming the two other graph propositionalization methods considered in this study, SUBDUE and MOSS, for all three learning methods.","","Electronic:978-0-7695-4300-0; POD:978-1-4244-9211-4","10.1109/ICMLA.2010.128","http://ieeexplore.ieee.org/stamp/stamp.jsp?arnumber=5708951","graph propositionalization;k-nearest neighbor;medicinal chemistry;random forests;structured data;support-vector machines","Chemistry;Classification algorithms;Data mining;Itemsets;Kernel;Machine learning;Machine learning algorithms","chemistry computing;graph theory;learning (artificial intelligence);pattern classification;support vector machines","MOSS;SUBDUE;fixed-length feature vectors;medicinal chemistry datasets;nearest neighbor classifiers;random forests;standard machine learning algorithms;structured data preprocessing;supervised graph propositionalization method;support vector machines","","1","","27","","","12-14 Dec. 2010","","IEEE","IEEE Conference Publications"
"Intracranial pressure level prediction in traumatic brain injury by extracting features from multiple sources and using machine learning methods","W. Chen; C. Cockrell; K. R. Ward; K. Najarian","Department of Computer Science and VCURES","2010 IEEE International Conference on Bioinformatics and Biomedicine (BIBM)","20110204","2010","","","510","515","This paper proposes a non-intrusive method to predict/estimate the intracranial pressure (ICP) level based on features extracted from multiple sources. Specifically, these features include midline shift measurement and texture features extracted from CT slices, as well as patient's demographic information, such as age. Injury Severity Score is also considered. After aggregating features from slices, a feature selection scheme is applied to select the most informative features. Support vector machine (SVM) is used to train the data and build the prediction model. The validation is performed with 10 fold cross validation. To avoid overfitting, all the feature selection and parameter selection are done using training data during the 10 fold cross validation for evaluation. This results an nested cross validation scheme implemented using Rapidminer. The final classification result shows the effectiveness of the proposed method in ICP prediction.","","Electronic:978-1-4244-8307-5; POD:978-1-4244-8306-8","10.1109/BIBM.2010.5706619","http://ieeexplore.ieee.org/stamp/stamp.jsp?arnumber=5706619","classification;intracranial pressure prediction;nested cross validation;texture analysis","Blood;Brain;Computed tomography;Entropy;Feature extraction;Injuries;Iterative closest point algorithm","blood pressure measurement;brain;computerised tomography;feature extraction;image classification;image texture;learning (artificial intelligence);medical image processing;support vector machines","CT slices;Rapidminer;feature extraction;feature selection;final classification;injury severity score;intracranial pressure level prediction;machine learning;midline shift measurement;multiple sources;overfitting;parameter selection;patient demographic information;support vector machine;texture features;traumatic brain injury","","2","","13","","","18-21 Dec. 2010","","IEEE","IEEE Conference Publications"
"Improving the accuracy of intrusion detection systems by using the combination of machine learning approaches","H. Sarvari; M. M. Keikha","Department of computer, Faculty engineering, University of Isfahan, Isfahan, Iran","2010 International Conference of Soft Computing and Pattern Recognition","20110113","2010","","","334","337","An Intrusion detection system is designed to classify the system activities into normal and abnormal. We use a combination of machine learning approaches as to detect the system attacks. The experimental results of the study show that increasing the number of classifiers has a threshold limit and the system accuracy will remain constant if the number of classifiers goes beyond this limit. The determination of the threshold limit is tentative. This article, also, presents a solution for unbalanced data of some attacks. The comparison of the results with other similar articles proves the efficiency of the presented system.","","Electronic:978-1-4244-7896-5; POD:978-1-4244-7897-2","10.1109/SOCPAR.2010.5686163","http://ieeexplore.ieee.org/stamp/stamp.jsp?arnumber=5686163","Decision;IDS;KNN;Machine Learning;Neural Network;Tree;Unbalanced Datal","Accuracy;Artificial neural networks;Decision trees;Intrusion detection;Machine learning;Support vector machines;Training","learning (artificial intelligence);security of data","intrusion detection system;machine learning;system activity classification;system attack detection","","3","","16","","","7-10 Dec. 2010","","IEEE","IEEE Conference Publications"
"Plant Species Classification Using a 3D LIDAR Sensor and Machine Learning","U. Weiss; P. Biber; S. Laible; K. Bohlmann; A. Zell","Corp. Sector Res. & Adv. Eng., Robert Bosch GmbH, Schwieberdingen, Germany","2010 Ninth International Conference on Machine Learning and Applications","20110204","2010","","","339","345","In the domain of agricultural robotics, one major application is crop scouting, e.g., for the task of weed control. For this task a key enabler is a robust detection and classification of the plant and species. Automatically distinguishing between plant species is a challenging task, because some species look very similar. It is also difficult to translate the symbolic high level description of the appearances and the differences between the plants used by humans, into a formal, computer understandable form. Also it is not possible to reliably detect structures, like leaves and branches in 3D data provided by our sensor. One approach to solve this problem is to learn how to classify the species by using a set of example plants and machine learning methods. In this paper we are introducing a method for distinguishing plant species using a 3D LIDAR sensor and supervised learning. For that we have developed a set of size and rotation invariant features and evaluated experimentally which are the most descriptive ones. Besides these features we have also compared different learning methods using the toolbox Weka. It turned out that the best methods for our application are simple logistic regression functions, support vector machines and neural networks. In our experiments we used six different plant species, typically available at common nurseries, and about 20 examples of each species. In the laboratory we were able to identify over 98% of these plants correctly.","","Electronic:978-0-7695-4300-0; POD:978-1-4244-9211-4","10.1109/ICMLA.2010.57","http://ieeexplore.ieee.org/stamp/stamp.jsp?arnumber=5708854","3D laser sensor;agricultural robotics;plant classification;supervised learning","Agriculture;Artificial neural networks;Histograms;Lasers;Robot sensing systems;Three dimensional displays","agriculture;biology computing;botany;learning (artificial intelligence);neural nets;optical radar;robots;support vector machines","3D LIDAR sensor;Weka;agricultural robotics;crop scouting;logistic regression;machine learning;neural networks;plant species classification;supervised learning;support vector machines","","2","","17","","","12-14 Dec. 2010","","IEEE","IEEE Conference Publications"
"Machine learning based Call Admission Control approaches: A comparative study","A. Bashar; G. Parr; S. McClean; B. Scotney; D. Nauck","School of Computing and Information Engineering, University of Ulster, Coleraine, UK BT52 1SA","2010 International Conference on Network and Service Management","20110117","2010","","","431","434","The importance of providing guaranteed Quality of Service (QoS) cannot be overemphasised, especially in the NGN environment which supports converged services on a common IP transport network. Call Admission Control (CAC) mechanisms do provide QoS to class-based services in a proactive manner. However, due to the factors of complexity, scale and dynamicity of NGN, Machine Learning techniques are favoured to analytical approaches for providing autonomous CAC. This paper is an effort to compare the performance of two such approaches - Neural Networks (NN) and Bayesian Networks (BN), to model the network behaviour and to estimate QoS metrics to be used in the CAC algorithm. It provides a way to find the optimum model training size for accurate predictions. Performance comparison is based on a wide range of experiments through a simulated network in Opnet. The outcome of this comparative study provides some interesting insights into the behaviour of NN and BN models and how they can be utilised for better CAC implementations.","2165-9605;21659605","Electronic:978-1-4244-8909-1; POD:978-1-4244-8910-7; USB:978-1-4244-8908-4","10.1109/CNSM.2010.5691261","http://ieeexplore.ieee.org/stamp/stamp.jsp?arnumber=5691261","Bayesian Networks;Call Admission Control;Machine Learning;Neural Networks;Quality of Service","Accuracy;Artificial neural networks;Delay;Machine learning;Predictive models;Quality of service;Training","IP networks;belief networks;learning (artificial intelligence);neural nets;next generation networks;quality of service;telecommunication congestion control","Bayesian networks;CAC mechanisms;IP transport network;NGN environment;QoS metrics estimation;call admission control;class based services;machine learning;neural networks;optimum model training;quality of service","","6","","16","","","25-29 Oct. 2010","","IEEE","IEEE Conference Publications"
"Cycle-Time Key Factor Identification and Prediction in Semiconductor Manufacturing Using Machine Learning and Data Mining","Y. Meidan; B. Lerner; G. Rabinowitz; M. Hassoun","Department of Industrial Engineering and Management, Ben-Gurion University of the Negev, Beer-Sheva, Israel","IEEE Transactions on Semiconductor Manufacturing","20110502","2011","24","2","237","248","Within the complex and competitive semiconductor manufacturing industry, lot cycle time (CT) remains one of the key performance indicators. Its reduction is of strategic importance as it contributes to cost decreasing, time-to-market shortening, faster fault detection, achieving throughput targets, and improving production-resource scheduling. To reduce CT, we suggest and investigate a data-driven approach that identifies key factors and predicts their impact on CT. In our novel approach, we first identify the most influential factors using conditional mutual information maximization, and then apply the selective naive Bayesian classifier (SNBC) for further selection of a minimal, most discriminative key-factor set for CT prediction. Applied to a data set representing a simulated fab, our SNBC-based approach improves the accuracy of CT prediction in nearly 40% while narrowing the list of factors from 182 to 20. It shows comparable accuracy to those of other machine learning and statistical models, such as a decision tree, a neural network, and multinomial logistic regression. Compared to them, our approach also demonstrates simplicity and interpretability, as well as speedy and efficient model training. This approach could be implemented relatively easily in the fab promoting new insights to the process of wafer fabrication.","0894-6507;08946507","","10.1109/TSM.2011.2118775","http://ieeexplore.ieee.org/stamp/stamp.jsp?arnumber=5719296","Cycle time;data mining;machine learning;production management;semiconductor manufacturing","Accuracy;Classification algorithms;Data models;Entropy;Manufacturing;Semiconductor device modeling;Uncertainty","Bayes methods;data mining;decision trees;learning (artificial intelligence);neural nets;regression analysis;scheduling;semiconductor device manufacture","cycle-time key factor identification;data mining;decision tree;fault detection;machine learning;multinomial logistic regression;mutual information maximization;neural network;production-resource scheduling;selective naive Bayesian classifier;semiconductor manufacturing industry;wafer fabrication","","9","2","38","","20110222","May 2011","","IEEE","IEEE Journals & Magazines"
"The Influence Machine: Nonnegative Instance-Space Learning with Differentiated Regularization","J. Zhang","CS Dept., Louisiana State Univ., Baton Rouge, LA, USA","2010 Ninth International Conference on Machine Learning and Applications","20110204","2010","","","861","866","We introduce a new method for classification called the influence machine. The influence machine assigns influence powers to the instances in the training sample so that they can apply their influence to other instances through the connections between the instances specified by a connection matrix. A new instance is classified to be positive if the overall influence it receives is positive and vice versa. Similar to support vector machine (SVM), the influence machine selects a small subset of the training instances to give influence power. However, this selection is very different from how the support vectors are selected by SVM. Experiment results show that the classification performance of the influence machine is comparable to that of the SVM. In a few cases, the influence machine shows much better classification accuracy. The influence machine has other advantages: any similarity matrix can be applied with the influence machine, not like SVM which requires that the kernel be positive definite. Furthermore, the influence machine uses linear optimization, instead of the quadratic optimization used by SVM. It may be more suitable for large scale learning problems.","","Electronic:978-0-7695-4300-0; POD:978-1-4244-9211-4","10.1109/ICMLA.2010.134","http://ieeexplore.ieee.org/stamp/stamp.jsp?arnumber=5708957","Differentiated Regularization;Influence Machine;Instance-space Learning","Accuracy;Kernel;Loss measurement;Machine learning;Optimization;Support vector machines;Training","learning (artificial intelligence);pattern classification;quadratic programming;support vector machines","differentiated regularization;influence machine;nonnegative instance space learning;pattern classification;quadratic optimization;support vector machine","","0","","10","","","12-14 Dec. 2010","","IEEE","IEEE Conference Publications"
"The effeciency of data types for classification performance of Machine Learning Techniques for screening β-Thalassemia","P. Paokanta; M. Ceccarelli; S. Srichairatanakool","Department of Knowledge, Management, Collage of Arts, Media and Technology, Chiang Mai University, Chiang Mai, Thailand","2010 3rd International Symposium on Applied Sciences in Biomedical and Communication Technologies (ISABEL 2010)","20110128","2010","","","1","4","Performance of classification methods using Machine Learning Techniques majority depends on the quality of data were used in learning. The transformation techniques are used to increase the efficiency of classification because each type of data is suitable for different classification techniques. This study is aimed at providing comparative performance of different classification techniques by changing the type of data to find the appropriate type of data for each technique. The ß-Thalassemia data is used for classifying genotypes of ß-Thalassemia patients. The results of this study show that the types of data are Nominal scale which can be used as well for Bayesian Networks (BNs) and Multinomial Logistic Regression with the percentage of accuracy 85.83 and 84.25 respectively. Moreover, the data types which such as Interval scale can be used appropriately for K-Nearest Neighbors (KNN), Multi-Layer Perceptron (MLP) and NaiveBayes with the percentage of accuracy 88.98, 87.40 and 84.25 respectively. In the future, we will study the impacts of data separation to be used for classifying genotypes of patients with Thalassemia using the other classification techniques.","2325-5315;23255315","DVD:978-1-4244-8130-9; Electronic:978-1-4244-8132-3; POD:978-1-4244-8131-6","10.1109/ISABEL.2010.5702769","http://ieeexplore.ieee.org/stamp/stamp.jsp?arnumber=5702769","ß-Thalassemia;Bayesian networks;Classification Techniques;K-Nearest Neighbors;Multi-Layer Perceptron;Multinomial Logistic Regression;NaiveBayes","","belief networks;cellular biophysics;data mining;genetics;learning (artificial intelligence);multilayer perceptrons;patient care;pattern classification;regression analysis","Bayesian network;data types classification;k-nearest neighbor;machine learning technique;multilayer perceptron;multinomial logistic regression;screening β-Thalassemia","","1","","15","","","7-10 Nov. 2010","","IEEE","IEEE Conference Publications"
"Automated Static Code Analysis for Classifying Android Applications Using Machine Learning","A. Shabtai; Y. Fledel; Y. Elovici","Dept. of Inf. Syst. Eng., Ben-Gurion Univ. of the Negev, Beer-Sheva, Israel","2010 International Conference on Computational Intelligence and Security","20110120","2010","","","329","333","In this paper we apply Machine Learning (ML) techniques on static features that are extracted from Android's application files for the classification of the files. Features are extracted from Android's Java byte-code (i.e.,.dex files) and other file types such as XML-files. Our evaluation focused on classifying two types of Android applications: tools and games. Successful differentiation between games and tools is expected to provide positive indication about the ability of such methods to learn and model Android benign applications and potentially detect malware files. The results of an evaluation, performed using a test collection comprising 2,285 Android .apk files, indicate that features, extracted statically from .apk files, coupled with ML classification algorithms can provide good indication about the nature of an Android application without running the application, and may assist in detecting malicious applications. This method can be used for rapid examination of Android .apks and informing of suspicious applications.","","Electronic:978-0-7695-4297-3; POD:978-1-4244-9114-8","10.1109/CIS.2010.77","http://ieeexplore.ieee.org/stamp/stamp.jsp?arnumber=5696292","Android;Machine Learning;Malware;Mobile Devices;Security;Static analysis","","Java;XML;file organisation;invasive software;learning (artificial intelligence);mobile computing;mobile handsets;operating systems (computers);pattern classification;program diagnostics","Android application;Java byte-code;ML classification algorithm;XML file;automated static code analysis;file classification;machine learning;malicious application detection;malware file;operating system;smart phone;static feature extraction","","33","2","30","","","11-14 Dec. 2010","","IEEE","IEEE Conference Publications"
"Metrics for characterizing machine learning-based hotspot detection methods","J. Y. Wuu; F. G. Pikus; M. Marek-Sadowska","Department of Electrical and Computer Engineering, University of California, Santa Barbara, CA USA","2011 12th International Symposium on Quality Electronic Design","20110519","2011","","","1","6","Machine learning techniques have recently been applied to the problem of lithographic hotspot detection. It is widely believed that they are capable of identifying hotspot patterns unknown to the trained model. The quality of a machine learning method is conventionally measured by the accuracy rates determined from experiments employing random partitioning of benchmark samples into training and testing sets. In this paper, we demonstrate that these accuracy rates may not reflect the predictive capability of a method. We introduce two metrics - the predictive and memorizing accuracy rates - that quantitatively characterize the method's capability to capture hotspots. We also claim that the number of false alarms per detected hotspot reflects both the method's performance and the difficulty of detecting hotspots in the test set. By adopting the proposed metrics, a designer can conduct a fair comparison between different hotspot detection tools and adopt the one better suited to the verification needs.","1948-3287;19483287","Electronic:978-1-61284-914-0; POD:978-1-61284-913-3","10.1109/ISQED.2011.5770713","http://ieeexplore.ieee.org/stamp/stamp.jsp?arnumber=5770713","DFM;Design for manufacturability;characterization methodology;hotspot detection;machine learning;printability","Accuracy;Encoding;Layout;Machine learning;Measurement;Testing;Training","design for manufacture;learning (artificial intelligence);lithography","hotspot detection tool;hotspot pattern identification;lithographic hotspot detection;machine learning;testing set","","1","1","13","","","14-16 March 2011","","IEEE","IEEE Conference Publications"
"Machine Learning Techniques for Passive Network Inventory","J. Francois; H. Abdelnur; R. State; O. Festor","MADYNES - INRIA Nancy-Grand Est, France","IEEE Transactions on Network and Service Management","20101217","2010","7","4","244","257","Being able to fingerprint devices and services, i.e., remotely identify running code, is a powerful service for both security assessment and inventory management. This paper describes two novel fingerprinting techniques supported by isomorphic based distances which are adapted for measuring the similarity between two syntactic trees. The first method leverages the support vector machines paradigm and requires a learning stage. The second method operates in an unsupervised manner thanks to a new classification algorithm derived from the ROCK and QROCK algorithms. It provides an efficient and accurate classification. We highlight the use of such classification techniques for identifying the remote running applications. The approaches are validated through extensive experimentations on SIP (Session Initiation Protocol) for evaluating the impact of the different parameters and identifying the best configuration before applying the techniques to network traces collected by a real operator.","1932-4537;19324537","","10.1109/TNSM.2010.1012.0352","http://ieeexplore.ieee.org/stamp/stamp.jsp?arnumber=5668980","Fingerprinting;SVM;inventory management;syntactic tree","Clustering algorithms;Fingerprint identification;Object recognition;Protocols;Support vector machines;Syntactics","fingerprint identification;learning (artificial intelligence);pattern classification;security of data;signalling protocols;support vector machines","QROCK algorithm;SIP;classification algorithm;fingerprinting techniques;inventory management;isomorphic based distances;machine learning;passive network inventory;security assessment;session initiation protocol;support vector machines;syntactic trees","","3","","33","","","December 2010","","IEEE","IEEE Journals & Magazines"
