"Symbolic execution of complex program driven by machine learning based constraint solving","X. Li; Y. Liang; H. Qian; Y. Q. Hu; L. Bu; Y. Yu; X. Chen; X. Li","State Key Laboratory for Novel Software Technology, Department of Computer Science and Technology, Nanjing University, Nanjing, Jiangsu, P.R. China","2016 31st IEEE/ACM International Conference on Automated Software Engineering (ASE)","20161006","2016","","","554","559","Symbolic execution is a widely-used program analysis technique. It collects and solves path conditions to guide the program traversing. However, due to the limitation of the current constraint solvers, it is difficult to apply symbolic execution on programs with complex path conditions, like nonlinear constraints and function calls. In this paper, we propose a new symbolic execution tool MLB to handle such problem. Instead of relying on the classical constraint solving, in MLB, the feasibility problems of the path conditions are transformed into optimization problems, by minimizing some dissatisfaction degree. The optimization problems are then handled by the underlying optimization solver through machine learning guided sampling and validation. MLB is implemented on the basis of Symbolic PathFinder and encodes not only the simple linear path conditions, but also nonlinear arithmetic operations, and even black-box function calls of library methods, into symbolic path conditions. Experiment results show that MLB can achieve much better coverage on complex real-world programs.","","","","http://ieeexplore.ieee.org/stamp/stamp.jsp?arnumber=7582790","Complicated Path Condition;Constraint Solving;Machine Learning;Symbolic Execution","Algorithm design and analysis;Engines;Java;Libraries;Machine learning algorithms;Optimization;Transforms","arithmetic;constraint handling;learning (artificial intelligence);optimisation;program diagnostics","MLB;black-box function calls;complex path conditions;complex program;constraint solvers;constraint solving;dissatisfaction degree;library methods;linear path conditions;machine learning;nonlinear arithmetic operations;nonlinear constraints;optimization problems;optimization solver;program analysis;symbolic PathFinder;symbolic execution tool;symbolic path conditions","","","","","","","3-7 Sept. 2016","","IEEE","IEEE Conference Publications"
"Improvements of Classification Accuracy of Film Defects by Using GPU-accelerated Image Processing and Machine Learning Frameworks","H. Ando; Y. Niitsu; M. Hirasawa; H. Teduka; M. Yajima","Dept. of Comput. Sci. & Eng., Univ. of Yamanashi, Kofu, Japan","2016 Nicograph International (NicoInt)","20160912","2016","","","83","87","Research on image classification for natural images are quite actively worked on and recent achievements using deep learning techniques are tremendous. On the other hand, image classification techniques of defects in industrial products are mostly kept secret, partly because defective images contain very sensitive information about the products and the confidential manufacturing technologies. With the help of a leading company in a visual inspection of film defects, we investigated the effectivity of using machine learning techniques for classification of defect images. We also made use of GPU to accelerate both image processing to assist detection of defects and machine learning. We propose the combination of deep neural networks with random forest classifier for image classification of film defects, which performed better than using either of the two techniques alone.","","","10.1109/NicoInt.2016.15","http://ieeexplore.ieee.org/stamp/stamp.jsp?arnumber=7564050","Deep Learning;Film Defects;GPU;Image Classification;Random Forest","Feature extraction;Films;Graphics processing units;Image classification;Inspection;Machine learning;Visualization","films;graphics processing units;image classification;inspection;learning (artificial intelligence);neural nets;product quality;production engineering computing","GPU;deep learning technique;deep neural network;film defect classification;graphics processing unit;image processing;industrial product;machine learning;manufacturing technology;natural image classification;random forest classifier;visual inspection","","","","","","","6-8 July 2016","","IEEE","IEEE Conference Publications"
"Machine learning techniques to build geometrical transformations for object matching a review","P. A. Jadhav; P. N. Chatur","Department of Computer science and Engineering, Government College of Engineering, Amravati (MH), India","2016 3rd International Conference on Advanced Computing and Communication Systems (ICACCS)","20161010","2016","01","","1","6","Image matching or object matching is one of the cutting edge research fields in machine learning or computer vision domain. Whereas aim of image matching techniques is to build geometrical transformations over source image and target image, videos, real time moving object to extract similarity measure. Several research methods devised for image matching but efficiency of techniques is bounded with various parameters such as image rotation, speed, blurriness, quality etc., these parameters are important while understanding and devising robust image matching techniques. Study and analysis of image matching parameters is highly important while learning and understanding, predicting performance when time is a limiting factor for implementation. Several approaches have been presented to achieve efficiency over real time object matching. Now in this paper we have presented fundamentals of object matching based on geometrical transformation to match object. Comprehensive review of existing methods with analysis of image matching parameters is presented to determine the limitations of existing methods. This review also addresses comparative study of existing image matching techniques to generalize criteria for design of robust technique.","","","10.1109/ICACCS.2016.7586381","http://ieeexplore.ieee.org/stamp/stamp.jsp?arnumber=7586381","Computer Vision;Geometrical Transformations;Image;Machine Learning;Object Matching;Rotation","Communication systems;Computer vision;Feature extraction;Image color analysis;Image edge detection;Image matching;Image registration","computer vision;geometry;image matching;image motion analysis;learning (artificial intelligence);object recognition;real-time systems","computer vision;geometrical transformations;image matching;machine learning;object matching;real time moving object","","","","","","","22-23 Jan. 2016","","IEEE","IEEE Conference Publications"
"Combining Crop Proportion Phenology Index models with machine learning algorithms for estimating winter wheat areas","L. Li; Y. Z. Pan; Q. C. Xin","College of Life Science, Beijing Normal University, 100875, China","2016 IEEE International Geoscience and Remote Sensing Symposium (IGARSS)","20161103","2016","","","7137","7140","Monitoring crop areas is a key issue in remote sensing studies. A Crop Proportion Phenology Index (CPPI) model has previously been developed for estimation of winter wheat areas. Here we test the CPPI model in different areas using remote sensing data for varied kernel functions, including linear regression (LR), Artificial Neural Network (ANN), and Support Vector Regression (SVR). The differences of the model performances among different kernel functions were found to be small for areas with simple planting structure. For areas where multiple crop types have similar phenology cycles, the non-linear model of ANN was found to perform the best. This study indicates that the CPPI model can be applied to map winter wheat distribution in areas with complex planting structures, thus it holds promises for estimating fractional areas of winter wheat areas over large geographic areas.","","","10.1109/IGARSS.2016.7730862","http://ieeexplore.ieee.org/stamp/stamp.jsp?arnumber=7730862","CPPI;MODIS;fractional crop area;kernel functions;time series","Agriculture;Artificial neural networks;Kernel;MODIS;Machine learning algorithms;Remote sensing;Time series analysis","agricultural engineering;crops;neural nets;regression analysis;support vector machines;vegetation mapping","ANN;CPPI;CPPI model;SVR;artificial neural network;complex planting structures;crop proportion phenology index models;kernel functions;large geographic areas;linear regression;machine learning algorithms;multiple crop types;nonlinear model;phenology cycles;planting structure;remote sensing data;support vector regression;winter wheat area estimation","","","","","","","10-15 July 2016","","IEEE","IEEE Conference Publications"
"A study of 4D trajectory prediction based on machine deep learning","X. Guan; R. Lv; L. Sun; Y. Liu","Civil Aviation Management Institute of China, Beijing, 100121, China","2016 12th World Congress on Intelligent Control and Automation (WCICA)","20160929","2016","","","24","27","Trajectory prediction is the core module of modern air traffic management system. Focused on the trajectory prediction model and key algorithm of the system, this paper tries to overcome the disadvantages of the traditional linear prediction method via employing machine learning technology in the problem. The statistical historical flight data of different aircraft type is taken as the training sample to build the predictive model. Besides, current state information is used as the input data of the model and to get the predictive flight trajectory information. Then machine learning technology is adopted to improve the efficiency. The result shows that the proposed method has obviously higher performance compared to the traditional predictive methods.","","","10.1109/WCICA.2016.7578458","http://ieeexplore.ieee.org/stamp/stamp.jsp?arnumber=7578458","","Air traffic control;Aircraft;Aircraft propulsion;Atmospheric modeling;Data models;Predictive models;Trajectory","air traffic;aircraft;learning (artificial intelligence);statistical analysis","4D trajectory prediction;air traffic management system;aircraft;linear prediction method;machine deep learning;predictive model;statistical historical flight data","","","","","","","12-15 June 2016","","IEEE","IEEE Conference Publications"
"Detection and classification of diseases of Grape plant using opposite colour Local Binary Pattern feature and machine learning for automated Decision Support System","H. Waghmare; R. Kokare; Y. Dandawate","Dept. of Electronics and Telecommunication Engineering, Vishwakarma Institute of Information Technology, Pune, India","2016 3rd International Conference on Signal Processing and Integrated Networks (SPIN)","20160915","2016","","","513","518","Plant diseases cause major economic and production losses as well as curtailment in both quantity and quality of agricultural production. Now a day's, for supervising large field of crops there is been increased demand for plant leaf disease detection system. The critical issue here is to monitor the health of the plants and detection of the respective diseases. Studies show that most of the plant disease can be diagnosed from the properties of the leaf. Thus leaf based disease analysis for plants is an exciting new domain. The technique proposed for identification of plant disease through the leaf texture analysis and pattern recognition. In this work we focus on Grapes plant leaf disease detection system. The system takes a single leaf of a plant as an input and segmentation is performed after background removal. The segmented leaf image is then analyzed through high pass filter to detect the diseased part of the leaf. The segmented leaf texture is retrieved using unique fractal based texture feature. Fractal based features are locally invariant in nature and therefore provides a good texture model. The texture of every independent disease will be different. The extracted texture pattern is then classified using multiclass SVM. The work classifies focus on major diseases commonly observed in Grapes plant which are downy mildew & black rot. The proposed approach avails advice of agricultural experts easily to farmers with the accuracy of 96.6%.","","","10.1109/SPIN.2016.7566749","http://ieeexplore.ieee.org/stamp/stamp.jsp?arnumber=7566749","Decision Support System (DSS);HSV (Hue Saturation Value);OC-LBP;Plant disease;Support Vector Machine (SVM);Texture analysis","Agriculture;Decision support systems;Diseases;Feature extraction;Image color analysis;Pipelines;Support vector machines","agriculture;decision support systems;fractals;image classification;image segmentation;image texture;learning (artificial intelligence);support vector machines","agricultural production;automated decision support system;background removal;fractal based features;grapes plant leaf disease detection system;high pass filter;leaf image segmentation;leaf texture analysis;machine learning;multiclass SVM classification;opposite colour local binary pattern feature;pattern recognition;plant disease classification;texture pattern extraction","","","","","","","11-12 Feb. 2016","","IEEE","IEEE Conference Publications"
"Homogenizing social networking with smart education by means of machine learning and Hadoop: A case study","A. Jagtap; B. Bodkhe; B. Gaikwad; S. Kalyana","Department of Computer Engineering, MES College of Engineering, Pune, India","2016 International Conference on Internet of Things and Applications (IOTA)","20160908","2016","","","85","90","In today's age of ever increasing use of internet, there are around 74% active internet users out of which 60% users contribute to social networking and most of them are students from the age group 16-30 [1]. If this young generation is targeted specifically towards educational activities keeping the same social networking environment in the background would create interest in students for educational activities and also yield productive results. Using Big Data analytics, machine learning and recommender system on the student data and activity would provide them with useful information and suggestions which would help them gain knowledge and make proper decisions to make their future in right direction. This can be implemented by creating a social-cum-educational portal with recommender systems, also data can be generated and displayed on the same place after analysis through recommenders. There is large amount of social, educational information generated on a rapid basis on the web which can be analysed and used for the betterment of the students and also the analysed information can be provided to the students based on their interests. Specific information to specific student can be provided. Use of such technology can reduce the gap between students and the information which can lead to their inherent development and success! However, most of the existing Social Recommender systems do not have good scalabilities which are unable to process huge volumes of data. Aiming to this problem we can design a social recommender system based on Hadoop and its parallel computing platform.","","","10.1109/IOTA.2016.7562700","http://ieeexplore.ieee.org/stamp/stamp.jsp?arnumber=7562700","Education recommender system;Education visualization;Hadoop;Machine learning;Smart student visualization;Social network;Social recommender system","Big data;Data analysis;Education;Portals;Recommender systems;Relational databases;Social network services","Big Data;computer aided instruction;data analysis;learning (artificial intelligence);parallel processing;portals;recommender systems;social networking (online)","Big Data analytics;Hadoop;Internet;educational activities;machine learning;parallel computing;smart education;social networking;social recommender systems;social-cum-educational portal;student activity;student data","","","","","","","22-24 Jan. 2016","","IEEE","IEEE Conference Publications"
"Quantum Machine Learning Based on Minimizing Kronecker-Reed-Muller Forms and Grover Search Algorithm with Hybrid Oracles","B. Lee; M. Perkowski","Dept. of Electr. & Comput. Eng., Portland State Univ., Portland, OR, USA","2016 Euromicro Conference on Digital System Design (DSD)","20161027","2016","","","413","422","This paper formulates the generic Machine Learning (ML) problem into finding the simplest spectral transform form (i.e. one having as many zero coefficients as possible) for an (in)complete binary function. The classical binary logic synthesis problem can be modeled to minimize a single output Boolean function with a two-level structure consisting of an exclusive-OR (EXOR) of ANDs of literals. The innovative approach in this paper is to build and simulate an accelerator that reduces learning to find the exact minimum expression of all 3n Kronecker Reed Muller (KRO) forms of a Boolean function with n input variables. This is in contrast to the previously studied quantum algorithm for the Fixed Polarity Reed-Muller forms (FPRM) which only selects from 2n possible forms. The algorithm, based on repeated application of a ternary Grover's Quantum Search algorithm, was simulated to find the minimum KRO form using a hybrid ternary/binary quantum oracle. This hybrid quantum system was simulated in Matlab and proved to be correct. The method can be also used as a future Quantum EDA Tool for exact minimization of AND/EXOR circuits, including reversible and quantum circuits.","","","10.1109/DSD.2016.30","http://ieeexplore.ieee.org/stamp/stamp.jsp?arnumber=7723581","EDA tools (CAD tools);Grover's search algorithm;Hybrid binary/ternary quantum circuits;Kronecker-Reed-Muller forms;Quantum Machine Learning;Quantum Oracle;exact minimization of AND/EXOR circuits","Boolean functions;Computers;Logic gates;Machine learning algorithms;Quantum computing;Quantum mechanics;Transforms","Boolean functions;Reed-Muller codes;learning (artificial intelligence);minimisation;quantum computing;search problems;transforms","Boolean function;FPRM;Grover search algorithm;Kronecker-Reed-Muller form;binary function;binary logic synthesis;binary quantum oracle;fixed polarity Reed-Muller forms;hybrid ternary oracle;n input variables;quantum EDA tool;quantum machine learning;spectral transform","","","","","","","Aug. 31 2016-Sept. 2 2016","","IEEE","IEEE Conference Publications"
"Text categorization with machine learning and hierarchical structures","M. Krendzelak; F. Jakab","Technical University of Kosice/KPI FEI TUKE, Kosice, Slovakia","2015 13th International Conference on Emerging eLearning Technologies and Applications (ICETA)","20160905","2015","","","1","5","Text categorization with machine learning algorithms usually assumes to have flat set of categories. Such classifiers are very domain specific and not reusable for some other generic text classifications. It is very possible that a hierarchically structured set of categories might have a higher impact on the way classifiers are used and built. As presented in this document, the list of most common approaches for text categorization disregards hierarchy. The main reason is because measured performance of hierarchical trials has not showed a significant difference. Nerveless, it is encouraged to perform additional research in text categorization with hierarchical structures.","","Electronic:978-1-4673-8534-3; POD:978-1-4673-8535-0","10.1109/ICETA.2015.7558486","http://ieeexplore.ieee.org/stamp/stamp.jsp?arnumber=7558486","","Algorithm design and analysis;Classification algorithms;Expert systems;Machine learning algorithms;Support vector machines;Text categorization;Training data","learning (artificial intelligence);pattern classification;set theory;text analysis","generic text classifications;hierarchically structured set;machine learning algorithms;text categorization","","","","","","","26-27 Nov. 2015","","IEEE","IEEE Conference Publications"
"Side-channel attacks and machine learning approach","A. Levina; D. Sleptsova; O. Zaitsev","ITMO University, Saint Petersburg, Russia","2016 18th Conference of Open Innovations Association and Seminar on Information Security and Protection of Information Technology (FRUCT-ISPIT)","20160908","2016","","","181","186","Most modern devices and cryptoalgorithms are vulnerable to a new class of attack called side-channel attack. It analyses physical parameters of the system in order to get secret key. Most spread techniques are simple and differential power attacks with combination of statistical tools. Few studies cover using machine learning methods for pre-processing and key classification tasks. In this paper, we investigate applicability of machine learning methods and their characteristic. Following theoretical results, we examine power traces of AES encryption with Support Vector Machines algorithm and decision trees and provide roadmap for further research.","","Electronic:978-9-5268-3973-8; POD:978-1-5090-2500-8","10.1109/FRUCT-ISPIT.2016.7561525","http://ieeexplore.ieee.org/stamp/stamp.jsp?arnumber=7561525","","Decision trees;Kernel;Power demand;Principal component analysis;Side-channel attacks;Support vector machines","decision trees;learning (artificial intelligence);private key cryptography;support vector machines","AES encryption;cryptoalgorithms;decision trees;differential power attacks;key classification tasks;machine learning;power traces;secret key;side-channel attacks;statistical tools;support vector machines algorithm;system physical parameters","","","","","","","18-22 April 2016","","IEEE","IEEE Conference Publications"
"A machine learning framework for auto classification of imaging system exams in hospital setting for utilization optimization","M. A. Patil; R. B. Patil; P. Krishnamoorthy; J. John","Philips Research, Department of Health care Applications, Bangalore 560045 India","2016 38th Annual International Conference of the IEEE Engineering in Medicine and Biology Society (EMBC)","20161018","2016","","","2423","2426","In clinical environment, Interventional X-Ray (IXR) system is used on various anatomies and for various types of the procedures. It is important to classify correctly each exam of IXR system into respective procedures and/or assign to correct anatomy. This classification enhances productivity of the system in terms of better scheduling of the Cath lab, also provides means to perform device usage/revenue forecast of the system by hospital management and focus on targeted treatment planning for a disease/anatomy. Although it may appear classification of each exam into respective procedure/anatomy a simple task. However, in real-life hospital settings, it is well-known that same system settings are used to perform different types of procedures. Though, such usage leads to under-utilization of the system. In this work, a method is developed to classify exams into respective anatomical type by applying machine-learning techniques (SVM, KNN and decision trees) on log information of the systems. The classification result is promising with accuracy of greater than 90%.","1557-170X;1557170X","Electronic:978-1-4577-0220-4; POD:978-1-4577-0219-8","10.1109/EMBC.2016.7591219","http://ieeexplore.ieee.org/stamp/stamp.jsp?arnumber=7591219","","Data mining;Decision trees;Feature extraction;Hospitals;Kernel;Support vector machines","decision trees;diagnostic radiography;diseases;image classification;learning (artificial intelligence);medical image processing;support vector machines","Cath lab;anatomical type;anatomy;decision trees;disease;hospital management;hospital setting;image autoclassification;imaging system;interventional X-ray system;k-nearest neighbors;machine-learning technique;support vector machines;treatment planning;utilization optimization","","","","","","","16-20 Aug. 2016","","IEEE","IEEE Conference Publications"
"Machine learning application in MOOCs: Dropout prediction","J. Liang; C. Li; L. Zheng","Department of Computer Science and Technology, Tsinghua University","2016 11th International Conference on Computer Science & Education (ICCSE)","20161006","2016","","","52","57","Massive Open Online Course(MOOC) is undergoing explosive growth recently, both the number of MOOC platforms and courses are increasing dramatically during these years. One of the major concerns in MOOC is high dropout rate, we study dropout prediction in MOOCs, using student's learning activities data in a period of time to measure how likely students would drop out in next couple of days. We collect 39 courses data from XuetangX platform, which is based on the open source Edx platform. Using supervised classification approach in the machine learning field, we achieve 89% accuracy in dropout prediction task with gradient boosting decision tree model. We describe details in drop out prediction framework, including data extraction from Edx platform, data preprocessing, feature engineering and performance test on several supervised classification models.","","","10.1109/ICCSE.2016.7581554","http://ieeexplore.ieee.org/stamp/stamp.jsp?arnumber=7581554","Classification;Feature enginnering;MOOCs;Supervised learning","Context;Data mining;Data models;Data preprocessing;Education;Feature extraction;Predictive models","computer aided instruction;decision trees;educational courses;learning (artificial intelligence);pattern classification;public domain software","MOOCs;XuetangX platform;data extraction;data preprocessing;dropout prediction;feature engineering;gradient boosting decision tree model;machine learning;massive open online course;open source Edx platform;performance test;student learning activities data;supervised classification models","","","","","","","23-25 Aug. 2016","","IEEE","IEEE Conference Publications"
