"An Investigation Into Machine Learning Regression Techniques for the Leaf Rust Disease Detection Using Hyperspectral Measurement","D. Ashourloo; H. Aghighi; A. A. Matkan; M. R. Mobasheri; A. M. Rad","Remote Sensing and GIS Center, Faculty of Earth Sciences, Shahid Beheshti University, Tehran, Iran","IEEE Journal of Selected Topics in Applied Earth Observations and Remote Sensing","20161003","2016","9","9","4344","4351","The complex impacts of disease stages and disease symptoms on spectral characteristics of the plants lead to limitation in disease severity detection using the spectral vegetation indices (SVIs). Although machine learning techniques have been utilized for vegetation parameters estimation and disease detection, the effects of disease symptoms on their performances have been less considered. Hence, this paper investigated on 1) using partial least square regression (PLSR), v support vector regression (v-SVR), and Gaussian process regression (GPR) methods for wheat leaf rust disease detection, 2) evaluating the impact of training sample size on the results, 3) the influence of disease symptoms effects on the predictions performances of the above-mentioned methods, and 4) comparisons between the performances of SVIs and machine learning techniques. In this study, the spectra of the infected and non infected leaves in different disease symptoms were measured using a non imaging spectroradiometer in the electromagnetic region of 350 to 2500 nm. In order to produce a ground truth dataset, we employed photos of a digital camera to compute the disease severity and disease symptoms fractions. Then, different sample sizes of collected datasets were utilized to train each method. PLSR showed coefficient of determination (R<sup>2</sup>) values of 0.98 (root mean square error (RMSE) = 0.6) and 0.92 (RMSE = 0.11) at leaf and canopy, respectively. SVR showed R<sup>2</sup> and RMSE close to PLSR at leaf (R<sup>2</sup> = 0.98, RMSE = 0.05) and canopy (R<sup>2</sup> = 0.95, RMSE = 0.12) scales. GPR showed R<sup>2</sup> values of 0.98 (RMSE = 0.03) and 0.97 (RMSE = 0.11) at leaf and canopy scale, respectively. Moreover, GPR represents better performances than others using small training sample size. The results represent that the machine learning techniques in contrast to SVIs are not sensitive to different disease symptoms and their results are reliable.","1939-1404;19391404","","10.1109/JSTARS.2016.2575360","http://ieeexplore.ieee.org/stamp/stamp.jsp?arnumber=7533506","$nu$ support vector regression $(nu$-SVR);Disease severity;Gaussian process regression (GPR);PLSR;disease symptoms;hyperspectral measurement;plant disease;wheat leaf rust (WLR)","Diseases;Ground penetrating radar;Hyperspectral sensors;Support vector machines;Training;Vegetation mapping","Gaussian processes;diseases;hyperspectral imaging;learning (artificial intelligence);regression analysis;remote sensing;vegetation","Gaussian process regression;digital camera;disease severity detection;disease stage;disease symptom;hyperspectral measurement;machine learning regression technique;partial least square regression;plant spectral characteristics;spectral vegetation index;spectroradiometer;support vector regression;vegetation parameter estimation;wheat leaf rust disease detection","","1","","","","20160804","Sept. 2016","","IEEE","IEEE Journals & Magazines"
"Learning Boltzmann machine with EM-like method","J. Song; C. Yuan","Department of Computer Science and Technology, Tsinghua University, Beijing 100084, China","2016 International Joint Conference on Neural Networks (IJCNN)","20161103","2016","","","2282","2289","We propose an expectation-maximization-like(EM-like) method to train Boltzmann machine with unconstrained connectivity. It adopts Monte Carlo approximation in the E-step, and replaces the intractable likelihood objective with efficiently computed objectives or directly approximates the gradient of likelihood objective in the M-step. The EM-like method is a modification of alternating minimization. We prove that EM-like method will be the exactly same with contrastive divergence in restricted Boltzmann machine if the M-step of this method adopts special approximation. We also propose a new measure to assess the performance of Boltzmann machine as generative models of data, and its computational complexity is O(Rmn). Finally, we demonstrate the performance of EM-like method using numerical experiments.","","","10.1109/IJCNN.2016.7727482","http://ieeexplore.ieee.org/stamp/stamp.jsp?arnumber=7727482","","Approximation algorithms;Computational modeling;Data models;Estimation;Minimization;Monte Carlo methods;Training","Boltzmann machines;Monte Carlo methods;computational complexity;expectation-maximisation algorithm;learning (artificial intelligence)","Boltzmann machine learning;EM-like method;Monte Carlo approximation;computational complexity;expectation-maximization;restricted Boltzmann machine","","","","","","","24-29 July 2016","","IEEE","IEEE Conference Publications"
"A hybrid rule and machine learning based generic alerting platform for smart environments","J. Rafferty; J. Synnott; C. Nugent","Ulster University, Jordanstown, Northern Ireland, BT37 0QB, UK","2016 38th Annual International Conference of the IEEE Engineering in Medicine and Biology Society (EMBC)","20161018","2016","","","5405","5408","Existing smart environment based alert solutions have adopted a relatively complex and tailored approach to supporting individuals. These solutions have involved sensor based monitoring, activity recognition and assistance provisioning. Traditionally they have suffered from a number of issues, rooted in scalability and performance, associated with complex activity recognition processes. This paper introduces a generic approach to realizing an alerting platform within a smart environment. The core concept of this approach is presented and placed within the context of related work. A description of the approach is provided, followed by an evaluation. This evaluation shows the approach offers reasonable accuracy, future work will increase accuracy.","1557-170X;1557170X","Electronic:978-1-4577-0220-4; POD:978-1-4577-0219-8","10.1109/EMBC.2016.7591949","http://ieeexplore.ieee.org/stamp/stamp.jsp?arnumber=7591949","","Computer vision;Monitoring;Temperature measurement;Temperature sensors","biomedical engineering;intelligent sensors;learning (artificial intelligence)","complex activity recognition;generic alerting platform;hybrid rule-machine learning;smart environments","","2","","","","","16-20 Aug. 2016","","IEEE","IEEE Conference Publications"
"Machine learning approach to automated correction of ETgX documents","K. Chuvilin","Institute of Computing for Physics and Technology, Protvino, Russia, Moscow Institute of Physics and Technology (State University), Moscow, Russia","2016 18th Conference of Open Innovations Association and Seminar on Information Security and Protection of Information Technology (FRUCT-ISPIT)","20160908","2016","","","33","40","The problem is the automatic synthesis of formal correcting rules for LATEX documents. Each document is represented as a syntax tree. Tree node mappings of initial documents to edited documents form the training set, which is used to generate the rules. Rules with a simple structure, which implement removal, insertion or replacing operations of single node and use linear sequence of nodes to select a position are synthesized primarily. The constructed rules are grouped based on the positions of applicability and quality. The rules that use tree-like structure of nodes to select the position are studied. The changes in the quality of the rules during the sequential increase of the training document set are analyzed.","","Electronic:978-9-5268-3973-8; POD:978-1-5090-2500-8","10.1109/FRUCT-ISPIT.2016.7561505","http://ieeexplore.ieee.org/stamp/stamp.jsp?arnumber=7561505","","Particle separators;Pattern matching;Physics;Publishing;Syntactics;Training;Vegetation","document handling;learning (artificial intelligence)","LATEX document correction;formal correcting rule synthesis;machine learning approach;syntax tree representation;tree node mappings;tree-like node structure","","","","","","","18-22 April 2016","","IEEE","IEEE Conference Publications"
"A review of supervised machine learning algorithms","A. Singh; N. Thakur; A. Sharma","Bharati Vidyapeeth's College of Engineering, A-4, Paschim Vihar, Rohtak Road, New Delhi - 110063, India","2016 3rd International Conference on Computing for Sustainable Global Development (INDIACom)","20161031","2016","","","1310","1315","Supervised machine learning is the construction of algorithms that are able to produce general patterns and hypotheses by using externally supplied instances to predict the fate of future instances. Supervised machine learning classification algorithms aim at categorizing data from prior information. Classification is carried out very frequently in data science problems. Various successful techniques have been proposed to solve such problems viz. Rule-based techniques, Logic-based techniques, Instance-based techniques, stochastic techniques. This paper discusses the efficacy of supervised machine learning algorithms in terms of the accuracy, speed of learning, complexity and risk of over fitting measures. The main objective of this paper is to provide a general comparison with state of art machine learning algorithms.","","","","http://ieeexplore.ieee.org/stamp/stamp.jsp?arnumber=7724478","Artificial Neural Networks (ANN);Bayesian Network (BN);Decision Trees (DT);Logistic Regression (LR);Random Forests (RF);Supervised Machine Learning;Support Vector Machine (SVM);k-Nearest Neighbors (k-NN)","Artificial neural networks;Classification algorithms;Decision support systems;Handheld computers;Machine learning algorithms;Roads;Support vector machines","learning (artificial intelligence);pattern classification","data categorization;data science problems;externally supplied instances;instance-based techniques;logic-based techniques;rule-based techniques;stochastic techniques;supervised machine learning classification algorithms","","","","","","","16-18 March 2016","","IEEE","IEEE Conference Publications"
"Machine learning techniques for intrusion detection on public dataset","U. S. K. P. M. Thanthrige; J. Samarabandu; X. Wang","Electrical and Computer Engineering, University Of Western Ontario, London, Ontario, Canada","2016 IEEE Canadian Conference on Electrical and Computer Engineering (CCECE)","20161103","2016","","","1","4","The development of computer based systems expands the usage of computer based application in human life. It can be observed that illegal activities such as unauthorized data access, data theft, data modification and various other intrusion activities are rapidly growing during last decade. Hence, deployment and continuous improvement of Intrusion Detection Systems (IDS) are of paramount importance. Training, testing and evaluation of IDS with real network traffic is significant challenge, so most of IDS evaluation is based on intrusion datasets. Therefore, analysis of intrusion datasets are of paramount importance. In this paper, we evaluated Aegean Wi-Fi Intrusion Dataset (AWID) with different machine learning techniques. Feature reduction techniques such as Information Gain (IG) and Chi-Squared statistics (CH) were applied to evaluate dataset performance with feature reduction. Results of experiments show that feature reduction can lead to better analysis in terms of accuracy, processing time and complexity. It was observed that, the maximum increment of classification accuracy with feature reduction from 110 to 41 is 2.4%.","","","10.1109/CCECE.2016.7726677","http://ieeexplore.ieee.org/stamp/stamp.jsp?arnumber=7726677","","Computers;IEEE 802.11 Standard;Intrusion detection;Labeling;Testing;Training;Vegetation","computer network security;learning (artificial intelligence);pattern classification;telecommunication traffic;wireless LAN","AWID;Aegean Wi-Fi Intrusion Dataset;IDS evaluation;IDS testing;IDS training;classification accuracy;computer based application;computer based systems;feature reduction techniques;illegal activities;intrusion dataset analysis;intrusion detection systems;machine learning techniques;public dataset","","","","","","","15-18 May 2016","","IEEE","IEEE Conference Publications"
"A memristor network with coupled oscillator and crossbar towards L2-norm based machine learning","Leibin Ni; Hantao Huang; H. Yu","School of Electrical and Electronic Engineering, Nanyang Technological University, Singapore 639798","2016 IEEE/ACM International Symposium on Nanoscale Architectures (NANOARCH)","20160915","2016","","","179","184","This paper introduces a memristor-network based accelerator for L2-norm based machine learning. A coupled-memristor-oscillator network is developed for a L2-norm calculation; and a binary-memristor-crossbar network is developed to accelerate matrix-vector multiplication. As such, one can map gradient-descent (of L2-norm) based on-line machine learning on the proposed memristor-network that is composed of coupled-oscillator (to sample L2-norm) and binary-crossbar (to digitize L2-norm). Experiment results have shown that such a memristor-network based accelerator can achieve significant power reduction and runtime speed-up for both training and testing compared to the conventional CMOS-CPU based implementation.","","Electronic:978-1-4503-4330-5; POD:978-1-4673-8927-3","10.1145/2950067.2950083","http://ieeexplore.ieee.org/stamp/stamp.jsp?arnumber=7568650","","Data analysis;Memristors;Neurons;Oscillators;Resistance;Training","coupled circuits;gradient methods;learning (artificial intelligence);matrix multiplication;memristors;oscillators","L2-norm based machine learning;L2-norm calculation;binary-memristor-crossbar network;coupled-memristor-oscillator network;gradient-descent based online machine learning;matrix-vector multiplication;memristor-network based accelerator","","","","","","","18-20 July 2016","","IEEE","IEEE Conference Publications"
"A novel hidden danger prediction method in cloud-based intelligent industrial production management using timeliness managing extreme learning machine","X. Luo; Xiaona Yang; Weiping Wang; X. Chang; X. Wang; Zhigang Zhao","School of Computer and Communication Engineering, University of Science and Technology Beijing, 100083, China","China Communications","20160902","2016","13","7","74","82","To prevent possible accidents, the study of data-driven analytics to predict hidden dangers in cloud service-based intelligent industrial production management has been the subject of increasing interest recently. A machine learning algorithm that uses timeliness managing extreme learning machine is utilized in this article to achieve the above prediction. Compared with traditional learning algorithms, extreme learning machine (ELM) exhibits high performance because of its unique feature of a high generalization capability at a fast learning speed. Timeliness managing ELM is proposed by incorporating timeliness management scheme into ELM. When using the timeliness managing ELM scheme to predict hidden dangers, newly incremental data could be added prior to the historical data to maximize the contribution of the newly incremental training data, because the incremental data may be able to contribute reasonable weights to represent the current production situation according to practical analysis of accidents in some industrial productions. Experimental results from a coal mine show that the use of timeliness managing ELM can improve the prediction accuracy of hidden dangers with better stability compared with other similar machine learning methods.","1673-5447;16735447","","10.1109/CC.2016.7559078","http://ieeexplore.ieee.org/stamp/stamp.jsp?arnumber=7559078","cloud service;extreme learning machine;incremental learning;prediction","Artificial neural networks;Cloud computing;Data models;Machine learning algorithms;Neurons;Prediction algorithms;Production","accident prevention;cloud computing;learning (artificial intelligence);production engineering computing;production management","ELM;cloud-based intelligent industrial production management;data-driven analytics;hidden danger prediction method;machine learning algorithm;timeliness management scheme;timeliness managing extreme learning machine","","","","","","","July 2016","","IEEE","IEEE Journals & Magazines"
"A machine learning approach for predicting bank credit worthiness","R. E. Turkson; E. Y. Baagyere; G. E. Wenya","School of Computer Science and Engineering, University of Electronic Science and Technology of China","2016 Third International Conference on Artificial Intelligence and Pattern Recognition (AIPR)","20161013","2016","","","1","7","Machine learning is an emerging technique for building analytic models for machines to ""learn"" from data and be able to do predictive analysis. The ability of machines to ""learn"" and do predictive analysis is very important in this era of big data and it has a wide range of application areas. For instance, banks and financial institutions are sometimes faced with the challenge of what risk factors to consider when advancing credit/loans to customers. For several features/attributes of the customers are normally taken into consideration, but most of these features have little predictive effect on the credit worthiness or otherwise of the customer. Furthermore, a robust and effective automated bank credit risk score that can aid in the prediction of customer credit worthiness very accurately is still a major challenge facing many banks. In this paper, we examine a real bank credit data and conduct several machine learning algorithms on the data for comparative analysis and to choose which algorithms are the best fit for learning bank credit data. The algorithms gave over 80% accuracy in prediction. Furthermore, the most important features that determine whether a customer will default or otherwise in paying his/her credit the next month are extracted from a total of 23 features. We then applied these most important features on some selected machine learning algorithms and compare their predictive accuracy with the other algorithms that used all the 23 features. The results show no significant di erence, signifying that these features can accurately determine the credit worthiness of the customers. Finally, we formulate a predictive model using the most important features to predict the credit worthiness of a given customer.","","","10.1109/ICAIPR.2016.7585216","http://ieeexplore.ieee.org/stamp/stamp.jsp?arnumber=7585216","bank credit;classification;confusion matrix;machine learning;predictive analysis","Algorithm design and analysis;Data mining;Feature extraction;Machine learning algorithms;Neural networks;Prediction algorithms;Predictive models","bank data processing;data analysis;feature extraction;learning (artificial intelligence)","bank credit risk score;bank credit worthiness prediction;feature extraction;machine learning;predictive analysis","","","","","","","19-21 Sept. 2016","","IEEE","IEEE Conference Publications"
"Unsupervised 3D Local Feature Learning by Circle Convolutional Restricted Boltzmann Machine","Z. Han; Z. Liu; J. Han; C. M. Vong; S. Bu; X. Li","Northwestern Polytechnical University, Xi&#x2019;an, China","IEEE Transactions on Image Processing","20160926","2016","25","11","5331","5344","Extracting local features from 3D shapes is an important and challenging task that usually requires carefully designed 3D shape descriptors. However, these descriptors are hand-crafted and require intensive human intervention with prior knowledge. To tackle this issue, we propose a novel deep learning model, namely circle convolutional restricted Boltzmann machine (CCRBM), for unsupervised 3D local feature learning. CCRBM is specially designed to learn from raw 3D representations. It effectively overcomes obstacles such as irregular vertex topology, orientation ambiguity on the 3D surface, and rigid or slightly non-rigid transformation invariance in the hierarchical learning of 3D data that cannot be resolved by the existing deep learning models. Specifically, by introducing the novel circle convolution, CCRBM holds a novel ring-like multi-layer structure to learn 3D local features in a structure preserving manner. Circle convolution convolves across 3D local regions via rotating a novel circular sector convolution window in a consistent circular direction. In the process of circle convolution, extra points are sampled in each 3D local region and projected onto the tangent plane of the center of the region. In this way, the projection distances in each sector window are employed to constitute a novel local raw 3D representation called projection distance distribution (PDD). In addition, to eliminate the initial location ambiguity of a sector window, the Fourier transform modulus is used to transform the PDD into the Fourier domain, which is then conveyed to CCRBM. Experiments using the learned local features are conducted on three aspects: global shape retrieval, partial shape retrieval, and shape correspondence. The experimental results show that the learned local features outperform other state-of-the-art 3D shape descriptors.","1057-7149;10577149","","10.1109/TIP.2016.2605920","http://ieeexplore.ieee.org/stamp/stamp.jsp?arnumber=7559748","3D shapes;Circle convolutional restricted Boltzmann machine;deep learning;fourier transform modulus;geometry processing;projection distance distribution","Convolution;Feature extraction;Machine learning;Shape;Solid modeling;Three-dimensional displays;Two dimensional displays","Boltzmann machines;Fourier transforms;convolution;feature extraction;feedforward neural nets;image representation;image retrieval;unsupervised learning","3D local regions;3D shape descriptors;CCRBM;Fourier transform modulus;PDD;circle convolutional restricted Boltzmann machine;consistent circular direction;deep learning model;global shape retrieval;local feature extraction;novel circular sector convolution window;novel local raw 3D representation;novel ring-like multilayer structure;partial shape retrieval;projection distance distribution;shape correspondence;unsupervised 3D local feature learning","","","","","","20160902","Nov. 2016","","IEEE","IEEE Journals & Magazines"
"Performance of Machine Learning Algorithms for Class-Imbalanced Process Fault Detection Problems","T. Lee; K. B. Lee; C. O. Kim","Department of Information and Industrial Engineering, Yonsei University, Seoul, South Korea","IEEE Transactions on Semiconductor Manufacturing","20161027","2016","29","4","436","445","In recent years, the semiconductor manufacturing industry has recognized class imbalance as a major impediment to the development of high-performance fault detection (FD) models. Class imbalance refers to skews in class distribution in which normal wafer samples are considerably more abundant than fault samples. In such a situation, standard machine learning algorithms create FD models with classification boundaries that are biased toward majority-class data, resulting in high type II error rates. In this paper, we compare the performance of machine learning algorithms for class-imbalanced FD problems. We evaluate the performance of three sampling-based algorithms, four ensemble algorithms, four instance-based algorithms, and two support vector machine algorithms. Two experiments were conducted to compare algorithm performance using etching process data and chemical vapor deposition process data. Different data scenarios were considered by setting the imbalance ratio to three levels. The results of the experiments indicated that the instance-based algorithms presented excellent performance even when the imbalance ratio increased.","0894-6507;08946507","","10.1109/TSM.2016.2602226","http://ieeexplore.ieee.org/stamp/stamp.jsp?arnumber=7549079","Class imbalance;fault detection;machine learning;performance evaluation;semiconductor manufacturing","Boosting;Fault detection;Machine learning algorithms;Performance evaluation;Semiconductor device modeling;Support vector machines","chemical vapour deposition;electronic engineering computing;etching;fault diagnosis;learning (artificial intelligence);semiconductor industry;semiconductor materials;semiconductor technology;support vector machines","FD models;chemical vapor deposition process data;class imbalance;ensemble algorithms;etching process data;instance-based algorithms;machine learning algorithms;majority-class data;process fault detection problems;sampling-based algorithms;semiconductor manufacturing industry;support vector machine algorithms;type II error rates;wafer samples","","","","","","20160824","Nov. 2016","","IEEE","IEEE Journals & Magazines"
