"Algorithm-Driven Architectural Design Space Exploration of Domain-Specific Medical-Sensor Processors","M. Shoaib; N. K. Jha; N. Verma","Department of Electrical Engineering, Princeton University, Princeton, NJ, USA","IEEE Transactions on Very Large Scale Integration (VLSI) Systems","20130909","2013","21","10","1849","1862","Data-driven machine-learning techniques enable the modeling and interpretation of complex physiological signals. The energy consumption of these techniques, however, can be excessive, due to the complexity of the models required. In this paper, we study the tradeoffs and limitations imposed by the energy consumption of high-order detection models implemented in devices designed for intelligent biomedical sensing. Based on the flexibility and efficiency needs at various processing stages in data-driven biomedical algorithms, we explore options for hardware specialization through architectures based on custom instruction and coprocessor computations. We identify the limitations in the former, and propose a coprocessor-based platform that exploits parallelism in computation as well as voltage scaling to operate at a subthreshold minimum-energy point. We present results from post-layout simulation of cardiac arrhythmia detection with patient data from the MIT-BIH database. After wavelet-based feature extraction, which consumes 12.28 μJ, we demonstrate classification computations in the 12.00-120.05 μJ range using 10000-100000 support vectors. This represents 1170× lower energy than that of a low-power processor with custom instructions alone. After morphological feature extraction, which consumes 8.65 μJ of energy, the corresponding energy numbers are 10.24-24.51 μJ, which is 1548× smaller than one based on a custom-instruction design. Results correspond to V<sub>dd</sub>=0.4 V and a data precision of 8 b.","1063-8210;10638210","","10.1109/TVLSI.2012.2220161","http://ieeexplore.ieee.org/stamp/stamp.jsp?arnumber=6338362","Biomedical sensor processors;classification accelerators;embedded machine learning;low-energy design by voltage and precision scaling;structured hardware specialization;support-vector machines","Complexity theory;Computational modeling;Feature extraction;Kernel;Program processors;Support vector machines;Vectors","bioelectric potentials;electrocardiography;feature extraction;learning (artificial intelligence);medical signal detection;medical signal processing;sensors;support vector machines;wavelet transforms","MIT-BIH database;cardiac arrhythmia detection;coprocessor computation;custom instruction;data-driven biomedical algorithm;data-driven machine-learning technique;domain-specific medical-sensor processor;energy 12.00 muJ to 120.05 muJ;energy consumption;hardware specialization;high-order detection model;intelligent biomedical sensing;parallelism;patient data;physiological signal;subthreshold minimum-energy point;support vector machine;voltage scaling;wavelet-based feature extraction","","1","","49","","20121023","Oct. 2013","","IEEE","IEEE Journals & Magazines"
"Improving supply chain security using big data","D. Zage; K. Glass; R. Colbaugh","Sandia National Laboratories, Albuquerque, NM, USA 87185-9300","2013 IEEE International Conference on Intelligence and Security Informatics","20130815","2013","","","254","259","Previous attempts at supply chain risk management are often non-technical and rely heavily on policies/procedures to provide security assurances. This is particularity worrisome as there are vast volumes of data that must be analyzed and data continues to grow at unprecedented rates. In order to mitigate these issues and minimize the amount of manual inspection required, we propose the development of mathematically-based automated screening methods that can be incorporated into supply chain risk management. In particular, we look at methods for identifying deception and deceptive practices that may be present in the supply chain. We examine two classes of constraints faced by deceivers, cognitive/computational limitations and strategic tradeoffs, which can be used to developed graph-based metrics to represent entity behavior. By using these metrics with novel machine learning algorithms, we can robustly detect deceptive behavior and identify potential supply chain issues.","","Electronic:978-1-4673-6213-9; POD:978-1-4673-6214-6","10.1109/ISI.2013.6578830","http://ieeexplore.ieee.org/stamp/stamp.jsp?arnumber=6578830","Deception Detection;Machine Learning;Supply Chain Risk Management","Algorithm design and analysis;Communities;Information management;Measurement;Security;Supply chains;Vectors","cognitive systems;graph theory;inspection;learning (artificial intelligence);production engineering computing;risk management;security of data;strategic planning;supply chain management","big data;cognitive limitations;computational limitations;deception identification;deceptive practices;entity behavior representation;graph-based metrics;machine learning algorithms;manual inspection minimization;mathematically-based automated screening method development;potential supply chain issue identification;robust deceptive behavior detection;security assurances;strategic tradeoffs;supply chain risk management;supply chain security improvement","","4","","36","","","4-7 June 2013","","IEEE","IEEE Conference Publications"
"Profiieseeker — Early warning system for predicting economic situation of small and medium enterprises","A. Burda; P. Cudek; Z. S. Hippe","University of Management and Administration, Zamo&#x015B;&#x0107;, Poland","2013 6th International Conference on Human System Interactions (HSI)","20130815","2013","","","398","400","This paper presents the construction of the ProfileSEEKER the information system for early warning small and medium-sized enterprises from bankruptcy. The developed system is a set of five classifiers, using a variety of topologies of artificial neural networks and Bayes belief network, supported by supervised machine learning methods. System performance was evaluated using the original validation, called queue validation procedure.","2158-2246;21582246","Electronic:978-1-4673-5637-4; POD:978-1-4673-5635-0","10.1109/HSI.2013.6577854","http://ieeexplore.ieee.org/stamp/stamp.jsp?arnumber=6577854","artificial neural networks;machine learning;predicting economic situation SMEs;queue validation","Artificial neural networks;Biological system modeling;Companies;Data models;Economics;Predictive models","bank data processing;economics;learning (artificial intelligence);management information systems;neural nets;small-to-medium enterprises","Bayes belief network;ProfileSEEKER;artificial neural networks;bankruptcy;early warning system;economic situation prediction;information system;queue validation procedure;small and medium enterprises;supervised machine learning methods","","0","","10","","","6-8 June 2013","","IEEE","IEEE Conference Publications"
"Self-adaptive and sensitivity-aware QoS modeling for the cloud","T. Chen; R. Bahsoon","School of Computer Science, University of Birmingham, Birmingham, UK. B15 2TT","2013 8th International Symposium on Software Engineering for Adaptive and Self-Managing Systems (SEAMS)","20130912","2013","","","43","52","Given the elasticity, dynamicity and on-demand nature of the cloud, cloud-based applications require dynamic models for Quality of Service (QoS), especially when the sensitivity of QoS tends to fluctuate at runtime. These models can be autonomically used by the cloud-based application to correctly self-adapt its QoS provision. We present a novel dynamic and self-adaptive sensitivity-aware QoS modeling approach, which is fine-grained and grounded on sound machine learning techniques. In particular, we combine symmetric uncertainty with two training techniques: Auto-Regressive Moving Average with eXogenous inputs model (ARMAX) and Artificial Neural Network (ANN) to reach two formulations of the model. We describe a middleware for implementing the approach. We experimentally evaluate the effectiveness of our models using the RUBiS benchmark and the FIFA 1998 workload trends. The results show that our modeling approach is effective and the resulting models produce better accuracy when compared with conventional models.","2157-2305;21572305","Electronic:978-1-4673-4401-2; POD:978-1-4673-4399-2","10.1109/SEAMS.2013.6595491","http://ieeexplore.ieee.org/stamp/stamp.jsp?arnumber=6595491","QoS modeling;cloud computing;interference;machine learning;prediction;sensitivity","Accuracy;Adaptation models;Data models;Quality of service;Sensitivity;Software;Uncertainty","autoregressive moving average processes;cloud computing;learning (artificial intelligence);neural nets;quality of service","ANN;ARMAX model;FIFA 1998 workload trend;QoS provision;RUBiS benchmark;artificial neural network;autoregressive moving average with exogenous inputs model;cloud computing;cloud-based application;machine learning technique;quality of service;self-adaptive QoS modeling;sensitivity-aware QoS modeling","","4","1","31","","","20-21 May 2013","","IEEE","IEEE Conference Publications"
"Detection of onset of Alzheimer's disease from MRI images using a GA-ELM-PSO classifier","S. Saraswathi; B. S. Mahanand; A. Kloczkowski; S. Suresh; N. Sundararajan","Battelle Center for Mathematical Medicine The Research Institute at Nationwide Children's Hospital, Columbus, OH, USA","2013 Fourth International Workshop on Computational Intelligence in Medical Imaging (CIMI)","20130822","2013","","","42","48","In this paper, a novel method for detecting the onset of Alzheimer's disease (AD) from Magnetic Resonance Imaging (MRI) scans is presented. It uses a combination of three different machine learning algorithms in order to get improved results and is based on a three-class classification problem. The three classes for classification considered in this study are normal, very mild AD and mild and moderate AD subjects. The machine learning algorithms used are: the Extreme Learning Machine (ELM) for classification, with its performance optimized by a Particle Swarm Optimization (PSO) and a Genetic algorithm (GA) used for feature selection. A Voxel-Based Morphometry (VBM) approach is used for feature extraction from the MRI images and GA is used to reduce the high dimensional features needed for classification. The GA-ELM-PSO classifier yields an average training accuracy of 94.57 % and a testing accuracy of 87.23 %, averaged across the three classes, over ten random trials. The results clearly indicate that the proposed approach can differentiate between very mild AD and normal cases more accurately, indicating its usefulness in detecting the onset of AD.","2326-991X;2326991X","Electronic:978-1-4673-5919-1; POD:978-1-5090-0005-0","10.1109/CIMI.2013.6583856","http://ieeexplore.ieee.org/stamp/stamp.jsp?arnumber=6583856","Alzheimer's;Machine Learning;Neural networks;Particle swarm optimization;Voxel-Based Morphometry","Accuracy;Diseases;Feature extraction;Genetic algorithms;Magnetic resonance imaging;Testing;Training","biomedical MRI;diseases;feature extraction;genetic algorithms;image classification;learning (artificial intelligence);medical image processing;particle swarm optimisation","Alzheimer disease detection;GA-ELM-PSO classifier;MRI image;VBM approach;extreme learning machine algorithm;feature extraction;feature selection;genetic algorithm;magnetic resonance imaging scan;particle swarm optimization;three-class classification problem;voxel-based morphometry","","2","","35","","","16-19 April 2013","","IEEE","IEEE Conference Publications"
"Identifying temporal relations between main events in new articles","I. Berrazega; R. Faiz","LARODEC, University of Tunis - ISG, 2000 Bardo, Tunisia","2013 ACS International Conference on Computer Systems and Applications (AICCSA)","20131003","2013","","","1","4","With the expansion of the Web 2.0, daily huge amount of data is produced everywhere, namely new articles. These contents need to be exploited in order to extract relevant information and to build knowledge databases. In this concern, processing the temporal dimension of language and extracting temporal information from electronic news articles is becoming a prominent task. In this concern, we propose an approach for identifying inter-sentential temporal relations between main events from news articles. Our approach is based on a complete linguistic analysis of texts and supervised learning models.","2161-5322;21615322","Electronic:978-1-4799-0792-2; POD:978-1-4799-0791-5; USB:978-1-4799-0790-8","10.1109/AICCSA.2013.6616467","http://ieeexplore.ieee.org/stamp/stamp.jsp?arnumber=6616467","Classification;Linguistic Analysis;Machine Learning;Natural Language Processing;Temporal Information Extraction;Temporal Relation Identification;Web 2.0","Accuracy;Data mining;Feature extraction;Natural language processing;Pragmatics;Semantics;Syntactics","Internet;information retrieval","Web 2.0;electronic news articles;intersentential temporal relation identification;knowledge databases;linguistic text analysis;supervised learning models;temporal information extraction;temporal language dimension","","0","","13","","","27-30 May 2013","","IEEE","IEEE Conference Publications"
"A Hybrid Approach for Automatic Incident Detection","J. Wang; X. Li; S. S. Liao; Z. Hua","Department of Information Systems, University of Science and Technology of China&#x2013;City University of Hong Kong Joint Advanced Research Center, Suzhou, China","IEEE Transactions on Intelligent Transportation Systems","20130829","2013","14","3","1176","1185","This paper presents a hybrid approach to automatic incident detection (AID) in transportation systems. It combines time series analysis (TSA) and machine learning (ML) techniques in light of the fault diagnosis theory. In this approach, the time series component is to forecast the normal traffic for the current time point based on prior (normal) traffic. The ML component aims to detect incidents using features of real-time traffic, predicted normal traffic, as well as differences between the two. We validate our approach using a real-world data set collected in previous research. The results show that the hybrid approach is able to detect incidents more accurately [higher detection rate (DR)] and faster (shorter mean time to detect) under the requirement of a similar false alarm rate (FAR), as compared with state-of-the-art algorithms. This paper lends support to further studies on combining TSA with ML to address problems related to intelligent transportation systems (ITS).","1524-9050;15249050","","10.1109/TITS.2013.2255594","http://ieeexplore.ieee.org/stamp/stamp.jsp?arnumber=6525409","Automatic incident detection (AID);hybrid approach;machine learning (ML);time series analysis (TSA)","","automated highways;fault diagnosis;learning (artificial intelligence);road traffic;time series","AID;DR;FAR;ITS;ML techniques;TSA;automatic incident detection;detection rate;false alarm rate;fault diagnosis theory;hybrid approach;intelligent transportation systems;machine learning techniques;normal traffic;real-time traffic;real-world data set;time series analysis","","11","","50","","20130606","Sept. 2013","","IEEE","IEEE Journals & Magazines"
"SentiMeter-Br: A new social web analysis metric to discover consumers' sentiment","R. L. Rosa; D. Z. Rodríguez; G. Bressan","Department of Computer Science and Digital Systems - University of S&#x00E3;o Paulo - Brazil","2013 IEEE International Symposium on Consumer Electronics (ISCE)","20130729","2013","","","153","154","This article analyzes Brazilian Consumers' Sentiments in a specific domain using a system, SentiMeter-Br. A Portuguese dictionary focused in a specific field of study was built, in which tenses and negative words are treated in a different way of other dictionaries, with a different metric. For the Portuguese dictionary performance validation, the results are compared with the SentiStrength algorithm and are evaluated by three Specialists in the field of study; each one analyzed 2000 texts captured from Twitter. Comparing the efficiency of the SentiMeter-Br and the SentiStrength against the Specialists' opinion, a Pearson correlation factor of 0.89 and 0.75 was reached, respectively. The polarity of the short texts were also tested through machine learning, with correctly classified instances of 71.79% by Sequential Minimal Optimization algorithm and F-Measure of 0.87 for positive and 0.91 for negative phrases.","0747-668X;0747668X","Electronic:978-1-4673-6199-6; POD:978-1-4673-6198-9","10.1109/ISCE.2013.6570158","http://ieeexplore.ieee.org/stamp/stamp.jsp?arnumber=6570158","consumer sentiment;machine learning;social web analysis tool;support vector machines","Algorithm design and analysis;Classification algorithms;Dictionaries;Google;Hair;Market research;Twitter","Internet;consumer behaviour;dictionaries;learning (artificial intelligence);marketing data processing;social networking (online);text analysis","Brazilian consumers sentiments discovery;F-Measure;Pearson correlation factor;Portuguese dictionary performance validation;SentiMeter-Br;SentiStrength algorithm;Twitter;machine learning;sequential minimal optimization algorithm;short texts polarity;social Web analysis metric;text analysis","","3","","1","","","3-6 June 2013","","IEEE","IEEE Conference Publications"
"Ready-to-use activity recognition for smartphones","P. Siirtola; J. Röning","Computer Science and Engineering Department, P.O. BOX 4500, FI-90014, University of Oulu, Finland","2013 IEEE Symposium on Computational Intelligence and Data Mining (CIDM)","20130916","2013","","","59","64","In this study, every day activities are recognized from data collected using smartphones accelerometer sensors. Offline experiments are made to show that the presented method is user- and body position-independent. In addition, it is shown that the features used in the classification are not dependent on the calibration of the phone. The recognition models trained using the offline data are also tested online. A mobile application running these models is built for two operating systems: Symbian^3 and Android. Real-time experiments using these applications are made to show that the presented method can be implemented to any operating system and hardware variations do not affect recognition results. High recognition accuracies are obtained, in the offline study, the average recognition rate is almost 99% and, also, in the online study, the average recognition accuracy is over 90%.","","Electronic:978-1-4673-5895-8; POD:978-1-4673-5894-1","10.1109/CIDM.2013.6597218","http://ieeexplore.ieee.org/stamp/stamp.jsp?arnumber=6597218","Accelerometer;activity recognition;machine learning;mobile phones","Accelerometers;Calibration;Feature extraction;Hardware;Operating systems;Sensors;Smart phones","accelerometers;operating systems (computers);pattern classification;pattern recognition;smart phones","Android operating system;Symbian^3 operating system;average recognition rate;body position-independent method;data classification;data collection;offline recognition;online recognition;ready-to-use activity recognition;recognition model training;smart phone accelerometer sensors;user-independent method","","10","","15","","","16-19 April 2013","","IEEE","IEEE Conference Publications"
"Coupling Recursive Hyperspheric Classification with Linear Discriminant Analysis for Improved Results","S. B. Reed; T. R. C. Reed; S. M. Dascalu","Dept. of Comput. Sci. & Eng., Univ. of Nevada, Reno, NV, USA","2013 10th International Conference on Information Technology: New Generations","20130930","2013","","","596","601","Recursive Hyper spheric Classification (RHC) can accurately and succinctly classify large datasets by dissecting labeled vectors into their constituent groups, or hyper spheres. While RHC is a powerful classification tool, coupling RHC with other linear classifiers enhances the ability and accuracy of the classification system, improving recognition of unlabeled vectors. In this paper, RHC is paired with Linear Discriminant Analysis (LDA) for improved classification and recognition rates.","","Electronic:978-0-7695-4967-5; POD:978-1-4673-5960-3","10.1109/ITNG.2013.91","http://ieeexplore.ieee.org/stamp/stamp.jsp?arnumber=6614371","Dimensional Reduction;Linear Discriminant Analysis;Machine Learning;Recursive Hyperspheric Classification;Wine Dataset","Classification algorithms;Couplings;Euclidean distance;Linear discriminant analysis;Support vector machine classification;Vectors","learning (artificial intelligence);pattern classification;vectors","LDA;classification rates;classification system;coupling RHC;hyper spheres;linear classifiers;linear discriminant analysis;powerful classification tool;recognition rates;recursive hyperspheric classification;unlabeled vectors recognition","","0","","11","","","15-17 April 2013","","IEEE","IEEE Conference Publications"
"Survey of Automated Speaker Identification Methods","M. Sidorov; A. Schmitt; S. Zablotskiy; W. Minker","Inst. of Commun. Eng., Univ. of Ulm, Ulm, Germany","2013 9th International Conference on Intelligent Environments","20130916","2013","","","236","239","In this paper we present an overview of state-of-the-art approaches for speaker identification. Due to the increased number of dialogue system applications the interest in that field has grown significantly in recent years. Nevertheless, there are many open issues in the field of automatic speaker identification. Among them the choice of the appropriate speech signal features and machine learning algorithms could be mentioned. We make here an overview of modern methods designed for the problem of speaker identification. We also describe here our direction for possible improvements to the automated speaker identification.","","Electronic:978-0-7695-5038-1; POD:978-1-4799-0745-8","10.1109/IE.2013.31","http://ieeexplore.ieee.org/stamp/stamp.jsp?arnumber=6597817","Gaussian mixture models;machine learning algorithms;speaker identification","Accuracy;Databases;Mel frequency cepstral coefficient;Speech;Support vector machines;Testing;Training","learning (artificial intelligence);speaker recognition","automated speaker identification;dialogue system application;machine learning algorithm;speech signal features","","2","","22","","","16-17 July 2013","","IEEE","IEEE Conference Publications"
"Automatically identifying a software product's quality attributes through sentiment analysis of tweets","R. Dehkharghani; C. Yilmaz","Dept. of Computer Science and Engineering, Sabanci University, Istanbul, Turkey","2013 1st International Workshop on Natural Language Analysis in Software Engineering (NaturaLiSE)","20130926","2013","","","25","30","Software quality attributes can be identified based on software features such as security, reliability and user-friendliness. This process can be done either manually or automatically. Sentiment analysis refers to the sentiment extraction task from resources such as natural language texts. We study the application of sentiment analysis on extracting the quality attributes of a software product based on the opinions of end-users that have been stated in microblogs such as Twitter. Our findings obtain advantageous techniques such as document frequency of words in a large number of tweets. The extracted results can help software developers know the advantages and disadvantages of their products.","","Electronic:978-1-4673-6271-9; POD:978-1-4673-6270-2","10.1109/NAturaLiSE.2013.6611717","http://ieeexplore.ieee.org/stamp/stamp.jsp?arnumber=6611717","Sentiment analysis;data mining;machine learning;software quality attributes;twitter","Accuracy;Feature extraction;Internet;Security;Software;Training;Twitter","data mining;human computer interaction;natural language processing;security of data;social networking (online);software quality;software reliability;text analysis","Twitter;document frequency of words;microblogs;natural language texts;sentiment analysis;sentiment extraction task;software developers;software product quality attributes;software reliability;software security;software user-friendliness;tweets","","2","1","11","","","25-25 May 2013","","IEEE","IEEE Conference Publications"
