"Machine learning based supper-resolution algorithm robust to registration errors","A. Milchevski; Z. Ivanovski; B. Mustafa","Faculty of Electrical Engineering and Information Technologies, Ss Cyril and Methodius University, Karpos bb, Skopje, Macedonia","2011 Digital Signal Processing and Signal Processing Education Meeting (DSP/SPE)","20110324","2011","","","326","331","In this work, a novel two phase approach is proposed for robust super-resolution in the presence of registration errors and outliers. In the first phase machine learning method is used to create a weight matrix for every LR image indicating the presence of registration errors. In the second phase, super-resolution is performed using all of the LR images and the associated weight matrices, creating an image which is free of error artifacts.","","Electronic:978-1-61284-227-1; POD:978-1-61284-226-4","10.1109/DSP-SPE.2011.5739234","http://ieeexplore.ieee.org/stamp/stamp.jsp?arnumber=5739234","L<inf>2</inf> norm minimization;image enhancement;logistic regression;registration error;super-resolution","Decision support systems;Digital signal processing","image enhancement;image registration;image resolution;learning (artificial intelligence);matrix algebra;regression analysis","L2 norm minimization;image enhancement;logistic regression;machine learning method;registration errors;supper-resolution algorithm;weight matrix","","2","","10","","","4-7 Jan. 2011","","IEEE","IEEE Conference Publications"
"Machine Learning Based QSAR for Discovering Potential Drug Candidate from Endemic Plants of Sri Lanka - Case Study: HIV-1 RT","S. Lokuge; H. Hewavitarne; P. Wimalaratne; R. Ranawana","Sch. of Comput., Univ. of Colombo, Colombo, Sri Lanka","2010 Second Vaagdevi International Conference on Information Technology for Real World Problems","20110120","2010","","","12","17","Diseases have become an inevitable aspect in the current world and the development of medicines have become a very important and crucial field. Computer-aided drug designing is an approach that is being used in the drug development process to minimize the high costs and time involved. An important method used along with this is QSAR where the mathematical relationships between chemical and molecular structures are identified. Plants have been proved to be a valuable and useful medicine for curing various kinds of diseases and Sri Lanka is a tropical country known as a country where Ayurvedic medicines and treatments are available. There are also a number of plants which are endemic to the country and could carry possible cures for diseases. The research presented in the paper aims to develop a model using a machine learning approach to identify potential drug candidates from a set of endemic plants of Sri Lanka.","","Electronic:978-0-7695-4326-0; POD:978-1-4244-9628-0","10.1109/VCON.2010.10","http://ieeexplore.ieee.org/stamp/stamp.jsp?arnumber=5692989","Decision trees;Drug Designing;HIV-1 RT;Weka","","CAD;diseases;drugs;learning (artificial intelligence);pharmaceutical industry;pharmaceutical technology","Ayurvedic medicines;HIV-1 RT;Sri Lanka;chemical structures;computer-aided drug designing;diseases;drug development process;endemic plants;machine learning;molecular structures;potential drug candidate discovering;quantitative structure-activity relationship","","0","","19","","","9-11 Dec. 2010","","IEEE","IEEE Conference Publications"
"Recent trends in classification of remote sensing data: active and semisupervised machine learning paradigms","L. Bruzzone; C. Persello","Department of Information Engineering and Computer Science, University of Trento, Via Sommarive, 14 I-38123, Povo, Italy","2010 IEEE International Geoscience and Remote Sensing Symposium","20101203","2010","","","3720","3723","This paper addresses the recent trends in machine learning methods for the automatic classification of remote sensing (RS) images. In particular, we focus on two new paradigms: semisupervised and active learning. These two paradigms allow one to address classification problems in the critical conditions where the available labeled training samples are limited. These operational conditions are very usual in RS problems, due to the high cost and time associated with the collection of labeled samples. Semisupervised and active learning techniques allow one to enrich the initial training set information and to improve classification accuracy by exploiting unlabeled samples or requiring additional labeling phases from the user, respectively. The two aforementioned strategies are theoretically and experimentally analyzed considering SVM-based techniques in order to highlight advantages and disadvantages of both strategies.","2153-6996;21536996","Electronic:978-1-4244-9566-5; POD:978-1-4244-9565-8; USB:978-1-4244-9564-1","10.1109/IGARSS.2010.5651236","http://ieeexplore.ieee.org/stamp/stamp.jsp?arnumber=5651236","Machine learning;active learning;remote sensing;semisupervised learning;supervised classification;support vector machines","Accuracy;Classification algorithms;Machine learning;Remote sensing;Semisupervised learning;Support vector machines;Training","geophysical image processing;image classification;learning (artificial intelligence);remote sensing;support vector machines","active learning;classification accuracy;image classification;remote sensing data classification;semisupervised machine learning;support vector machines;training samples;training set information","","5","","6","","","25-30 July 2010","","IEEE","IEEE Conference Publications"
"Classification of surrounding rocks in tunnel based on Gaussian process machine learning","Yan Zhang; Guoshao Su; Liubin Yan","School of Civil and Architecture Engineering, Guangxi University, Nanning, China","2011 International Conference on Electric Technology and Civil Engineering (ICETCE)","20110527","2011","","","3971","3974","Classification of surrounding rocks in tunnel is very important for design and construction. Aiming to the fact that it is still difficult to reasonably determine the classification of surrounding rocks in tunnel, the model based on Gaussian process machine learning is proposed for classifying surrounding rocks. With the help of simple learning process, the uncertain mapping relationship between classification of surrounding rocks and its influencing factors is established by Gaussian process for binary classification model. The model is applied to a real engineering. The results of case study show that Gaussian process for binary classification model is feasible and has the same results with artificial neural networks and support vector machine. Nevertheless, compared with artificial neural networks and support vector machine, it has attractive merit of self-adaptive parameters determination.","","Electronic:978-1-4577-0290-7; POD:978-1-4577-0289-1","10.1109/ICETCE.2011.5775328","http://ieeexplore.ieee.org/stamp/stamp.jsp?arnumber=5775328","gaussian process;machine learning;surrounding rocks classification;tunnel","Artificial neural networks;Gaussian processes;Machine learning;Rocks;Stability analysis;Support vector machines;Water resources","Gaussian processes;geotechnical engineering;learning (artificial intelligence);neural nets;rocks;structural engineering computing;support vector machines;tunnels","Gaussian process machine learning;artificial neural network;binary classification model;rocks;self-adaptive parameter determination;support vector machine;tunnel","","0","","13","","","22-24 April 2011","","IEEE","IEEE Conference Publications"
"Applying machine learning algorithms for automatic Persian text classification","M. Farhoodi; A. Yari","Iran Telecommunication Research Center, Iran","2010 6th International Conference on Advanced Information Management and Service (IMS)","20110214","2010","","","318","323","Automatic document classification due to its various applications in data mining and information technology is one of the important topics in computer science. Classification plays a vital role in many information management and retrieval tasks. Document classification, also known as document categorization, is the process of assigning a document to one or more predefined category labels. Classification is often posed as a supervised learning problem in which a set of labeled data is used to train a classifier which can be applied to label future examples. Document classification includes different parts such as text processing, feature extraction, feature vector construction and final classification. Thus improvement in each part should lead to better results in document classification. In this paper, we apply machine learning methods for automatic Persian news classification. In this regard, we first try to exert some language preprocess in Hamshahri dataset, and then we extract a feature vector for each news text by using feature weighting and feature selection algorithms. After that we train our classifier by support vector machine (SVM) and K-nearest neighbor (KNN) algorithms. In Experiments, although both algorithms show acceptable results for Persian text classification, the performance of KNN is better in comparison to SVM.","","Electronic:978-89-88678-32-9; POD:978-1-4244-8599-4","","http://ieeexplore.ieee.org/stamp/stamp.jsp?arnumber=5713467","Hamshahri;KNN;SVM;feature selection;machine learning;text classification","Classification algorithms;Feature extraction;Kernel;Machine learning algorithms;Support vector machine classification;Text categorization","data mining;feature extraction;information retrieval;learning (artificial intelligence);natural language processing;pattern classification;support vector machines;text analysis","Hamshahri dataset;K-nearest neighbor algorithm;automatic Persian text classification;automatic document classification;data mining;document categorization;document classification;feature extraction;feature selection algorithm;feature vector construction;feature weighting;information management;information retrieval;information technology;machine learning algorithm;supervised learning problem;support vector machine;text processing","","2","","20","","","Nov. 30 2010-Dec. 2 2010","","IEEE","IEEE Conference Publications"
"A Machine Learning Approach for Identifying Disease-Treatment Relations in Short Texts","O. Frunza; D. Inkpen; T. Tran","University of Ottawa, Ottawa","IEEE Transactions on Knowledge and Data Engineering","20110421","2011","23","6","801","814","The Machine Learning (ML) field has gained its momentum in almost any domain of research and just recently has become a reliable tool in the medical domain. The empirical domain of automatic learning is used in tasks such as medical decision support, medical imaging, protein-protein interaction, extraction of medical knowledge, and for overall patient management care. ML is envisioned as a tool by which computer-based systems can be integrated in the healthcare field in order to get a better, more efficient medical care. This paper describes a ML-based methodology for building an application that is capable of identifying and disseminating healthcare information. It extracts sentences from published medical papers that mention diseases and treatments, and identifies semantic relations that exist between diseases and treatments. Our evaluation results for these tasks show that the proposed methodology obtains reliable outcomes that could be integrated in an application to be used in the medical care domain. The potential value of this paper stands in the ML settings that we propose and in the fact that we outperform previous results on the same data set.","1041-4347;10414347","","10.1109/TKDE.2010.152","http://ieeexplore.ieee.org/stamp/stamp.jsp?arnumber=5560656","Healthcare;machine learning;natural language processing.","Classification algorithms;Diseases;Machine learning;Medical diagnostic imaging;Semantics","diseases;learning (artificial intelligence);medical computing","ML;computer based systems;disease treatment relation identification;machine learning approach;medical decision support;medical imaging;patient management care;protein-protein interaction;short texts","","10","","29","","20100902","June 2011","","IEEE","IEEE Journals & Magazines"
"Machine Learning and keyword-matching integrated Protocol Identification","Xuejun Cai; Ruoyuan Zhang; Bin Wang","Ercisson, China","2010 3rd IEEE International Conference on Broadband Network and Multimedia Technology (IC-BNMT)","20110131","2010","","","164","169","Identifying the underlying protocol carried in the data traffic (i.e., Protocol Identification) is of fundamental important to QoS, Security, Network management and many other purposes. Port-based, content-based and behavior-based are commonly used identification methods in today's networks. However, all of these methods have their own shortcomings. In this paper, a new Machine Learning and Keyword-matching Integrated (MALKI) protocol identification method is proposed to overcome the shortcomings brought by these existing methods. The proposed method combines the content and behavior-based technologies together to identify the underlying protocol in the data flow. A prototype is implemented on a high performance multi-core processor platform. From the experimental results, we can see the proposed method is effective and efficient when applied into the protocol identification.","","Electronic:978-1-4244-6772-3; POD:978-1-4244-6769-3","10.1109/ICBNMT.2010.5704888","http://ieeexplore.ieee.org/stamp/stamp.jsp?arnumber=5704888","","Protocols","learning (artificial intelligence);protocols;string matching;telecommunication traffic","behavior-based technologies;data flow;keyword matching integrated protocol identification;machine learning;multicore processor;network management","","0","","9","","","26-28 Oct. 2010","","IEEE","IEEE Conference Publications"
"GreenSim: A Network Simulator for Comprehensively Validating and Evaluating New Machine Learning Techniques for Network Structural Inference","C. Fogelberg; V. Palade","Comput. Lab., Univ. of Oxford, Oxford, UK","2010 22nd IEEE International Conference on Tools with Artificial Intelligence","20101217","2010","2","","225","230","Networks are very important in many fields of machine learning research. Within networks research, inferring the structure of unknown networks is often a key problem; e.g. of genetic regulatory networks. However, there are very few well-known biological networks, and good simulation is essential for validating and evaluating novel structural inference techniques. Further, the importance of large, genome-wide structural inference is increasingly recognised, but there does not appear to be a good simulator available for large networks. This paper presents GreenSim, a simulator that helps address this gap. GreenSim automatically generates large, genome-size networks with more biologically realistic structural characteristics and 2nd-order non-linear regulatory functions. The simulator itself and the novel method used for generating a network structure with appropriate in- and out-degree distributions may also generalise easily to other types of network. GreenSim is available online at: http://syntilect.com/cgf/pubs:software.","1082-3409;10823409","Electronic:978-0-7695-4263-8; POD:978-1-4244-8817-9","10.1109/ICTAI.2010.105","http://ieeexplore.ieee.org/stamp/stamp.jsp?arnumber=5671407","genetic regulatory networks;networks;simulation;structural inference","Analytical models;Biological system modeling;Data models;Limit-cycles;Noise;Time series analysis","digital simulation;genetic engineering;inference mechanisms;learning (artificial intelligence);neural nets","2nd-order nonlinear regulatory functions;GreenSim;biological networks;genome-wide structural inference;machine learning;network simulator;network structural inference;structural inference techniques","","0","","25","","","27-29 Oct. 2010","","IEEE","IEEE Conference Publications"
"A Study on Machine Learning Algorithms for Fall Detection and Movement Classification","Y. Choi; A. S. Ralhan; S. Ko","Dept. of Electr. & Comput. Eng., Univ. of Saskatchewan, Saskatoon, SK, Canada","2011 International Conference on Information Science and Applications","20110523","2011","","","1","8","Falls among the elderly is an important health issue. Fall detection and movement tracking are therefore instrumental in addressing this issue. This paper responds to the challenge of classifying different movements as a part of a system designed to fulfill the need for a wearable device to collect data for fall and near-fall analysis. Four different fall trajectories (forward, backward, left and right), three normal activities (standing, walking and lying down) and near-fall situations are identified and detected. Different machine learning algorithms are compared and the best one is used for real time classification. The comparison is made using Waikato Environment for Knowledge Analysis (WEKA), one of the most popular machine learning software. The system also has the ability to adapt to the different gait characteristics of each individual. A feature selection algorithm is also introduced to reduce the number of features required for the classification problem.","2162-9048;21629048","Electronic:978-1-4244-9224-4; POD:978-1-4244-9222-0; USB:978-1-4244-9223-7","10.1109/ICISA.2011.5772404","http://ieeexplore.ieee.org/stamp/stamp.jsp?arnumber=5772404","","Acceleration;Accelerometers;Accuracy;Correlation;Gyroscopes;Machine learning;Prediction algorithms","feature extraction;gait analysis;handicapped aids;image classification;image motion analysis;learning (artificial intelligence)","WEKA;Waikato environment for knowledge analysis;fall analysis;fall detection;fall trajectories;feature selection algorithm;health issue;machine learning algorithm;machine learning software;movement classification;movement tracking;near-fall analysis;real time classification;wearable device","","4","","25","","","26-29 April 2011","","IEEE","IEEE Conference Publications"
"ALPOS: A Machine Learning Approach for Analyzing Microblogging Data","D. Zhang; Y. Liu; R. D. Lawrence; V. Chenthamarakshan","Dept. of Comput. Sci., Purdue Univ., West Lafayette, IN, USA","2010 IEEE International Conference on Data Mining Workshops","20110120","2010","","","1265","1272","With the development of Internet, the increasing volume of information posted on micro-blogging sites like Twitter necessitates the need for efficient information filtering. In conventional text classification problems, it is assumed that the feature vectors extracted from the available documents are sufficient to learn good classifiers. However, this conventional approach is not likely to work for Twitter due to the limited number of characters on each tweet. From a higher level, each tweet can be viewed as an abbreviated abstraction of a long document, and we only have a partial observation of this document. To solve the problem caused by the partial observations, we introduce a novel domain adaption/transfer learning approach called Assisted Learning for Partial Observation (ALPOS). The basic idea is to use a large number of multi-labeled examples (source domain) to improve the learning on the partial observations (target domain). In particular, we learn a hidden, higher-level abstraction space, which is meaningful for the multi-labeled examples in the source domain. This is done by simultaneously minimizing the document reconstruction error and the error in a classification model learned in the hidden space by using known labels from the source domain. The partial observations in the target space are then mapped to the same hidden space for recovery and classification. We compare the performance of this method with existing approaches on synthetic data and the well-known Reuters-21578 dataset. We also present experimental results on twitter classification.","2375-9232;23759232","Electronic:978-0-7695-4257-7; POD:978-1-4244-9244-2","10.1109/ICDMW.2010.154","http://ieeexplore.ieee.org/stamp/stamp.jsp?arnumber=5693439","Assisted Learning for Partial Observation;Text Classification;Transfer learning;Twitter","","Internet;data analysis;feature extraction;information filtering;learning (artificial intelligence);pattern classification;social networking (online);text analysis","ALPOS;Internet;Reuters- 21578 dataset;Twitter;assisted learning;document reconstruction error;domain transfer learning approach;feature vector extraction;higher level abstraction space;information filtering;machine learning approach;microblogging data analysis;multilabeled example;partial observation;text classification","","1","","25","","","13-13 Dec. 2010","","IEEE","IEEE Conference Publications"
"Statistical atlases and machine learning tools applied to optimized prostate biopsy for cancer detection and estimation of volume and Gleason score","C. Davatzikos","Section of Biomedical Image Analysis, University of Pennsylvania, USA","2011 IEEE International Symposium on Biomedical Imaging: From Nano to Macro","20110609","2011","","","2107","2108","We discuss the use of statistical atlases and machine learning tools for determining optimized biopsy procedures. Prostate cancer diagnosis most often involves the sampling of prostate tissue via placement of a number of biopsy needles in locations that are somewhat random but try to cover the gland. The purpose of this work is to establish optimal strategies for sampling the prostate tissue, using population statistics. In particular, a statistical atlas reflecting the spatial distribution of prostate cancer has been constructed via elastic registration of expert-labeled histological 3D volumes of radical prostatectomy patients. This atlas reflects the probability of encountering prostate carcinoma at a given location in the gland.","1945-7928;19457928","Electronic:978-1-4244-4128-0; POD:978-1-4244-4127-3","10.1109/ISBI.2011.5872828","http://ieeexplore.ieee.org/stamp/stamp.jsp?arnumber=5872828","prostate biopsy;statistical atlas of prostate cancer;statistical models","Biological system modeling;Biopsy;Cancer;Cancer detection;Estimation;Machine learning;Needles","biological tissues;biomedical measurement;cancer;learning (artificial intelligence);medical diagnostic computing;statistical analysis;surgery;volume measurement","Gleason score;biopsy;cancer detection;elastic registration;expert-labeled histological 3D volumes;machine learning;optimized prostate biopsy;prostate cancer;statistical atlas","","0","","4","","","March 30 2011-April 2 2011","","IEEE","IEEE Conference Publications"
"No-Reference Metric Design With Machine Learning for Local Video Compression Artifact Level","J. P. Vink; G. de Haan","Philips Research Laboratories, Eindhoven, The Netherlands","IEEE Journal of Selected Topics in Signal Processing","20110314","2011","5","2","297","308","In decoded digital video, the local perceptual compression artifact level depends on the global compression ratio and the local video content. In this paper, we show how to build a highly relevant metric for video compression artifacts using supervised learning. To obtain the ground truth for training, we first build a reference metric for local estimation of the artifact level, which is robust to scaling and sensitive to all types of compression artifacts. Next, we design a large feature set and use AdaBoost to create no-reference metrics trained with the output of the reference metric. Two separate trained no-reference metrics, one for flat and one for detailed areas, respectively, are necessary to cover all types of artifacts. The relevance of these metrics is validated in a compression artifact reduction application, using objective scores like PSNR and BIM, but also a subjective evaluation as proof. We conclude that our created reference metric is an accurate local estimator of the compression artifact level. We were able to copy the performance to two no-reference metrics, based on a weighted mixture of low-level features. Our new metrics enable a far superior performance of artifact reduction compared to relevant alternative proposals.","1932-4553;19324553","","10.1109/JSTSP.2010.2055832","http://ieeexplore.ieee.org/stamp/stamp.jsp?arnumber=5503981","AdaBoost;artifact reduction;compression artifact;human visual system;image quality evaluation;no-reference metric","","decoding;feature extraction;learning (artificial intelligence);set theory;video coding","AdaBoost;artifact reduction;digital video decoding;feature set;local video compression artifact level;machine learning;no-reference metric design;supervised learning;video content","","5","","42","","20100708","April 2011","","IEEE","IEEE Journals & Magazines"
