"Combining one-class classifiers for imbalanced classification of breast thermogram features","B. Krawczyk; G. Schaefer; M. Wozniak","Dept. of Systems and Computer Networks Wroclaw University of Technology Wroclaw, Poland","2013 Fourth International Workshop on Computational Intelligence in Medical Imaging (CIMI)","20130822","2013","","","36","41","Thermography provides an interesting modality for diagnosing breast cancer as it is a non-contact, non-invasive and passive technique that is able to detect small tumors, which in turn can lead to earlier diagnosis. We perform computer-aided diagnosis of breast thermograms based on image features describing bilateral differences in regions of interest and a pattern classification approach that learns from previous examples. As is often the case in medical diagnosis, such training sets are imbalanced as typically (many) more benign cases get recorded compared to malignant cases. In this paper, we address this problem and perform classification using an ensemble of one-class classifiers. One-class classification uses samples from a single distribution to derive a decision boundary, and employing this method on the minority class can significantly boost its recognition rate and hence the sensitivity of our approach. We combine several one-class classifiers using a random subspace approach and a diversity measure to select members of the committee. We show that our proposed technique works well and leads to significantly improved performance compared to a single one-class predictor as well as compared to state-of-the-art classifier ensembles for imbalanced data.","2326-991X;2326991X","Electronic:978-1-4673-5919-1; POD:978-1-5090-0005-0","10.1109/CIMI.2013.6583855","http://ieeexplore.ieee.org/stamp/stamp.jsp?arnumber=6583855","breast cancer;breast thermogram;imbalanced classification;machine learning;medical imaging;multiple classifier system;one-class classification","Biomedical imaging;Breast cancer;Diversity reception;Feature extraction;Sensitivity","biomedical optical imaging;cancer;feature extraction;image classification;infrared imaging;learning (artificial intelligence);medical image processing;random processes","breast cancer diagnosis;breast thermogram feature classification;breast tumor detection;computer-aided diagnosis;decision boundary;image feature classification;image recognition;one-class classifier;one-class predictor;pattern classification approach;random subspace approach;regions of interest;thermography","","4","","35","","","16-19 April 2013","","IEEE","IEEE Conference Publications"
"2nd International workshop on realizing artificial intelligence synergies in software engineering (RAISE 2013)","R. Harrison; M. Mernik; P. Henriques; D. da Cruz; T. Menzies; D. Rodriguez","Oxford Brookes University, UK","2013 35th International Conference on Software Engineering (ICSE)","20130926","2013","","","1543","1544","The RAISE'13 workshop brought together researchers from the AI and software engineering disciplines to build on the interdisciplinary synergies which exist and to stimulate research across these disciplines. The first part of the workshop was devoted to current results and consisted of presentations and discussion of the state of the art. This was followed by a second part which looked over the horizon to seek future directions, inspired by a number of selected vision statements concerning the AI-and-SE crossover. The goal of the RAISE workshop was to strengthen the AI-and-SE community and also develop a roadmap of strategic research directions for AI and software engineering.","0270-5257;02705257","Electronic:978-1-4673-3076-3; POD:978-1-4673-3075-6","10.1109/ICSE.2013.6606778","http://ieeexplore.ieee.org/stamp/stamp.jsp?arnumber=6606778","AI;computational intelligence;data mining;machine learning;software engineering","Artificial intelligence;Cognition;Communities;Conferences;Educational institutions;Software;Software engineering","","","","0","","","","","18-26 May 2013","","IEEE","IEEE Conference Publications"
"An outer loop link adaptation for BICM-OFDM that learns","S. Wahls; H. V. Poor","Department of Electrical Engineering, Princeton University, Princeton, NJ 08544, USA","2013 IEEE 14th Workshop on Signal Processing Advances in Wireless Communications (SPAWC)","20130926","2013","","","719","723","Wireless BICM-OFDM systems usually perform some link adaptation procedure in order to adapt their transmission parameters to the changing channel. It is common practice to choose modulation and code rate based on thresholds on the signal-to-noise ratios (inner loop link adaptation), while these thresholds are shifted in an external control loop (outer loop link adaptation). This paper proposes a new approach for adjusting the threshold offset. Adaptive kernel regression is used in order to learn the relationship between offsets, the channel state, and packet error rates for each code rate in an online fashion. The proposed algorithm exploits this knowledge when selecting offsets. This is in contrast to current approaches, which do not anticipate the effect of changes to the offset but rely on probing only. Another advantage is that frequency-selective modulation can (but does not have to) be employed. Some less-known arguments in favor of frequency-selective modulation are pointed out.","1948-3244;19483244","Electronic:978-1-4673-5577-3; POD:978-1-4673-5576-6; USB:978-1-4673-5575-9","10.1109/SPAWC.2013.6612144","http://ieeexplore.ieee.org/stamp/stamp.jsp?arnumber=6612144","Link adaptation;Machine learning algorithms;OFDM;Unsupervised learning","Adaptation models;Kernel;Modulation;OFDM;Signal processing algorithms;Signal to noise ratio;Wireless communication","OFDM modulation;channel coding;error statistics;frequency modulation;interleaved codes;modulation coding;radio links;regression analysis;telecommunication computing;unsupervised learning","adaptive kernel regression;bit interleaved coded modulation;channel state;code rate;external control loop;frequency selective modulation;inner loop link adaptation;machine learning;orthogonal frequency division multiplexing;outer loop link adaptation;packet error rate;signal to noise ratio;threshold offset;transmission parameter;wireless BICM-OFDM system","","3","","18","","","16-19 June 2013","","IEEE","IEEE Conference Publications"
"Constraints as Features","S. Asafi; D. Cohen-Or","Tel Aviv Univ., Tel Aviv, Israel","2013 IEEE Conference on Computer Vision and Pattern Recognition","20131003","2013","","","1634","1641","In this paper, we introduce a new approach to constrained clustering which treats the constraints as features. Our method augments the original feature space with additional dimensions, each of which derived from a given Cannot-link constraints. The specified Cannot-link pair gets extreme coordinates values, and the rest of the points get coordinate values that express their spatial influence from the specified constrained pair. After augmenting all the new features, a standard unconstrained clustering algorithm can be performed, like k-means or spectral clustering. We demonstrate the efficacy of our method for active semi-supervised learning applied to image segmentation and compare it to alternative methods. We also evaluate the performance of our method on the four most commonly evaluated datasets from the UCI machine learning repository.","1063-6919;10636919","Electronic:978-0-7695-4989-7; POD:978-1-4673-6410-2","10.1109/CVPR.2013.214","http://ieeexplore.ieee.org/stamp/stamp.jsp?arnumber=6619058","clustering;image segmentation;machine learning;semi-supervised","Clustering algorithms;Clustering methods;Extraterrestrial measurements;Image segmentation;Matrix converters;Standards","image segmentation;learning (artificial intelligence);pattern clustering","Cannot-link constraints;Cannot-link pair;UCI machine learning repository;active semisupervised learning;constrained clustering;extreme coordinate values;feature space;image segmentation;k-means clustering;spectral clustering;standard unconstrained clustering algorithm","","0","","27","","","23-28 June 2013","","IEEE","IEEE Conference Publications"
"Detecting inconsistencies in wrappers: A case study","H. Femmer; D. Ganesan; M. Lindvall; D. McComas","Technische Universit&#x00E4;t M&#x00FC;nchen, Munich, Germany","2013 35th International Conference on Software Engineering (ICSE)","20130926","2013","","","1022","1031","Exchangeability between software components such as operating systems, middleware, databases, and hardware components is a common requirement in many software systems. One way to enable exchangeability is to promote indirect use through a common interface and an implementation for each component that wraps the original component. As developers use the interface instead of the underlying component, they assume that the software system will behave in a specific way independently of the actual component in use. However, differences in the implementations of the wrappers may lead to different behavior when one component is changed for another, which might lead to failures in the field. This work reports on a simple, yet effective approach to detect these differences. The approach is based on tool-supported reviews leveraging lightweight static analysis and machine learning. The approach is evaluated in a case study that analyzes NASA's Operating System Abstraction Layer (OSAL), which is used in various space missions. We detected 84 corner-case issues of which 57 turned out to be bugs that could have resulted in runtime failures.","0270-5257;02705257","Electronic:978-1-4673-3076-3; POD:978-1-4673-3075-6","10.1109/ICSE.2013.6606652","http://ieeexplore.ieee.org/stamp/stamp.jsp?arnumber=6606652","Abstraction;Equivalence;Inconsistencies;Interfaces;Machine Learning;Wrappers","Computer bugs;Data mining;Feature extraction;Measurement;Software systems;Training","learning (artificial intelligence);object-oriented programming;operating systems (computers);program diagnostics;system recovery","NASA Operating System Abstraction Layer;OSAL;common interface;database;hardware components;lightweight static analysis;machine learning;middleware;operating system;runtime failure;software component exchangeability;software system behavior;space mission;tool-supported review;wrapper inconsistency detection","","3","","27","","","18-26 May 2013","","IEEE","IEEE Conference Publications"
"Self-Organizing Maps for Fingerprint Image Quality Assessment","M. A. Olsen; E. Tabassi; A. Makarov; C. Busch","","2013 IEEE Conference on Computer Vision and Pattern Recognition Workshops","20130912","2013","","","138","145","Fingerprint quality assessment is a crucial task which needs to be conducted accurately in various phases in the biometric enrolment and recognition processes. Neglecting quality measurement will adversely impact accuracy and efficiency of biometric recognition systems (e.g. verification and identification of individuals). Measuring and reporting quality allows processing enhancements to increase probability of detection and track accuracy while decreasing probability of false alarms. Aside from predictive capabilities with respect to the recognition performance, another important design criteria for a quality assessment algorithm is to meet the low computational complexity requirement of mobile platforms used in national biometric systems, by military and police forces. We propose a computationally efficient means of predicting biometric performance based on a combination of unsupervised and supervised machine learning techniques. We train a self-organizing map (SOM) to cluster blocks of fingerprint images based on their spatial information content. The output of the SOM is a high-level representation of the finger image, which forms the input to a Random Forest trained to learn the relationship between the SOM output and biometric performance. The quantitative evaluation performed demonstrates that our proposed quality assessment algorithm is a reasonable predictor of performance. The open source code of our algorithm will be posted at NIST NFIQ 2.0 website.","2160-7508;21607508","Electronic:978-0-7695-4990-3; POD:978-1-4799-0994-0","10.1109/CVPRW.2013.28","http://ieeexplore.ieee.org/stamp/stamp.jsp?arnumber=6595866","Kohonen self-organizing map;biometric;evaluation;fingerprint;machine learning;quality;random forest;standard","Accuracy;Histograms;Quality assessment;Topology;Training;Vectors;Vegetation","computational complexity;fingerprint identification;image representation;military computing;mobile computing;pattern clustering;police;probability;self-organising feature maps;unsupervised learning","NIST NFIQ 2.0 Website;SOM;accuracy tracking;biometric enrolment;biometric recognition systems;computational complexity requirement;detection probability;finger image high-level representation;fingerprint image block clustering;fingerprint image quality assessment;military force;mobile platforms;national biometric systems;police forces;quality measurement;random forest;recognition process;self-organizing maps;spatial information content;supervised machine learning techniques;unsupervised machine learning techniques","","6","","19","","","23-28 June 2013","","IEEE","IEEE Conference Publications"
"Improvements in the clustering validity indexes of the load profiling methodology","I. P. Panapakidis; A. S. Dagoumas; M. C. Alexiadis; G. K. Papagiannis","Dept. of Electrical and Computer Engineering, Aristotle University of Thessaloniki, Greece","2013 10th International Conference on the European Energy Market (EEM)","20130926","2013","","","1","8","In the recent years the utilization of the load profiling tool for tracking the demand patterns is gathering momentum. There is variety of different clustering algorithms for the formation of daily load curve clusters. Their effectiveness is tested by a set of validity indexes or adequacy measures. This paper examines the behavior of all the adequacy measures that have been proposed in the related literature. We propose an alternative form of the measures that involves a weighting factor that refers to the variance of each element of the vector that represents the demand pattern. This fact increases the accuracy of the dissimilarity measures within and among the clusters. The data sample refers to the daily load curves of an existing high voltage industry within the Greek region and the period of study is the years 2003-2011. This vast amount of data is sufficient for assessing the load profiling methodology.","2165-4077;21654077","Electronic:978-1-4799-2008-2; POD:978-1-4799-2558-2; USB:978-1-4799-2009-9","10.1109/EEM.2013.6607330","http://ieeexplore.ieee.org/stamp/stamp.jsp?arnumber=6607330","Clustering validation;Competative learning neural networks;Load profiles;Unsupervised machine learning","Artificial neural networks;Silicon","electricity supply industry;pattern clustering;power engineering computing;unsupervised learning","Greek region;adequacy measures;clustering algorithms;clustering validity indexes;daily load curve cluster formation;demand pattern tracking;dissimilarity measures;high voltage industry;load profiling methodology;unsupervised machine learning;weighting factor","","1","","15","","","27-31 May 2013","","IEEE","IEEE Conference Publications"
"Predicting mine dam levels and energy consumption using artificial intelligence methods","A. N. Hasan; B. Twala; T. Marwala","Department of Electric and Electronic Engineering Science, University of Johannesburg, South Africa","2013 IEEE Symposium on Computational Intelligence for Engineering Solutions (CIES)","20130926","2013","","","171","175","Four machine learning algorithms (artificial neural networks, a naive Bayes' classifier, a support vector machines and decision trees) were applied for a single pump station mine to monitor and predict the dam levels and energy consumption. This work was undertaken to investigate the feasibility of using artificial intelligence in certain aspects of the mining industry. If successful, artificial intelligence systems could lead to improved safety and reduced electrical energy consumption. The results show neural networks to be more efficient when compared with support vector machines, a naive Bayes' classifier and in particular, decision trees in terms of predicting underground dam levels. Artificial neural networks showed 60% accuracy, out-performing support vector machine, naive Bayes' classifier and decision trees. For the prediction of water pump energy consumption, an artificial neural network and a naive Bayes' classifier had the same accuracy of 99.0%, whereas a support vector machine and decision trees achieved a lower accuracy.","","Electronic:978-1-4673-5851-4; POD:978-1-4673-5850-7","10.1109/CIES.2013.6611745","http://ieeexplore.ieee.org/stamp/stamp.jsp?arnumber=6611745","de-watering system;deep gold mines;energy consumption;machine learning algorithms;underground pump stations","Computational intelligence;Decision support systems;Economic indicators;Handheld computers","Bayes methods;dams;decision trees;energy consumption;mining;mining industry;neural nets;pattern classification;power engineering computing;production engineering computing;support vector machines","artificial intelligence method;artificial neural networks;decision trees;energy consumption prediction;machine learning algorithms;mine dam level prediction;mining industry;naive Bayes classifier;reduced electrical energy consumption;safety;single pump station mine;support vector machines;underground dam levels;water pump energy consumption","","2","","21","","","16-19 April 2013","","IEEE","IEEE Conference Publications"
"Exploiting Unsupervised Learning in Publish Subscribe System Design","C. Chen; P. C. Tung; W. C. Teng","Dept. of Comput. Sci. & Inf. Eng., Nat. Taiwan Univ. of Sci. & Technol., Taipei, Taiwan","2013 International Symposium on Biometrics and Security Technologies","20130916","2013","","","32","39","Skewed ness in popularity among subscriptions and events is an inherent property in publish/subscribe systems. In this paper, we propose to exploit the popularity skew by utilizing unsupervised machine learning techniques in the design of publish/subscribe systems. The design comprises three main ideas. First, similar subscriptions are clustered together using unsupervised machine learning methods, and the resulting cluster membership information is then distributed to all the brokers in the system. Secondly, the brokers apply unsupervised learning methods again to partition the published events they receive. By grouping similar events together, the events can be delivered in batches, instead of single event-based delivery as commonly employed in publish/subscribe systems. Thirdly, the event batches are delivered either as a single message using traditional publish/subscribe system delivery process, or using application level multicast trees maintained by the system. We explore the traditional delivery process case in this paper. Our design admits a spectrum of possible accuracy and efficiency choices in the design of publish/subscribe systems. Using an extensive set of experiments, our proposal is shown to deliver events using the collective resources of the overlay network effectively, while achieving reasonable accuracy.","","Electronic:978-1-4673-5314-4; POD:978-1-4673-5313-7","10.1109/ISBAST.2013.8","http://ieeexplore.ieee.org/stamp/stamp.jsp?arnumber=6597663","publish/subscribe services;published event;structured P2P Networks;subscription;unsupervised machine learning","Clustering algorithms;Overlay networks;Peer-to-peer computing;Routing;Servers;Subscriptions;Unsupervised learning","message passing;middleware;pattern clustering;trees (mathematics);unsupervised learning","application level multicast trees;cluster membership information;event batch;overlay network collective resources;popularity skewedness;publish subscribe system design;publish-subscribe system delivery process;similar subscription clustering;single event-based delivery;unsupervised machine learning techniques","","0","","28","","","2-5 July 2013","","IEEE","IEEE Conference Publications"
"Smart grid distribution prediction and control using computational intelligence","S. A. Chandler; J. G. Hughes","Department of Smart Grid Technology, Portland General Electric, Portland, Oregon, USA","2013 1st IEEE Conference on Technologies for Sustainability (SusTech)","20131003","2013","","","86","89","Smart-grid systems (SGS) may comprise distributed generation, automated demand response, mega-watt scale batteries, and a variety of other utility energy resources and programs. Their physical characteristics and operating flexibility within the distribution grid introduce new challenges to solving the power economic dispatch (PED) problem. Good operation of an SGS requires efficient use of available assets over both the short and long-term. Ideally resources will be scheduled and dispatched to equal loads (demand) in an optimal way, i.e., at the lowest cost, taking into account the differing operating constraints of assets and the changing conditions of the system and its environment. An experimental intelligent controller has been developed as part of the Pacific Northwest Smart Grid Demonstration (PNWSGD) project to address SGS demand-dependent non-linear cost functions, microgrid reliability zone constraints, and dynamic availability states. The controller is embedded within an existing utility control system that provides real time, historical, and forecast data used to predict energy demand for the next 72 hours and to create a near-optimal dispatch schedule for the next 24 hours. Both demand forecasts and schedules are updated every 5 minutes. The modularity of the controller architecture allows for a variety of load forecast and dispatch optimization tools and methods to be used; the current version uses computational intelligence, specifically neural networks. Its generality and versatility provides guidance for development of intelligent controllers adaptable and scalable to a variety of SGS applications.","","Electronic:978-1-4673-4630-6; POD:978-1-4673-4629-0; USB:978-1-4673-4628-3","10.1109/SusTech.2013.6617302","http://ieeexplore.ieee.org/stamp/stamp.jsp?arnumber=6617302","Smart grid;computational intelligence;machine-learning;neural networks;power economic dispatch;transactive control","Computational intelligence;Control systems;Load forecasting;Microgrids;Real-time systems;Schedules;Smart grids","distributed power generation;intelligent control;load forecasting;neural nets;power distribution control;power engineering computing;power generation dispatch;secondary cells","PNWSGD project;Pacific Northwest Smart Grid Demonstration project;SGS;automated demand response;computational intelligence;demand forecasts;dispatch optimization;distributed generation;energy demand;intelligent controller;load forecast;mega-watt scale batteries;microgrid reliability zone constraints;neural networks;power economic dispatch;smart grid distribution control;smart grid distribution prediction;smart grid systems;utility energy resources","","3","","3","","","1-2 Aug. 2013","","IEEE","IEEE Conference Publications"
"MobSafe: cloud computing based forensic analysis for massive mobile applications using data mining","J. Xu; Y. Yu; Z. Chen; B. Cao; W. Dong; Y. Guo; J. Cao","Department of Computer Science and Technology and Tsinghua National Laboratory for Information Science and Technology (TNList), Tsinghua University, Beijing 100084, China","Tsinghua Science and Technology","20130805","2013","18","4","418","427","With the explosive increase in mobile apps, more and more threats migrate from traditional PC client to mobile device. Compared with traditional Win+Intel alliance in PC, Android+ARM alliance dominates in Mobile Internet, the apps replace the PC client software as the major target of malicious usage. In this paper, to improve the security status of current mobile apps, we propose a methodology to evaluate mobile apps based on cloud computing platform and data mining. We also present a prototype system named MobSafe to identify the mobile app's virulence or benignancy. Compared with traditional method, such as permission pattern based method, MobSafe combines the dynamic and static analysis methods to comprehensively evaluate an Android app. In the implementation, we adopt Android Security Evaluation Framework (ASEF) and Static Android Analysis Framework (SAAF), the two representative dynamic and static analysis methods, to evaluate the Android apps and estimate the total time needed to evaluate all the apps stored in one mobile app market. Based on the real trace from a commercial mobile app market called AppChina, we can collect the statistics of the number of active Android apps, the average number apps installed in one Android device, and the expanding ratio of mobile apps. As mobile app market serves as the main line of defence against mobile malwares, our evaluation results show that it is practical to use cloud computing platform and data mining to verify all stored apps routinely to filter out malware apps from mobile app markets. As the future work, MobSafe can extensively use machine learning to conduct automotive forensic analysis of mobile apps based on the generated multifaceted data in this stage.","","","10.1109/TST.2013.6574680","http://ieeexplore.ieee.org/stamp/stamp.jsp?arnumber=6574680","Android platform;big data;cloud computing;data mining;forensic analysis;hadoop distributed file system;machine learning;mobile malware detection;redis key-value store","Androids;Cloud computing;Humanoid robots;Malware;Mobile communication;Smart phones","","","","3","","","","","August 2013","","TUP","TUP Journals & Magazines"
